|word_de|part_of_speech|word_en|sentence_de|sentence_en|sentence_lemmatized_de
9036.0|vorbringen|verb|to put forward|Er wollte seine Argumente eloquent vorbringen.|He wanted to put forward his arguments eloquently.|er;wollen;sein;Argument;eloquent;vorbringen
9040.0|herkommen|verb|to come from|Kannst du mir sagen, woher dieser Akzent herkommt?|Can you tell me where this accent comes from?|Kannst;du;mir;sagen;woher;dieser;Akzent;herkommen
9049.0|riechen|verb|smell|Die Blumen riechen wunderbar nach Frühling.|The flowers smell wonderfully of spring.|der;Blume;riechen;wunderbar;nach;Frühling
9051.0|die Lunte|noun|fuse|Die Lunte am Feuerwerk war bereits entzündet.|The fuse on the firework was already lit.|der;Lunte;an;Feuerwerk;sein;bereits;entzünden
9055.0|blitzen|verb|to flash|Am Horizont blitzten unaufhörlich die grellen Blitze.|Bright flashes of lightning continuously illuminated the horizon.|an;Horizont;blitzen;unaufhörlich;der;grell;Blitz
9057.0|der Zorn|noun|anger|Der Zorn in seiner Stimme war unüberhörbar.|The anger in his voice was unmistakable.|der;Zorn;in;sein;Stimme;sein;unüberhörbar
9058.0|der Mir|noun|Mir|Der Mir ist ein Symbol für vergangene Raumfahrt.|The Mir is a symbol of past space exploration.|der;Mir;sein;ein;Symbol;für;vergangen;Raumfahrt
9062.0|der Ausweg|noun|way out|Er suchte verzweifelt nach einem Ausweg.|He desperately looked for a way out.|er;suchen;verzweifelt;nach;ein;Ausweg
9065.0|die Flucht|noun|escape|Die Flucht aus dem Labyrinth schien unmöglich.|The escape from the labyrinth seemed impossible.|der;Flucht;aus;der;Labyrinth;scheinen;unmöglich
9067.0|vorn|adverb|at the front|Der Gewinner steht ganz vorn auf der Bühne.|The winner is at the front of the stage.|der;Gewinner;stehen;ganz;vorn;auf;der;Bühne
9113.0|die Fahne|noun|the flag|Die Fahne wehte im Wind vor dem Rathaus.|The flag waved in the wind in front of the town hall.|der;Fahne;wehen;in;Wind;vor;der;Rathaus
9126.0|die Mission|noun|mission|Die Mission wurde erfolgreich abgeschlossen.|The mission was successfully completed.|der;Mission;werden;erfolgreich;abschließen
9128.0|erfüllen|verb|fulfill|Kannst du diesen Wunsch für mich erfüllen?|Can you fulfill this wish for me?|Kannst;du;dieser;Wunsch;für;mich;erfüllen
9129.0|das Ausrufezeichen|noun|exclamation mark|Setz am Ende des Satzes ein Ausrufezeichen!|Put an exclamation mark at the end of the sentence!|Setz;an;Ende;der;Satz;ein;Ausrufezeichen
9130.0|das Plakat|noun|poster|Das Plakat kündigte die neue Ausstellung an.|The poster announced the new exhibition.|der;Plakat;ankündigen;der;neu;Ausstellung;an
9131.0|acht|numeral|eight|Acht Minuten später klingelte das Telefon.|Eight minutes later, the phone rang.|acht;Minute;spät;klingeln;der;Telefon
9132.0|das Komma|noun|the comma|Das Komma wurde in der letzten Zeile vergessen.|The comma was forgotten in the last line.|der;Komma;werden;in;der;letzter;Zeile;vergessen
9133.0|die Verhaftung|noun|arrest|Die Verhaftung des Täters verlief ohne Vorfall.|The arrest of the perpetrator proceeded without incident.|der;Verhaftung;der;Täter;verlaufen;ohne;Vorfall
9138.0|folgen|verb|follow|Viele Leute folgen dem neuen Trend begeistert.|Many people eagerly follow the new trend.|vieler;Leute;folgen;der;neu;Trend;begeistert
9140.0|Hol|Verb|fetch|Hol bitte die Zeitung aus dem Briefkasten.|Please fetch the newspaper from the mailbox.|Hol;bitte;der;Zeitung;aus;der;Briefkasten
9142.0|der Vorschlaghammer|noun|the sledgehammer|Mit dem Vorschlaghammer brachen sie die Wand auf.|They broke the wall with a sledgehammer.|mit;der;Vorschlaghammer;aufbrechen;sie;der;Wand;auf
9154.0|drüben|adverb|over there|Die Party findet drüben im Nachbarhaus statt.|The party is taking place over there in the neighbor’s house.|der;Party;stattfinden;drüben;in;Nachbarhaus;statt
9165.0|Aldi|noun|Aldi|Ich kaufe bei Aldi immer frisches Gemüse ein.|I always buy fresh vegetables at Aldi.|ich;einkaufen;bei;Aldi;immer;frisch;Gemüse;ein
9168.0|unser|Possessivpronomen|our|Unser Weg führte über zerklüftete Berge.|Our path led across jagged mountains.|unser;Weg;führen;über;zerklüftet;Berg
9169.0|das Abbild|Nomen|the image|Das Abbild des Monsters war in Stein gemeißelt.|The image of the monster was carved in stone.|der;Abbild;der;Monster;sein;in;Stein;meißeln
9184.0|die Girlande|noun|the garland|Die Girlande schmückte den festlichen Raum.|The garland decorated the festive room.|der;Girlande;schmücken;der;festlich;Raum
9186.0|zerknüllen|verb|to crumple|Sie zerknüllte das Papier und warf es weg.|She crumpled the paper and threw it away.|sie;zerknüllen;der;Papier;und;wegwerfen;es;weg
9194.0|das Denkmal|noun|monument|Das Denkmal erinnert an die Helden der Stadt.|The monument commemorates the heroes of the city.|der;Denkmal;erinnern;an;der;Held;der;Stadt
9200.0|enthüllen|verb|to unveil|Der Künstler enthüllte sein neuestes Meisterwerk.|The artist unveiled his latest masterpiece.|der;Künstler;enthüllen;sein;neue;Meisterwerk
9209.0|bauen|verb|build|Sie wollen ein neues Haus im Grünen bauen.|They want to build a new house in the countryside.|sie;wollen;ein;neu;Haus;in;grüne;bauen
9212.0|der Vollidiot|noun|the complete idiot|Nur ein Vollidiot würde das Geld verschenken.|Only a complete idiot would give the money away.|nur;ein;Vollidiot;werden;der;Geld;verschenken
9218.0|versauen|verb|to ruin|Die schlechte Planung hat den Urlaub versaut.|The poor planning ruined the vacation.|der;schlecht;Planung;haben;der;Urlaub;versauen
9223.0|der Sprayer|noun|the graffiti artist|Der Sprayer erschuf ein farbenfrohes Wandgemälde.|The graffiti artist created a colorful mural.|der;Sprayer;erscehufen;ein;farbenfroh;Wandgemälde
9229.0|nachts|adverb|at night|Er geht nachts gerne spazieren, wenn es ruhig ist.|He likes to walk at night when it’s quiet.|er;spazierengehen;nachts;gerne;spazieren;wenn;es;ruhig;sein
9232.0|Trümmer|noun|rubble|Nach dem Sturm blieben nur Trümmer übrig.|Only rubble remained after the storm.|nach;der;Sturm;übrigbleiben;nur;Trümmer;übrig
9247.0|hell|adjective|bright|Das Zimmer war hell erleuchtet von der Sonne.|The room was brightly lit by the sun.|der;Zimmer;sein;hell;erleuchten;von;der;Sonne
9264.0|vereinen|verb|unite|Das Festival vereint Kulturen aus aller Welt.|The festival unites cultures from around the world.|der;Festival;vereinen;Kultur;aus;aller;Welt
9266.0|der Beton|noun|the concrete|Der frische Beton wurde gerade gegossen.|The fresh concrete was just poured.|der;frisch;Beton;werden;gerade;gegossen
9268.0|die Seligkeit|noun|the bliss|Die Seligkeit des Moments war überwältigend.|The bliss of the moment was overwhelming.|der;Seligkeit;der;Moment;sein;überwältigend
9307.0|die Inschrift|noun|inscription|Die Inschrift auf dem Denkmal war kaum lesbar.|The inscription on the monument was barely legible.|der;Inschrift;auf;der;Denkmal;sein;kaum;lesbar
9312.0|der Schuh|noun|shoe|Der Schuh drückte unangenehm nach einem langen Spaziergang.|The shoe pressed uncomfortably after a long walk.|der;Schuh;drücken;unangenehm;nach;ein;lang;Spaziergang
9316.0|golden|adjective|golden|Die Stadt erstrahlt im goldenen Abendlicht.|The city shines in the golden evening light.|der;Stadt;erstrahlen;in;golden;Abendlicht
9317.0|die Schrift|noun|writing|Die alte Schrift war schwer zu entziffern.|The old writing was hard to decipher.|der;alt;Schrift;sein;schwer;zu;entziffern
9321.0|die Ewigkeit|noun|eternity|Manche Dinge dauern einfach eine Ewigkeit.|Some things just take an eternity.|mancher;Ding;dauern;einfach;ein;Ewigkeit
9398.0|pennen|verb|to sleep|Er pennte auf dem Sofa, während der Fernseher lief.|He slept on the sofa while the TV was on.|er;pennen;auf;der;Sofa;während;der;Fernseher;laufen
9403.0|die Wake|noun|the wake|Die Wake des Schiffes war im Mondlicht sichtbar.|The wake of the ship was visible in the moonlight.|der;Wake;der;Schiff;sein;in;Mondlicht;sichtbar
9410.0|der Abdruck|noun|imprint|Der Abdruck im Sand war deutlich erkennbar.|The imprint in the sand was clearly visible.|der;Abdruck;in;Sand;sein;deutlich;erkennbar
9435.0|der Kaffee|noun|the coffee|Der Kaffee auf dem Tisch war noch dampfend heiß.|The coffee on the table was still steaming hot.|der;Kaffee;auf;der;Tisch;sein;noch;dampfend;heiß
9435.001|das Kaffee|noun|coffee|Das Kaffee schmeckte frisch und aromatisch.|The coffee tasted fresh and aromatic.|der;Kaffee;schmecken;frisch;und;aromatisch
9466.0|der Stand|noun|the booth|Der Stand auf dem Markt verkaufte nur regionale Produkte.|The booth at the market sold only regional products.|der;Stand;auf;der;Markt;verkaufen;nur;regional;Produkt
9486.0|der Affe|noun|monkey|Der Affe kletterte geschickt auf den Baum.|The monkey climbed the tree skillfully.|der;Affe;klettern;geschickt;auf;der;Baum
9491.0|die Drohne|noun|drone|Die Drohne lieferte spektakuläre Luftaufnahmen.|The drone delivered spectacular aerial shots.|der;Drohne;liefern;spektakulär;Luftaufnahme
9497.0|der Himmel|noun|sky|Der Himmel leuchtete in kräftigen Orangetönen.|The sky glowed in vibrant shades of orange.|der;Himmel;leuchten;in;kräftig;Orangetönen
9500.0|rot|adjective|red|Die rote Fahne wehte im Wind wie ein warnendes Signal.|The red flag waved in the wind like a warning signal.|der;rot;Fahne;wehen;in;Wind;wie;ein;warnend;Signal
9501.0|Australien|noun|Australia|Australien ist ein faszinierender Kontinent.|Australia is a fascinating continent.|Australien;sein;ein;faszinierend;Kontinent
9506.0|unweit|adverb|not far|Unweit des Dorfes befindet sich ein altes Schloss.|Not far from the village lies an old castle.|unweit;der;Dorf;befinden;sich;ein;alt;Schloss
9509.0|das Dschungelcamp|noun|jungle camp|Das Dschungelcamp ist jedes Jahr ein TV-Hit.|The jungle camp is a TV hit every year.|der;Dschungelcamp;sein;jeder;Jahr;ein;TV-Hit
9512.0|der Februar|noun|February|Im Februar sind die Tage oft noch bitterkalt.|In February, the days are often still bitterly cold.|in;Februar;sein;der;Tag;oft;noch;bitterkalt
9520.0|die Riß|noun|the crack|Ein feiner Riß zieht sich durch die Glasplatte.|A fine crack runs through the glass plate.|ein;fein;Riß;ziehen;sich;durch;der;Glasplatte
9520.001|das Riß|noun|the tear|Das Riß im Stoff war nicht mehr zu flicken.|The tear in the fabric could no longer be mended.|der;Riß;in;Stoff;sein;nicht;mehr;zu;flicken
9522.0|Erfurt|noun|Erfurt|Die Altstadt von Erfurt ist eine Reise wert.|The old town of Erfurt is worth a visit.|der;Altstadt;von;Erfurt;sein;ein;Reise;wert
9527.0|Hanau|noun|Hanau|In Hanau findet ein bekanntes Straßenfest statt.|A well-known street festival takes place in Hanau.|in;Hanau;stattfinden;ein;bekannt;Straßenfest;statt
9534.0|die Maske|noun|the mask|Die Maske verdeckte ihr Gesicht komplett.|The mask completely covered her face.|der;Maske;verdecken;ihr;Gesicht;komplett
9544.0|die Pandemie|noun|the pandemic|Die Pandemie veränderte das Leben weltweit massiv.|The pandemic massively changed life worldwide.|der;Pandemie;verändern;der;Leben;weltweit;massiv
9564.0|der März|noun|March|Im März beginnt die Natur wieder zu erwachen.|In March, nature begins to awaken again.|in;März;beginnen;der;Natur;wieder;zu;erwachen
9575.0|wuschen|verb|to wash|Wir wuschen die Kleidung mit klarem Bergwasser.|We washed the clothes with clear mountain water.|wir;wuschen;der;Kleidung;mit;klar;Bergwasser
9583.0|funktionieren|verb|to function|Das neue System funktioniert einwandfrei.|The new system functions perfectly.|der;neu;System;funktionieren;einwandfrei
9585.0|ungelogen|adverb|truthfully|Ungelogen, dieser Film hat mich zu Tränen gerührt.|Truthfully, this movie moved me to tears.|ungelogen;dieser;Film;haben;mich;zu;Träne;rühren
9592.0|die Europa|noun|Europe|Die Europa von heute ist vielfältig und stark.|The Europe of today is diverse and strong.|der;Europa;von;heute;sein;vielfältig;und;stark
9602.0|die Hilfe|noun|help|Die Hilfe des Systems bleibt oft unerkannt.|The help of the system often remains unnoticed.|der;Hilfe;der;System;bleiben;oft;unerkannt
9605.0|die Lufthansa|noun|Lufthansa|Die Lufthansa bietet Direktflüge nach Tokio an.|Lufthansa offers direct flights to Tokyo.|der;Lufthansa;anbieten;Direktflug;nach;Tokio;an
9606.0|das Mitleid|noun|compassion|Das Mitleid in ihren Augen war unübersehbar.|The compassion in her eyes was unmistakable.|der;Mitleid;in;ihr;Auge;sein;unübersehbar
9616.0|falls|conjunction|if|Falls du Zeit hast, komm doch einfach vorbei.|If you have time, just drop by.|falls;du;Zeit;haben;vorbeikomm;doch;einfach;vorbei
9621.0|die Triggerwarnung|noun|the trigger warning|Die Triggerwarnung wies auf sensible Inhalte hin.|The trigger warning pointed to sensitive content.|der;Triggerwarnung;hinweisen;auf;sensibel;Inhalt;hin
9625.0|der Basketball|noun|the basketball|Der Basketball sprang hoch und flog ins Netz.|The basketball bounced high and went into the net.|der;Basketball;hochspringen;hoch;und;fliegen;in;Netz
9630.0|der Rassismus|noun|racism|Die Kampagne setzt ein Zeichen gegen Rassismus.|The campaign takes a stand against racism.|der;Kampagne;setzen;ein;Zeichen;gegen;Rassismus
9631.0|bemerken|verb|notice|Niemand schien den leisen Vogelruf zu bemerken.|No one seemed to notice the soft birdcall.|niemand;scheinen;der;leise;Vogelruf;zu;bemerken
9634.0|der Mai|noun|May|Im Mai blühten die Kirschbäume in voller Pracht.|In May, the cherry trees blossomed in full splendor.|in;Mai;blühn;der;Kirschbaum;in;voll;Pracht
9638.0|die Kachel|noun|tile|Die Kachel im Bad hatte ein kunstvolles Muster.|The tile in the bathroom had an artistic pattern.|der;Kachel;in;Bad;haben;ein;kunstvoll;Muster
9644.0|zweimal|adverb|twice|Er musste die Aufgabe zweimal überarbeiten.|He had to revise the task twice.|er;musste;der;Aufgabe;zweimal;überarbeiten
9645.0|demonstrieren|verb|demonstrate|Die Bürger wollten ihre Wut auf der Straße demonstrieren.|The citizens wanted to demonstrate their anger in the streets.|der;Bürger;wollen;ihr;Wut;auf;der;Straße;demonstrieren
9676.0|aufrecht|adjective|upright|Der aufrecht stehende Baum trotzte dem Sturm.|The upright tree defied the storm.|der;aufrecht;stehend;Baum;trotzen;der;Sturm
9679.0|völlig|adverb|completely|Ich bin völlig erschöpft nach diesem langen Tag.|I am completely exhausted after this long day.|ich;sein;völlig;erschöpfen;nach;dieser;lang;Tag
9680.0|perplex|adjective|perplexed|Der Student war sichtlich perplex über die Frage.|The student was visibly perplexed by the question.|der;Student;sein;sichtlich;perplex;über;der;Frage
9682.0|wünschen|verb|to wish|Ich wünsche dir alles Gute zum Geburtstag.|I wish you all the best for your birthday.|ich;wünschen;dir;aller;gute;zu;Geburtstag
9694.0|weggehen|verb|to leave|Ich werde nie einfach so weggehen, keine Sorge.|I will never just leave like that, don't worry.|ich;werden;nie;einfach;so;weggehen;kein;Sorge
9704.0|Gleiche|noun|the same|Das Gleiche passiert, wenn du nichts änderst.|The same happens if you change nothing.|der;Gleiche;passieren;wenn;du;nichts;änderen
9706.0|der September|Substantiv|September|Im September färben sich die Blätter bunt.|In September, the leaves turn colorful.|in;September;färben;sich;der;Blatt;bunt
9772.0|die Schmerztablette|noun|the painkiller|Er nahm eine Schmerztablette gegen die Migräne.|He took a painkiller for the migraine.|er;nehmen;ein;Schmerztablette;gegen;der;Migräne
9775.0|das Fernweh|noun|the wanderlust|Das Fernweh trieb sie dazu, die Welt zu bereisen.|The wanderlust drove her to travel the world.|der;Fernweh;treiben;sie;dazu;der;Welt;zu;bereisen
9779.0|die Schwäche|noun|weakness|Seine Schwäche für Süßes ist offensichtlich.|His weakness for sweets is obvious.|sein;Schwäche;für;süße;sein;offensichtlich
9783.0|die Eifersucht|noun|jealousy|Eifersucht kann Beziehungen schwer belasten.|Jealousy can seriously strain relationships.|Eifersucht;können;Beziehung;schwer;belasten
9786.0|Wanderrucksack|noun|hiking backpack|Der Wanderrucksack ist ideal für lange Touren.|The hiking backpack is ideal for long trips.|der;Wanderrucksack;sein;ideal;für;lang;Tour
9791.0|verliebt|adjective|in love|Er wirkte glücklich und sichtlich verliebt.|He seemed happy and visibly in love.|er;wirken;glücklich;und;sichtlich;verliebt
9802.0|treu|adjective|loyal|Er blieb treu, obwohl ihn viele aufgegeben hatten.|He stayed loyal even though many had given up on him.|er;bleiben;treu;obwohl;ihn;viele;aufgeben;haben
9807.0|die Seele|noun|the soul|Die Musik berührte die Seele tief und unerwartet.|The music touched the soul deeply and unexpectedly.|der;Musik;berühren;der;Seele;tief;und;unerwartet
9808.0|kreuchen|verb|to crawl|Im Schatten kreuchen seltsame Kreaturen.|Strange creatures crawl in the shadows.|in;Schatten;kreuchen;seltsam;Kreatur
9824.0|das Feuerzeug|noun|the lighter|Das Feuerzeug war klein, aber zuverlässig.|The lighter was small but reliable.|der;Feuerzeug;sein;klein;aber;zuverlässig
9834.0|unmöglich|adjective|impossible|Die Aufgabe schien zunächst unmöglich zu lösen.|The task initially seemed impossible to solve.|der;Aufgabe;scheinen;zunächst;unmöglich;zu;lösen
9839.0|besitzen|verb|to own|Sie besitzen ein wunderschönes Ferienhaus.|They own a beautiful vacation home.|sie;besitzen;ein;wunderschön;Ferienhaus
9848.0|der Ballast|noun|the ballast|Der alte Ballast wurde endlich entsorgt.|The old ballast was finally disposed of.|der;alt;Ballast;werden;endlich;entsorgen
9870.0|der Ball|noun|ball|Der Ball rollte langsam die Treppe hinunter.|The ball rolled slowly down the stairs.|der;Ball;hinunterrollen;langsam;der;Treppe;hinunter
9871.0|flach|adjective|flat|Das Land hier ist völlig flach und karg.|The land here is completely flat and barren.|der;Land;hier;sein;völlig;flach;und;karg
9879.0|der Zügel|noun|the rein|Der Reiter zog vorsichtig an den Zügeln.|The rider gently pulled on the reins.|der;Reiter;ziehen;vorsichtig;an;der;Zügel
9885.0|das Tal|noun|valley|Das Tal erstreckte sich weit unterhalb der schroffen Berge.|The valley stretched far below the rugged mountains.|der;Tal;erstrecken;sich;weit;unterhalb;der;schroff;Berg
9887.0|küssen|verb|kiss|Er wollte sie zum Abschied auf die Wange küssen.|He wanted to kiss her on the cheek goodbye.|er;wollen;sie;zu;Abschied;auf;der;Wange;küssen
9889.0|festhalten|Verb|to hold on|Er wollte die flüchtigen Momente festhalten.|He wanted to hold on to the fleeting moments.|er;wollen;der;flüchtig;Moment;festhalten
9891.0|fest|adjective|firm|Der Griff an der Kante war fest und stabil.|The grip on the edge was firm and stable.|der;Griff;an;der;Kante;sein;fest;und;stabil
9899.0|der Masochist|noun|masochist|Ein Masochist sucht Vergnügen im Schmerz.|A masochist seeks pleasure in pain.|ein;Masochist;suchen;vergnügen;in;Schmerz
9912.0|hissen|verb|to hoist|Sie werden die Flagge bei Sonnenaufgang hissen.|They will hoist the flag at sunrise.|sie;werden;der;Flagge;bei;Sonnenaufgang;hissen
9919.0|hart|adjective|hard|Das Brot ist so hart, man kann es kaum schneiden.|The bread is so hard, you can barely cut it.|der;Brot;sein;so;hart;man;können;es;kaum;schneiden
9920.0|vermissen|Verb|miss|Ich werde ihn vermissen, er war ein treuer Freund.|I will miss him; he was a loyal friend.|ich;werden;ihn;vermissen;er;sein;ein;treu;Freund
9928.0|die Peitsche|noun|the whip|Die Peitsche wurde kunstvoll aus Leder gefertigt.|The whip was artfully made from leather.|der;Peitsche;werden;kunstvoll;aus;Leder;fertigen
9932.0|gefälligst|adverb|kindly|Du solltest gefälligst zuhören, wenn ich rede.|You should kindly listen when I speak.|du;solltest;gefälligst;zuhören;wenn;ich;reden
9940.0|das Genital|noun|genital|In der Medizin wird das Genital oft untersucht.|In medicine, the genital is often examined.|in;der;Medizin;werden;der;Genital;oft;untersuchen
9941.0|direkt|adjective|direct|Seine direkte Art brachte ihn oft in Schwierigkeiten.|His direct manner often got him into trouble.|sein;direkt;Art;bringen;ihn;oft;in;Schwierigkeit
9944.0|der Kohl|noun|cabbage|Der Kohl wurde frisch vom Feld geerntet.|The cabbage was freshly harvested from the field.|der;Kohl;werden;frisch;von;Feld;ernten
9949.0|der Gesichtsausdruck|noun|facial expression|Sein Gesichtsausdruck verriet sofort seine Enttäuschung.|His facial expression immediately revealed his disappointment.|sein;Gesichtsausdruck;verraten;sofort;sein;Enttäuschung
9950.0|der Schrei|noun|scream|Der Schrei hallte durch die leere Halle.|The scream echoed through the empty hall.|der;Schrei;hallen;durch;der;leer;Halle
9957.0|mollig|adjective|plump|Die mollige Katze lag schnurrend im Sessel.|The plump cat lay purring in the armchair.|der;mollig;Katze;liegen;schnurrend;in;Sessel
9958.0|kalt|adjective|cold|Der Wind war so kalt, dass er die Haut stach.|The wind was so cold that it stung the skin.|der;Wind;sein;so;kalt;dass;er;der;Haut;stach
9964.0|Olle|noun|old lady|Die Olle saß im Park und fütterte die Tauben.|The old lady sat in the park feeding the pigeons.|der;Olle;sitzen;in;Park;und;füttern;der;Taube
9966.0|das Mach|noun|Mach number|Die Geschwindigkeit des Jets lag knapp unter Mach 2.|The speed of the jet was just below Mach 2.|der;Geschwindigkeit;der;Jet;liegen;knapp;unter;Mach;2.
9969.0|der Ring|noun|ring|Der Ring aus Gold glänzt in der Vitrine.|The gold ring shines in the display case.|der;Ring;aus;Gold;glänzen;in;der;Vitrine
9972.0|das Kalb|noun|the calf|Das Kalb tollte fröhlich über die Wiese.|The calf frolicked happily across the meadow.|der;Kalb;tollen;fröhlich;über;der;Wiese
9977.0|der Volleyball|noun|the volleyball|Wir spielen jeden Freitag Volleyball am Strand.|We play volleyball on the beach every Friday.|wir;spielen;jeder;Freitag;Volleyball;an;Strand
9988.0|die Vergangenheit|noun|the past|Die Vergangenheit lässt sich nicht mehr ändern.|The past can no longer be changed.|der;Vergangenheit;lässt;sich;nicht;mehr;ändern
10079.0|das Wachs|noun|wax|Das Wachs tropfte langsam von der Kerze.|The wax dripped slowly from the candle.|der;Wachs;tropfen;langsam;von;der;Kerze
10082.0|weichen|verb|to yield|Er musste dem entgegenkommenden Wagen weichen.|He had to yield to the oncoming car.|er;musste;der;entgegenkommend;Wagen;weichen
10086.0|der Brokkoli|noun|the broccoli|Der Brokkoli war knackig und frisch gekocht.|The broccoli was crunchy and freshly cooked.|der;Brokkoli;sein;knackig;und;frisch;kochen
10091.0|die Schwerkraft|noun|the gravity|Die Schwerkraft hält Planeten in ihrer Umlaufbahn.|Gravity keeps planets in their orbit.|der;Schwerkraft;halten;Planet;in;ihr;Umlaufbahn
10095.0|die Klinge|noun|the blade|Die Klinge des Dolches glänzte im Mondlicht.|The blade of the dagger gleamed in the moonlight.|der;Klinge;der;Dolch;glänzen;in;Mondlicht
10097.0|schneiden|verb|cut|Er begann, die langen Bänder vorsichtig zu schneiden.|He began to cut the long ribbons carefully.|er;beginnen;der;lang;Bänder;vorsichtig;zu;schneiden
10098.0|klingen|verb|sound|Die Melodie kann traurig, aber schön klingen.|The melody can sound sad but beautiful.|der;Melodie;können;traurig;aber;schön;klingen
10101.0|das Glockenspiel|noun|the carillon|Das Glockenspiel erklang jeden Tag pünktlich um zwölf Uhr.|The carillon rang every day promptly at twelve o'clock.|der;Glockenspiel;erklingen;jeder;Tag;pünktlich;um;zwölf;Uhr
10184.0|der Hit|noun|the hit|Dieser Song ist ein echter Hit in jeder Sommerparty.|This song is a real hit at every summer party.|dieser;Song;sein;ein;echt;Hit;in;jeder;Sommerparty
10187.0|die Nation|noun|nation|Die Nation feierte ihren Unabhängigkeitstag.|The nation celebrated its independence day.|der;Nation;feiern;ihr;Unabhängigkeitstag
10206.0|davon|adverb|of it|Davon war nichts in der Nachricht erwähnt worden.|Nothing of it was mentioned in the message.|davon;sein;nichts;in;der;Nachricht;erwähnen;werden
10215.0|klug|adjective|smart|Der kluge Junge löste das Rätsel in Minuten.|The smart boy solved the puzzle in minutes.|der;klug;Junge;lösen;der;Rätsel;in;Minute
10223.0|der Betrug|noun|fraud|Der Betrug wurde erst nach Jahren aufgedeckt.|The fraud was uncovered only after years.|der;Betrug;werden;erst;nach;Jahr;aufdecken
10232.0|klauen|Verb|steal|Er wollte das Fahrrad klauen, wurde aber erwischt.|He wanted to steal the bike but was caught.|er;wollen;der;Fahrrad;klauen;werden;aber;erwischen
10263.0|stehlen|verb|to steal|Ein Unbekannter wollte die wertvollen Gemälde stehlen.|An unknown person wanted to steal the valuable paintings.|ein;Unbekannter;wollen;der;wertvoll;Gemälde;stehlen
10265.0|ziehen|verb|to pull|Sie zogen die alte Truhe aus dem dunklen Versteck.|They pulled the old chest from the dark hiding place.|sie;ziehen;der;alt;Truhe;aus;der;dunkel;Versteck
10267.0|rauben|verb|to rob|Die Banditen versuchten, die Reisenden zu rauben.|The bandits tried to rob the travelers.|der;Bandite;versuchen;der;Reisenden;zu;rauben
10268.0|die Entschuldigung|noun|apology|Seine Entschuldigung klang aufrichtig und ehrlich.|His apology sounded sincere and honest.|sein;Entschuldigung;klingen;aufrichtig;und;ehrlich
10278.0|tierisch|adjective|animalistic|Seine tierische Wut war kaum zu kontrollieren.|His animalistic rage was barely controllable.|sein;tierisch;Wut;sein;kaum;zu;kontrollieren
10281.0|fahren|verb|drive|Wir wollen morgen ans Meer fahren und entspannen.|We want to drive to the sea tomorrow and relax.|wir;wollen;morgen;an;Meer;fahren;und;entspannen
10288.0|glänzen|verb|to shine|Die Sterne glänzten am klaren Nachthimmel.|The stars shone in the clear night sky.|der;Stern;glänzen;an;klar;Nachthimmel
10295.0|der Teich|noun|the pond|Der kleine Teich war voller Libellen und Frösche.|The small pond was full of dragonflies and frogs.|der;klein;Teich;sein;voll;Libell;und;Frösche
10303.0|das Ross|noun|steed|Das Ross galoppierte majestätisch über die Wiese.|The steed galloped majestically across the meadow.|der;Ross;galoppieren;majestätisch;über;der;Wiese
10310.0|der Held|noun|hero|Der Held rettete die Stadt vor der Katastrophe.|The hero saved the city from the disaster.|der;Held;retten;der;Stadt;vor;der;Katastrophe
