|word_de|part_of_speech|word_en|sentence_de|sentence_en|sentence_lemmatized_de
41470.0|die Gummizelle|noun|padded cell|Die Gummizelle blieb still, bis die Wachen kamen.|The padded cell remained quiet until the guards arrived.|der;Gummizelle;stillbleiben;still;bis;der;Wache;kommen
41476.0|die Hüpfburg|noun|bouncy castle|Die Hüpfburg war der Hit auf dem Kinderfest.|The bouncy castle was the highlight of the children's party.|der;Hüpfburg;sein;der;Hit;auf;der;Kinderfest
41492.0|die Komödie|noun|comedy|Die Komödie spiegelte aktuelle gesellschaftliche Themen.|The comedy reflected current social issues.|der;Komödie;spiegeln;aktuell;gesellschaftlich;Thema
41546.0|sadistisch|adjective|sadistic|Sein sadistisches Verhalten schockierte alle Anwesenden.|His sadistic behavior shocked everyone present.|sein;sadistisch;verhalten;schockieren;aller;Anwesenden
41652.0|die Show|noun|show|Die Show endete mit einem spektakulären Finale.|The show ended with a spectacular finale.|der;Show;enden;mit;ein;spektakulär;Finale
41658.0|das Aussehen|noun|appearance|Das Aussehen der alten Stadtmauer war beeindruckend.|The appearance of the old city wall was impressive.|der;Aussehen;der;alt;Stadtmauer;sein;beeindruckend
41708.0|durcheinander|adjective|confused|Nach dem Gespräch war er völlig durcheinander und ratlos.|After the conversation, he was completely confused and helpless.|nach;der;Gespräch;sein;er;völlig;durcheinander;und;ratlos
41758.0|Brechen|noun|breaking|Das plötzliche Brechen des Eises schockierte alle.|The sudden breaking of the ice shocked everyone.|der;plötzlich;Brechen;der;Eis;schockieren;alle
41762.0|das Nasenbein|noun|nasal bone|Das Nasenbein war nach dem Unfall verletzt.|The nasal bone was injured after the accident.|der;Nasenbein;sein;nach;der;Unfall;verletzen
41786.0|verstimmen|verb|to upset|Seine Bemerkung verstimmte die sonst friedliche Runde.|His remark upset the otherwise peaceful group.|sein;Bemerkung;verstimmen;der;sonst;friedlich;Runde
41795.0|strukturieren|verb|to structure|Wir müssen den Ablauf präziser strukturieren.|We need to structure the process more precisely.|wir;müssen;der;Ablauf;präzis;strukturieren
41813.0|bitten|Verb|ask|Ich wollte dich um einen kleinen Gefallen bitten.|I wanted to ask you for a small favor.|ich;wollen;dich;um;ein;klein;Gefallen;bitten
41830.0|ängstlich|Adjective|anxious|Er war ängstlich, als er die Prüfung ablegte.|He was anxious as he took the exam.|er;sein;ängstlich;als;er;der;Prüfung;ablegen
41836.0|die Balance|noun|balance|Die Tänzerin hielt die Balance auf dem Seil.|The dancer maintained the balance on the rope.|der;Tänzerin;halten;der;Balance;auf;der;Seil
41846.0|das DAS|noun|the DAS|Das DAS wurde bei der Analyse hervorgehoben.|The DAS was highlighted during the analysis.|der;DAS;werden;bei;der;Analyse;hervorheben
41855.0|das Himmelreich|noun|heaven|Er träumte vom ewigen Frieden im Himmelreich.|He dreamed of eternal peace in heaven.|er;träumen;von;ewig;Frieden;in;Himmelreich
41957.0|das Sterben|Noun|the dying|Das Sterben der Wälder ist ein globales Problem.|The dying of the forests is a global problem.|der;Sterben;der;Wald;sein;ein;global;Problem
42000.0|implodieren|verb|to implode|Der Ballon schien plötzlich zu implodieren.|The balloon seemed to suddenly implode.|der;Ballon;scheinen;plötzlich;zu;implodieren
42013.0|ruhen|verb|to rest|Die alten Werkzeuge ruhen seit Jahren in der Schublade.|The old tools have been resting in the drawer for years.|der;alt;Werkzeug;ruhen;seit;Jahr;in;der;Schublade
42022.0|zersetzen|verb|decompose|Die Chemikalien zersetzen die alten Stoffe.|The chemicals decompose the old materials.|der;Chemikalie;zersetzen;der;alt;Stoff
42026.0|verteilen|verb|to distribute|Die Flyer wurden in der Innenstadt verteilt.|The flyers were distributed in the city center.|der;Flyer;werden;in;der;Innenstadt;verteilen
42028.0|vernetzen|verb|to network|Die Firmen wollen sich global vernetzen.|The companies want to network globally.|der;Firma;wollen;sich;global;vernetzen
42030.0|komplex|adjective|complex|Das Thema ist extrem komplex und vielschichtig.|The topic is extremely complex and multifaceted.|der;Thema;sein;extrem;komplex;und;vielschichtig
42035.0|die Vorstellung|noun|the idea|Die Vorstellung des neuen Films war grandios.|The idea of the new movie was magnificent.|der;Vorstellung;der;neu;Film;sein;grandios
42058.0|das Autodach|noun|the car roof|Das Autodach glänzte in der Sommersonne.|The car roof gleamed in the summer sun.|der;Autodach;glänzen;in;der;Sommersonne
42066.0|das Magnetband|noun|the magnetic tape|Das Magnetband speicherte alle Daten sicher.|The magnetic tape stored all data securely.|der;Magnetband;speichern;aller;Datum;sicher
42068.0|die Kassette|noun|the cassette|Die Kassette knirschte im alten Rekorder.|The cassette crackled in the old recorder.|der;Kassette;knirschen;in;alt;Rekorder
42074.0|die Vogelscheiße|noun|the bird poop|Die Vogelscheiße ruinierte den frischen Lack.|The bird poop ruined the fresh paint.|der;Vogelscheiße;ruinieren;der;frisch;Lack
42090.0|die Lava|noun|the lava|Die Lava floss langsam den Hang hinunter.|The lava slowly flowed down the slope.|der;Lava;hinunterfloss;langsam;der;Hang;hinunter
42094.0|die Sommersonne|noun|the summer sun|Die Sommersonne ließ die Blumen erblühen.|The summer sun made the flowers bloom.|der;Sommersonne;lassen;der;Blume;erblühen
42096.0|die Toskana|noun|Tuscany|Die Toskana leuchtet in warmen Erdtönen.|Tuscany glows in warm earthy tones.|der;Toskana;leuchten;in;warm;Erdton
42120.0|das Flöckchen|noun|the little flake|Das Flöckchen Schnee schmolz auf der Zunge.|The little flake of snow melted on the tongue.|der;Flöckchen;Schnee;schmolz;auf;der;Zunge
42131.0|das Stöckchen|noun|stick|Der Hund holte das Stöckchen eifrig zurück.|The dog eagerly fetched the stick back.|der;Hund;zurückholen;der;Stöckchen;eifrig;zurück
42137.0|zurückbringen|verb|bring back|Er wollte den verlorenen Gegenstand zurückbringen.|He wanted to bring back the lost item.|er;wollen;der;verloren;Gegenstand;zurückbringen
42163.0|der Nachthimmel|noun|the night sky|Der Nachthimmel war voller funkelnder Sterne.|The night sky was full of sparkling stars.|der;Nachthimmel;sein;voll;funkelnd;Stern
42167.0|segeln|verb|sail|Wir segelten durch die raue See Richtung Heimat.|We sailed through the rough sea toward home.|wir;segeln;durch;der;rau;See;Richtung;Heimat
42178.0|das Segel|noun|the sail|Das Segel flatterte im Wind und trieb das Boot voran.|The sail fluttered in the wind and propelled the boat forward.|der;Segel;flattern;in;Wind;und;vorantreiben;der;Boot;voran
42192.0|das Funkeln|Noun|sparkle|Das Funkeln in ihren Augen war unverkennbar.|The sparkle in her eyes was unmistakable.|der;Funkeln;in;ihr;Auge;sein;unverkennbar
42197.0|der Seemann|noun|the sailor|Der Seemann erzählte von stürmischen Reisen.|The sailor told of stormy journeys.|der;Seemann;erzählen;von;stürmisch;Reise
42199.0|Ronny|noun|Ronny|Ronny überraschte alle mit seinem ungewöhnlichen Talent.|Ronny surprised everyone with his unusual talent.|Ronny;überraschen;alle;mit;sein;ungewöhnlich;Talent
42214.0|geschwind|adjective|swift|Der geschwind laufende Hund erreichte das Tor.|The swiftly running dog reached the gate.|der;geschwind;laufend;Hund;erreichen;der;Tor
42318.0|spitzen|verb|to sharpen|Er begann, den Bleistift sorgfältig zu spitzen.|He began carefully sharpening the pencil.|er;beginnen;der;Bleistift;sorgfältig;zu;spitzen
42367.0|der Wasabi|noun|the wasabi|Der Wasabi brannte in seiner Nase heftig.|The wasabi burned intensely in his nose.|der;Wasabi;brannte;in;sein;Nase;heftig
42391.0|der Techno|noun|the techno|Der Techno füllte die ganze Tanzfläche mit Leben.|The techno filled the dance floor with life.|der;Techno;füllen;der;ganz;Tanzfläche;mit;Leben
42391.001|das Techno|noun|techno|Das Techno dröhnte laut aus den Clublautsprechern.|The techno blared loudly from the club speakers.|der;Techno;dröhnen;laut;aus;der;Clublautsprecher
42412.0|der Brüsseler|noun|the Brussels resident|Der Brüsseler brachte Pralinen als Geschenk mit.|The Brussels resident brought chocolates as a gift.|der;Brüsseler;mitbringen;Praline;als;Geschenk;mit
42446.0|emanzipieren|Verb|emancipate|Es ist Zeit, sich von alten Zwängen zu emanzipieren.|It’s time to emancipate from old constraints.|es;sein;Zeit;sich;von;alt;Zwang;zu;emanzipieren
42454.0|weird|Adjective|weird|Dieses weird Verhalten irritiert alle Anwesenden.|This weird behavior irritates everyone present.|dieser;weird;verhalten;irritieren;aller;Anwesenden
42462.0|der Meilenstein|noun|the milestone|Der Meilenstein wurde mit einer Feier gewürdigt.|The milestone was celebrated with a ceremony.|der;Meilenstein;werden;mit;ein;Feier;würdigen
42552.0|der Dichter|noun|the poet|Der Dichter schrieb Verse über die Nacht.|The poet wrote verses about the night.|der;Dichter;schreiben;Vers;über;der;Nacht
42554.0|der Denker|noun|the thinker|Der Denker analysierte das Problem tiefgründig.|The thinker analyzed the problem deeply.|der;Denker;analysieren;der;Problem;tiefgründig
42561.0|emotional|adjective|emotional|Das Gespräch war tief emotional und bewegend.|The conversation was deeply emotional and moving.|der;Gespräch;sein;tief;emotional;und;bewegend
42569.0|pragmatisch|Adjective|pragmatic|Ein pragmatischer Ansatz half uns im Projekt.|A pragmatic approach helped us in the project.|ein;pragmatisch;Ansatz;helfen;uns;in;Projekt
42575.0|Thorben|Proper noun|Thorben|Thorben war der schnellste Läufer im Rennen.|Thorben was the fastest runner in the race.|Thorben;sein;der;schnell;Läufer;in;rennen
42586.0|das Liebesgedicht|noun|the love poem|Das Liebesgedicht rührte alle zu Tränen.|The love poem moved everyone to tears.|der;Liebesgedicht;rühren;alle;zu;Träne
42592.0|fehlerfrei|Adjective|error-free|Der Bericht wurde fehlerfrei eingereicht.|The report was submitted error-free.|der;Bericht;werden;fehlerfrei;einreichen
42594.0|das Werk|noun|the work|Das Werk des Künstlers wurde weltbekannt.|The artist's work became world-famous.|der;Werk;der;Künstler;werden;weltbekennen
42595.0|rezipieren|Verb|receive|Seine Kunst wurde breit rezipiert und diskutiert.|His art was widely received and discussed.|sein;Kunst;werden;breit;rezipieren;und;diskutieren
42597.0|zeitgleich|adverb|simultaneously|Die Glocken läuteten zeitgleich in der Stadt.|The bells rang simultaneously in the city.|der;Glocke;läuten;zeitgleich;in;der;Stadt
42601.0|reparieren|verb|to repair|Der Techniker konnte den Schaden schnell reparieren.|The technician was able to repair the damage quickly.|der;Techniker;können;der;Schaden;schnell;reparieren
42603.0|der Bohrer|noun|drill|Der Bohrer liegt auf der Werkbank bereit.|The drill is ready on the workbench.|der;Bohrer;bereitliegen;auf;der;Werkbank;bereit
42607.0|Kant|noun|Kant|Kant beeinflusste die Philosophie nachhaltig.|Kant profoundly influenced philosophy.|Kant;beeinflussen;der;Philosophie;nachhaltig
42608.0|wortgewandt|Adjective|eloquent|Er ist so wortgewandt, dass alle ihm lauschen.|He is so eloquent that everyone listens to him.|er;sein;so;wortgewandt;dass;alle;ihm;lauschen
42622.0|charmant|Adjective|charming|Der charmante Gastgeber begrüßte uns herzlich.|The charming host welcomed us warmly.|der;charmant;Gastgeber;begrüßen;uns;herzlich
42634.0|schweißen|verb|to weld|Er musste das Metallteil genau schweißen.|He had to weld the metal part precisely.|er;musste;der;Metallteil;genau;schweißen
42638.0|der Klei|noun|clay|Der Klei fühlt sich kühl und formbar an.|The clay feels cool and malleable.|der;Klei;anfühlen;sich;kühl;und;formbar;an
42662.0|wonach|adverb|after what|Wonach hast du so lange gesucht in dieser Schublade?|What have you been searching for so long in this drawer?|wonach;haben;du;so;lange;suchen;in;dieser;Schublade
42666.0|verzehren|Verb|consume|Er wollte das köstliche Mahl langsam verzehren.|He wanted to consume the delicious meal slowly.|er;wollen;der;köstlich;Mahl;langsam;verzehren
42675.0|der Heimwerker|noun|DIY enthusiast|Der Heimwerker plante eine neue Gartenbank.|The DIY enthusiast planned a new garden bench.|der;Heimwerker;planen;ein;neu;Gartenbank
42679.0|der Pragmatismus|noun|the pragmatism|Ihr Pragmatismus half, die Krise zu bewältigen.|Her pragmatism helped to manage the crisis.|ihr;Pragmatismus;helfen;der;Krise;zu;bewältigen
42693.0|das Piano|noun|piano|Das Piano klang himmlisch unter seinen Fingern.|The piano sounded heavenly under his fingers.|der;Piano;klingen;himmlisch;unter;sein;Finger
42703.0|der Klassiker|noun|classic|Der Film gilt als zeitloser Klassiker der 80er.|The movie is considered a timeless classic of the '80s.|der;Film;gelten;als;zeitlos;Klassiker;der;80er
42706.0|der Jazz|noun|the jazz|Der Jazz in dieser Bar war absolut erstklassig.|The jazz in this bar was absolutely top-notch.|der;Jazz;in;dieser;Bar;sein;absolut;erstklassig
42711.0|die Symphonie|noun|symphony|Die Symphonie begann mit einem kraftvollen Takt.|The symphony began with a powerful beat.|der;Symphonie;beginnen;mit;ein;kraftvoll;Takt
42749.0|bleich|adjective|pale|Die bleiche Haut verriet die schlaflosen Nächte.|The pale skin betrayed the sleepless nights.|der;bleich;Haut;verraten;der;schlaflos;Nacht
42755.0|die Damenwelt|noun|womenfolk|Die Damenwelt bewunderte seine charmante Art.|The womenfolk admired his charming manner.|der;Damenwelt;bewunderen;sein;charmant;Art
42793.0|pausieren|verb|to pause|Die Musiker mussten die Probe kurz pausieren.|The musicians had to pause the rehearsal briefly.|der;Musiker;mussten;der;Probe;kurz;pausieren
42803.0|die Fliese|noun|the tile|Die kaputte Fliese wurde umgehend ersetzt.|The broken tile was promptly replaced.|der;kaputt;Fliese;werden;umgehend;ersetzen
42813.0|eklig|adjective|disgusting|Der Geschmack war so eklig, dass er ihn sofort ausspuckte.|The taste was so disgusting that he spat it out immediately.|der;Geschmack;sein;so;eklig;dass;er;ihn;sofort;ausspucken
42826.0|der Wecker|noun|alarm clock|Der Wecker klingelte um Punkt sieben Uhr.|The alarm clock rang at exactly seven o'clock.|der;Wecker;klingeln;um;Punkt;sieben;Uhr
42837.0|der Stau|noun|traffic jam|Im endlosen Stau verlor er fast den Verstand.|In the endless traffic jam, he almost lost his mind.|in;endlos;Stau;verlieren;er;fast;der;Verstand
42841.0|die Intervention|noun|intervention|Die Intervention brachte die Verhandlungen voran.|The intervention advanced the negotiations.|der;Intervention;voranbringen;der;Verhandlung;voran
42853.0|hupen|verb|to honk|Er musste laut hupen, um die Fußgänger zu warnen.|He had to honk loudly to warn the pedestrians.|er;musste;laut;hupen;um;der;Fußgänger;zu;warnen
42903.0|die Germania|noun|Germania|Die Germania wurde als Symbol der Einheit gesehen.|Germania was seen as a symbol of unity.|der;Germania;werden;als;Symbol;der;Einheit;sehen
42904.0|der Export|noun|export|Der Export von Waren stieg in diesem Jahr an.|The export of goods increased this year.|der;Export;von;Ware;ansteigen;in;dieser;Jahr;an
42904.001|das Export|noun|export beer|Das Export wurde bei der Feier ausgeschenkt.|The export beer was served at the celebration.|der;Export;werden;bei;der;Feier;ausschenken
42928.0|die Fernbedienung|Noun|remote control|Die Fernbedienung lag unauffindbar unter dem Sofa.|The remote control was nowhere to be found under the sofa.|der;Fernbedienung;liegen;unauffindbar;unter;der;Sofa
42938.0|sowieso|Adverb|anyway|Das wird sowieso nicht funktionieren, fürchte ich.|That won’t work anyway, I fear.|der;werden;sowieso;nicht;funktionieren;fürchten;ich
42944.0|die Baustelle|noun|construction site|Die Baustelle blockierte die Hauptstraße.|The construction site blocked the main road.|der;Baustelle;blockieren;der;Hauptstraße
42983.0|nebenan|adverb|next door|Die laute Musik von nebenan störte die Nachtruhe.|The loud music next door disturbed the night's peace.|der;laut;Musik;von;nebenan;stören;der;Nachtruhe
43098.0|das Heimweh|Noun|homesickness|Das Heimweh überkam ihn in der kalten Nacht.|Homesickness overcame him on the cold night.|der;Heimweh;überkommen;ihn;in;der;kalt;Nacht
43100.0|das Zuhause|noun|the home|Das Zuhause war von Wärme und Liebe erfüllt.|The home was filled with warmth and love.|der;Zuhause;sein;von;Wärme;und;Liebe;erfüllen
43117.0|der Karton|noun|cardboard box|Der Karton wurde sorgsam zusammengefaltet.|The cardboard box was carefully folded.|der;Karton;werden;sorgsam;zusammengefaltet
43119.0|das Rührei|noun|scrambled eggs|Das Rührei war fluffig und perfekt gewürzt.|The scrambled eggs were fluffy and perfectly seasoned.|der;Rührei;sein;fluffig;und;perfekt;würzen
43177.0|die Schlauheit|noun|cleverness|Die Schlauheit des Fuchses war beeindruckend.|The cleverness of the fox was impressive.|der;Schlauheit;der;Fuchs;sein;beeindruckend
43183.0|schlicht|adjective|plain|Die schlicht gehaltene Dekoration war elegant.|The plain decoration was elegant.|der;schlicht;gehalten;Dekoration;sein;elegant
43185.0|blöd|adjective|stupid|Es wäre blöd, diese Chance ungenutzt zu lassen.|It would be stupid to let this chance go unused.|es;sein;blöd;dieser;Chance;ungenutzt;zu;lassen
43199.0|erörtern|verb|to discuss|Wir müssen die Vor- und Nachteile genau erörtern.|We must discuss the pros and cons in detail.|wir;müssen;der;Vor-;und;Nachteil;genau;erörtern
43203.0|bewirken|verb|cause|Sein Einsatz wird positive Veränderungen bewirken.|His effort will cause positive changes.|sein;Einsatz;werden;positiv;Veränderung;bewirken
43212.0|die Geige|noun|violin|Die Geige klang weich und melancholisch.|The violin sounded soft and melancholic.|der;Geige;klingen;weich;und;melancholisch
43217.0|Wertekanon|noun|canon of values|Der Wertekanon prägt unser Gesellschaftsbild.|The canon of values shapes our societal image.|der;Wertekanon;prägen;unser;Gesellschaftsbild
43220.0|banal|Adjective|banal|Die Lösung des Problems war erschreckend banal.|The solution to the problem was frighteningly banal.|der;Lösung;der;Problem;sein;erschreckend;banal
43226.0|die Ouvertüre|noun|overture|Die Ouvertüre klang majestätisch und kraftvoll.|The overture sounded majestic and powerful.|der;Ouvertüre;klingen;majestätisch;und;kraftvoll
43230.0|der Grand|noun|grand|Der Grand war das Highlight des Ballturniers.|The grand was the highlight of the ballroom tournament.|der;Grand;sein;der;Highlight;der;Ballturnier
43231.0|der Final|noun|the final|Der Final des Turniers war nervenaufreibend und intensiv.|The final of the tournament was nerve-wracking and intense.|der;Final;der;Turnier;sein;nervenaufreibend;und;intensiv
43238.0|die Matroschka|noun|matryoshka|Die Matroschka enthielt immer kleinere Figuren.|The matryoshka contained increasingly smaller figures.|der;Matroschka;enthalten;immer;klein;Figur
43267.0|der Pudel|noun|poodle|Der Pudel rannte freudig im Garten umher.|The poodle ran happily around the garden.|der;Pudel;umherrannen;freudig;in;Garten;umher
43267.001|die Pudel|noun|poodles|Die Pudel spielten ausgelassen miteinander.|The poodles played exuberantly with each other.|der;Pudel;spielen;ausgelassen;miteinander
43274.0|das Gedärm|noun|intestine|Im Schlachthof wurde das Gedärm sorgsam entfernt.|In the slaughterhouse, the intestines were carefully removed.|in;Schlachthof;werden;der;Gedärm;sorgsam;entfernen
43282.0|paradox|adjective|paradoxical|Die Situation war paradox, aber dennoch lösbar.|The situation was paradoxical but still solvable.|der;Situation;sein;paradox;aber;dennoch;lösbar
43292.0|existent|adjective|existent|Die Gefahr war real und durchaus existent.|The danger was real and truly existent.|der;Gefahr;sein;real;und;durchaus;existent
43293.0|der Pardon|noun|pardon|Der Pardon des Königs beendete die Verurteilung.|The king's pardon ended the sentencing.|der;Pardon;der;König;beenden;der;Verurteilung
43293.001|das Pardon|noun|pardon|Ohne ein Pardon wurde das Urteil vollstreckt.|Without a pardon, the sentence was carried out.|ohne;ein;Pardon;werden;der;Urteil;vollstrecken
43321.0|errechnen|verb|to calculate|Er konnte die Gesamtkosten genau errechnen.|He was able to calculate the total costs precisely.|er;können;der;Gesamtkosten;genau;errechnen
43324.0|der Nenner|noun|denominator|Der gemeinsame Nenner wurde rasch gefunden.|The common denominator was quickly found.|der;gemeinsam;Nenner;werden;rasch;finden
43331.0|der Zweig|Noun|branch|Ein zerbrochener Zweig lag auf dem schmalen Pfad.|A broken branch lay on the narrow path.|ein;zerbrochen;Zweig;liegen;auf;der;schmal;Pfad
43336.0|der Kompromiss|noun|compromise|Der Kompromiss war für beide Seiten akzeptabel.|The compromise was acceptable for both sides.|der;Kompromiss;sein;für;beide;Seite;akzeptabel
43336.001|das Kompromiss|Noun|compromise|Der Kompromiss war für beide Seiten akzeptabel.|The compromise was acceptable to both sides.|der;Kompromiss;sein;für;beide;Seite;akzeptabel
43487.0|das Bermudadreieck|Noun|Bermuda Triangle|Das Bermudadreieck bleibt ein Mysterium für viele.|The Bermuda Triangle remains a mystery for many.|der;Bermudadreieck;bleiben;ein;Mysterium;für;viele
43522.0|das Wie|noun|how|Das Wie der Umsetzung bleibt eine knifflige Frage.|The how of implementation remains a tricky question.|der;Wie;der;Umsetzung;bleiben;ein;knifflig;Frage
43526.0|Kurt|Proper noun|Kurt|Kurt lächelte verschmitzt und zog den Vorhang zu.|Kurt smiled mischievously and closed the curtain.|Kurt;lächeln;verschmitzt;und;zuziehen;der;Vorhang;zu
43528.0|abkratzen|verb|to scrape off|Er musste den alten Lack vom Holz abkratzen.|He had to scrape the old paint off the wood.|er;musste;der;alt;Lack;von;Holz;abkratzen
43532.0|der Papa|noun|dad|Der Papa hat uns heute Morgen Pancakes gemacht.|Dad made us pancakes this morning.|der;Papa;haben;uns;heute;Morgen;Pancake;machen
43532.001|die Papa|noun|the dad|Die Papa kochte das beste Essen für den Familientag.|The dad cooked the best meal for family day.|der;Papa;kochen;der;gut;Essen;für;der;Familientag
43542.0|der Schmarotzer|noun|parasite|Der Schmarotzer lebt auf Kosten anderer Wesen.|The parasite lives at the expense of other beings.|der;Schmarotzer;leben;auf;Kosten;anderer;Wesen
43545.0|die Nachbarschaft|noun|neighborhood|Die Nachbarschaft half zusammen beim Schneeräumen.|The neighborhood worked together to clear the snow.|der;Nachbarschaft;helfen;zusammen;bei;Schneeräumen
43553.0|der Strick|noun|rope|Der Strick war stark und vielseitig nutzbar.|The rope was strong and versatile.|der;Strick;sein;stark;und;vielseitig;nutzbar
43558.0|schnulzen|verb|to croon|Er schnulzte melancholisch in der leeren Bar.|He crooned melancholically in the empty bar.|er;schnulzen;melancholisch;in;der;leer;Bar
43562.0|die Eiscreme|noun|ice cream|Die Eiscreme schmolz schnell in der Sommerhitze.|The ice cream melted quickly in the summer heat.|der;Eiscreme;schmolz;schnell;in;der;Sommerhitze
43577.0|der Grabstein|noun|gravestone|Auf dem Grabstein stand eine berührende Inschrift.|On the gravestone was a touching inscription.|auf;der;Grabstein;stehen;ein;berührend;Inschrift
43591.0|der Traumprinz|Noun|dream prince|Sie wartete vergeblich auf ihren Traumprinzen.|She waited in vain for her dream prince.|sie;warten;vergeblich;auf;ihr;Traumprinz
43605.0|fett|adjective|fat|Der Text wurde fett gedruckt, um hervorzuheben.|The text was printed in bold to emphasize it.|der;Text;werden;fett;drucken;um;hervorheben
43607.0|das Rauschgift|noun|narcotic|Das Rauschgift wurde bei einer Razzia gefunden.|The narcotic was found during a raid.|der;Rauschgift;werden;bei;ein;Razzia;finden
43619.0|das Gleis|noun|the track|Das Gleis war wegen Bauarbeiten gesperrt.|The track was closed due to construction.|der;Gleis;sein;wegen;Bauarbeit;sperren
43626.0|der Verlass|noun|reliability|Auf ihn war stets uneingeschränkter Verlass.|He was always completely reliable.|auf;ihn;sein;stets;uneingeschränkt;Verlass
43670.0|der Willen|Noun|the will|Der Willen zum Erfolg war bei ihm unerschütterlich.|His will to succeed was unshakable.|der;Willen;zu;Erfolg;sein;bei;ihm;unerschütterlich
43681.0|prophezeien|verb|to prophesy|Man prophezeit Unwetter für die kommenden Tage.|They are prophesying storms for the coming days.|man;prophezeien;Unwetter;für;der;kommend;Tag
43708.0|der Fettsack|noun|fatso|Der Fettsack wurde zur Zielscheibe für böse Witze.|The fatso became the target of mean jokes.|der;Fettsack;werden;zu;Zielscheibe;für;böse;Witz
43713.0|einstürzen|verb|to collapse|Das Gebäude stürzte nach dem Erdbeben ein.|The building collapsed after the earthquake.|der;Gebäude;einstürzen;nach;der;Erdbeben;ein
43736.0|der Kringel|noun|swirl|Der Kringel aus Sahne verzierte den Kuchen.|The swirl of cream decorated the cake.|der;Kringel;aus;Sahne;verzieren;der;Kuchen
43756.0|die Droge|noun|the drug|Die Droge hatte gefährliche Nebenwirkungen.|The drug had dangerous side effects.|der;Droge;haben;gefährlich;Nebenwirkung
43764.0|russisch|adjective|Russian|Die russisch inspirierte Küche war außergewöhnlich.|The Russian-inspired cuisine was exceptional.|der;russisch;inspiriert;Küche;sein;außergewöhnlich
43765.0|das Roulette|noun|roulette|Das Roulette im Casino lockte viele Spieler an.|The roulette at the casino attracted many players.|der;Roulette;in;Casino;anlocken;vieler;Spieler;an
43771.0|der Schuss|noun|shot|Der Schuss hallte durch die stille Nacht hindurch.|The shot echoed through the silent night.|der;Schuss;halln;durch;der;still;Nacht;hindurch
43780.0|manisch|adjective|manic|Sein manisches Verhalten irritierte alle.|His manic behavior puzzled everyone.|sein;manisch;verhalten;irritieren;alle
43781.0|depressiv|adjective|depressive|Seine depressiv wirkende Haltung fiel sofort auf.|His depressive demeanor was immediately noticeable.|sein;depressiv;wirkend;Haltung;auffallen;sofort;auf
43785.0|panisch|adjective|panicked|Er rannte panisch aus dem brennenden Gebäude.|He ran panicked out of the burning building.|er;rannen;panisch;aus;der;brennend;Gebäude
43795.0|der Vampir|noun|vampire|Der Vampir suchte nach seiner nächsten Beute.|The vampire was searching for its next prey.|der;Vampir;suchen;nach;sein;nächster;Beute
