frequency_rank|speech_part|word_german|word_english|sentence_german|sentence_english
1174|die|die Ausbildung, -en|training, development|Die Ausbildung ist wichtig.|The training is important.
1175|der|der Wagen, -|car, carriage|Der Wagen ist neu.|The car is new.
1176|das|das Schiff, -e|ship|Das Schiff ist groß.|The ship is big.
1177|num|tausend|thousand|Tausend Menschen kamen.|A thousand people came.
1178|die|die Tat, -en|deed, action|Die Tat war mutig.|The deed was brave.
1179|adj|obere (r, s)|upper|Die obere Etage.|The upper floor.
1180|die|die Gleichung, -en|equation|Die Gleichung ist schwierig.|The equation is difficult.
1181|der|der Stein, -e|rock, stone|Der Stein ist schwer.|The stone is heavy.
1182|verb|kümmern (sich), kümmert, kümmerte, hat gekümmert|to take care of, be concerned|Ich kümmere mich darum.|I take care of it.
1183|adj|mittlere (r, s)|middle, average|Die mittlere Größe.|The average size.
1184|verb|erheben, erhebt, erhob, hat erhoben|to raise|Er erhebt die Hand.|He raises his hand.
1185|die|die Erklärung, -en|explanation|Die Erklärung ist klar.|The explanation is clear.
1186|das|das Konzept, -e|concept, idea, plan|Das Konzept ist gut.|The concept is good.
1187|der|der Mittwoch, -e|Wednesday|Mittwoch ist mein Lieblingstag.|Wednesday is my favorite day.
1188|verb|stören, stört, störte, hat gestört|to disturb, bother|Der Lärm stört mich.|The noise bothers me.
1189|die|die Spur, -en|track, lane|Die Spur ist frisch.|The track is fresh.
1190|adj|berliner|(of) Berlin|Die Berliner Mauer.|The Berlin Wall.
1191|die|die Herausforderung, -en|challenge|Die Aufgabe ist eine Herausforderung.|The task is a challenge.
1192|verb|starten, startet, startete, hat gestartet|to start|Das Rennen startet jetzt.|The race starts now.
1193|adj|staatlich|state, government, national|Das ist staatlich geregelt.|That is regulated by the state.
1194|verb|verbessern, verbessert, verbesserte, hat verbessert|to improve, correct|Er verbessert seine Leistung.|He improves his performance.
1195|adj|heiß|hot|Der Kaffee ist heiß.|The coffee is hot.
1196|die|die Vergangenheit, -en|past|Die Vergangenheit ist wichtig.|The past is important.
1197|das|das Gleichgewicht, -e|balance|Das Gleichgewicht ist verloren.|The balance is lost.
1198|das|Griechenland|Greece|Griechenland ist schön.|Greece is beautiful.
1199|das|das Maß, -e|measure|Das Maß ist korrekt.|The measure is correct.
1200|verb|abgeben, gibt ab, gab ab, hat abgegeben|to give, hand in, submit|Er gibt das Paket ab.|He hands in the package.
1201|der|der Bericht, -e|report|Der Bericht ist fertig.|The report is ready.
1202|die|die Qualität, -en|quality|Die Qualität ist hoch.|The quality is high.
1203|der|der Rand, -̈er|edge|Der Rand ist scharf.|The edge is sharp.
1204|das|Italien|Italy|Italien ist sonnig.|Italy is sunny.
1205|der|der Kern, -e|seed, core, nucleus|Der Kern ist hart.|The core is hard.
1206|der|der Winter, -|winter|Der Winter ist kalt.|The winter is cold.
1207|der|der Hintergrund, -̈e|background|Der Hintergrund ist dunkel.|The background is dark.
1208|der|Osten, Ost-|east|Der Osten ist weit.|The east is vast.
1209|das|Amerika|America|Amerika ist groß.|America is big.
1210|adj|geboren|born|Er ist geboren.|He is born.
1211|adj|gefährlich|dangerous|Das Tier ist gefährlich.|The animal is dangerous.
1212|verb|zwingen, zwingt, zwang, hat gezwungen|to force|Er zwingt ihn.|He forces him.
1213|das|das Bier, -e|beer|Das Bier ist kalt.|The beer is cold.
1214|verb|ansprechen, spricht an, sprach an, hat angesprochen|to address, speak|Er spricht das Thema an.|He addresses the topic.
1215|adj|komplett|complete|Das Bild ist komplett.|The picture is complete.
1216|die|die Forderung, -en|demand, claim|Die Forderung ist hoch.|The demand is high.
1217|verb|gelangen, gelangt, gelangte, ist gelangt|to reach|Er gelangt ans Ziel.|He reaches the goal.
1218|die|die Nachricht, -en|news, message|Die Nachricht ist gut.|The news is good.
1219|verb|sammeln, sammelt, sammelte, hat gesammelt|to collect, gather|Er sammelt Briefmarken.|He collects stamps.
1220|verb|ablehnen, lehnt ab, lehnte ab, hat abgelehnt|to refuse, reject, turn down|Er lehnt das Angebot ab.|He rejects the offer.
1221|verb|stoßen, stößt, stieß, hat gestoßen|to bump, push|Er stößt den Tisch.|He bumps the table.
1222|adj|konstant|constant|Die Temperatur ist konstant.|The temperature is constant.
1223|der|der Oktober, -|October|Oktober ist kühl.|October is cool.
1224|verb|umgehen, umgeht, umging, hat umgangen|to treat, handle|Er geht vorsichtig um.|He handles carefully.
1225|verb|angehen, geht an, ging an, ist angegangen|to concern, go on|Das geht dich nichts an.|That doesn't concern you.
1226|verb|verlaufen, verläuft, verlief, ist verlaufen|to proceed, get lost|Der Tag verlief gut.|The day proceeded well.
1227|adv|demnach|therefore|Er hat demnach recht.|Therefore, he is right.
1228|verb|auftauchen, taucht auf, tauchte auf, ist aufgetaucht|to surface, appear|Ein Problem tauchte auf.|A problem surfaced.
1229|adj|böse|bad, mad|Er war böse auf mich.|He was mad at me.
1230|verb|auslösen, löst aus, löste aus, hat ausgelöst|to set off, provoke|Der Alarm wurde ausgelöst.|The alarm was set off.
1231|verb|weitergehen, geht weiter, ging weiter, ist weitergegangen|to go on, continue|Der Film geht weiter.|The movie goes on.
1232|verb|abhängen, hängt ab, hing ab, hat abgehangen|to depend|Es hängt vom Wetter ab.|It depends on the weather.
1233|die|die Geschwindigkeit, -en|speed|Die Geschwindigkeit ist hoch.|The speed is high.
1234|adj|ideal|ideal|Das ist ideal.|That is ideal.
1235|der|der Augenblick, -e|moment|Warte einen Augenblick!|Wait a moment!
1236|verb|reduzieren, reduziert, reduzierte, hat reduziert|to reduce, decrease|Wir müssen die Kosten reduzieren.|We need to reduce the costs.
1237|die|die Maschine, -n|machine|Die Maschine ist kaputt.|The machine is broken.
1238|adj|linear|linear|Die Linie ist linear.|The line is linear.
1239|verb|ausmachen, macht aus, machte aus, hat ausgemacht|to put out, agree|Das macht nichts aus.|That doesn't matter.
1240|verb|eintreten, tritt ein, trat ein, hat eingetreten|to enter, join, occur|Er tritt in den Raum ein.|He enters the room.
1241|adj|kritisch|critical|Die Lage ist kritisch.|The situation is critical.
1242|part|äh|um|Äh, ich weiß nicht.|Um, I don't know.
1243|das|das Wochenende, -n|weekend|Das Wochenende ist kurz.|The weekend is short.
1244|der|der Donnerstag, -e|Thursday|Donnerstag ist morgen.|Thursday is tomorrow.
1245|die|die Saison, -s|season|Die Saison beginnt bald.|The season starts soon.
1246|der|der Forscher, -|researcher|Der Forscher ist bekannt.|The researcher is famous.
1247|verb|gründen, gründet, gründete, hat gegründet|to establish, found|Er gründet eine Firma.|He founds a company.
1248|adj|offensichtlich|obvious|Das ist offensichtlich.|That is obvious.
1249|das|das Teilchen, -|particle|Ein Teilchen ist klein.|A particle is small.
1250|verb|genügen, genügt, genügte, hat genügt|to be sufficient|Das genügt mir.|That is sufficient for me.
1251|verb|schieben, schiebt, schob, hat geschoben|to push|Er schiebt den Wagen.|He pushes the cart.
1252|der|der Computer, -|computer|Der Computer ist neu.|The computer is new.
1253|der|der Effekt, -e|effect|Der Effekt ist groß.|The effect is significant.
1254|verb|abnehmen, nimmt ab, nahm ab, hat abgenommen|to lose weight, decrease, reduce|Er hat Gewicht abgenommen.|He has lost weight.
1255|die|die Verteilung, -en|distribution|Die Verteilung ist gerecht.|The distribution is fair.
1256|verb|blicken, blickt, blickte, hat geblickt|to look|Er blickt nach oben.|He looks up.
1257|verb|beitragen, trägt bei, trug bei, hat beigetragen|to contribute|Er trägt zur Diskussion bei.|He contributes to the discussion.
1258|die|die Anwendung, -en|application, use|Die Anwendung ist einfach.|The application is simple.
1259|verb|zeichnen, zeichnet, zeichnete, hat gezeichnet|to draw|Sie zeichnet ein Bild.|She draws a picture.
1260|adj|frisch|fresh|Das Brot ist frisch.|The bread is fresh.
1261|adv|meistens|mostly|Meistens lese ich abends.|Mostly, I read in the evenings.
1262|verb|erwähnen, erwähnt, erwähnte, hat erwähnt|to mention|Er erwähnte deinen Namen.|He mentioned your name.
1263|die|die Welle, -n|wave|Die Welle ist hoch.|The wave is high.
1264|die|die Nase, -n|nose|Meine Nase juckt.|My nose itches.
1265|verb|vertreten, vertritt, vertrat, hat vertreten|to represent, advocate, substitute|Er vertritt die Firma.|He represents the company.
1266|adj|dicht|thick, dense|Der Wald ist dicht.|The forest is dense.
1267|der|der Soldat, -en|soldier|Der Soldat marschiert.|The soldier marches.
1268|adj|bereit|ready|Ich bin bereit.|I am ready.
1269|die|die Technik, -en|technology, technique|Die Technik ist fortgeschritten.|The technology is advanced.
1270|das|das Blatt, -̈er|sheet, leaf|Das Blatt ist grün.|The leaf is green.
1271|verb|prägen, prägt, prägte, hat geprägt|to shape, mint|Das hat ihn geprägt.|That shaped him.
1272|adv|sozusagen|so to speak|Er ist sozusagen mein Freund.|He is, so to speak, my friend.
1273|der|der November, -|November|November ist kalt.|November is cold.
1274|adj|Schweizer|Swiss|Der Käse ist Schweizer.|The cheese is Swiss.
1275|adj|gesund|healthy|Ich fühle mich gesund.|I feel healthy.
1276|verb|danken, dankt, dankte, hat gedankt|to thank|Ich danke dir.|I thank you.
1277|der|der Fußball, -̈e|soccer, soccer ball|Wir spielen Fußball.|We play soccer.
1278|der|der Umstand, -̈e|circumstance|Die Umstände sind schwierig.|The circumstances are difficult.
1279|verb|einladen, lädt ein, lud ein, hat eingeladen|to invite, load|Wir laden Freunde ein.|We invite friends.
1280|das|Kilogramm, kg|kilogram|Das Paket wiegt ein Kilogramm.|The package weighs one kilogram.
1281|adj|warm|warm|Der Tee ist warm.|The tea is warm.
1282|die|die Integration, -en|integration|Die Integration ist wichtig.|The integration is important.
1283|der|der Nachbar, -n|neighbor|Mein Nachbar ist nett.|My neighbor is nice.
1284|adj|maximal|maximum|Das ist maximal möglich.|That is possible at maximum.
1285|die|die Figur, -en|figure|Die Figur ist schön.|The figure is beautiful.
1286|die|die Freude, -n|joy|Die Freude ist groß.|The joy is great.
1287|adj|offiziell|official|Das ist offiziell.|That is official.
1288|adj|außen|outside|Er bleibt draußen.|He stays outside.
1289|der|der Kreis, -e|circle, district|Der Kreis ist rund.|The circle is round.
1290|verb|nicken, nickt, nickte, hat genickt|to nod|Er nickt zustimmend.|He nods approvingly.
1291|adj|digital|digital|Die Uhr ist digital.|The clock is digital.
1292|adj|unbekannt|unknown|Der Autor ist unbekannt.|The author is unknown.
1293|das|das Gericht, -e|court, dish|Das Gericht ist lecker.|The dish is tasty.
1294|verb|schätzen, schätzt, schätzte, hat geschätzt|to estimate, value|Ich schätze deine Hilfe.|I appreciate your help.
1295|verb|organisieren, organisiert, organisierte, hat organisiert|to organize|Er organisiert das Event.|He organizes the event.
1296|der|der Aspekt, -e|aspect|Der Aspekt ist wichtig.|The aspect is important.
1297|verb|verzichten, verzichtet, verzichtete, hat verzichtet|to do without|Er verzichtet auf Zucker.|He does without sugar.
1298|verb|bemerken, bemerkt, bemerkte, hat bemerkt|to notice|Ich habe das bemerkt.|I noticed that.
1299|der|der Kaffee, -s|coffee|Der Kaffee ist stark.|The coffee is strong.
1300|adv|das Leid|(be) tired (of)|Ich bin des Wartens leid.|I am tired of waiting.
1300|das|das Leid|sorrow, grief|Das Leid war groß.|The sorrow was great.
1301|adj|still|still, quiet|Das Zimmer ist still.|The room is quiet.
1302|verb|leiten, leitet, leitete, hat geleitet|to lead|Er leitet das Projekt.|He leads the project.
1303|der|der Vertreter, -|representative|Er ist mein Vertreter.|He is my representative.
1304|die|die Statistik, -en|statistics|Die Statistik ist korrekt.|The statistics are accurate.
1305|die|die Heimat, -en|home, homeland|Deutschland ist meine Heimat.|Germany is my homeland.
1306|der|Milliliter, ml|milliliter|Das Glas fasst einen Milliliter.|The glass holds a milliliter.
1307|verb|zurückkehren, kehrt zurück, kehrte zurück, ist zurückgekehrt|to return|Er kehrt nach Hause zurück.|He returns home.
1308|der|der Gegenstand, -̈e|object|Der Gegenstand ist schwer.|The object is heavy.
1309|pron|euer|your|Euer Haus ist schön.|Your house is beautiful.
1310|verb|umsetzen, setzt um, setzte um, hat umgesetzt|to implement, move, put (into practice)|Er setzt den Plan um.|He implements the plan.
1311|verb|betreiben, betreibt, betrieb, hat betrieben|to proceed with, operate, run|Er betreibt ein Geschäft.|He runs a business.
1312|die|die Zusammenarbeit|cooperation|Die Zusammenarbeit ist gut.|The cooperation is good.
1313|verb|enden, endet, endete, hat geendet|to end|Der Film endet gut.|The movie ends well.
1314|adv|vielmehr|rather|Ich mag Tee, vielmehr Kaffee.|I like tea, rather coffee.
1315|verb|konzentrieren, konzentriert, konzentrierte, hat konzentriert|to concentrate|Ich kann mich nicht konzentrieren.|I can't concentrate.
1316|verb|landen, landet, landete, ist gelandet|to land|Das Flugzeug landet pünktlich.|The plane lands on time.
1317|der|der See, -n|lake|Der See ist klar.|The lake is clear.
1317|die|der See, -n|sea|Die See ist ruhig.|The sea is calm.
1318|der|der Tourist, -en|tourist|Der Tourist ist verloren.|The tourist is lost.
1319|die|die Konzentration, -en|concentration|Die Konzentration ist wichtig.|The concentration is important.
1320|verb|verbieten, verbietet, verbot, hat verboten|to forbid, prohibit|Das Rauchen ist verboten.|Smoking is prohibited.
1321|adj|krank|sick, ill|Er ist krank.|He is sick.
1322|die|die Fähigkeit, -en|ability, capability|Die Fähigkeit ist wichtig.|The ability is important.
1323|adj|finanziell|financial|Die finanzielle Lage ist schlecht.|The financial situation is bad.
1324|der, die|die Jugendliche|adolescent|Die Jugendliche liest ein Buch.|The adolescent reads a book.
1325|das|das Netz, -e|net, network|Das Netz ist groß.|The network is large.
1326|die|die Änderung, -en|change, modification, alteration|Die Änderung ist notwendig.|The modification is necessary.
1327|verb|abschließen, schließt ab, schloss ab, hat abgeschlossen|to lock, conclude|Er schließt die Tür ab.|He locks the door.
1328|die|die Erkenntnis, -se|realization, discovery|Die Erkenntnis war wichtig.|The realization was important.
1329|adj|selbstverständlich|natural, self-evident, obvious|Das ist selbstverständlich.|That is obvious.
1330|verb|erzeugen, erzeugt, erzeugte, hat erzeugt|to produce, generate|Der Motor erzeugt Strom.|The engine generates electricity.
1331|die|die Ursache, -n|cause|Die Ursache ist unbekannt.|The cause is unknown.
1332|adj|ursprünglich|original|Das Gebäude ist ursprünglich.|The building is original.
1333|die|die Basis, -en|basis|Das ist die Basis.|That is the basis.
1334|verb|erzielen, erzielt, erzielte, hat erzielt|to achieve, reach|Er erzielte sein Ziel.|He achieved his goal.
1335|die|die Forschung, -en|research|Die Forschung ist abgeschlossen.|The research is completed.
1336|verb|schießen, schießt, schoss, hat geschossen|to shoot|Er schießt ein Tor.|He shoots a goal.
1337|verb|warnen, warnt, warnte, hat gewarnt|to warn|Der Lehrer warnte die Schüler.|The teacher warned the students.
1338|der|Zentimeter, cm|centimeter, cm|Das Buch ist zehn Zentimeter dick.|The book is ten centimeters thick.
1339|verb|eröffnen, eröffnet, eröffnete, hat eröffnet|to open, start|Das Geschäft eröffnet morgen.|The shop opens tomorrow.
1340|die|die Ahnung, -en|suspicion, idea|Ich habe keine Ahnung.|I have no idea.
1341|verb|ankündigen, kündigt an, kündigte an, hat angekündigt|to announce|Er kündigte seinen Besuch an.|He announced his visit.
1342|das|das Enzym, -e|enzyme|Das Enzym ist wichtig.|The enzyme is important.
1343|adj|individuell|individual|Das Design ist individuell.|The design is individual.
1344|adj|intensiv|intensive|Das Training ist intensiv.|The training is intensive.
1345|die|die Bundesregierung, -en|federal government|Die Bundesregierung tagt heute.|The federal government meets today.
1346|verb|begreifen, begreift, begriff, hat begriffen|to understand, grasp|Er begreift das Konzept.|He understands the concept.
1347|die|die Szene, -n|scene|Die Szene ist berühmt.|The scene is famous.
1348|die|DDR (Deutsche Demokratische Republik)||Die DDR existiert nicht mehr.|The DDR no longer exists.
1349|adj|rasch|quick|Der Bus kam rasch.|The bus came quickly.
1350|adj|real|real|Das ist real.|That is real.
1351|der, die|die Abgeordnete|member of parliament, congress|Die Abgeordnete spricht.|The member of parliament speaks.
1352|verb|verstärken, verstärkt, verstärkte, hat verstärkt|to strengthen, reinforce|Die Brücke wird verstärkt.|The bridge is being reinforced.
1353|verb|ausschließen, schließt aus, schloss aus, hat ausgeschlossen|to exclude, rule out|Er wurde ausgeschlossen.|He was excluded.
1354|adj|sinnvoll|sensible, meaningful|Das ist sinnvoll.|That is sensible.
1355|der|der Bezug, -̈e|reference, cover|Er nimmt Bezug auf das Buch.|He makes reference to the book.
1356|der|der Dienstag, -e|Tuesday|Dienstag ist ein Arbeitstag.|Tuesday is a workday.
1357|der|der Stand, -̈e|stand, stage|Der Stand ist hoch.|The level is high.
1358|verb|retten, rettet, rettete, hat gerettet|to save, rescue|Er rettete das Kind.|He saved the child.
1359|num|zwanzig|twenty|Zwanzig Menschen kamen.|Twenty people came.
1360|der|der Club, -s|club|Der Club ist voll.|The club is full.
1361|die|die Gewalt, -en|violence, force|Gewalt ist keine Lösung.|Violence is not a solution.
1362|verb|gucken, guckt, guckte, hat geguckt (kucken)|to look|Er guckte aus dem Fenster.|He looked out the window.
1363|der|der Anschlag, -̈e|attack|Der Anschlag war verheerend.|The attack was devastating.
1364|verb|beeinflussen, beeinflusst, beeinflusste, hat beeinflusst|to influence|Das Wetter beeinflusst mich.|The weather influences me.
1365|verb|riechen, riecht, roch, hat gerochen|to smell|Die Rose riecht gut.|The rose smells good.
1366|prep|außerhalb|outside|Er wohnt außerhalb der Stadt.|He lives outside the city.
1367|verb|begleiten, begleitet, begleitete, hat begleitet|to accompany|Sie begleitet ihn.|She accompanies him.
1368|das|das Publikum, die Publika|public, audience|Das Publikum klatschte.|The audience applauded.
1369|der|der Besucher, -|visitor|Der Besucher ist willkommen.|The visitor is welcome.
1370|das|das Wachstum|growth|Das Wachstum ist stark.|The growth is strong.
1371|verb|aufgeben, gibt auf, gab auf, hat aufgegeben|to give up|Er gibt nicht auf.|He does not give up.
1372|adj|stolz|proud|Ich bin stolz auf dich.|I am proud of you.
1373|der|der Verlust, -e|loss|Der Verlust war groß.|The loss was great.
1374|verb|begründen, begründet, begründete, hat begründet|to justify|Er begründet seine Meinung.|He justifies his opinion.
1375|adj|streng|strict|Der Lehrer ist streng.|The teacher is strict.
1376|die|die Ecke, -n|corner|Die Ecke ist dunkel.|The corner is dark.
1377|der|der Lauf, -̈e|course, run, race|Der Lauf war anstrengend.|The run was exhausting.
1378|der|der Artikel, -|article|Der Artikel ist interessant.|The article is interesting.
1379|adj|berühmt|famous|Der Schauspieler ist berühmt.|The actor is famous.
1380|verb|ersetzen, ersetzt, ersetzte, hat ersetzt|to replace, reimburse|Der alte Computer wird ersetzt.|The old computer is replaced.
1381|die|die Wahrscheinlichkeit, -en|probability|Die Wahrscheinlichkeit ist hoch.|The probability is high.
1382|das|das Ausland|foreign countries|Er lebt im Ausland.|He lives abroad.
1383|adj|bayrisch|Bavarian|Das Essen ist bayrisch.|The food is Bavarian.
1384|adv|diesmal|this time|Diesmal mache ich es.|This time I will do it.
1385|das|das Gehirn, -e|brain|Das Gehirn ist komplex.|The brain is complex.
1386|das|das Gebäude, -|building|Das Gebäude ist hoch.|The building is tall.
1387|adj|langfristig|long-term|Die Investition ist langfristig.|The investment is long-term.
1388|adj|herzlich|cordial, warm|Er ist herzlich willkommen.|He is warmly welcome.
1389|verb|sichern, sichert, sicherte, hat gesichert|to secure, safeguard|Die Tür ist gesichert.|The door is secured.
1390|das|das Material, -ien|material|Das Material ist teuer.|The material is expensive.
1391|verb|verbringen, verbringt, verbrachte, hat verbracht|to spend (time)|Er verbringt viel Zeit.|He spends a lot of time.
1392|der|der Strom, -̈e|stream, current, electricity|Der Strom ist weg.|The electricity is gone.
1393|das|das Amt, -Äer|office, department, function|Er arbeitet im Amt.|He works in the office.
1394|verb|kritisieren, kritisiert, kritisierte, hat kritisiert|to criticize|Er kritisiert den Plan.|He criticizes the plan.
1395|verb|vermitteln, vermittelt, vermittelte, hat vermittelt|to convey, mediate, find, procure|Er vermittelt den Vertrag.|He mediates the contract.
1396|die|die Wirklichkeit, -en|reality|Die Wirklichkeit ist hart.|The reality is harsh.
1397|die|die Union, -en|union|Die Union ist stark.|The union is strong.
1398|das|das Studium, -en|study, studies|Das Studium ist schwer.|The studies are hard.
1399|verb|festhalten, hält fest, hielt fest, hat festgehalten|to hold on to, detain|Er hält am Plan fest.|He holds on to the plan.
1400|verb|präsentieren, präsentiert, präsentierte, hat präsentiert|to present, show|Sie präsentiert ihre Ideen.|She presents her ideas.
1401|die|die Demokratie, -n|democracy|Die Demokratie ist wichtig.|Democracy is important.
1402|adv|niemals|never|Ich werde niemals lügen.|I will never lie.
1403|die|die Aufnahme, -n|reception, recording, snapshot|Die Aufnahme war klar.|The recording was clear.
1404|die|die Ausnahme, -n|exception|Das ist eine Ausnahme.|That is an exception.
1405|verb|beenden, beendet, beendete, hat beendet|to end|Der Krieg wurde beendet.|The war was ended.
1406|die|die Investition, -en|investment|Die Investition ist groß.|The investment is significant.
1407|die|die Lust, -̈e|desire|Ich habe Lust auf Eis.|I desire ice cream.
1408|verb|prüfen, prüft, prüfte, hat geprüft|to examine, check|Der Lehrer prüft die Tests.|The teacher checks the tests.
1409|verb|anlegen, legt an, legte an, hat angelegt|to put on, invest|Er legt das Geld an.|He invests the money.
1410|der|der Zuschauer, -|spectator|Der Zuschauer applaudiert.|The spectator applauds.
1411|adj|hell|light, bright|Das Zimmer ist hell.|The room is bright.
1412|adv|mitten|in the middle|Mitten im Raum.|In the middle of the room.
1413|prep|zufolge|according to|Dem Bericht zufolge.|According to the report.
1414|der|der Konflikt, -e|conflict|Der Konflikt ist gelöst.|The conflict is resolved.
1415|die|die Bahn, -en|train, railway, way|Die Bahn ist pünktlich.|The train is on time.
1416|das|Syrien|Syria|Syrien ist weit weg.|Syria is far away.
1417|das|das Einkommen, -|income|Das Einkommen ist hoch.|The income is high.
1418|verb|empfehlen, empfiehlt, empfahl, hat empfohlen|to recommend|Ich empfehle dieses Buch.|I recommend this book.
1419|adj|britisch|British|Sie ist britisch.|She is British.
1420|verb|fürchten, fürchtet, fürchtete, hat gefürchtet|to fear|Er fürchtet die Dunkelheit.|He fears the darkness.
1421|verb|vorbereiten, bereitet vor, bereitete vor, hat vorbereitet|to prepare|Er bereitet das Essen vor.|He prepares the food.
1422|die|die Aktivität, -en|activity|Die Aktivität ist anstrengend.|The activity is exhausting.
1423|der|der Auftrag, -̈e|instructions, order, job|Der Auftrag ist wichtig.|The job is important.
1424|adj|froh|happy, glad|Ich bin froh.|I am happy.
1425|verb|äußern, äußert, äußerte, hat geäußert|to express, voice|Er äußerte seine Meinung.|He expressed his opinion.
1426|der|der Geist, -er|mind, spirit|Der Geist ist stark.|The spirit is strong.
1427|das|das Objekt, -e|object|Das Objekt ist schwer.|The object is heavy.
1428|adv|möglicherweise|possibly|Er kommt möglicherweise.|He might come.
1429|adj|zuständig|appropriate, responsible|Er ist zuständig.|He is responsible.
1430|verb|aufweisen, weist auf, wies auf, hat aufgewiesen|to show, exhibit, contain|Der Bericht weist Fehler auf.|The report shows errors.
1431|verb|springen, springt, sprang, ist gesprungen|to jump|Das Kind springt hoch.|The child jumps high.
1432|der|der Hof, -̈e|courtyard, yard|Der Hof ist groß.|The courtyard is big.
1433|der|der Polizist, -en|police officer, policeman|Der Polizist hilft.|The police officer helps.
1434|die|die Übung, -en|exercise, practice|Die Übung ist schwer.|The exercise is hard.
1435|der|der Widerstand, -̈e|resistance, opposition|Der Widerstand wächst.|The resistance grows.
1436|verb|anziehen, zieht an, zog an, hat angezogen|to attract, put on, dress|Er zieht das Hemd an.|He puts on the shirt.
1437|der|der Experte, -n|expert|Der Experte spricht.|The expert speaks.
1438|adv|ohnehin|anyway|Er kommt ohnehin.|He comes anyway.
1439|verb|füllen, füllt, füllte, hat gefüllt|to fill|Der Eimer ist gefüllt.|The bucket is filled.
1440|die|die Gemeinde, -n|community, municipality|Die Gemeinde ist klein.|The community is small.
1441|die|die Pause, -n|pause, break|Die Pause ist kurz.|The break is short.
1442|adj|scharf|sharp|Das Messer ist scharf.|The knife is sharp.
1443|verb|schütteln, schüttelt, schüttelte, hat geschüttelt|to shake|Er schüttelt den Kopf.|He shakes his head.
1444|das|das Fernsehen|television|Das Fernsehen läuft.|The television is on.
1445|die|die Formel, -n|formula|Die Formel ist schwer.|The formula is difficult.
1446|adj|gelb|yellow|Die Blume ist gelb.|The flower is yellow.
1447|das|das Sommersemester, -|summer semester|Das Sommersemester beginnt.|The summer semester starts.
1448|adj|heftig|hard, heavy, violent|Der Sturm war heftig.|The storm was violent.
1449|die|die Bühne, -n|stage|Die Bühne ist leer.|The stage is empty.
1450|verb|empfinden, empfindet, empfand, hat empfunden|to feel|Er empfindet Freude.|He feels joy.
1451|der|der Schaden, -̈|damage|Der Schaden ist groß.|The damage is significant.
