|#frequency_rank|part_of_speech|word_de|word_pl_de|word_en|word_ru|sentence_de|sentence_en|sentence_ru
2617|2530|verb|bedrohen, bedroht, bedrohte, hat bedroht||to threaten|угрожать|Die Situation bedroht uns alle.|The situation threatens us all.|Ситуация угрожает всем нам.
2618|2531|adv|keineswegs||by no means, not at all|ни в коем случае|Das ist keineswegs sicher.|That is by no means certain.|Это ни в коем случае не безопасно.
2619|2532|adj|klug||clever|умный|Er ist ein kluger Junge.|He is a clever boy.|Он умный мальчик.
2620|2533|der|der Arbeitnehmer, -||employee|работник|Der Arbeitnehmer ist krank.|The employee is sick.|Работник болеет.
2621|2534|verb|beugen, beugt, beugte, hat gebeugt||to bend|наклоняться|Er beugt sich vor.|He bends forward.|Он наклоняется вперед.
2622|2535|verb|einbringen, bringt ein, brachte ein, hat eingebracht||to bring in, contribute|вносить|Er bringt neue Ideen ein.|He brings in new ideas.|Он вносит новые идеи.
2623|2536|die|die Materie, -n||matter|материя|Die Materie ist komplex.|The matter is complex.|Материя сложная.
2624|2537|das|das Personal||staff|персонал|Das Personal ist freundlich.|The staff is friendly.|Персонал дружелюбный.
2625|2538|adj|scheinbar||apparent|кажущийся|Das ist nur scheinbar so.|That is only apparently so.|Это только кажется так.
2626|2539|die|die Frequenz, -en||frequency|частота|Die Frequenz ist hoch.|The frequency is high.|Частота высокая.
2627|2540|verb|lehren, lehrt, lehrte, hat gelehrt||to teach|учить|Sie lehrt an der Universität.|She teaches at the university.|Она преподает в университете.
2628|2541|adj|selbstständig||independent, self-employed|независимый|Er arbeitet selbstständig.|He works independently.|Он работает самостоятельно.
2629|2542|verb|überwinden, überwindet, überwand, hat überwunden||to overcome|преодолевать|Sie überwinden alle Hindernisse.|They overcome all obstacles.|Они преодолевают все препятствия.
2630|2543|adj|unklar||unclear|непонятный|Die Erklärung war unklar.|The explanation was unclear.|Объяснение было непонятным.
2631|2544|adj|verfügbar||available|доступный|Das Zimmer ist verfügbar.|The room is available.|Комната доступна.
2632|2545|pron|wozu||what for, to what|для чего|Wozu ist das gut?|What is that good for?|Для чего это нужно?
2633|2546|adj|schlicht||simple, plain|простой|Der Stil ist schlicht.|The style is simple.|Стиль простой.
2634|2547|adj|angemessen||appropriate|соответствующий|Die Entscheidung war angemessen.|The decision was appropriate.|Решение было соответствующим.
2635|2548|der|der Arbeitsmarkt, -̈e||labor market|рынок труда|Der Arbeitsmarkt verändert sich.|The labor market is changing.|Рынок труда меняется.
2636|2549|der|der Pass, -̈e||pass, passport|паспорт|Der Pass ist abgelaufen.|The passport has expired.|Паспорт истек.
2637|2550|der|der Bedarf, -e||need, demand|потребность|Der Bedarf an Wasser steigt.|The need for water is increasing.|Потребность в воде растет.
2638|2551|adj|ernsthaft||serious|серьезный|Das ist eine ernsthafte Angelegenheit.|This is a serious matter.|Это серьезное дело.
2639|2552|verb|werben, wirbt, warb, hat geworben||to advertise|рекламировать|Sie werben für das Produkt.|They advertise the product.|Они рекламируют продукт.
2640|2553|verb|errichten, errichtet, errichtete, hat errichtet||to build, erect|возводить|Er errichtete ein neues Gebäude.|He erected a new building.|Он возвел новое здание.
2641|2554|der|der Kredit, -e||loan, credit|кредит|Ich brauche einen Kredit.|I need a loan.|Мне нужен кредит.
2642|2555|das|das Wohnzimmer, -||living room|гостиная|Das Wohnzimmer ist gemütlich.|The living room is cozy.|Гостиная уютная.
2643|2556|die|die Kompetenz, -en||competence, authority|компетентность|Ihre Kompetenz ist beeindruckend.|Her competence is impressive.|Ее компетентность впечатляющая.
2644|2557|die|die Leitung, -en||management, leadership|руководство|Die Leitung hat gewechselt.|The management has changed.|Руководство сменилось.
2645|2558|verb|strahlen, strahlt, strahlte, hat gestrahlt||to shine|сиять|Die Sonne strahlt hell.|The sun shines brightly.|Солнце ярко светит.
2646|2559|der|der Zucker, -||sugar|сахар|Der Kaffee braucht Zucker.|The coffee needs sugar.|Кофе нуждается в сахаре.
2647|2560|der|der Austausch, -e||exchange|обмен|Der Austausch war produktiv.|The exchange was productive.|Обмен был продуктивным.
2648|2561|verb|gleichen, gleicht, glich, hat geglichen||to be alike, be just like|походить|Er gleicht seinem Bruder.|He is just like his brother.|Он похож на своего брата.
2649|2562|die|die Station, -en||station, stop, stopover|станция|Die Station ist geschlossen.|The station is closed.|Станция закрыта.
2650|2563|der|der Kaiser, -||emperor|император|Der Kaiser war mächtig.|The emperor was powerful.|Император был могущественным.
2651|2564|verb|sperren, sperrt, sperrte, hat gesperrt||to cut off, block, close|перекрывать|Die Straße ist gesperrt.|The road is blocked.|Дорога перекрыта.
2652|2565|der|der Sportler, -||athlete|спортсмен|Der Sportler trainiert hart.|The athlete trains hard.|Спортсмен тренируется усердно.
2653|2566|die|die Differenz, -en||difference|разница|Die Differenz ist klein.|The difference is small.|Разница маленькая.
2654|2567|der|der Fakt, -en||fact|факт|Das ist ein Fakt.|That is a fact.|Это факт.
2655|2568|die|die Herstellung, -en||production|производство|Die Herstellung dauert lange.|The production takes a long time.|Производство длится долго.
2656|2569|das|das Individuum, -en||individual|индивид|Jedes Individuum ist einzigartig.|Every individual is unique.|Каждый индивид уникален.
2657|2570|das|das Symbol, -e||symbol|символ|Das Herz ist ein Symbol der Liebe.|The heart is a symbol of love.|Сердце - это символ любви.
2658|2571|verb|ausbreiten, breitet aus, breitete aus, hat ausgebreitet||to spread, spread out|распространяться|Die Wolken breiten sich aus.|The clouds spread out.|Облака распространяются.
2659|2572|die|die Versorgung, -en||supply, care|снабжение|Die Versorgung ist gesichert.|The supply is secured.|Снабжение обеспечено.
2660|2573|der|der Kommentar, -e||comment, opinion|комментарий|Der Kommentar war hilfreich.|The comment was helpful.|Комментарий был полезным.
2661|2574|adj|kontinuierlich||constant, continuous|непрерывный|Der Prozess ist kontinuierlich.|The process is continuous.|Процесс непрерывный.
2662|2575|das|das Radio, -s||radio|радио|Das Radio ist laut.|The radio is loud.|Радио громкое.
2663|2576|adj|Münchner||Munich|Мюнхенский|Der Münchner Markt ist groß.|The Munich market is big.|Мюнхенский рынок большой.
2664|2577|der|der Musiker, -||musician|музыкант|Der Musiker spielt Klavier.|The musician plays piano.|Музыкант играет на пианино.
2665|2578|verb|wecken, weckt, weckte, hat geweckt||to wake sb up|будить|Der Wecker hat mich geweckt.|The alarm clock woke me up.|Будильник меня разбудил.
2666|2579|verb|ansteigen, steigt an, stieg an, ist angestiegen||to rise, go up|повышаться|Die Preise steigen an.|The prices are rising.|Цены повышаются.
2667|2580|die|die Rückkehr||return|возвращение|Die Rückkehr war erfreulich.|The return was joyful.|Возвращение было радостным.
2668|2581|verb|auszeichnen, zeichnet aus, zeichnete aus, hat ausgezeichnet||to award a prize, honor, distinguish|награждать|Er wurde für seine Arbeit ausgezeichnet.|He was awarded for his work.|Он был награжден за свою работу.
2669|2582|die|Bar||bar|бар|Die Bar ist voll.|The bar is full.|Бар полный.
2670|2583|die|die Betrachtung, -en||contemplation, examination|рассмотрение|Die Betrachtung war interessant.|The contemplation was interesting.|Рассмотрение было интересным.
2671|2584|die|die Kommission, -en||commission, committee|комиссия|Die Kommission tagt morgen.|The commission meets tomorrow.|Комиссия заседает завтра.
2672|2585|der|der Star, -e||star, starling|звезда|Der Star ist berühmt.|The star is famous.|Звезда известна.
2673|2586|adj|wütend||furious|разъярённый|Er wurde wütend.|He became furious.|Он разозлился.
2674|2587|adj|christlich||Christian|христианский|Die Werte sind christlich.|The values are Christian.|Ценности христианские.
2675|2588|adj|Hamburger||Hamburg|гамбургер|Der Hamburger Hafen ist groß.|The Hamburg port is large.|Гамбургер вкусный.
2676|2588|der|der Hamburger, -||hamburger|гамбургский|Der Hamburger schmeckt gut.|The hamburger tastes good.|Гамбургский порт большой.
2677|2589|die|die Leiche, -n||corpse|труп|Die Leiche wurde gefunden.|The corpse was found.|Труп был найден.
2678|2590|adv|nochmals||again|ещё раз|Das sage ich nochmals.|I say that again.|Я говорю это ещё раз.
2679|2591|verb|wehren (sich), wehrt, wehrte, hat gewehrt||to defend oneself|защищаться|Er wehrt sich gegen die Vorwürfe.|He defends himself against the accusations.|Он защищается от обвинений.
2680|2592|der|der Abbau, -e||reduction, decline, mining|сокращение|Der Abbau der Kosten ist notwendig.|The reduction of costs is necessary.|Сокращение затрат необходимо.
2681|2593|die|die Staatsanwaltschaft, -en||prosecution|прокуратура|Die Staatsanwaltschaft ermittelt.|The prosecution investigates.|Прокуратура ведет расследование.
2682|2594|die|die Freizeit, -en||spare time|свободное время|Ich habe viel Freizeit.|I have a lot of spare time.|У меня много свободного времени.
2683|2595|das|das Geschenk, -e||gift, present|подарок|Das Geschenk ist schön.|The gift is nice.|Подарок красивый.
2684|2596|adj|hübsch||pretty|красивый|Sie ist sehr hübsch.|She is very pretty.|Она очень красивая.
2685|2597|der|der Moslem, -s||Muslim|мусульманин|Der Moslem betet fünfmal am Tag.|The Muslim prays five times a day.|Мусульманин молится пять раз в день.
2686|2598|adj|spontan||spontaneous|спонтанный|Die Entscheidung war spontan.|The decision was spontaneous.|Решение было спонтанным.
2687|2599|adv|dorthin||there|туда|Ich gehe dorthin.|I am going there.|Я иду туда.
2688|2600|das|das Frühstück, -e||breakfast|завтрак|Das Frühstück ist fertig.|The breakfast is ready.|Завтрак готов.
2689|2601|verb|klettern, klettert, kletterte, ist geklettert||to climb|лазить|Der Junge klettert auf den Baum.|The boy climbs the tree.|Мальчик лазит на дерево.
2690|2602|der|der Mittelpunkt, -e||midpoint, center of attention|центр внимания|Er ist der Mittelpunkt der Party.|He is the center of the party.|Он центр внимания вечеринки.
2691|2603|verb|bereiten, bereitet, bereitete, hat bereitet||to make, cause, give|причинять|Der Unfall hat großen Schaden bereitet.|The accident caused great damage.|Авария нанесла большой ущерб.
2692|2604|die|die Entstehung, -en||origin|происхождение|Die Entstehung des Lebens ist ein Rätsel.|The origin of life is a mystery.|Происхождение жизни - это загадка.
2693|2605|adj|konservativ||conservative|консервативный|Er hat konservative Ansichten.|He has conservative views.|У него консервативные взгляды.
2694|2606|der|der Magen, -̈||stomach|желудок|Mein Magen tut weh.|My stomach hurts.|Мой желудок болит.
2695|2607|adj|psychisch||psychological|психологический|Die Belastung war psychisch schwer.|The strain was psychologically heavy.|Психологическая нагрузка была тяжелой.
2696|2608|das|das Salz, -e||salt|соль|Das Essen braucht mehr Salz.|The food needs more salt.|Еде нужно больше соли.
2697|2609|num|siebzig||seventy|семьдесят|Es sind siebzig Leute gekommen.|Seventy people came.|Пришло семьдесят человек.
2698|2610|verb|versichern, versichert, versicherte, hat versichert||to insure, assert|застраховать|Ich bin gut versichert.|I am well insured.|Я хорошо застрахован.
2699|2611|der|der Brite, -n||Brit|британец|Der Brite wohnt in London.|The Brit lives in London.|Британец живет в Лондоне.
2700|2612|adj|erkennbar||recognizable, apparent, visible|заметный|Das Bild ist erkennbar.|The picture is recognizable.|Изображение заметно.
2701|2613|adv|namens||by the name of, called|по имени|Eine Frau namens Anna rief an.|A woman called Anna called.|Женщина по имени Анна позвонила.
2702|2614|die|die Achse, -n||axle, axis|ось|Die Achse ist gebrochen.|The axle is broken.|Ось сломана.
2703|2615|verb|klingeln, klingelt, klingelte, hat geklingelt||to ring|звенеть|Das Telefon klingelt laut.|The phone rings loudly.|Телефон громко звонит.
2704|2616|verb|speichern, speichert, speicherte, hat gespeichert||to store, save|сохранять|Er speichert die Daten.|He stores the data.|Он сохраняет данные.
2705|2617|der|der Tee, -s||tea|чай|Ich trinke gerne Tee.|I like to drink tea.|Я люблю пить чай.
2706|2618|der|der Zeuge, -n||witness|свидетель|Der Zeuge sah den Unfall.|The witness saw the accident.|Свидетель видел аварию.
2707|2619|der|der Aufwand, -̈e||expense, effort|затраты|Der Aufwand war enorm.|The expense was enormous.|Затраты были огромными.
2708|2620|die|die Kooperation, -en||cooperation|сотрудничество|Die Kooperation verlief gut.|The cooperation went well.|Сотрудничество прошло хорошо.
2709|2621|der|der Kritiker, -||critic|критик|Der Kritiker lobte den Film.|The critic praised the movie.|Критик похвалил фильм.
2710|2622|das|das Tal, -̈er||valley|долина|Das Tal ist sehr schön.|The valley is very beautiful.|Долина очень красивая.
2711|2623|adj|derartig||such, like that|подобный|Derartige Fehler sind selten.|Such mistakes are rare.|Подобные ошибки редки.
2712|2624|der, die|die Erste||first|первая|Die Erste ist die Beste.|The first is the best.|Первая — лучшая.
2713|2625|adj|vielfach||multiple|множественный|Die Aufgabe ist vielfach.|The task is multiple.|Задача многозадачная.
2714|2626|verb|empfangen, empfängt, empfing, hat empfangen||to receive|принимать|Er empfing die Gäste.|He received the guests.|Он принял гостей.
2715|2627|die|die Ernährung, -en||food, diet|питание|Die Ernährung ist wichtig.|The diet is important.|Питание важно.
2716|2628|die|die Küste, -n||coast|берег|Die Küste ist gefährlich.|The coast is dangerous.|Берег опасен.
2717|2629|verb|mitkommen, kommt mit, kam mit, ist mitgekommen||to come (with sb)|пойти с кем-то|Kommst du mit uns?|Are you coming with us?|Ты идёшь с нами?
2718|2630|die|die Republik, -en||republic|республика|Die Republik ist groß.|The republic is large.|Республика большая.
2719|2631|verb|zucken, zuckt, zuckte, hat gezuckt||to twitch, shrug|пожимать|Er zuckte mit den Schultern.|He shrugged his shoulders.|Он пожал плечами.
2720|2632|verb|anschließen, schließt an, schloss an, hat angeschlossen||to join, chain to, connect|подключать|Ich schließe das Gerät an.|I connect the device.|Я подключаю устройство.
2721|2633|verb|austauschen, tauscht aus, tauschte aus, hat ausgetauscht||to exchange, replace|обменивать|Sie tauschten die Ideen aus.|They exchanged ideas.|Они обменялись идеями.
2722|2634|verb|beschleunigen, beschleunigt, beschleunigte, hat beschleunigt||to accelerate|ускорять|Das Auto beschleunigt schnell.|The car accelerates quickly.|Машина быстро ускоряется.
2723|2635|die|die Norm, -en||norm|норма|Das entspricht der Norm.|That corresponds to the norm.|Это соответствует норме.
2724|2636|verb|anstellen, stellt an, stellte an, hat angestellt||to hire, employ, line up, get into mischief|нанимать|Wir stellen neue Mitarbeiter an.|We hire new employees.|Мы нанимаем новых сотрудников.
2725|2637|verb|decken, deckt, deckte, hat gedeckt||to cover, set|накрывать|Er deckt den Tisch.|He sets the table.|Он накрывает на стол.
2726|2638|adj|grob||coarse, rude, gross|грубый|Das Verhalten war grob.|The behavior was rude.|Поведение было грубым.
2727|2639|der|der Protest, -e||protest|протест|Der Protest war friedlich.|The protest was peaceful.|Протест был мирным.
2728|2640|die|die Tour, -en||tour, trip|тур|Die Tour war aufregend.|The tour was exciting.|Тур был захватывающим.
2729|2641|der|der Überblick, -e||view, overview|обзор|Der Überblick war nützlich.|The overview was useful.|Обзор был полезным.
2730|2642|der|der Geschäftsführer, -||manager|менеджер|Der Geschäftsführer ist neu.|The manager is new.|Менеджер новый.
2731|2643|der|der Griff, -e||handle, grip, grasp|ручка|Der Griff ist kaputt.|The handle is broken.|Ручка сломана.
2732|2644|verb|küssen, küsst, küsste, hat geküsst||to kiss|целовать|Er küsste sie auf die Wange.|He kissed her on the cheek.|Он поцеловал ее в щеку.
2733|2645|der|der Liter, -||liter|литр|Wir benötigen einen Liter Milch.|We need a liter of milk.|Нам нужен литр молока.
2734|2646|das|das Subjekt, -e||subject|субъект|Das Subjekt ist wichtig.|The subject is important.|Субъект важен.
2735|2647|der|der Außenminister, -||foreign minister|министр иностранных дел|Der Außenminister reiste ab.|The foreign minister departed.|Министр иностранных дел уехал.
2736|2648|die|die Faser, -n||fiber|волокно|Die Faser ist stark.|The fiber is strong.|Волокно крепкое.
2737|2649|der|der Schatz, -̈e||treasure, sweetheart|сокровище|Der Schatz ist verborgen.|The treasure is hidden.|Сокровище скрыто.
2738|2650|adj|sekundär||secondary|вторичный|Das ist nur sekundär.|That is only secondary.|Это всего лишь вторично.
2739|2651|die|die Zentralbank, -en||central bank|центральный банк|Die Zentralbank entscheidet.|The central bank decides.|Центральный банк решает.
2740|2652|der, die, das|die Alte||old person/thing|старик|Der Alte ging spazieren.|The old man went for a walk.|Старик пошёл на прогулку.
2741|2653|der, die|die Angestellte||employee|служащий|Die Angestellte ist freundlich.|The employee is friendly.|Служащий дружелюбный.
2742|2654|adj|dankbar||grateful|благодарный|Ich bin dir dankbar.|I am grateful to you.|Я тебе благодарен.
2743|2655|verb|faszinieren, fasziniert, faszinierte, hat fasziniert||to fascinate|очаровывать|Das Buch fasziniert mich.|The book fascinates me.|Книга меня очаровывает.
2744|2656|der|der Flur, -e||hall, corridor|коридор|Der Flur ist lang.|The corridor is long.|Коридор длинный.
2745|2657|das|das Hemd, -en||shirt|рубашка|Das Hemd ist sauber.|The shirt is clean.|Рубашка чистая.
2746|2658|adj|inhaltlich||in terms of content|содержательный|Inhaltlich ist der Text gut.|In terms of content, the text is good.|Содержательно текст хорош.
2747|2659|die|die Begründung, -en||explanation, justification|обоснование|Die Begründung war plausibel.|The explanation was plausible.|Обоснование было правдоподобным.
2748|2660|adv|dreimal||three times|три раза|Er hat dreimal angerufen.|He called three times.|Он позвонил три раза.
2749|2661|adv|momentan||at the moment, momentarily|в данный момент|Ich bin momentan beschäftigt.|I am busy at the moment.|В данный момент я занят.
2750|2662|verb|zögern, zögert, zögerte, hat gezögert||to hesitate|колебаться|Er zögerte mit der Antwort.|He hesitated with the answer.|Он колебался с ответом.
2751|2663|adv|derart||so|так|Derart ist es geschehen.|So it happened.|Так это случилось.
2752|2664|adj|kreativ||creative|креативный|Seine Idee ist kreativ.|His idea is creative.|Его идея креативная.
2753|2665|verb|einziehen, zieht ein, zog ein, hat eingezogen||to move in|въезжать|Wir ziehen nächste Woche ein.|We are moving in next week.|Мы въезжаем на следующей неделе.
2754|2666|das|das Ausmaß, -e||extent, size|размер|Das Ausmaß war groß.|The extent was large.|Размер был большой.
2755|2667|der|der Feind, -e||enemy|враг|Er ist mein Feind.|He is my enemy.|Он мой враг.
2756|2668|verb|verbrennen, verbrennt, verbrannte, ist verbrannt||to burn|сжигать|Das Holz verbrennt schnell.|The wood burns quickly.|Древесина быстро сгорает.
2757|2669|der|der Vorstand, -̈e||board, chairperson|правление|Der Vorstand trifft sich heute.|The board meets today.|Правление встречается сегодня.
2758|2670|der|der Atem||breath|дыхание|Ich verlor den Atem.|I lost my breath.|Я потерял дыхание.
2759|2671|die|die Distanz, -en||distance|дистанция|Die Distanz war kurz.|The distance was short.|Дистанция была короткой.
2760|2672|der|der Händler, -||trader, dealer, retailer|торговец|Der Händler bietet gute Preise.|The dealer offers good prices.|Торговец предлагает хорошие цены.
2761|2673|verb|hassen, hasst, hasste, hat gehasst||to hate|ненавидеть|Er hasst Lügen.|He hates lies.|Он ненавидит ложь.
2762|2674|das|das Muster, -||pattern, model|образец|Das Muster ist einfach.|The pattern is simple.|Образец простой.
2763|2675|adj|ausführlich||detailed|подробный|Der Bericht war ausführlich.|The report was detailed.|Отчёт был подробным.
2764|2676|verb|bedenken, bedenkt, bedachte, hat bedacht||to consider|обдумывать|Er bedachte alle Möglichkeiten.|He considered all possibilities.|Он обдумал все возможности.
2765|2677|der|der Terror||terror|террор|Der Terror verbreitet Angst.|The terror spreads fear.|Террор распространяет страх.
2766|2678|die|die Verfassung, -en||constitution|конституция|Die Verfassung garantiert Rechte.|The constitution guarantees rights.|Конституция гарантирует права.
2767|2679|adj|blind||blind|слепой|Der Mann ist blind.|The man is blind.|Человек слеп.
2768|2680|verb|einschlafen, schläft ein, schlief ein, ist eingeschlafen||to fall asleep|засыпать|Das Kind ist eingeschlafen.|The child fell asleep.|Ребенок заснул.
2769|2681|die|die Flüchtlingskrise, -n||refugee crisis|кризис беженцев|Die Flüchtlingskrise ist ernst.|The refugee crisis is serious.|Кризис беженцев серьёзен.
2770|2682|der|der Ärger||annoyance, trouble|раздражение|Ich habe viel Ärger.|I have a lot of trouble.|У меня много неприятностей.
2771|2683|adj|allmählich||gradual|постепенный|Der Fortschritt ist allmählich.|The progress is gradual.|Прогресс постепенный.
2772|2684|der|der Führer, -||leader, guide|лидер|Der Führer gab Anweisungen.|The leader gave instructions.|Лидер дал указания.
2773|2685|das|das Vitamin, -e||vitamin|витамин|Vitamine sind wichtig.|Vitamins are important.|Витамины важны.
2774|2686|der|der Abschied, -e||departure, parting|прощание|Der Abschied fiel schwer.|The farewell was hard.|Прощание было тяжёлым.
