speech_part|word_de|word_combination_de|word_en|word_combination_en|sentence_de|sentence_en|frequency_rank
verb|beeinflussen, beeinflusst, beeinflusste, hat beeinflusst|eine Meinung beeinflussen|to influence|to influence an opinion|Werbung beeinflusst das Verhalten von Kunden.|Advertising influences the behavior of customers.|1364
verb|riechen, riecht, roch, hat gerochen|eine Blume riechen|to smell|to smell a flower|Die Blumen riechen gut.|The flowers smell good.|1365
prep|außerhalb|außerhalb der Stadt|outside|outside the city|Sie lebt außerhalb der Stadt.|She lives outside the city.|1366
verb|begleiten, begleitet, begleitete, hat begleitet|eine Gruppe begleiten|to accompany|to accompany a group|Ich begleite Tom auf seiner Reise.|I’m accompanying Tom on his journey.|1367
das|das Publikum, die Publika|das Publikum begeistern|public, audience|to inspire the audience|Morgen singt er vor einem großen Publikum.|Tomorrow he’s singing in front of a big audience.|1368
der|der Besucher, -|ein Hausbesuch|visitor|a house visit|Heute sind wir die einzigen Besucher im Museum.|Today we are the only visitors to the museum.|1369
das|das Wachstum|das Wachstum fördern|growth|to promote growth|Bei Jugendlichen befindet sich der Körper noch im Wachstum.|In adolescents, the body is still in a state of growth.|1370
verb|aufgeben, gibt auf, gab auf, hat aufgegeben|eine Aufgabe aufgeben|to give up|to give up a task|Ich werde nicht nach einem Versuch aufgeben.|I won’t give up after one attempt.|1371
adj|stolz|stolz sein|proud|to be proud|Ute ist stolz auf ihre drei Kinder.|Ute is proud of her three children.|1372
der|der Verlust, -e|großer Verlust|loss|great loss|Der Tod meiner Mutter war ein großer Verlust für mich.|The death of my mother was a great loss to me.|1373
verb|begründen, begründet, begründete, hat begründet|eine Entscheidung begründen|to justify|to justify a decision|Ich möchte, dass du deine Meinung begründest.|I want you to justify your opinion.|1374
adj|streng|eine strenge Regel|strict|a strict rule|In der Schule haben wir eine strenge Lehrerin.|At school we have a strict teacher.|1375
die|die Ecke, -n|um die Ecke|corner|around the corner|An der Ecke der Straße ist eine Schule.|At the corner of the street is a school.|1376
der|der Lauf, -̈e|einen Lauf machen|course, run, race|to go for a run|Normalerweise stoppe ich die Zeit meiner Läufe.|Usually I time my runs.|1377
der|der Artikel, -|einen Artikel schreiben|article|to write an article|In der Zeitung steht ein interessanter Artikel über Leipzig.|The newspaper has an interesting article about Leipzig.|1378
adj|berühmt|ein berühmter Autor|famous|a famous author|Bald ist Christoph ein berühmter Schauspieler.|Soon Christoph will be a famous actor.|1379
verb|ersetzen, ersetzt, ersetzte, hat ersetzt|eine Sache ersetzen|to replace, reimburse|to replace something|Maschinen ersetzen viele Jobs.|Machines replace many jobs.|1380
die|die Wahrscheinlichkeit, -en|eine hohe Wahrscheinlichkeit|probability|a high probability|Rauchen erhöht die Wahrscheinlichkeit, krank zu werden.|Smoking increases the probability of becoming ill.|1381
das|das Ausland|ins Ausland reisen|foreign countries|to travel abroad|Nach unserem Abschluss wollen wir im Ausland arbeiten.|After graduation, we want to work abroad.|1382
adj|bayrisch|bayrische Küche|Bavarian|Bavarian cuisine|Das Restaurant ist typisch bayrisch.|The restaurant is typically Bavarian.|1383
adv|diesmal|diesmal besser|this time|better this time|Diesmal mache ich alles richtig.|I’m doing everything right this time.|1384
das|das Gehirn, -e|das Gehirn benutzen|brain|to use the brain|Das Gehirn ist ein wichtiges Organ im menschlichen Körper.|The brain is an important organ in the human body.|1385
das|das Gebäude, -|ein hohes Gebäude|building|a tall building|In diesem Gebäude befindet sich die Universität.|The university is located in this building.|1386
adj|langfristig|langfristige Planung|long-term|long-term planning|Für den Schutz der Umwelt sollten wir eine langfristige Lösung finden.|For the protection of the environment we should find a long-term solution.|1387
adj|herzlich|ein herzliches Willkommen|cordial, warm|a warm welcome|Meine Oma ist eine liebe und herzliche Frau.|My grandma is a dear and warm woman.|1388
verb|sichern, sichert, sicherte, hat gesichert|einen Plan sichern|to secure, safeguard|to secure a plan|Wir kaufen Kameras, um unser Haus zu sichern.|We buy cameras to secure our house.|1389
das|das Material, -ien|hochwertiges Material|material|high-quality material|Für den Unterricht hat sie viele Materialien vorbereitet.|She has prepared many materials for the lessons.|1390
verb|verbringen, verbringt, verbrachte, hat verbracht|Zeit verbringen|to spend (time)|to spend time|Wenn ich für eine Prüfung lerne, verbringe ich viel Zeit in der Bibliothek.|When I am studying for an exam, I spend a lot of time in the library.|1391
der|der Strom, -̈e|elektrischer Strom|stream, current, electricity|electric current|Elektrische Geräte funktionieren nur mit Strom.|Electrical devices only work with electricity.|1392
das|das Amt, -Äer|ein Amt haben|office, department, function|to hold an office|Bis zu den nächsten Wahlen bleibt der jetzige Präsident im Amt.|The current president remains in office until the next elections.|1393
verb|kritisieren, kritisiert, kritisierte, hat kritisiert|einen Text kritisieren|to criticize|to criticize a text|Meine Mutter kritisiert immer meine Leistungen in der Schule.|My mother always criticizes my performance in school.|1394
verb|vermitteln, vermittelt, vermittelte, hat vermittelt|eine Nachricht vermitteln|to convey, mediate, find, procure|to convey a message|Letzten Monat vermittelte das Arbeitsamt 250 Personen.|Last month, the employment agency found employment for 250 people.|1395
die|die Wirklichkeit, -en|die Wirklichkeit ist hart|reality|reality is harsh|Es ist kein Traum sondern die Wirklichkeit.|It is not a dream but reality.|1396
die|die Union, -en|eine Union bilden|union|to form a union|Manche Mitgliedsstaaten möchten aus der Union austreten.|Some member states want to leave the union.|1397
das|das Studium, -en|ein Studium absolvieren|study, studies|to complete a degree|Dieses Jahr möchte ich mein Studium beenden.|This year I want to finish my studies.|1398
verb|festhalten, hält fest, hielt fest, hat festgehalten|eine Idee festhalten|to hold on to, detain|to hold on to an idea|Die Polizei hält einen Verdächtigen fest.|Police are holding a suspect.|1399
verb|präsentieren, präsentiert, präsentierte, hat präsentiert|ein Konzept präsentieren|to present, show|to present a concept|Barbara präsentiert ihren Freundinnen das Kleid für das Fest.|Barbara shows her friends the dress for the party.|1400
die|die Demokratie, -n|eine Demokratie verteidigen|democracy|to defend a democracy|In einer Demokratie gehen die Macht und Regierung vom Volk aus.|In a democracy, power and government emanate from the people.|1401
adv|niemals|niemals vergessen|never|never forget|Ich werde dich niemals vergessen.|I’ll never forget you.|1402
die|die Aufnahme, -n|eine Aufnahme machen|reception, recording, snapshot|to make a recording|Auf der CD sind die ersten Aufnahmen der Band.|On the CD are the band’s first recordings.|1403
die|die Ausnahme, -n|eine Ausnahme machen|exception|to make an exception|Alle Kinder setzen sich mit Ausnahme von Tom, der stehenbleibt.|All the children sit down with the exception of Tom, who remains standing.|1404
verb|beenden, beendet, beendete, hat beendet|ein Projekt beenden|to end|to end a project|Wenn du nicht glücklich bist, musst du die Beziehung zu Luke beenden.|If you’re not happy, you have to end the relationship with Luke.|1405
die|die Investition, -en|eine Investition planen|investment|to plan an investment|Das ist eine gute Investition, du wirst viel Gewinn machen.|This is a good investment; you’ll make a lot of profit.|1406
die|die Lust, -̈e|Lust haben|desire|to feel like|Im Sommer habe ich immer Lust auf Eis.|In summer I always desire ice cream.|1407
verb|prüfen, prüft, prüfte, hat geprüft|eine Arbeit prüfen|to examine, check|to examine a work|An der Universität werden die Studenten regelmäßig geprüft.|At the university, the students are tested regularly.|1408
verb|anlegen, legt an, legte an, hat angelegt|eine Aktie anlegen|to put on, invest|to invest in a stock|Vielleicht lege ich mein Geld in Aktien an.|Maybe I’ll invest my money in shares.|1409
der|der Zuschauer, -|ein Zuschauer sehen|spectator|to see a spectator|Bei meiner mündlichen Prüfung möchte ich keine Zuschauer.|I don’t want any spectators at my oral exam.|1410
adj|hell|helles Licht|light, bright|bright light|Bitte mach das Licht aus, es ist mir zu hell.|Please turn off the light; it’s too bright.|1411
adv|mitten|mitten im Raum|in the middle|in the middle of the room|Wegen meines Babys muss ich immer mitten in der Nacht aufstehen.|I always have to get up in the middle of the night because of my baby.|1412
prep|zufolge|einer Meinung zufolge|according to|according to an opinion|Dem Arzt zufolge bin ich gesund.|According to the doctor, I’m healthy.|1413
der|der Konflikt, -e|ein Konflikt lösen|conflict|to resolve a conflict|Zwischen einigen Staaten herrschen politische Konflikte.|There are political conflicts between some states.|1414
die|die Bahn, -en|mit der Bahn fahren|train, railway, way|to travel by train|Wir fahren mit dem Zug in den Urlaub, weil das Auto kaputt ist.|We’re going on vacation by train because the car broke down.|1415
das|Syrien|ein Land besuchen|Syria|to visit a country|Viele Menschen aus Syrien wohnen jetzt in Deutschland.|Many people from Syria now live in Germany.|1416
das|das Einkommen, -|ein hohes Einkommen|income|a high income|Je mehr Geld du verdienst, desto höher ist dein Einkommen.|The more money you earn, the higher your income.|1417
verb|empfehlen, empfiehlt, empfahl, hat empfohlen|ein Restaurant empfehlen|to recommend|to recommend a restaurant|Welchen Wein können Sie empfehlen?|Which wine can you recommend?|1418
adj|britisch|britische Kultur|British|British culture|Ich trinke sehr gerne britischen Tee.|I like to drink British tea.|1419
verb|fürchten, fürchtet, fürchtete, hat gefürchtet|etwas fürchten|to fear|to fear something|Du musst dich nicht fürchten, wenn es dunkel ist.|You do not have to fear when it’s dark.|1420
verb|vorbereiten, bereitet vor, bereitete vor, hat vorbereitet|eine Reise vorbereiten|to prepare|to prepare a trip|Sie bereiten sich auf die Prüfung vor.|They’re preparing for the exam.|1421
die|die Aktivität, -en|eine Aktivität planen|activity|to plan an activity|Heute suche ich mir eine sportliche Aktivität für meinen Urlaub aus.|Today I’m looking for an athletic activity for my vacation.|1422
der|der Auftrag, -̈e|einen Auftrag erteilen|instructions, order, job|to give an order|Er handelt im Auftrag der Regierung.|He works by order of the government.|1423
adj|froh|ein frohes Herz|happy, glad|a happy heart|Ich bin froh, wenn die Prüfungen vorbei sind.|I’ll be glad when the exams are over.|1424
verb|äußern, äußert, äußerte, hat geäußert|eine Meinung äußern|to express, voice|to express an opinion|Julia hat eine freundliche Art, Kritik zu äußern.|Julia has a friendly way of expressing criticism.|1425
der|der Geist, -er|ein freier Geist|mind, spirit|a free spirit|Sport zu machen ist gesund für Körper und Geist.|Doing sport is healthy for body and mind.|1426
das|das Objekt, -e|ein Objekt zeigen|object|to show an object|Schau, da ist ein seltsames Objekt am Himmel zu sehen!|Look, there’s a strange object in the sky!|1427
adv|möglicherweise|möglicherweise richtig|possibly|possibly correct|Der Zug kommt möglicherweise zehn Minuten später.|The train possibly arrives ten minutes later.|1428
adj|zuständig|die zuständige Behörde|appropriate, responsible|responsible authority|Für dieses Problem ist eine andere Person zuständig.|Another person is responsible for this problem.|1429
verb|aufweisen, weist auf, wies auf, hat aufgewiesen|ein Problem aufweisen|to show, exhibit, contain|to show a problem|Nach dem Unfall weist das Auto einen starken Schaden auf.|After the accident, the car shows a lot of damage.|1430
verb|springen, springt, sprang, ist gesprungen|hoch springen|to jump|to jump high|Bei dem Spiel springen alle Kinder in die Luft.|All children jump in the air during the game.|1431
der|der Hof, -̈e|auf einem Hof|courtyard, yard|in a courtyard|Hinter dem Haus ist ein Hof.|There’s a yard behind the house.|1432
der|der Polizist, -en|ein Polizist spricht|police officer, policeman|a police officer speaks|Der Polizist befragt den Verdächtigen.|The police officer is questioning the suspect.|1433
die|die Übung, -en|eine Übung machen|exercise, practice|to do an exercise|Du brauchst viel Übung, um besser zu werden.|You need a lot of practice to get better.|1434
der|der Widerstand, -̈e|Widerstand leisten|resistance, opposition|to offer resistance|Der Widerstand gegen die Regierung steigt.|The resistance against the government is increasing.|1435
verb|anziehen, zieht an, zog an, hat angezogen|einen Mantel anziehen|to attract, put on, dress|to put on a coat|Das neue Museum zieht viele Touristen an.|The new museum attracts many tourists.|1436
der|der Experte, -n|ein Experte spricht|expert|an expert speaks|Herr Michels ist Experte auf dem Gebiet der deutschen Literatur.|Mr. Michels is an expert in the field of German literature.|1437
adv|ohnehin|ohnehin egal|anyway|it doesn't matter anyway|Das hätte uns ohnehin nichts genützt.|That wouldn’t have helped us anyway.|1438
verb|füllen, füllt, füllte, hat gefüllt|ein Glas füllen|to fill|to fill a glass|Weil sie etwas trinken möchte, füllt sie Wasser in ein Glas.|Because she wants to drink something, she fills a glass with water.|1439
die|die Gemeinde, -n|eine Gemeinde besuchen|community, municipality|to visit a community|Zörbig ist eine kleine Gemeinde in der Nähe von Leipzig.|Zörbig is a small community near Leipzig.|1440
die|die Pause, -n|eine Pause machen|pause, break|to take a break|Nach einer kurzen Pause mache ich weiter.|After a short break I continue.|1441
adj|scharf|scharfe Kritik|sharp|sharp criticism|Sei vorsichtig, das Messer ist sehr scharf.|Be careful, the knife is very sharp.|1442
verb|schütteln, schüttelt, schüttelte, hat geschüttelt|den Kopf schütteln|to shake|to shake the head|Man muss die Flasche vor dem Öffnen schütteln.|You have to shake the bottle before opening it.|1443
das|das Fernsehen|Fernsehen schauen|television|to watch television|Das Spiel wird live im Fernsehen übertragen.|The game will be broadcast live on television.|1444
die|die Formel, -n|eine Formel berechnen|formula|to calculate a formula|Die Formel zur Berechnung der Geschwindigkeit ist v = s/t.|The formula for calculating the velocity is v = s/t.|1445
adj|gelb|eine gelbe Blume|yellow|a yellow flower|Es ist Herbst und die Blätter werden langsam gelb.|It is autumn and the leaves are slowly turning yellow.|1446
das|das Sommersemester, -|im Sommersemester|summer semester|in the summer semester|Das Sommersemester beginnt im April.|The summer semester starts in April.|1447
adj|heftig|eine heftige Diskussion|hard, heavy, violent|a violent discussion|Bei dem Streit bekommt er einen heftigen Schlag auf den Kopf.|In the fight, he gets a hard punch to the head.|1448
die|die Bühne, -n|auf einer Bühne|stage|on a stage|Die Schauspieler verlassen die Bühne unter Beifall.|The actors are leaving the stage to applause.|1449
verb|empfinden, empfindet, empfand, hat empfunden|große Freude empfinden|to feel|to feel great joy|Meine Eltern empfinden immer noch viel für einander.|My parents still feel a lot for each other.|1450
der|der Schaden, -̈|der Schaden ist groß|damage|the damage is significant|Der Unfall hat einen großen Schaden an meinem Auto verursacht.|The accident caused a lot of damage to my car.|1451
adj|umgekehrt|eine umgekehrte Wirkung|reversed, contrary, around|a reversed effect|Er wendet sein Auto und fährt in umgekehrter Richtung zurück.|He turns his car around and drives back in the opposite direction.|1452
verb|veröffentlichen, veröffentlicht, veröffentlichte, hat veröffentlicht|ein Buch veröffentlichen|to publish|to publish a book|Sie war erst 19 Jahre alt, als sie ihr erstes Buch veröffentlichte.|She was only 19 years old when she published her first book.|1453
verb|aufstellen, stellt auf, stellte auf, hat aufgestellt|eine Tabelle aufstellen|to put up, draw up|to draw up a table|Der neue Besitzer stellt Werbung vor seinem Laden auf.|The new owner puts up advertisements in front of his shop.|1454
adj|abhängig|abhängig von etwas|dependent|dependent on something|Viele Studenten sind finanziell von ihren Eltern abhängig.|Many students are financially dependent on their parents.|1455
die|die Strecke, -n|die Strecke fahren|distance, route|to drive the route|Die Strecke am Fluss entlang ist schöner.|The route along the river is nicer.|1456
die|die Praxis, -en|eine Praxis besuchen|practice, doctor’s office|to visit a doctor's office|Nicht nur theoretische Erfahrungen, sondern auch Praxis ist wichtig.|Not only theoretical experience, but also practice is important.|1457
adj|ungefähr|ungefähr 10 Kilometer|approximately|approximately 10 kilometers|Die Fahrt dauert ungefähr drei Stunden.|The journey takes about three hours.|1458
verb|mitnehmen, nimmt mit, nahm mit, hat mitgenommen|etwas mitnehmen|to take (along)|to take something along|Sandra nimmt ihr Essen für die Arbeit von zu Hause mit.|Sandra takes food from home along to work.|1459
adj|üblich|eine übliche Methode|usual|a usual method|Er geht zu seiner üblichen Zeit ins Bett.|He goes to bed at his usual time.|1460
verb|übertragen|Daten übertragen|to transfer|to transfer data|Ich muss einige Aufgaben an meine Kollegen übertragen.|I have to transfer some tasks to my colleagues.|1461
die|die Wissenschaft, -en|die Wissenschaft studieren|science|to study science|Biologie ist die Wissenschaft vom Leben.|Biology is the science of life.|1462
adj|global|global denken|global|to think globally|Krieg ist ein globales Problem.|War is a global problem.|1463
der|der Nachmittag, -e|am Nachmittag|afternoon|in the afternoon|Lass uns heute Nachmittag in den Park gehen.|Let’s go to the park this afternoon.|1464
die|die Annahme, -n|eine Annahme treffen|acceptance, assumption|to make an assumption|Die Ergebnisse bestätigen die Annahme.|The results confirm the assumption.|1465
die|die Umgebung, -en|die Umgebung erkunden|surroundings|to explore the surroundings|Er ist froh, wieder zu Hause in seiner normalen Umgebung zu sein.|He’s happy to be back home in his normal surroundings.|1466
die|die Öffentlichkeit, -en|die Öffentlichkeit informieren|public|to inform the public|Morgen geht die Polizei mit ihrer Suche an die Öffentlichkeit.|Tomorrow the police will go public with their search.|1467
der|der Spiegel, -|in den Spiegel schauen|mirror|to look in the mirror|Ich betrachte mein Gesicht im Spiegel.|I look at my face in the mirror.|1468
verb|zurückkommen, kommt zurück, kam zurück, ist zurückgekommen|nach Hause zurückkommen|to return|to return home|Ich bin jetzt im Urlaub und komme erst in zwei Wochen zurück.|I’m on vacation now, and I will return in two weeks.|1469
verb|besetzen, besetzt, besetzte, hat besetzt|einen Platz besetzen|to occupy, fill|to occupy a place|In unserem Unternehmen sind noch einige Positionen zu besetzen.|There are still some positions to be filled in our company.|1470
das|das Gegenteil, -e|das Gegenteil behaupten|opposite|to claim the opposite|Das Gegenteil von Frieden ist Krieg.|Peace is the opposite of war.|1471
adv|vorbei|der Sommer ist vorbei|past, over|summer is over|Sie war froh, als ihre Prüfungen vorbei waren.|She was glad when her exams were over.|1472
der|der Fan, -s|ein großer Fan|fan, supporter|a big fan|Er ist ein wahrer Fan und geht zu allen Spielen der Mannschaft.|He is a true fan and goes to all the matches of the team.|1473
die|die Karte, -n|eine Karte kaufen|card, ticket, menu|to buy a ticket|Die Karten für das Theater kosten 15 Euro.|The tickets for the theater cost 15 euros.|1474
adj|arm|arm sein|poor|to be poor|Sie ist zu arm, um Essen für ihre Kinder zu kaufen.|She’s too poor to buy food for her children.|1475
die|die Krise, -n|eine Krise bewältigen|crisis|to manage a crisis|Die politische Krise verursacht Unruhen im Land.|The political crisis causes turmoil in the country.|1476
die|die Strategie, -n|eine Strategie entwickeln|strategy|to develop a strategy|Wir müssen eine neue Strategie für das Problem entwickeln.|We have to develop a new strategy for the problem.|1477
die|die Debatte, -n|eine Debatte führen|debate|to conduct a debate|Nach einer langen Debatte stimmt der Chef dem Vorschlag zu.|After a long debate, the boss agrees to the proposal.|1478
pron|davor|davor stehen|before, in front of|to stand in front of|Hinter dem Haus ist ein See, davor ein schöner Garten.|Behind the house is a lake, in front of it a beautiful garden.|1479
der|der Journalist, -en|ein Journalist schreiben|journalist|a journalist writes|Er arbeitet als Journalist für mehrere Zeitungen und das Fernsehen.|He works as a journalist for various newspapers and television.|1480
verb|kochen, kocht, kochte, hat gekocht|das Abendessen kochen|to cook|to cook dinner|Ich koche gerne italienische Gerichte.|I like to cook Italian dishes.|1481
verb|zurückgehen, geht zurück, ging zurück, ist zurückgegangen|zurückgehen nach Hause|to go back, decrease|to go back home|Peter muss noch einmal zurückgehen und seinen Schlüssel holen.|Peter has to go back and get his key.|1482
der|der Schmerz, -en|großer Schmerz|pain, grief|great pain|Der Patient hat starke Schmerzen und schreit.|The patient’s in a lot of pain and is screaming.|1483
adj|erheblich|erheblich besser|considerable|considerably better|Es macht einen erheblichen Unterschied, ob ich helfe oder weitergehe.|It makes a considerable difference whether I help or keep going.|1484
adj|ausschließlich|ausschließlich für Mitglieder|exclusive|exclusively for members|Der Raum ist für die ausschließliche Nutzung unserer Gäste.|This room is for the exclusive use of our guests.|1485
adj|griechisch|griechische Kultur|Greek|Greek culture|Moussaka ist ein griechisches Gericht.|Moussaka is a Greek dish.|1486
das|griechisch|Griechisch lernen|Greek|to learn Greek|Er spricht nur Griechisch.|He only speaks Greek.|1486
part|naja|naja, mal sehen|(oh) well|oh well, let's see|Naja, es könnte schlimmer sein.|Well, it could be worse.|1487
die|die Runde, -n|eine Runde drehen|round|to take a round|Ich lade euch auf eine Runde Bier ein.|I’ll buy you a round of beer.|1488
der|der Angriff, -e|ein Angriff planen|attack|to plan an attack|Sie planen einen Angriff auf das Schloss.|They’re planning an attack on the castle.|1489
verb|einführen, führt ein, führte ein, hat eingeführt|eine Regel einführen|to introduce, import|to introduce a rule|Es ist verboten, manche Güter einzuführen.|It is forbidden to import some goods.|1490
adv|desto|desto besser|the more|the better|Je mehr Timo isst, desto dicker wird er.|The more Timo eats, the bigger he gets.|1491
der|der Wettbewerb, -e|ein Wettbewerb gewinnen|competition|to win a competition|An dem Wettbewerb nehmen Menschen aus aller Welt teil.|People from all over the world take part in the competition.|1492
verb|verfügen, verfügt, verfügte, hat verfügt|über viele Ressourcen verfügen|to have sth at one’s disposal, be in charge|to have many resources|Das Land verfügt über Atomwaffen.|The country has nuclear weapons at its disposal.|1493
pron|woher|woher kommst du|from where, how|where are you from|Woher kommst du?|Where are you from?|1494
der|der Zweifel, -|große Zweifel haben|doubt|to have great doubts|Daran besteht kein Zweifel.|There’s no doubt about it.|1495
der|der Konzern, -e|ein großer Konzern|corporation|a large corporation|Die Firma wurde von einem großen Konzern übernommen.|The company was taken over by a large corporation.|1496
verb|tanzen, tanzt, tanzte, hat getanzt|gerne tanzen|to dance|to love dancing|Meine Eltern tanzen gerne Tango.|My parents like to dance the tango.|1497
verb|überleben, überlebt, überlebte, hat überlebt|einen Unfall überleben|to survive|to survive an accident|Zum Glück überlebte der Mann den Angriff.|Fortunately, the man survived the attack.|1498
adj|spezifisch|spezifische Anforderungen|specific|specific requirements|Jedes Organ hat seine eigene spezifische Funktion.|Each organ has its own specific function.|1499
adj|stabil|stabil bleiben|stable, sturdy|to remain stable|Für so viele Bücher ist das Regal nicht stabil genug.|The shelf is not sturdy enough for so many books.|1500
die|die Kamera, -s|eine Kamera benutzen|camera|to use a camera|Jonathan dreht Filme und kauft sich heute eine neue Kamera.|Jonathan is making movies and buying a new camera today.|1501
der|der Schatten, -|im Schatten sitzen|shadow, shade|to sit in the shade|Ich sitze gerne in der Sonne, aber meine Freundin sitzt lieber im Schatten.|I like sitting in the sun, but my girlfriend prefers sitting in the shade.|1502
verb|berücksichtigen, berücksichtigt, berücksichtigte, hat berücksichtigt|einen Aspekt berücksichtigen|to consider|to consider an aspect|Ich werde mein Bestes tun, Ihre Wünsche zu berücksichtigen.|I’ll do my best to consider your wishes.|1503
das|das Pferd, -e|ein Pferd reiten|horse|to ride a horse|Elsa wünscht sich ein Pferd.|Elsa wants a horse.|1504
verb|begegnen, begegnet, begegnete, ist begegnet|einem Freund begegnen|to meet, encounter, come across|to meet a friend|Auf meinen Reisen begegnete ich vielen verschiedenen Kulturen.|On my travels, I encountered many different cultures.|1505
