speech_part|word_de|word_combination_de|word_en|word_combination_en|sentence_de|sentence_en|frequency_rank
verb|ansteigen, steigt an, stieg an, ist angestiegen|der Preis ansteigen|to rise, go up|the price rises|Der Preis für Milch steigt um 20 Prozent an.|The price of milk rises by 20 percent.|2579
die|die Rückkehr|die Rückkehr planen|return|to plan the return|Nach seiner Rückkehr aus dem Krieg wird er im Krankenhaus behandelt.|After his return from the war, he is treated in the hospital.|2580
verb|auszeichnen, zeichnet aus, zeichnete aus, hat ausgezeichnet|einen Künstler auszeichnen|to award a prize, honor, distinguish|to honor an artist|Jedes Jahr wird der beste Mitarbeiter mit einem Preis ausgezeichnet.|Every year, the best employee is awarded a prize.|2581
die|Bar|eine Bar besuchen|bar|to visit a bar|Nach der Arbeit treffen sich die Kollegen in der Bar, um zu trinken und zu reden.|After work, the colleagues meet in the bar to drink and talk.|2582
die|die Betrachtung, -en|eine Betrachtung anstellen|contemplation, examination|to make an observation|Bei genauerer Betrachtung erkennt man, dass die Sterne ein Zeichen formen.|Upon closer examination, one recognizes that the stars form a sign.|2583
die|die Kommission, -en|eine Kommission einrichten|commission, committee|to set up a commission|Eine unabhängige Kommission beobachtet den Wahlprozess.|An independent commission observes the electoral process.|2584
der|der Star, -e|ein berühmter Star|star, starling|a famous star|Ein Star ist eine berühmte Person.|A star is a famous person.|2585
adj|wütend|wütend reagieren|furious|to react furiously|Immer wenn Claudia ein Spiel verliert, wird sie wütend.|Whenever Claudia loses a game, she gets angry.|2586
adj|christlich|christliche Werte|Christian|Christian values|Weihnachten ist ein christliches Fest.|Christmas is a Christian celebration.|2587
adj|der Hamburger, -|ein Hamburger Restaurant|Hamburg|a restaurant in Hamburg|Der Hamburger Hafen ist der größte Hafen Deutschlands.|The port of Hamburg is the largest port in Germany.|2588
der|der Hamburger, -|einen Hamburger essen|hamburger|to eat a hamburger|Der Hamburger schmeckt mir nicht.|I don’t like the hamburger.|2588
die|die Leiche, -n|eine Leiche finden|corpse|to find a corpse|Die Polizei findet die Leiche eines Mannes im Wald.|The police find the body of a man in the forest.|2589
adv|nochmals|nochmals versuchen|again|to try again|Ich möchte mich nochmals bei Ihnen bedanken.|I would like to thank you again.|2590
verb|wehren (sich), wehrt, wehrte, hat gewehrt|sich wehren|to defend oneself|to defend oneself|Wehr dich, wenn du ungerecht behandelt wirst!|Defend yourself if you’re treated unjustly!|2591
der|der Abbau, -e|den Abbau planen|reduction, decline, mining|to plan the reduction|Der Abbau von Metallen ist ein wichtiger wirtschaftlicher Faktor in westafrikanischen Ländern.|The mining of metals is an important economic factor in West African countries.|2592
die|die Staatsanwaltschaft, -en|die Staatsanwaltschaft informieren|prosecution|to inform the prosecution|Die Staatsanwaltschaft präsentiert neue Beweise vor Gericht.|The prosecution presents new evidence in court.|2593
die|die Freizeit, -en|Freizeit genießen|spare time|to enjoy free time|Was machst du in deiner Freizeit, wenn du nicht arbeiten musst?|What do you do in your free time when you don’t have to work?|2594
das|das Geschenk, -e|ein Geschenk geben|gift, present|to give a gift|Liesbeth hat Geburtstag und bekommt viele Geschenke.|It’s Liesbeth’s birthday and she gets many gifts.|2595
adj|hübsch|eine hübsche Blume|pretty|a pretty flower|Das Mädchen trägt ein hübsches Kleid.|That girl is wearing a pretty dress.|2596
der|der Moslem, -s|ein Moslem betet|Muslim|a Muslim prays|Ich esse kein Schweinefleisch, weil ich Moslem bin.|I don’t eat pork because I’m Muslim.|2597
adj|spontan|spontan handeln|spontaneous|to act spontaneously|Es ist nur eine spontane Idee, kein konkreter Plan.|It’s just a spontaneous idea, not a concrete plan.|2598
adv|dorthin|dorthin gehen|there|to go there|Wow, Australien, dorthin möchte ich auch reisen!|Wow, Australia, I want to travel there too!|2599
das|das Frühstück, -e|ein Frühstück zubereiten|breakfast|to prepare breakfast|Ein gutes Frühstück gibt Kraft für den Tag.|A good breakfast gives strength for the day.|2600
verb|klettern, klettert, kletterte, ist geklettert|auf den Berg klettern|to climb|to climb the mountain|Tina und Tim klettern auf den Baum.|Tina and Tim climb the tree.|2601
der|der Mittelpunkt, -e|im Mittelpunkt stehen|midpoint, center of attention|to be the center of attention|Heute ist sein Geburtstag und nur er steht im Mittelpunkt.|Today is his birthday and only he is the center of attention.|2602
verb|bereiten, bereitet, bereitete, hat bereitet|eine Freude bereiten|to make, cause, give|to give joy|Die Kinder meines Bruders bereiten mir nur Freude.|My brother’s children are only giving me joy.|2603
die|die Entstehung, -en|die Entstehung des Lebens|origin|the origin of life|Es gibt verschiedene Theorien zur Entstehung des Universums.|There are several theories about the origin of the universe.|2604
adj|konservativ|konservative Werte|conservative|conservative values|Der konservative Flügel der Partei steht für traditionelle Werte.|The conservative wing of the party stands for traditional values.|2605
der|der Magen, -̈|einen vollen Magen|stomach|a full stomach|Nach dem Essen trinkt er einen Tee, um seinen Magen zu beruhigen.|After eating, he drinks tea to calm his stomach.|2606
adj|psychisch|psychische Probleme|psychological|psychological problems|Stress verursacht psychische Probleme.|Stress causes psychological problems.|2607
das|das Salz, -e|Salz hinzufügen|salt|to add salt|Stefanie isst das Ei mit Salz, weil es dann besser schmeckt.|Stefanie eats the egg with salt because it tastes better.|2608
num|siebzig|siebzig Jahre alt|seventy|seventy years old|Tobias verkauft sein Fahrrad für siebzig Euro.|Tobias sells his bike for seventy euros.|2609
verb|versichern, versichert, versicherte, hat versichert|ein Auto versichern|to insure, assert|to insure a car|Er versichert sein Fahrrad, falls er einen Unfall hat.|He insures his bike in case of an accident.|2610
der|der Brite, -n|ein Brite spricht|Brit|a Brit speaks|Die Briten entscheiden über die Zukunft Großbritanniens.|The Brits decide on Great Britain’s future.|2611
adj|erkennbar|leicht erkennbar|recognizable, apparent, visible|easily recognizable|Bakterien sind mit dem menschlichen Auge nicht erkennbar.|Bacteria are not visible for the human eye.|2612
adv|namens|ein Mann namens|by the name of, called|a man called|Die Organisation namens “Sea-Watch” hilft bei der Rettung von Flüchtlingen im Mittelmeer.|The organization called “Sea-Watch” helps rescue refugees in the Mediterranean.|2613
die|die Achse, -n|die Achse drehen|axle, axis|to turn the axle|Die Erde dreht sich in 24 Stunden einmal um ihre Achse.|The earth rotates once around its axis in 24 hours.|2614
verb|klingeln, klingelt, klingelte, hat geklingelt|an der Tür klingeln|to ring|to ring the doorbell|Das Telefon klingelt, aber niemand ist da.|The phone is ringing, but nobody is there.|2615
verb|speichern, speichert, speicherte, hat gespeichert|Daten speichern|to store, save|to store data|Daniel speichert alles auf seinem Computer.|Daniel stores everything on his computer.|2616
der|der Tee, -s|einen Tee trinken|tea|to drink tea|Der Tee kommt aus Indien.|The tea comes from India.|2617
der|der Zeuge, -n|ein Zeuge berichten|witness|a witness reports|Die Zeugin behauptet, den Täter nicht zu kennen.|The witness claims not to know who the perpetrator is.|2618
der|der Aufwand, -̈e|hoher Aufwand|expense, effort|high effort|Die Organisation des Festes bedeutet für alle einen großen Aufwand.|The organization of the festival is a big effort for everyone.|2619
die|die Kooperation, -en|gute Kooperation|cooperation|good cooperation|Das Projekt wird in Kooperation mit der Universität Leipzig durchgeführt.|The project is carried out in cooperation with the University of Leipzig.|2620
der|der Kritiker, -|ein Kritiker schreiben|critic|a critic writes|Die Kritiker der Reform warnen vor wirtschaftlichen Folgen.|The critics of the reform warn of economic consequences.|2621
das|das Tal, -̈er|durch das Tal|valley|through the valley|Der Schnee liegt nur auf den Bergen und nicht im Tal.|The snow is only on the mountains and not in the valley.|2622
adj|derartig|derartige Probleme|such, like that|such problems|Derartige Probleme wie Unfälle im Verkehr gibt es auf dem Dorf kaum.|Such problems as accidents in traffic hardly exist in the village.|2623
der, die|die Erste|die Erste sein|first|to be the first|Angela Merkel ist die Erste in diesem Amt.|Angela Merkel is the first in this position.|2624
adj|vielfach|vielfach nützlich|multiple|multiple uses|Seine Theorie ist in vielfacher Hinsicht interessant.|His theory is interesting in many ways.|2625
verb|empfangen, empfängt, empfing, hat empfangen|einen Brief empfangen|to receive|to receive a letter|Wir empfangen unsere Gäste am Flughafen.|We receive our guests at the airport.|2626
die|die Ernährung, -en|gesunde Ernährung|food, diet|healthy diet|Viele Menschen bevorzugen eine Ernährung ohne Fleisch.|Many people prefer a meatless diet.|2627
die|die Küste, -n|an der Küste|coast|at the coast|New York liegt an der Ostküste der USA.|New York is located on the east coast of the USA.|2628
verb|mitkommen, kommt mit, kam mit, ist mitgekommen|mit Freunden mitkommen|to come (with sb)|to come with friends|Martin fragt Tina, ob sie in den Urlaub mitkommen möchte.|Martin asks Tina if she wants to come along on a vacation.|2629
die|die Republik, -en|eine Republik gründen|republic|to found a republic|Eine Republik ist eine Staatsform, bei der die Menschen die Regierung wählen.|A republic is a form of state in which the people elect the government.|2630
verb|zucken, zuckt, zuckte, hat gezuckt|mit den Schultern zucken|to twitch, shrug|to shrug shoulders|Seine Beine zucken im Schlaf.|His legs twitch in his sleep.|2631
verb|anschließen, schließt an, schloss an, hat angeschlossen|sich einer Gruppe anschließen|to join, chain to, connect|to join a group|Du kannst dein Handy an meinen Computer anschließen.|You can connect your phone to my computer.|2632
verb|austauschen, tauscht aus, tauschte aus, hat ausgetauscht|eine Idee austauschen|to exchange, replace|to exchange an idea|Sie tauschen ihre Nummern aus, damit er ihn anrufen kann.|They exchange their numbers so he can call him.|2633
verb|beschleunigen, beschleunigt, beschleunigte, hat beschleunigt|das Tempo beschleunigen|to accelerate|to accelerate the speed|Sie beschleunigt das Auto auf 100 Kilometer pro Stunde.|She accelerates the car to 100 kilometers per hour.|2634
die|die Norm, -en|nach der Norm|norm|according to the norm|Es gibt eine politische Debatte über die Normen und Werte des Landes.|There is a political debate about the norms and values of the country.|2635
verb|anstellen, stellt an, stellte an, hat angestellt|eine Person anstellen|to hire, employ, line up, get into mischief|to hire a person|Die Firma stellt im nächsten Jahr mehr als 100 neue Arbeiter an.|The company will hire more than 100 new workers next year.|2636
verb|decken, deckt, deckte, hat gedeckt|den Tisch decken|to cover, set|to set the table|Vor dem Abendessen deckt sie den Tisch.|Before dinner she sets the table.|2637
adj|grob|eine grobe Schätzung|coarse, rude, gross|a rough estimate|Obwohl sie freundlich fragt, bekommt sie eine grobe Antwort.|Although she asks nicely, she gets a rude answer.|2638
der|der Protest, -e|lauter Protest|protest|loud protest|Viele Menschen beteiligen sich an dem friedlichen Protest.|Many people take part in the peaceful protest.|2639
die|die Tour, -en|eine Tour planen|tour, trip|to plan a trip|Wir machen eine Tour mit dem Fahrrad durch Leipzig.|We are taking a bicycle tour through Leipzig.|2640
der|der Überblick, -e|den Überblick behalten|view, overview|to keep the overview|Ich gebe Ihnen einen kurzen Überblick über meinen Vortrag.|I am giving you a short overview of my presentation.|2641
der|der Geschäftsführer, -|ein Geschäftsführer leiten|manager|a manager leads|Der Geschäftsführer kümmert sich persönlich um das Problem.|The manager personally takes care of the problem.|2642
der|der Griff, -e|den Griff festhalten|handle, grip, grasp|to hold the handle|Tobias packt das Messer am Griff.|Tobias grabs the knife by the handle.|2643
verb|küssen, küsst, küsste, hat geküsst|jemanden küssen|to kiss|to kiss someone|Sie küsst ihn auf den Mund.|She kisses him on the mouth.|2644
der|der Liter, -|ein Liter Wasser|liter|a liter of water|Die Flasche enthält einen Liter Milch.|The bottle contains one liter of milk.|2645
das|das Subjekt, -e|das Subjekt analysieren|subject|to analyze the subject|Sophia ist das Subjekt in dem Satz “Sophia spielt Fußball.”|Sophia is the subject in the sentence “Sophia plays soccer.”|2646
der|der Außenminister, -|ein Außenminister spricht|foreign minister|a foreign minister speaks|Die Außenministerin trifft sich mit dem türkischen Präsidenten.|The foreign minister is meeting with the Turkish president.|2647
die|die Faser, -n|eine Faser spüren|fiber|to feel a fiber|Die Fasern an der Leiche stammen wahrscheinlich von der Kleidung des Täters.|The fibers on the body are probably from the offender’s clothes.|2648
der|der Schatz, -̈e|einen Schatz finden|treasure, sweetheart|to find a treasure|Auf dem Boden des Meeres liegen viele Schätze.|On the bottom of the sea lie many treasures.|2649
adj|sekundär|sekundäre Bedeutung|secondary|secondary importance|Der Aspekt ist nur von sekundärer Bedeutung.|This aspect is only of secondary importance.|2650
die|die Zentralbank, -en|die Zentralbank regulieren|central bank|to regulate the central bank|Die Zentralbank senkt die Zinsen.|The central bank lowers interest rates.|2651
der, die, das|die Alte|alte Gebäude|old person/thing|old buildings|Der Alte hat keine Familie mehr, er ist sehr einsam.|The old man has no family; he’s very lonely.|2652
der, die|die Angestellte|ein Angestellter spricht|employee|an employee speaks|Die Firma hat nur wenige Angestellte.|The company has just a few employees.|2653
adj|dankbar|dankbar sein|grateful|to be grateful|Wir sind dankbar für die Geschenke und das schöne Fest.|We are grateful for the gifts and the beautiful celebration.|2654
verb|faszinieren, fasziniert, faszinierte, hat fasziniert|etwas faszinieren|to fascinate|to fascinate something|Die Größe des Universums fasziniert die Menschen weltweit.|The size of the universe fascinates people worldwide.|2655
der|der Flur, -e|im Flur stehen|hall, corridor|to stand in the corridor|Die Gäste ziehen ihre Schuhe im Flur aus.|The guests take off their shoes in the hall.|2656
das|das Hemd, -en|ein Hemd bügeln|shirt|to iron a shirt|Sein Hemd hat die gleiche Farbe wie ihr Kleid.|His shirt is the same color as her dress.|2657
adj|inhaltlich|inhaltliche Fehler|in terms of content|content errors|Inhaltlich ist der Text gut, aber formal gibt es einige Fehler.|In terms of its content, the text is good, but formally there are some mistakes.|2658
die|die Begründung, -en|eine gute Begründung|explanation, justification|a good justification|Mit welcher Begründung kommt Martin heute nicht zur Schule?|What justification does Martin give for not coming to school today?|2659
adv|dreimal|dreimal täglich|three times|three times a day|Er klopft dreimal an die Tür.|He knocks on the door three times.|2660
adv|momentan|momentan verfügbar|at the moment, momentarily|currently available|Und momentan suche ich nach einem Job.|And at the moment, I’m looking for a job.|2661
verb|zögern, zögert, zögerte, hat gezögert|nicht zögern|to hesitate|not to hesitate|Sven zögert kurz, aber dann stellt er die Frage.|Sven hesitates, but then he asks the question.|2662
adv|derart|derart schnell|so|so fast|Florian ist derart nervös, dass sein Herz sehr schnell schlägt.|Florian is so nervous that his heart beats very fast.|2663
adj|kreativ|kreative Ideen|creative|creative ideas|Wir suchen noch kreative Menschen mit neuen Ideen.|We are still looking for creative people with new ideas.|2664
verb|einziehen, zieht ein, zog ein, hat eingezogen|in eine Wohnung einziehen|to move in|to move into an apartment|Mein Großvater zieht für ein paar Wochen bei uns ein.|My grandfather’s moving in with us for a few weeks.|2665
das|das Ausmaß, -e|das Ausmaß messen|extent, size|to measure the extent|Das Ausmaß des Schadens ist noch unklar.|The extent of the damage is still unclear.|2666
der|der Feind, -e|ein gefährlicher Feind|enemy|a dangerous enemy|Nach dem Krieg schließen die ehemaligen Feinde Frieden.|After the war, the former enemies make peace.|2667
verb|verbrennen, verbrennt, verbrannte, ist verbrannt|Holz verbrennen|to burn|to burn wood|Sie verbrennt alle Beweise, bevor die Polizei kommt.|She burns all the evidence before the police come.|2668
der|der Vorstand, -̈e|der Vorstand treffen|board, chairperson|to meet the board|Der Vorstand entscheidet letztendlich über die Vorschläge.|The board finally decides on the proposals.|2669
der|der Atem|tiefer Atem|breath|deep breath|Ihr Atem riecht nach Alkohol.|Her breath smells of alcohol.|2670
die|die Distanz, -en|große Distanz|distance|large distance|Über das Internet kann man über weite Distanzen hinweg kommunizieren.|You can communicate over long distances over the internet.|2671
der|der Händler, -|ein Händler verkaufen|trader, dealer, retailer|a trader sells|Der Händler verkauft frische und regionale Produkte auf dem Markt.|The trader sells fresh and regional products on the market.|2672
verb|hassen, hasst, hasste, hat gehasst|jemanden hassen|to hate|to hate someone|Ich hasse es, vor vielen Menschen zu sprechen.|I hate speaking in front of so many people.|2673
das|das Muster, -|ein schönes Muster|pattern, model|a beautiful pattern|Der Stoff hat ein buntes Muster.|The fabric has a colorful pattern.|2674
adj|ausführlich|eine ausführliche Erklärung|detailed|a detailed explanation|Auf der Webseite gibt es eine ausführliche Beschreibung der Wohnung.|On the website there is a detailed description of the apartment.|2675
verb|bedenken, bedenkt, bedachte, hat bedacht|alle Aspekte bedenken|to consider|to consider all aspects|Du musst bei der Planung bedenken, dass das Fest im Winter stattfindet.|You have to consider in your planning that the party takes place in winter.|2676
der|der Terror|politischer Terror|terror|political terror|Verschiedene radikale Gruppen sind für den Terror verantwortlich.|Different radical groups are responsible for the terror.|2677
die|die Verfassung, -en|eine neue Verfassung|constitution|a new constitution|Die Verfassung von Deutschland heißt Grundgesetz.|The constitution of Germany is called the Grundgesetz.|2678
adj|blind|blind sein|blind|to be blind|Sie ist blind und kann nur Licht und Schatten wahrnehmen.|She is blind and can only perceive light and shadow.|2679
verb|einschlafen, schläft ein, schlief ein, ist eingeschlafen|schnell einschlafen|to fall asleep|to fall asleep quickly|Tina ist so müde, dass sie während des Films einschläft.|Tina is so tired that she falls asleep during the movie.|2680
die|die Flüchtlingskrise, -n|die Flüchtlingskrise bewältigen|refugee crisis|to cope with the refugee crisis|Seit der Flüchtlingskrise 2015 haben sich der Staat und die Gesellschaft in vielerlei Hinsicht verändert.|Since the refugee crisis in 2015, the state and society have changed in many ways.|2681
der|der Ärger|großer Ärger|annoyance, trouble|great annoyance|Er hat viel Ärger mit den deutschen Behörden am Flughafen.|He has a lot of trouble with the German authorities at the airport.|2682
adj|allmählich|allmählich verbessern|gradual|to improve gradually|Die Zeitungen berichten von einem allmählichen Anstieg der Temperaturen.|The newspapers report a gradual rise in temperatures.|2683
der|der Führer, -|ein Führer spricht|leader, guide|a leader speaks|Eine Führerin gibt den Touristen Informationen zur Stadt.|A guide gives the tourists information about the city.|2684
das|das Vitamin, -e|Vitamin C nehmen|vitamin|to take vitamin C|Im Winter haben viele Menschen einen Mangel an Vitamin D.|In winter, many people have a vitamin D deficiency.|2685
der|der Abschied, -e|Abschied nehmen|departure, parting|to say goodbye|Der Abschied ist leicht, weil Mirjam schon in einer Woche wiederkommt.|The parting is easy because Mirjam is returning in a week.|2686
der|der Hafen, -̈|ein großer Hafen|harbor|a large harbor|Am Hafen liegen Schiffe mit Gütern aus aller Welt.|At the harbor are ships with goods from all over the world.|2687
die|die Niere, -n|die Niere spenden|kidney|to donate a kidney|Daniels kranke Mutter bekommt eine Niere von ihrem Sohn.|Daniel’s sick mother gets a kidney from her son.|2688
verb|abbilden, bildet ab, bildete ab, hat abgebildet|ein Bild abbilden|to copy, portray|to portray a picture|Der Maler versucht, die Gefühle der Menschen auf dem Bild abzubilden.|The painter tries to portray the feelings of the people in the picture.|2689
der|der Rezeptor, -en|einen Rezeptor aktivieren|receptor|to activate a receptor|Der Rezeptor ist ein Teil von einem Nerv und reagiert auf Reize wie Hitze oder Kälte.|The receptor is part of the nerve and responds to stimuli such as heat or cold.|2690
verb|etablieren, etabliert, etablierte, hat etabliert|eine Firma etablieren|to establish|to establish a company|Die Marke hat sich erfolgreich am Markt etabliert.|The brand has successfully established itself on the market.|2691
das|das Messer, -|ein Messer schärfen|knife|to sharpen a knife|Julius schneidet das Brot mit einem großen Messer.|Julius cuts the bread with a big knife.|2692
adv|teils|teils sonnig|partly|partly sunny|Wir reisen teils mit dem Flugzeug und teils mit dem Schiff.|We travel partly by plane and partly by ship.|2693
das|Brasilien|nach Brasilien reisen|Brazil|to travel to Brazil|Brasilien ist das größte Land in Südamerika.|Brazil is the largest country in South America.|2694
verb|ergreifen, ergreift, ergriff, hat ergriffen|eine Chance ergreifen|to take, seize, grip, capture|to seize an opportunity|Ich möchte die Gelegenheit ergreifen, um mich bei allen zu bedanken.|I would like to take the opportunity to thank everyone.|2695
das|das Grundgesetz, -e|das Grundgesetz verstehen|basic law|to understand the basic law|Viele Normen und Werte unserer Gesellschaft sind im Grundgesetz beschrieben.|Many norms and values of our society are described in the Basic Law.|2696
die|die Herkunft, -̈e|die Herkunft klären|origin|to clarify the origin|Weil er anders aussieht, wird er oft nach seiner Herkunft gefragt.|Because he looks different, he is often asked about his origin.|2697
verb|hinausgehen, geht hinaus, ging hinaus, ist hinausgegangen|hinausgehen in den Garten|to go out, exceed|to go out into the garden|Die Kosten sollen nicht über die geplanten 50 Euro hinausgehen.|The costs should not exceed the planned 50 euros.|2698
die|die Katastrophe, -n|eine Katastrophe verhindern|catastrophe|to prevent a catastrophe|So ein Sturm ist eine schlimme Katastrophe.|Such a storm is a terrible catastrophe.|2699
verb|lehnen, lehnt, lehnte, hat gelehnt|sich an die Wand lehnen|to lean|to lean against the wall|Sie lehnt mit dem Rücken an der Wand.|She’s leaning her back against the wall.|2700
verb|beraten, berät, beriet, hat beraten|jemanden beraten|to advise, discuss|to advise someone|Als Verkäuferin ist es meine Aufgabe, meine Kunden zu beraten.|As a saleswoman it is my job to advise my customers.|2701
adj|bürgerlich|bürgerliche Rechte|civil, civic|civil rights|Er ruft die Polizei, weil es seine bürgerliche Pflicht ist.|He’s calling the police because it’s his civic duty.|2702
das|das Erlebnis, -se|ein tolles Erlebnis|experience|a great experience|Die Präsidentin zu treffen, ist ein besonderes Erlebnis.|Meeting the president is a special experience.|2703
adv|nachher|kurz nachher|afterwards|shortly afterwards|Wenn du mir in der Küche hilfst, kannst du nachher ein Eis bekommen.|If you help me in the kitchen, you can have an ice cream afterwards.|2704
verb|übergehen, geht über, ging über, ist übergegangen|zum nächsten Thema übergehen|to pass into|to pass to the next topic|Das Haus geht in den Besitz des Sohnes über.|The house passes into the son’s possession.|2705
die|die Wut|große Wut|rage, fury|great rage|Wut ist eine Emotion, die extremen Ärger ausdrückt.|Rage is an emotion that expresses extreme anger.|2706
verb|aufrufen, ruft auf, rief auf, hat aufgerufen|zum Streik aufrufen|to call out/up/upon|to call for a strike|Der Arzt ruft den nächsten Patienten auf.|The doctor calls out to the next patient.|2707
adj|quer|quer durch die Stadt|diagonally, sideways, across|across the city|Der kürzeste Weg ist quer durch den Park.|The shortest way is across the park.|2708
der|der Kapitän, -e|der Kapitän spricht|captain|the captain speaks|Der Kapitän verlässt als Letzter das Schiff.|The captain is the last to leave the ship.|2709
verb|zusammenhängen, hängt zusammen, hing zusammen, hat zusammengehangen|mit der Situation zusammenhängen|to be connected|to be connected with the situation|Die Anzahl der Fische hängt mit der Qualität des Wassers zusammen.|The number of fish is connected with the quality of the water.|2710
der|der Ausländer, -|ein Ausländer fragen|foreigner|to ask a foreigner|Die Integration von Ausländern ist in allen modernen Gesellschaften sehr wichtig.|The integration of foreigners is very important in all modern societies.|2711
der, die|die Beschäftigte|eine Beschäftigte informieren|employee|to inform an employee|Wir brauchen mehr Beschäftigte, um die ganze Arbeit zu erledigen.|We need more employees to do all the work.|2712
