|#frequency_rank|part_of_speech|word_de|word_pl_de|word_en|word_ru|sentence_de|sentence_en|sentence_ru
1462|1386|das|das Gebäude, -||building|здание|Das Gebäude ist hoch.|The building is tall.|Здание высокое.
1463|1387|adj|langfristig||long-term|долгосрочный|Die Investition ist langfristig.|The investment is long-term.|Инвестиция долгосрочная.
1464|1388|adj|herzlich||cordial, warm|сердечный|Er ist herzlich willkommen.|He is warmly welcome.|Он сердечно приветствуется.
1465|1389|verb|sichern, sichert, sicherte, hat gesichert||to secure, safeguard|обеспечивать|Die Tür ist gesichert.|The door is secured.|Дверь защищена.
1466|1390|das|das Material, -ien||material|материал|Das Material ist teuer.|The material is expensive.|Материал дорогой.
1467|1391|verb|verbringen, verbringt, verbrachte, hat verbracht||to spend (time)|проводить|Er verbringt viel Zeit.|He spends a lot of time.|Он проводит много времени.
1468|1392|der|der Strom, -̈e||stream, current, electricity|электричество|Der Strom ist weg.|The electricity is gone.|Электричество пропало.
1469|1393|das|das Amt, -Äer||office, department, function|учреждение|Er arbeitet im Amt.|He works in the office.|Он работает в учреждении.
1470|1394|verb|kritisieren, kritisiert, kritisierte, hat kritisiert||to criticize|критиковать|Er kritisiert den Plan.|He criticizes the plan.|Он критикует план.
1471|1395|verb|vermitteln, vermittelt, vermittelte, hat vermittelt||to convey, mediate, find, procure|посредничать|Er vermittelt den Vertrag.|He mediates the contract.|Он посредничает в договоре.
1472|1396|die|die Wirklichkeit, -en||reality|реальность|Die Wirklichkeit ist hart.|The reality is harsh.|Реальность суровая.
1473|1397|die|die Union, -en||union|союз|Die Union ist stark.|The union is strong.|Союз сильный.
1474|1398|das|das Studium, -en||study, studies|учёба|Das Studium ist schwer.|The studies are hard.|Учёба трудная.
1475|1399|verb|festhalten, hält fest, hielt fest, hat festgehalten||to hold on to, detain|удерживать|Er hält am Plan fest.|He holds on to the plan.|Он придерживается плана.
1476|1400|verb|präsentieren, präsentiert, präsentierte, hat präsentiert||to present, show|презентовать|Sie präsentiert ihre Ideen.|She presents her ideas.|Она презентует свои идеи.
1477|1401|die|die Demokratie, -n||democracy|демократия|Die Demokratie ist wichtig.|Democracy is important.|Демократия важна.
1478|1402|adv|niemals||never|никогда|Ich werde niemals lügen.|I will never lie.|Я никогда не буду лгать.
1479|1403|die|die Aufnahme, -n||reception, recording, snapshot|запись|Die Aufnahme war klar.|The recording was clear.|Запись была чёткой.
1480|1404|die|die Ausnahme, -n||exception|исключение|Das ist eine Ausnahme.|That is an exception.|Это исключение.
1481|1405|verb|beenden, beendet, beendete, hat beendet||to end|заканчивать|Der Krieg wurde beendet.|The war was ended.|Война была закончена.
1482|1406|die|die Investition, -en||investment|инвестиция|Die Investition ist groß.|The investment is significant.|Инвестиция значительная.
1483|1407|die|die Lust, -̈e||desire|желание|Ich habe Lust auf Eis.|I desire ice cream.|Я хочу мороженого.
1484|1408|verb|prüfen, prüft, prüfte, hat geprüft||to examine, check|проверять|Der Lehrer prüft die Tests.|The teacher checks the tests.|Учитель проверяет тесты.
1485|1409|verb|anlegen, legt an, legte an, hat angelegt||to put on, invest|вкладывать|Er legt das Geld an.|He invests the money.|Он вкладывает деньги.
1486|1410|der|der Zuschauer, -||spectator|зритель|Der Zuschauer applaudiert.|The spectator applauds.|Зритель аплодирует.
1487|1411|adj|hell||light, bright|светлый|Das Zimmer ist hell.|The room is bright.|Комната светлая.
1488|1412|adv|mitten||in the middle|посреди|Mitten im Raum.|In the middle of the room.|Посреди комнаты.
1489|1413|prep|zufolge||according to|согласно|Dem Bericht zufolge.|According to the report.|Согласно отчёту.
1490|1414|der|der Konflikt, -e||conflict|конфликт|Der Konflikt ist gelöst.|The conflict is resolved.|Конфликт решён.
1491|1415|die|die Bahn, -en||train, railway, way|поезд|Die Bahn ist pünktlich.|The train is on time.|Поезд вовремя.
1492|1416|das|Syrien||Syria|Сирия|Syrien ist weit weg.|Syria is far away.|Сирия далеко.
1493|1417|das|das Einkommen, -||income|доход|Das Einkommen ist hoch.|The income is high.|Доход высокий.
1494|1418|verb|empfehlen, empfiehlt, empfahl, hat empfohlen||to recommend|рекомендовать|Ich empfehle dieses Buch.|I recommend this book.|Я рекомендую эту книгу.
1495|1419|adj|britisch||British|британский|Sie ist britisch.|She is British.|Она британка.
1496|1420|verb|fürchten, fürchtet, fürchtete, hat gefürchtet||to fear|бояться|Er fürchtet die Dunkelheit.|He fears the darkness.|Он боится темноты.
1497|1421|verb|vorbereiten, bereitet vor, bereitete vor, hat vorbereitet||to prepare|готовить|Er bereitet das Essen vor.|He prepares the food.|Он готовит еду.
1498|1422|die|die Aktivität, -en||activity|активность|Die Aktivität ist anstrengend.|The activity is exhausting.|Активность утомительна.
1499|1423|der|der Auftrag, -̈e||instructions, order, job|заказ|Der Auftrag ist wichtig.|The job is important.|Заказ важен.
1500|1424|adj|froh||happy, glad|счастливый|Ich bin froh.|I am happy.|Я счастлив.
1501|1425|verb|äußern, äußert, äußerte, hat geäußert||to express, voice|выражать|Er äußerte seine Meinung.|He expressed his opinion.|Он выразил своё мнение.
1502|1426|der|der Geist, -er||mind, spirit|дух|Der Geist ist stark.|The spirit is strong.|Дух силен.
1503|1427|das|das Objekt, -e||object|объект|Das Objekt ist schwer.|The object is heavy.|Объект тяжёлый.
1504|1428|adv|möglicherweise||possibly|возможно|Er kommt möglicherweise.|He might come.|Он возможно придёт.
1505|1429|adj|zuständig||appropriate, responsible|ответственный|Er ist zuständig.|He is responsible.|Он ответственный.
1506|1430|verb|aufweisen, weist auf, wies auf, hat aufgewiesen||to show, exhibit, contain|показывать|Der Bericht weist Fehler auf.|The report shows errors.|Отчёт показывает ошибки.
1507|1431|verb|springen, springt, sprang, ist gesprungen||to jump|прыгать|Das Kind springt hoch.|The child jumps high.|Ребёнок прыгает высоко.
1508|1432|der|der Hof, -̈e||courtyard, yard|двор|Der Hof ist groß.|The courtyard is big.|Двор большой.
1509|1433|der|der Polizist, -en||police officer, policeman|полицейский|Der Polizist hilft.|The police officer helps.|Полицейский помогает.
1510|1434|die|die Übung, -en||exercise, practice|упражнение|Die Übung ist schwer.|The exercise is hard.|Упражнение трудное.
1511|1435|der|der Widerstand, -̈e||resistance, opposition|сопротивление|Der Widerstand wächst.|The resistance grows.|Сопротивление растёт.
1512|1436|verb|anziehen, zieht an, zog an, hat angezogen||to attract, put on, dress|надевать|Er zieht das Hemd an.|He puts on the shirt.|Он надевает рубашку.
1513|1437|der|der Experte, -n||expert|эксперт|Der Experte spricht.|The expert speaks.|Эксперт говорит.
1514|1438|adv|ohnehin||anyway|всё равно|Er kommt ohnehin.|He comes anyway.|Он всё равно придёт.
1515|1439|verb|füllen, füllt, füllte, hat gefüllt||to fill|наполнять|Der Eimer ist gefüllt.|The bucket is filled.|Ведро наполнено.
1516|1440|die|die Gemeinde, -n||community, municipality|сообщество|Die Gemeinde ist klein.|The community is small.|Сообщество маленькое.
1517|1441|die|die Pause, -n||pause, break|перерыв|Die Pause ist kurz.|The break is short.|Перерыв короткий.
1518|1442|adj|scharf||sharp|острый|Das Messer ist scharf.|The knife is sharp.|Нож острый.
1519|1443|verb|schütteln, schüttelt, schüttelte, hat geschüttelt||to shake|трясти|Er schüttelt den Kopf.|He shakes his head.|Он трясёт головой.
1520|1444|das|das Fernsehen||television|телевидение|Das Fernsehen läuft.|The television is on.|Телевидение работает.
1521|1445|die|die Formel, -n||formula|формула|Die Formel ist schwer.|The formula is difficult.|Формула сложная.
1522|1446|adj|gelb||yellow|жёлтый|Die Blume ist gelb.|The flower is yellow.|Цветок жёлтый.
1523|1447|das|das Sommersemester, -||summer semester|летний семестр|Das Sommersemester beginnt.|The summer semester starts.|Летний семестр начинается.
1524|1448|adj|heftig||hard, heavy, violent|сильный|Der Sturm war heftig.|The storm was violent.|Шторм был сильный.
1525|1449|die|die Bühne, -n||stage|сцена|Die Bühne ist leer.|The stage is empty.|Сцена пустая.
1526|1450|verb|empfinden, empfindet, empfand, hat empfunden||to feel|чувствовать|Er empfindet Freude.|He feels joy.|Он чувствует радость.
1527|1451|der|der Schaden, -̈||damage|ущерб|Der Schaden ist groß.|The damage is significant.|Ущерб большой.
1528|1452|adj|umgekehrt||reversed, contrary, around|обратный|Die Richtung ist umgekehrt.|The direction is reversed.|Направление обратное.
1529|1453|verb|veröffentlichen, veröffentlicht, veröffentlichte, hat veröffentlicht||to publish|опубликовать|Das Buch wurde veröffentlicht.|The book was published.|Книга была опубликована.
1530|1454|verb|aufstellen, stellt auf, stellte auf, hat aufgestellt||to put up, draw up|ставить|Er stellt den Stuhl auf.|He puts up the chair.|Он ставит стул.
1531|1455|adj|abhängig||dependent|зависимый|Ich bin abhängig.|I am dependent.|Я зависим.
1532|1456|die|die Strecke, -n||distance, route|расстояние|Die Strecke ist lang.|The distance is long.|Расстояние длинное.
1533|1457|die|die Praxis, -en||practice, doctor’s office|практика|Die Praxis ist modern.|The doctor’s office is modern.|Практика современная.
1534|1458|adj|ungefähr||approximately|примерно|Der Weg ist ungefähr zehn Kilometer.|The way is approximately ten kilometers.|Путь примерно десять километров.
1535|1459|verb|mitnehmen, nimmt mit, nahm mit, hat mitgenommen||to take (along)|взять с собой|Er nimmt den Hund mit.|He takes the dog along.|Он берёт с собой собаку.
1536|1460|adj|üblich||usual|обычный|Das ist üblich.|That is usual.|Это обычно.
1537|1461|verb|übertragen||to transfer|переводить|Daten werden übertragen.|Data is being transferred.|Данные передаются.
1538|1462|die|die Wissenschaft, -en||science|наука|Die Wissenschaft ist spannend.|The science is exciting.|Наука захватывающая.
1539|1463|adj|global||global|глобальный|Das Problem ist global.|The problem is global.|Проблема глобальная.
1540|1464|der|der Nachmittag, -e||afternoon|после полудня|Der Nachmittag ist sonnig.|The afternoon is sunny.|После полудня солнечно.
1541|1465|die|die Annahme, -n||acceptance, assumption|предположение|Die Annahme war richtig.|The assumption was correct.|Предположение было правильным.
1542|1466|die|die Umgebung, -en||surroundings|окрестности|Die Umgebung ist schön.|The surroundings are beautiful.|Окрестности красивые.
1543|1467|die|die Öffentlichkeit, -en||public|общественность|Die Öffentlichkeit ist informiert.|The public is informed.|Общественность проинформирована.
1544|1468|der|der Spiegel, -||mirror|зеркало|Der Spiegel ist groß.|The mirror is big.|Зеркало большое.
1545|1469|verb|zurückkommen, kommt zurück, kam zurück, ist zurückgekommen||to return|возвращаться|Er kommt zurück.|He returns.|Он возвращается.
1546|1470|verb|besetzen, besetzt, besetzte, hat besetzt||to occupy, fill|занимать|Die Stelle ist besetzt.|The position is occupied.|Место занято.
1547|1471|das|das Gegenteil, -e||opposite|противоположность|Das Gegenteil ist richtig.|The opposite is true.|Противоположность верна.
1548|1472|adv|vorbei||past, over|прошло|Die Zeit ist vorbei.|The time is over.|Время прошло.
1549|1473|der|der Fan, -s||fan, supporter|фанат|Der Fan ist begeistert.|The fan is excited.|Фанат в восторге.
1550|1474|die|die Karte, -n||card, ticket, menu|билет|Die Karte ist teuer.|The ticket is expensive.|Билет дорогой.
1551|1475|adj|arm||poor|бедный|Er ist arm.|He is poor.|Он беден.
1552|1476|die|die Krise, -n||crisis|кризис|Die Krise ist vorbei.|The crisis is over.|Кризис прошёл.
1553|1477|die|die Strategie, -n||strategy|стратегия|Die Strategie ist klug.|The strategy is smart.|Стратегия умная.
1554|1478|die|die Debatte, -n||debate|дебаты|Die Debatte war lang.|The debate was long.|Дебаты были долгими.
1555|1479|pron|davor||before, in front of|перед|Er stand davor.|He stood in front of it.|Он стоял перед ним.
1556|1480|der|der Journalist, -en||journalist|журналист|Der Journalist schreibt.|The journalist writes.|Журналист пишет.
1557|1481|verb|kochen, kocht, kochte, hat gekocht||to cook|готовить|Er kocht gern.|He likes to cook.|Он любит готовить.
1558|1482|verb|zurückgehen, geht zurück, ging zurück, ist zurückgegangen||to go back, decrease|уменьшаться|Die Preise gehen zurück.|The prices are decreasing.|Цены уменьшаются.
1559|1483|der|der Schmerz, -en||pain, grief|боль|Der Schmerz ist stark.|The pain is strong.|Боль сильная.
1560|1484|adj|erheblich||considerable|значительный|Die Kosten sind erheblich.|The costs are considerable.|Затраты значительные.
1561|1485|adj|ausschließlich||exclusive|исключительно|Das ist ausschließlich für Mitglieder.|That is exclusively for members.|Это исключительно для членов.
1562|1486|adj|griechisch||Greek|греческий|Er studiert die griechische Mythologie.|He studies Greek mythology.|Он изучает греческую мифологию.
1563|1486|das|das Griechisch||Greek|греческий|Er spricht Griechisch.|He speaks Greek.|Он говорит по-гречески.
1564|1487|part|naja||(oh) well|ну|Naja, was soll’s?|Oh well, what can you do?|Ну, что поделать?
1565|1488|die|die Runde, -n||round|раунд|Die Runde ist spannend.|The round is exciting.|Раунд захватывающий.
1566|1489|der|der Angriff, -e||attack|атака|Der Angriff war schnell.|The attack was swift.|Атака была быстрой.
1567|1490|verb|einführen, führt ein, führte ein, hat eingeführt||to introduce, import|вводить|Das Produkt wird eingeführt.|The product is being introduced.|Продукт вводится.
1568|1491|adv|desto||the more|тем|Je länger, desto besser.|The longer, the better.|Чем дольше, тем лучше.
1569|1492|der|der Wettbewerb, -e||competition|соревнование|Der Wettbewerb ist hart.|The competition is tough.|Соревнование жесткое.
1570|1493|verb|verfügen, verfügt, verfügte, hat verfügt||to have sth at one’s disposal, be in charge|располагать|Er verfügt über viele Bücher.|He has many books at his disposal.|Он располагает многими книгами.
1571|1494|pron|woher||from where, how|откуда|Woher kommst du?|Where do you come from?|Откуда ты?
1572|1495|der|der Zweifel, -||doubt|сомнение|Er hat Zweifel.|He has doubts.|У него есть сомнения.
1573|1496|der|der Konzern, -e||corporation|концерн|Der Konzern expandiert.|The corporation is expanding.|Концерн расширяется.
1574|1497|verb|tanzen, tanzt, tanzte, hat getanzt||to dance|танцевать|Wir tanzen gern.|We like to dance.|Мы любим танцевать.
1575|1498|verb|überleben, überlebt, überlebte, hat überlebt||to survive|выживать|Er überlebte den Unfall.|He survived the accident.|Он выжил в аварии.
1576|1499|adj|spezifisch||specific|специфический|Das ist spezifisch.|That is specific.|Это специфично.
1577|1500|adj|stabil||stable, sturdy|стабильный|Das Haus ist stabil.|The house is sturdy.|Дом стабильный.
1578|1501|die|die Kamera, -s||camera|камера|Die Kamera ist teuer.|The camera is expensive.|Камера дорогая.
1579|1502|der|der Schatten, -||shadow, shade|тень|Der Baum wirft einen Schatten.|The tree casts a shadow.|Дерево отбрасывает тень.
1580|1503|verb|berücksichtigen, berücksichtigt, berücksichtigte, hat berücksichtigt||to consider|учитывать|Er berücksichtigt die Fakten.|He considers the facts.|Он учитывает факты.
1581|1504|das|das Pferd, -e||horse|лошадь|Das Pferd ist schnell.|The horse is fast.|Лошадь быстрая.
1582|1505|verb|begegnen, begegnet, begegnete, ist begegnet||to meet, encounter, come across|встретить|Er begegnet ihr.|He meets her.|Он встречает её.
1583|1506|der|der Zugang, -̈e||access|доступ|Der Zugang ist gesperrt.|The access is blocked.|Доступ закрыт.
1584|1507|num|elf||eleven|одиннадцать|Elf Personen kamen.|Eleven people came.|Пришли одиннадцать человек.
1585|1508|die|die Suche, -n||search|поиск|Die Suche ist erfolgreich.|The search is successful.|Поиск успешен.
1586|1509|adj|doppelt||double|двойной|Die Menge ist doppelt so groß.|The amount is twice as large.|Количество вдвое больше.
1587|1510|verb|festlegen, legt fest, legte fest, hat festgelegt||to determine, fix, lay down|устанавливать|Die Regeln sind festgelegt.|The rules are determined.|Правила установлены.
1588|1511|adj|österreichisch||Austrian|австрийский|Das Essen ist österreichisch.|The food is Austrian.|Еда австрийская.
1589|1512|conj|sodass||so that|так что|Er arbeitet, sodass er Geld verdient.|He works so that he earns money.|Он работает, так что зарабатывает деньги.
1590|1513|die|die Tatsache, -n||fact|факт|Die Tatsache ist bekannt.|The fact is known.|Факт известен.
1591|1514|der|der Alkohol, -e||alcohol|алкоголь|Er trinkt keinen Alkohol.|He doesn’t drink alcohol.|Он не пьёт алкоголь.
1592|1515|verb|informieren, informiert, informierte, hat informiert||to inform|информировать|Er informiert die Öffentlichkeit.|He informs the public.|Он информирует общественность.
1593|1516|der|Norden, Nord-||north|север|Der Wind kommt aus dem Norden.|The wind comes from the north.|Ветер дует с севера.
1594|1517|verb|vermuten, vermutet, vermutete, hat vermutet||to assume, suspect|предполагать|Ich vermute, es regnet.|I suspect it will rain.|Я предполагаю, что будет дождь.
1595|1518|adj|zufrieden||satisfied|доволен|Ich bin zufrieden.|I am satisfied.|Я доволен.
1596|1519|verb|reißen, reißt, riss, hat gerissen||to tear|рвать|Das Seil reißt.|The rope tears.|Верёвка рвётся.
1597|1520|adv|dahin||there|туда|Das Auto fährt dahin.|The car drives there.|Машина едет туда.
1598|1521|conj|solange||as long as|пока|Solange du lernst, wirst du bestehen.|As long as you study, you will pass.|Пока ты учишься, ты будешь сдавать.
1599|1522|der|der Wissenschaftler, -||scholar, scientist|учёный|Der Wissenschaftler forscht viel.|The scientist researches a lot.|Учёный много исследует.
1600|1523|die|die Kommunikation, -en||communication|коммуникация|Die Kommunikation ist wichtig.|Communication is important.|Коммуникация важна.
1601|1524|das|das Steuer, -||steering wheel, helm|руль|Er greift das Steuer.|He grabs the steering wheel.|Он берётся за руль.
1602|1524|die|die Steuer, -n||tax|налог|Die Steuer ist hoch.|The tax is high.|Налог высокий.
1603|1525|adj|angeblich||alleged|предполагаемый|Der angebliche Grund ist falsch.|The alleged reason is false.|Предполагаемая причина ложная.
1604|1526|adj|günstig||cheap, favorable, good|дешёвый|Das Angebot ist günstig.|The offer is favorable.|Предложение выгодное.
1605|1527|der|der Dezember, -||December|декабрь|Dezember ist ein kalter Monat.|December is a cold month.|Декабрь холодный месяц.
1606|1528|der|der Flughafen, -̈||airport|аэропорт|Der Flughafen ist groß.|The airport is large.|Аэропорт большой.
1607|1529|das|das Krankenhaus, -̈er||hospital|больница|Das Krankenhaus ist voll.|The hospital is full.|Больница полная.
1608|1530|verb|wenden, wendet, wandte, hat gewandt||to turn around|поворачивать|Er wendet das Auto.|He turns the car around.|Он поворачивает машину.
1609|1531|adj|türkisch||Turkish|турецкий|Der türkische Basar ist sehr lebhaft.|The Turkish bazaar is very lively.|Турецкий базар очень оживленный.
1610|1531|das|das Türkisch||Turkish|турецкий язык|Türkisch ist ihre Muttersprache.|Turkish is her native language.|Турецкий — её родной язык.
1611|1532|der|der Gegner, -||opponent, competitor, enemy|оппонент|Der Gegner ist stark.|The opponent is strong.|Оппонент сильный.
1612|1533|der|der Leser, -||reader|читатель|Der Leser mag das Buch.|The reader likes the book.|Читателю нравится книга.
1613|1534|die|VWL (Volkswirtschaftslehre)||economics|экономика|VWL ist ein interessantes Fach.|Economics is an interesting subject.|Экономика интересный предмет.
1614|1535|der|der Handel, -̈||trade|торговля|Der Handel floriert.|The trade is flourishing.|Торговля процветает.
1615|1536|die|die Kenntnis, -se||knowledge|знание|Er hat gute Kenntnisse.|He has good knowledge.|У него хорошие знания.
1616|1537|adj|sichtbar||visible|видимый|Das Licht ist sichtbar.|The light is visible.|Свет видимый.
1617|1538|verb|zulassen, lässt zu, ließ zu, hat zugelassen||to allow, admit|допускать|Er lässt ihn zu.|He admits him.|Он допускает его.
1618|1539|die|die Mark, -||Deutschmark|марка|Die Mark ist stabil.|The Deutschmark is stable.|Марка стабильная.
1619|1540|verb|vorsehen, sieht vor, sah vor, hat vorgesehen||to look around, plan, provide for|предусматривать|Der Plan sieht eine Erhöhung vor.|The plan provides for an increase.|План предусматривает повышение.
1620|1541|die|die Schwierigkeit, -en||difficulty|трудность|Die Aufgabe hat viele Schwierigkeiten.|The task has many difficulties.|Задача имеет много трудностей.
1621|1542|verb|wahrnehmen, nimmt wahr, nahm wahr, hat wahrgenommen||to perceive, detect|воспринимать|Er nimmt die Umgebung wahr.|He perceives the surroundings.|Он воспринимает окружение.
1622|1543|verb|hinweisen, weist hin, wies hin, hat hingewiesen||to point to, refer to|указывать|Er weist darauf hin.|He points to it.|Он указывает на это.
1623|1544|der|der Juli, -s||July|июль|Juli ist ein heißer Monat.|July is a hot month.|Июль жаркий месяц.
1624|1545|das|das Signal, -e||signal|сигнал|Das Signal ist rot.|The signal is red.|Сигнал красный.
1625|1546|verb|kontrollieren, kontrolliert, kontrollierte, hat kontrolliert||to check, control|контролировать|Die Polizei kontrolliert den Verkehr.|The police control the traffic.|Полиция контролирует движение.
1626|1547|adv|sowieso||anyway|всё равно|Er kommt sowieso.|He is coming anyway.|Он всё равно придёт.
1627|1548|der|der Bauer, -n||farmer|фермер|Der Bauer pflügt das Feld.|The farmer plows the field.|Фермер пашет поле.
1628|1549|der|der Kurs, -e||course, exchange rate|курс|Der Kurs ist schwer.|The course is difficult.|Курс трудный.
