|#frequency_rank|part_of_speech|word_de|word_pl_de|word_en|word_ru|sentence_de|sentence_en|sentence_ru
3727|3627|adj|vorläufig||temporary|временный|Die Lösung ist vorläufig.|The solution is temporary.|Решение временное.
3728|3628|verb|weichen, weicht, wich, ist gewichen||to soak, give way, yield|отступать|Das Brot weicht in der Suppe.|The bread soaks in the soup.|Хлеб размокает в супе.
3729|3629|adj|akut||acute, urgent|острый|Der Schmerz ist akut.|The pain is acute.|Боль острая.
3730|3630|das|das Album, -en||album|альбом|Das Album ist neu.|The album is new.|Альбом новый.
3731|3631|adj|chronisch||chronic|хронический|Die Krankheit ist chronisch.|The disease is chronic.|Болезнь хроническая.
3732|3632|die|die Justiz||judiciary|юстиция|Die Justiz arbeitet hart.|The judiciary works hard.|Юстиция работает усердно.
3733|3633|verb|zusammenkommen, kommt zusammen, kam zusammen, ist zusammengekommen||to meet, come together|собираться|Die Freunde kommen zusammen.|The friends come together.|Друзья собираются вместе.
3734|3634|das|das Abenteuer, -||adventure|приключение|Das Abenteuer beginnt.|The adventure begins.|Приключение начинается.
3735|3635|verb|erforschen, erforscht, erforschte, hat erforscht||to explore, investigate|исследовать|Er erforscht den Wald.|He explores the forest.|Он исследует лес.
3736|3636|der|der Flügel, -||wing|крыло|Der Vogel hat einen Flügel gebrochen.|The bird broke a wing.|Птица сломала крыло.
3737|3637|der|der Teppich, -e||carpet|ковёр|Der Teppich ist teuer.|The carpet is expensive.|Ковер дорогой.
3738|3638|adj|touristisch||touristic|туристический|Die Stadt ist touristisch attraktiv.|The city is touristically attractive.|Город туристически привлекателен.
3739|3639|verb|werten, wertet, wertete, hat gewertet||to rate, judge|оценивать|Das Buch wurde gut bewertet.|The book was well rated.|Книга была хорошо оценена.
3740|3640|adj|geographisch||geographic|географический|Die Lage ist geographisch vorteilhaft.|The location is geographically advantageous.|Расположение географически выгодно.
3741|3641|der|der Hang, -̈e||slope, inclination|склон|Der Hang ist steil.|The slope is steep.|Склон крутой.
3742|3642|das|Ägypten||Egypt|Египет|Ägypten hat eine reiche Geschichte.|Egypt has a rich history.|Египет имеет богатую историю.
3743|3643|der|der Applaus, -e||applause|аплодисменты|Der Applaus war laut.|The applause was loud.|Аплодисменты были громкими.
3744|3644|die|die Ausprägung, -en||shaping, markedness|выраженность|Die Ausprägung ist deutlich.|The shaping is clear.|Выраженность ясна.
3745|3645|der|der Block, -̈e||block|блок|Der Block ist groß.|The block is large.|Блок большой.
3746|3646|verb|rauschen, rauscht, rauschte, hat gerauscht||to rustle, roar, rush|шуметь|Der Wind rauscht durch die Bäume.|The wind rustles through the trees.|Ветер шумит сквозь деревья.
3747|3647|verb|tauschen, tauscht, tauschte, hat getauscht||to exchange, change, swap, switch|меняться|Sie tauschten die Plätze.|They switched places.|Они поменялись местами.
3748|3648|verb|zusammenleben, lebt zusammen, lebte zusammen, hat zusammengelebt||to live together|жить вместе|Die Familie lebt zusammen.|The family lives together.|Семья живет вместе.
3749|3649|das|das Budget, -s||budget|бюджет|Das Budget ist knapp.|The budget is tight.|Бюджет ограничен.
3750|3650|das|das Gemüse, -||vegetables|овощи|Gemüse ist gesund.|Vegetables are healthy.|Овощи полезны.
3751|3651|adj|gültig||valid|действительный|Der Pass ist gültig.|The passport is valid.|Паспорт действителен.
3752|3652|pron|jegliche (r, s)||any|любой|Er hat jegliche Hoffnung verloren.|He has lost any hope.|Он потерял любую надежду.
3753|3653|verb|mitbekommen, bekommt mit, bekam mit, hat mitbekommen||to notice, catch, get|замечать|Er hat das Gespräch mitbekommen.|He caught the conversation.|Он заметил разговор.
3754|3654|der|der Skandal, -e||scandal|скандал|Der Skandal war groß.|The scandal was big.|Скандал был большим.
3755|3655|verb|weggehen, geht weg, ging weg, ist weggegangen||to leave, go away|уходить|Er ist weggegangen.|He has gone away.|Он ушел.
3756|3656|die|die Abgabe, -n||delivery, handing in|передача|Die Abgabe war pünktlich.|The delivery was on time.|Передача была вовремя.
3757|3657|verb|blühen, blüht, blühte, hat geblüht||to bloom|цвести|Die Blumen blühen.|The flowers bloom.|Цветы цветут.
3758|3658|adj|israelisch||Israeli|израильский|Das Produkt ist israelisch.|The product is Israeli.|Продукт израильский.
3759|3659|der|der Nachweis, -e||proof, evidence, certificate|доказательство|Der Nachweis ist erbracht.|The proof is provided.|Доказательство предоставлено.
3760|3660|die|die Steuerung, -en||control, steering|управление|Die Steuerung ist automatisch.|The control is automatic.|Управление автоматическое.
3761|3661|verb|zurückgeben, gibt zurück, gab zurück, hat zurückgegeben||to give back, return|возвращать|Er gibt das Buch zurück.|He returns the book.|Он возвращает книгу.
3762|3662|der|der Aufenthalt, -e||stay, residence|пребывание|Der Aufenthalt war angenehm.|The stay was pleasant.|Пребывание было приятным.
3763|3663|verb|auflegen, legt auf, legte auf, hat aufgelegt||to publish, put on, hang up|издавать|Die Zeitung wurde neu aufgelegt.|The newspaper was republished.|Газета была переиздана.
3764|3664|verb|kippen, kippt, kippte, hat gekippt||to tilt, overbalance|опрокидываться|Der Stuhl kippte.|The chair tilted.|Стул опрокинулся.
3765|3665|adj|vergeblich||futile|тщетный|Der Versuch war vergeblich.|The attempt was futile.|Попытка была тщетной.
3766|3666|verb|wischen, wischt, wischte, hat gewischt||to wipe, mop|вытирать|Er wischt den Boden.|He mops the floor.|Он вытирает пол.
3767|3667|die|die Beurteilung, -en||judgment|оценка|Die Beurteilung war fair.|The judgment was fair.|Оценка была справедливой.
3768|3668|verb|erbringen, erbringt, erbrachte, hat erbracht||to raise, produce, show|производить|Die Arbeit hat viel erbracht.|The work produced a lot.|Работа принесла много.
3769|3669|adv|folglich||consequently|следовательно|Folglich änderte er die Richtung.|Consequently, he changed direction.|Следовательно, он изменил направление.
3770|3670|der|der Hörer, -||listener, receiver|приемник|Der Hörer ist defekt.|The receiver is broken.|Приемник неисправен.
3771|3671|der|der Prinz, -en||prince|принц|Der Prinz ist jung.|The prince is young.|Принц молод.
3772|3672|der|der Radius, -en||radius|радиус|Der Radius ist groß.|The radius is large.|Радиус большой.
3773|3673|das|das Schaf, -e||sheep|овца|Das Schaf ist weiß.|The sheep is white.|Овца белая.
3774|3674|adj|schuldig||guilty|виновный|Er ist schuldig.|He is guilty.|Он виновен.
3775|3675|das|das Tagebuch, -̈er||diary|дневник|Das Tagebuch ist geheim.|The diary is secret.|Дневник секретный.
3776|3676|verb|zielen, zielt, zielte, hat gezielt||to aim|целиться|Er zielt genau.|He aims precisely.|Он целится точно.
3777|3677|adj|elementar||elementary, basic|элементарный|Das Wissen ist elementar.|The knowledge is elementary.|Знание элементарное.
3778|3678|adv|nebenbei||on the side, in addition|в дополнение|Er arbeitet nebenbei.|He works on the side.|Он работает дополнительно.
3779|3679|der|der Ökonom, -en||economist|экономист|Der Ökonom analysiert die Daten.|The economist analyzes the data.|Экономист анализирует данные.
3780|3680|das|das Versprechen, -||promise|обещание|Das Versprechen wurde gehalten.|The promise was kept.|Обещание было сдержано.
3781|3681|das|das Werkzeug, -e||tool|инструмент|Das Werkzeug ist nützlich.|The tool is useful.|Инструмент полезен.
3782|3682|das|das Adjektiv, -e||adjective|прилагательное|Das Adjektiv ist klar.|The adjective is clear.|Прилагательное ясно.
3783|3683|verb|bremsen, bremst, bremste, hat gebremst||to brake, slow down|тормозить|Das Auto bremst.|The car brakes.|Машина тормозит.
3784|3684|verb|einbauen, baut ein, baute ein, hat eingebaut||to install, build in, fit|устанавливать|Er baut das Regal ein.|He installs the shelf.|Он устанавливает полку.
3785|3685|adj|final (er, e, es)||final|финальный|Das ist die finale Entscheidung.|That is the final decision.|Это финальное решение.
3786|3686|das|das Getränk, -e||drink, beverage|напиток|Das Getränk ist kalt.|The drink is cold.|Напиток холодный.
3787|3687|adv|hierzulande||in these parts, in this country, round here|в этих краях|Hierzulande ist das üblich.|In these parts, that is common.|В этих краях это обычно.
3788|3688|adj|physiologisch||physiological|физиологический|Die Reaktion ist physiologisch.|The reaction is physiological.|Реакция физиологическая.
3789|3689|die|die Unternehmung, -en||company, venture, enterprise|предприятие|Die Unternehmung wächst.|The enterprise grows.|Предприятие растет.
3790|3690|verb|vorlesen, liest vor, las vor, hat vorgelesen||to read sth to sb|читать вслух|Er liest das Buch vor.|He reads the book aloud.|Он читает книгу вслух.
3791|3691|verb|berechtigen, berechtigt, berechtigte, hat berechtigt||to entitle|давать право|Das Ticket berechtigt zum Eintritt.|The ticket entitles entry.|Билет дает право на вход.
3792|3692|der|der Bruch, -̈e||fracture, break|перелом|Der Bruch ist kompliziert.|The fracture is complicated.|Перелом сложный.
3793|3693|adj|endlos||endless, infinite|бесконечный|Die Straße ist endlos.|The street is endless.|Дорога бесконечна.
3794|3694|die|die Erweiterung, -en||expansion, extension|расширение|Die Erweiterung ist fertig.|The expansion is complete.|Расширение завершено.
3795|3695|die|die Lüge, -n||lie|ложь|Das war eine Lüge.|That was a lie.|Это была ложь.
3796|3696|der|der Reichtum, -̈er||wealth|богатство|Der Reichtum ist groß.|The wealth is immense.|Богатство велико.
3797|3697|das|das Schema, -s||scheme|схема|Das Schema ist komplex.|The scheme is complex.|Схема сложная.
3798|3698|verb|spiegeln, spiegelt, spiegelte, hat gespiegelt||to shine, reflect|отражать|Der Spiegel spiegelt das Licht.|The mirror reflects the light.|Зеркало отражает свет.
3799|3699|adj|städtisch||municipal, urban|городской|Die städtische Umgebung ist laut.|The urban environment is noisy.|Городская среда шумная.
3800|3700|verb|wandeln, wandelt, wandelte, ist gewandelt||to change, convert|изменять|Er wandelte seine Meinung.|He changed his opinion.|Он изменил свое мнение.
3801|3701|adj|harmlos||harmless|безобидный|Der Hund ist harmlos.|The dog is harmless.|Собака безобидна.
3802|3702|adj|reichlich||plenty, generous|обильный|Das Essen ist reichlich.|The food is plentiful.|Еда обильная.
3803|3703|verb|ringen, ringt, rang, hat gerungen||to wrestle, struggle|бороться|Er ringt mit dem Problem.|He wrestles with the problem.|Он борется с проблемой.
3804|3704|adj|spektakulär||spectacular|захватывающий|Das Feuerwerk war spektakulär.|The fireworks were spectacular.|Фейерверк был захватывающим.
3805|3705|verb|stabilisieren, stabilisiert, stabilisierte, hat stabilisiert||to stabilize|стабилизировать|Die Maßnahmen stabilisierten die Lage.|The measures stabilized the situation.|Меры стабилизировали ситуацию.
3806|3706|der|der Strich, -e||stroke, line|линия|Der Strich ist gerade.|The line is straight.|Линия прямая.
3807|3707|der|der Wirt, -e||host, innkeeper|хозяин|Der Wirt ist freundlich.|The innkeeper is friendly.|Хозяин дружелюбен.
3808|3708|die|die Addition, -en||addition, summation|сложение|Die Addition ist einfach.|The addition is simple.|Сложение простое.
3809|3709|verb|besagen, besagt, besagte, hat besagt||to say|говорить|Die Regeln besagen das.|The rules say that.|Правила говорят это.
3810|3710|die|die Geduld||patience|терпение|Geduld ist eine Tugend.|Patience is a virtue.|Терпение - это добродетель.
3811|3711|die|die Innenstadt, -̈e||town center, downtown|центр города|Die Innenstadt ist belebt.|The town center is lively.|Центр города оживлен.
3812|3712|die|die Konstruktion, -en||construction, design|конструкция|Die Konstruktion ist solide.|The construction is solid.|Конструкция прочная.
3813|3713|das|das Lehrbuch, -̈er||textbook|учебник|Das Lehrbuch ist nützlich.|The textbook is useful.|Учебник полезен.
3814|3714|verb|siegen, siegt, siegte, hat gesiegt||to win, triumph|побеждать|Das Team siegt immer.|The team always wins.|Команда всегда побеждает.
3815|3715|die|die Stichprobe, -n||sample|выборка|Die Stichprobe war klein.|The sample was small.|Выборка была маленькой.
3816|3716|verb|trocknen, trocknet, trocknete, hat getrocknet||to dry|сушить|Die Kleidung trocknet schnell.|The clothes dry quickly.|Одежда сохнет быстро.
3817|3717|der|der Vorsprung, -̈e||lead, advance|лидерство|Der Vorsprung ist groß.|The lead is large.|Лидерство велико.
3818|3718|adv|vorwiegend||mainly|в основном|Sie sind vorwiegend Lehrer.|They are mainly teachers.|Они в основном учителя.
3819|3719|verb|bekennen, bekennt, bekannte, hat bekannt||to confess, admit|признавать|Er bekennt seine Schuld.|He confesses his guilt.|Он признает свою вину.
3820|3720|adj|dauernd||constant, lasting|постоянный|Das Problem ist dauernd.|The problem is constant.|Проблема постоянная.
3821|3721|adj|eigenständig||independent|самостоятельный|Sie ist eigenständig.|She is independent.|Она самостоятельная.
3822|3722|adj|elegant||elegant|элегантный|Das Kleid ist elegant.|The dress is elegant.|Платье элегантное.
3823|3723|die|die Haftung, -en||liability|ответственность|Die Haftung ist begrenzt.|The liability is limited.|Ответственность ограничена.
3824|3724|adj|mutmaßlich||presumed, suspected|предполагаемый|Der mutmaßliche Täter wurde gefasst.|The suspected perpetrator was caught.|Предполагаемый преступник был пойман.
3825|3725|adv|vergleichsweise||comparatively|сравнительно|Vergleichsweise ist das günstig.|Comparatively, that is cheap.|Сравнительно, это дешево.
3826|3726|adj|vermehrt||increased|увеличенный|Es gibt vermehrt Anfragen.|There are increased inquiries.|Запросы увеличились.
3827|3727|verb|bedauern, bedauert, bedauerte, hat bedauert||to regret, feel sorry|сожалеть|Ich bedauere meinen Fehler.|I regret my mistake.|Я сожалею о своей ошибке.
3828|3728|verb|begeben (sich), begibt, begab, hat begeben||to proceed|отправляться|Wir begeben uns auf den Weg.|We proceed on the way.|Мы отправляемся в путь.
3829|3729|verb|durchgehen, geht durch, ging durch, ist durchgegangen||to go through, pass, bolt|проходить через|Er geht durch den Tunnel.|He goes through the tunnel.|Он проходит через туннель.
3830|3730|verb|vorschreiben, schreibt vor, schrieb vor, hat vorgeschrieben||to dictate|предписывать|Das Gesetz schreibt es vor.|The law dictates it.|Закон это предписывает.
3831|3731|verb|zutrauen, traut zu, traute zu, hat zugetraut||to dare to do sth|осмеливаться сделать что-то|Er traut es sich zu.|He dares to do it.|Он осмеливается сделать это.
3832|3732|adv|abseits||offside, off the beaten track|в стороне|Das Haus liegt abseits.|The house is off the beaten track.|Дом находится в стороне.
3833|3733|adj|asymmetrisch||asymmetric|асимметричный|Die Form ist asymmetrisch.|The shape is asymmetric.|Форма асимметричная.
3834|3734|adj|bescheiden||modest|скромный|Er ist bescheiden.|He is modest.|Он скромен.
3835|3735|verb|entfallen, entfällt, entfiel, ist entfallen||to slip (sb’s mind), be dropped|отменяться|Der Termin entfällt heute.|The appointment is canceled today.|Встреча сегодня отменяется.
3836|3736|die|die FIFA||FIFA|ФИФА|Die FIFA hat neue Regeln.|FIFA has new rules.|ФИФА имеет новые правила.
3837|3737|die|die Hemmung, -en||inhibition|торможение|Sie hat keine Hemmungen.|She has no inhibitions.|У нее нет торможений.
3838|3738|das|das Schlafzimmer, -||bedroom|спальня|Das Schlafzimmer ist groß.|The bedroom is large.|Спальня большая.
3839|3739|die|die Tragödie, -n||tragedy|трагедия|Die Tragödie war erschütternd.|The tragedy was shocking.|Трагедия была потрясающей.
3840|3740|die|die Wunde, -n||wound|рана|Die Wunde heilt langsam.|The wound heals slowly.|Рана заживает медленно.
3841|3741|num|achtzehn||eighteen|восемнадцать|Sie ist achtzehn Jahre alt.|She is eighteen years old.|Ей восемнадцать лет.
3842|3742|das|das Chaos||chaos|хаос|Das Chaos ist komplett.|The chaos is complete.|Хаос полный.
3843|3743|die|die Krone, -n||crown|корона|Die Krone ist aus Gold.|The crown is made of gold.|Корона из золота.
3844|3744|verb|reiben, reibt, rieb, hat gerieben||to rub|тереть|Er reibt sich die Augen.|He rubs his eyes.|Он трет себе глаза.
3845|3745|der|der Reporter, -||reporter|репортер|Der Reporter berichtet live.|The reporter reports live.|Репортер сообщает в прямом эфире.
3846|3746|der|der Schluck, -e||sip|глоток|Er trank einen Schluck Wasser.|He took a sip of water.|Он выпил глоток воды.
3847|3747|der|der Schock, -e||shock|шок|Der Schock war groß.|The shock was great.|Шок был велик.
3848|3748|verb|aufschreiben, schreibt auf, schrieb auf, hat aufgeschrieben||to write down|записывать|Er schrieb die Adresse auf.|He wrote down the address.|Он записал адрес.
3849|3749|verb|reizen, reizt, reizte, hat gereizt||to annoy, provoke, tempt|раздражать|Der Lärm reizt mich.|The noise annoys me.|Шум меня раздражает.
3850|3750|das|das Attribut, -e||adjunct, attribute|атрибут|Das Attribut ist wichtig.|The attribute is important.|Атрибут важен.
3851|3751|verb|aufreißen, reißt auf, riss auf, hat aufgerissen||to tear open|разрывать|Er reißt den Brief auf.|He tears open the letter.|Он разрывает письмо.
3852|3752|die|die Diagnose, -n||diagnosis|диагноз|Die Diagnose war richtig.|The diagnosis was correct.|Диагноз был правильным.
3853|3753|verb|hinzukommen, kommt hinzu, kam hinzu, ist hinzugekommen||to be added, join|добавляться|Ein neues Problem kam hinzu.|A new problem was added.|Добавилась новая проблема.
3854|3754|adj|prinzipiell||in principle|в принципе|Das Prinzip ist einfach.|The principle is simple.|Принцип прост.
3855|3755|verb|reflektieren, reflektiert, reflektierte, hat reflektiert||to reflect|отражать|Der Spiegel reflektiert das Licht.|The mirror reflects the light.|Зеркало отражает свет.
3856|3756|die (pl)|die Unterlage, -n||documents|документы|Die Unterlagen liegen auf dem Schreibtisch.|The documents are on the desk.|Документы лежат на столе.
3857|3756|die|die Unterlage, -n||base, pad, document|подкладка|Er nutzt eine Unterlage für seine Maus.|He uses a pad for his mouse.|Он использует подкладку для своей мыши.
3858|3757|verb|vernachlässigen, vernachlässigt, vernachlässigte, hat vernachlässigt||to neglect|пренебрегать|Er vernachlässigt seine Arbeit.|He neglects his work.|Он пренебрегает своей работой.
3859|3758|verb|versinken, versinkt, versank, ist versunken||to sink|тонуть|Das Schiff versinkt.|The ship sinks.|Корабль тонет.
3860|3759|verb|erhitzen, erhitzt, erhitzte, hat erhitzt||to heat (up)|нагревать|Das Wasser erhitzt schnell.|The water heats up quickly.|Вода нагревается быстро.
3861|3760|der|der Ersatz, -̈e||replacement, compensation|замена|Der Ersatz kam rechtzeitig.|The replacement arrived on time.|Замена прибыла вовремя.
3862|3761|die|die EU-Kommission||European Commission|Еврокомиссия|Die EU-Kommission tagt heute.|The European Commission meets today.|Еврокомиссия заседает сегодня.
3863|3762|adj|hessisch||Hessian|гессенский|Die hessische Landschaft ist wunderschön.|The Hessian landscape is beautiful.|Гессенский пейзаж прекрасен.
3864|3762|das|das Hessisch||Hessian|гессенский язык|Er versteht Hessisch, aber spricht es nicht.|He understands Hessian, but doesn’t speak it.|Он понимает гессенский диалект, но не говорит на нем.
3865|3763|adj|passiv||passive|пассивный|Die Gruppe ist passiv.|The group is passive.|Группа пассивна.
3866|3764|der|der Rauch, -e||smoke, fume|дым|Der Rauch stieg auf.|The smoke rose.|Дым поднялся.
3867|3765|verb|stinken, stinkt, stank, hat gestunken||to stink|вонять|Der Müll stinkt.|The garbage stinks.|Мусор воняет.
3868|3766|interj|tschüss||bye|пока|Tschüss, bis morgen!|Bye, see you tomorrow!|Пока, до завтра!
3869|3767|der|der Vorgänger, -||predecessor|предшественник|Der Vorgänger war erfahren.|The predecessor was experienced.|Предшественник был опытен.
3870|3768|verb|anstarren, starrt an, starrte an, hat angestarrt||to gaze, stare at|пялиться|Er starrt das Bild an.|He stares at the picture.|Он пялится на картину.
3871|3769|adj|detailliert||detailed|подробный|Der Bericht ist detailliert.|The report is detailed.|Отчет подробный.
3872|3770|die|die Fremdsprache, -n||foreign language|иностранный язык|Die Fremdsprache ist schwierig.|The foreign language is difficult.|Иностранный язык сложный.
3873|3771|das|das Gepäck, -e||luggage|багаж|Das Gepäck ist schwer.|The luggage is heavy.|Багаж тяжелый.
3874|3772|adj|unglücklich||unhappy, unfortunate|несчастливый|Er ist unglücklich.|He is unhappy.|Он несчастлив.
3875|3773|verb|wehen, weht, wehte, hat geweht||to blow, flutter|дуть|Der Wind weht stark.|The wind blows strongly.|Ветер дует сильно.
3876|3774|verb|ausprobieren, probiert aus, probierte aus, hat ausprobiert||to try out|пробовать|Wir probieren das Rezept aus.|We try out the recipe.|Мы пробуем рецепт.
3877|3775|verb|bewerben (sich), bewirbt, bewarb, hat beworben||to apply|подавать заявку|Er bewirbt sich um die Stelle.|He applies for the job.|Он подает заявку на работу.
3878|3776|verb|erhoffen, erhofft, erhoffte, hat erhofft||to expect, hope for|надеяться|Wir erhoffen uns Erfolg.|We hope for success.|Мы надеемся на успех.
3879|3777|die|die Feder, -n||feather|перо|Die Feder ist leicht.|The feather is light.|Перо легкое.
3880|3778|die|die Feuerwehr, -en||fire brigade|пожарная служба|Die Feuerwehr ist schnell.|The fire brigade is fast.|Пожарная служба быстрая.
3881|3779|verb|fixieren, fixiert, fixierte, hat fixiert||to fixate on sb/sth|фиксировать|Er fixiert das Bild.|He fixes the picture.|Он фиксирует картину.
3882|3780|das|das Gemälde, -||painting|картина|Das Gemälde ist schön.|The painting is beautiful.|Картина красивая.
3883|3781|das|das Heim, -e||home, institution|дом|Das Heim ist gemütlich.|The home is cozy.|Дом уютный.
