speech_part|word_de|word_combination_de|word_en|word_combination_en|sentence_de|sentence_en|frequency_rank
verb|fixieren, fixiert, fixierte, hat fixiert|den Blick fixieren|to fixate on sb/sth|fix the gaze|Sie ist sehr auf ihren Sohn fixiert.|She’s very fixated on her son.|3779
das|das Gemälde, -|ein Gemälde betrachten|painting|view a painting|Im Museum hängen viele berühmte Gemälde.|There are many famous paintings in the museum.|3780
das|das Heim, -e|ein gemütliches Heim|home, institution|a cozy home|Kinder, die keine Eltern mehr haben, leben oft in einem Heim.|Children who no longer have parents often live in an institution.|3781
verb|heranziehen, zieht heran, zog heran, hat herangezogen|einen Experten heranziehen|to consult, draw near|consult an expert|Für meine schriftliche Arbeit muss ich auch Meinungen von anderen Autoren heranziehen.|For my written work I also have to consult the opinions of other authors.|3782
das|das Image, -s|ein positives Image|image|a positive image|Das gute Image der Firma ist meinem Chef sehr wichtig.|The good image of the company is very important to my boss.|3783
der|der Koch, -̈e|der Koch bereitet vor|cook|the cook prepares|Mein Vater arbeitet als Koch in einem Restaurant.|My father works as a cook in a restaurant.|3784
der|der Stadtteil, -e|ein Stadtteil erkunden|district|explore a district|Ich wohne in einem sehr schönen Stadtteil von Leipzig.|I live in a very beautiful district of Leipzig.|3785
der|der Träger, -|der Träger der Tasche|strap, holder, responsible body|the strap of the bag|Als ich den Arm hebe, reißt der Träger von meinem T-Shirt.|As I lift my arm, the strap rips off my T-shirt.|3786
verb|verschärfen, verschärft, verschärfte, hat verschärft|die Maßnahmen verschärfen|to tighten, intensify|tighten the measures|Viele Regierungen wollen die Gesetze für Asyl wieder verschärfen.|Many governments want to tighten the laws on asylum again.|3787
die|die Zunahme, -n|eine Zunahme beobachten|increase|observe an increase|Wir müssen mit einer Zunahme der Anzahl von Studierenden im nächsten Jahr rechnen.|We have to expect an increase in the number of students next year.|3788
verb|annähern, nähert an, näherte an, hat angenähert|einen Schritt annähern|to approach|approach a step|Nach einer langen Zeit ohne Kontakt nähern mein Vater und ich uns jetzt einander wieder an.|After a long time without contact, my father and I are approaching each other again.|3789
der|der Baron, -e|ein Baron spricht|baron|a baron speaks|Den Titel Baron bekamen früher nur reiche Menschen.|In the past, only rich people got the title of baron.|3790
das|das Eigentum, -e|persönliches Eigentum|property|personal property|Wenn etwas mir gehört, dann ist es mein Eigentum.|If something belongs to me, it’s my property.|3791
adj|gründlich|gründlich reinigen|thorough|clean thoroughly|Du musst deine Sätze in Zukunft gründlicher lesen, du hast zu viele Fehler gemacht.|You have to read your sentences more thoroughly in the future; you have made too many mistakes.|3792
das|Sachsen-Anhalt|in Sachsen-Anhalt|Saxony-Anhalt|in Saxony-Anhalt|Sachsen-Anhalt ist ein Bundesland in der Mitte von Deutschland.|Saxony-Anhalt is a federal state in the middle of Germany.|3793
verb|umsehen, sieht um, sah um, hat umgesehen|sich umsehen|to look (around)|look around|Obwohl ich weiß, dass du nicht da bist, sehe ich mich auf der Straße immer nach dir um.|Although I know you’re not here, I keep looking for you on the street.|3794
prep|via|via Internet|via|via the internet|Bitte schick mir die Dokumente via E-Mail.|Please send me the documents via e-mail.|3795
verb|abziehen, zieht ab, zog ab, hat abgezogen|Steuern abziehen|to take off, withdraw, subtract|deduct taxes|Wenn man vier von zwölf abzieht, bekommt man acht.|If you subtract four from twelve, you get eight.|3796
der|der Befund, -e|ein medizinischer Befund|result, finding(s)|a medical finding|Mein Arzt sagt, dass mein Befund für die Krankheit negativ ist.|My doctor says that my findings are negative for the disease.|3797
die|die Niederlande|Reise in die Niederlande|the Netherlands|trip to the Netherlands|Wir fahren mit einem Schiff durch die Niederlande.|We travel by ship through the Netherlands.|3798
verb|schwanken, schwankt, schwankte, ist geschwankt|die Temperaturen schwanken|to vary|temperatures vary|Ich schwanke in meiner Entscheidung, wohin ich dieses Jahr in den Urlaub fahren soll.|I vary in my decision about where I should go on vacation this year.|3799
der|der Stoß, -̈e|ein Stoß geben|push, shock|give a push|Sie gibt mir einen Stoß und ich falle hin.|She gives me a push and I fall.|3800
der|der Unsinn|Unsinn reden|nonsense|talk nonsense|Was dir deine Lehrer erzählen, ist Unsinn, ich weiß es besser.|What your teachers tell you is nonsense, I know better.|3801
die|die Wahlperiode, -n|eine Wahlperiode dauert|term|a term lasts|Die Wahlperiode eines Bundeskanzlers dauert in Deutschland vier Jahre.|The term of office of a federal chancellor in Germany lasts four years.|3802
verb|blockieren, blockiert, blockierte, hat blockiert|einen Weg blockieren|to block|block a path|Ich komme zu spät, weil Autos die Straße blockieren.|I’m late because cars are blocking the road.|3803
das|das Defizit, -e|ein finanzielles Defizit|deficit|a financial deficit|Der neue Finanzdirektor kann das Defizit deutlich reduzieren.|The new financial director can significantly reduce the deficit.|3804
die|die Dynamik, -en|die Dynamik der Gruppe|dynamics|the group's dynamics|Die Dynamik einer Gruppe bedingt sich an deren Mitgliedern.|The dynamics of a group are determined by its members.|3805
adv|nirgendwo|nirgendwo zu finden|nowhere|nowhere to be found|Ich kann meinen Schlüssel nirgendwo finden.|I can’t find my key anywhere.|3806
verb|umarmen, umarmt, umarmte, hat umarmt|eine Freundin umarmen|to embrace|hug a friend|Ich umarme meine Freundin, als sie in den Zug steigt.|I embrace my girlfriend as she gets on the train.|3807
die|die Vernunft|logische Vernunft|reason|logical reason|Ein gutes Argument basiert auf Vernunft und Logik.|A good argument is based on reason and logic.|3808
die|die Anregung, -en|eine Anregung geben|stimulus, idea|give a suggestion|Die Bilder geben Anregung zur Diskussion.|The pictures provide a stimulus for discussion.|3809
der|der Code, -s|einen Code knacken|code|crack a code|Ich gebe meinen Code in das Handy ein, um es zu starten.|I enter my code into the phone to activate it.|3810
adj|jetzig|der jetzige Zustand|current|the current state|Bis zu den nächsten Wahlen bleibt der jetzige Präsident im Amt.|The current president remains in office until the next elections.|3811
verb|kommunizieren, kommuniziert, kommunizierte, hat kommuniziert|über das Internet kommunizieren|to communicate|communicate over the internet|Wir können jetzt ständig mit Menschen am anderen Ende der Welt kommunizieren.|We can now communicate instantly with people on the other side of the world.|3812
der|der Krebs, -e|eine Diagnose von Krebs|cancer|a diagnosis of cancer|Jährlich erkranken viele Menschen an Krebs.|Many people contract cancer every year.|3813
der|der Kühlschrank, -̈e|Lebensmittel im Kühlschrank|fridge|food in the fridge|Wenn man Gemüse in den Kühlschrank legt, bleibt es länger frisch.|If you put vegetables in the fridge, they stay fresh longer.|3814
adj|lächerlich|lächerliche Behauptung|ridiculous|ridiculous claim|Du siehst lächerlich mit dem Hut aus.|You look ridiculous in that hat.|3815
die|die Airline, -s|eine Airline buchen|airline|book an airline|Die Airline bietet Flüge von Amsterdam direkt nach Toronto an.|The airline offers direct flights from Amsterdam to Toronto.|3816
der|der Akt, -e|der Akt der Güte|act|an act of kindness|Das Stück besteht aus fünf Akten.|The play consists of five acts.|3817
adj|außerordentlich|außerordentliche Leistung|extraordinary|extraordinary performance|Christine lernt außerordentlich viel für das Examen.|Christine is learning an extraordinary amount for the exam.|3818
der|der Empfang, -̈e|ein herzlicher Empfang|reception|a warm reception|Wir haben hier auf dem Land einen schlechten Empfang.|We have bad reception here in the country.|3819
adj|minimal|minimaler Aufwand|minimal|minimal effort|Der Athlet auf Platz eins hat nur einen minimalen Vorsprung vor dem Athleten auf Platz zwei.|The athlete in first place has only a minimal lead over the athlete in second place.|3820
der|der Nacken, -|einen steifen Nacken|neck|a stiff neck|Der Nacken ist der Übergang vom Rücken zum Kopf.|The neck is the transition from the back to the head.|3821
der|der Republikaner, -|ein Republikaner spricht|Republican|a Republican speaks|Die Republikaner sind Anhänger der Republikanischen Partei der USA.|The Republicans are supporters of the Republican Party of the USA.|3822
der|der Rhythmus, -en|im Rhythmus tanzen|rhythm|dance in rhythm|Der Rhythmus dieses Liedes ist einfach zu schnell zum Tanzen.|The rhythm of this song is just too fast for dancing.|3823
adj|unerwartet|unerwartete Nachricht|unexpected|unexpected news|Mareike erzählt, dass sie und Felix bald unerwartet Eltern werden.|Mareike says that she and Felix are unexpectedly becoming parents soon.|3824
die|die Unterschrift, -en|eine Unterschrift leisten|signature|provide a signature|Sie müssen den Vertrag nur noch mit Ihrer Unterschrift bestätigen.|You only have to confirm the contract with your signature.|3825
verb|anfallen, fällt an, fiel an, hat angefallen|ein Hund greift an|to attack, accumulate|a dog attacks|Zusätzlich zu den Steuern fallen auch Kosten für die Versicherung für das Auto an.|In addition to the taxes, costs for car insurance also accumulate.|3826
der|der Ausfall, -̈e|ein technischer Ausfall|failure, breakdown|a technical failure|Durch den Ausfall der Maschinen verliert die Firma viel Zeit und Geld.|Due to the failure of the machines, the company loses a lot of time and money.|3827
verb|beantragen, beantragt, beantragte, hat beantragt|einen Pass beantragen|to apply for|apply for a passport|Familie Winter beantragt einen Kredit bei der Bank.|The Winter family applies for a loan from the bank.|3828
adv|daheim|daheim bleiben|at home|stay at home|Daheim warten schon ihre Kinder und ihr Ehemann.|Her children and her husband are already waiting at home.|3829
der|der Offizier, -e|der Offizier befiehlt|officer|the officer commands|Der Offizier gibt den Soldaten Anweisungen.|The officer gives instructions to the soldiers.|3830
der|der Protagonist, -en|die Hauptfigur im Film|protagonist|the protagonist in the movie|Der Autor nutzt Freunde und Familie als Vorbilder für seine außergewöhnlichen Protagonisten.|The author uses friends and family as role models for his extraordinary protagonists.|3831
verb|quälen, quält, quälte, hat gequält|eine Seele quälen|to torment|torment a soul|Martina kann nicht verstehen, warum manche Menschen Tiere quälen.|Martina can’t understand why some people torment animals.|3832
die|die Strömung, -en|die Strömung des Flusses|current, trend|the current of the river|Hier darf man nicht schwimmen, der Fluss hat eine starke Strömung.|You can’t swim here; the river has a strong current.|3833
verb|überfordern, überfordert, überforderte, hat überfordert|eine Person überfordern|to overtax, be too much|overtax a person|Die vielen neuen Aufgaben überfordern mich im Moment.|The many new tasks are too much for me at the moment.|3834
verb|dokumentieren, dokumentiert, dokumentierte, hat dokumentiert|alles dokumentieren|to document|document everything|Raffael dokumentiert sein Experiment für seine Arbeit.|Raffael documents his experiment for his work.|3835
die|die Gliederung, -en|eine logische Gliederung|structure, organization|a logical structure|Die Gliederung des Textes besteht aus fünf Punkten.|The structure of the text consists of five points.|3836
die|die Kartoffel, -n|Kartoffeln schälen|potato|peel potatoes|Aus Kartoffeln kann man viele verschiedene Gerichte machen.|Potatoes can be made into many different dishes.|3837
verb|schleichen, schleicht, schlich, ist geschlichen|leise schleichen|to creep, prowl, sneak|sneak quietly|Wenn seine Eltern schlafen, schleicht sich Daniel leise aus dem Haus.|When his parents are sleeping, Daniel sneaks quietly out of the house.|3838
verb|zulegen, legt zu, legte zu, hat zugelegt|Gewicht zulegen|to gain, put on, get|gain weight|Wir legen uns Kühe zu, damit wir immer frische Milch zu haben.|We are getting cows so we always have fresh milk.|3839
der|der Aktionär, -e|ein Aktionär spricht|shareholder|a shareholder speaks|Die Entwicklung der Börse bereitet den Aktionären Sorge.|Shareholders are concerned about the development of the stock market.|3840
verb|auseinandersetzen, setzt auseinander, setzte auseinander, hat auseinandergesetzt|mit Problemen auseinandersetzen|to deal with|deal with problems|In der Therapie muss er sich mit seinen Ängsten auseinandersetzen.|In therapy he has to deal with his fears.|3841
verb|bestrafen, bestraft, bestrafte, hat bestraft|ein Kind bestrafen|to punish|punish a child|Mein Ehemann bestraft mich nach jedem Streit mit Schweigen.|My husband punishes me with silence after every argument.|3842
verb|einlegen, legt ein, legte ein, hat eingelegt|eine CD einlegen|to put in, insert|insert a CD|Sie legt die CD ein und startet die Musik.|She inserts the CD and starts the music.|3843
verb|erlernen, erlernt, erlernte, hat erlernt|eine Sprache erlernen|to learn|learn a language|Kinder erlernen Fremdsprachen schneller als Erwachsene.|Children learn foreign languages faster than adults.|3844
der|der Friedhof, -̈e|einen Friedhof besuchen|cemetery|visit a cemetery|Jeden Sonntag geht sie auf den Friedhof und besucht das Grab ihres Mannes.|Every Sunday she goes to the cemetery and visits her husband’s grave.|3845
adj|materiell|materielle Werte|financial, material|material values|Materieller Reichtum allein macht nicht glücklich.|Material wealth alone does not make you happy.|3846
der|der Produzent, -en|ein Produzent spricht|producer|a producer speaks|Das Unternehmen ist der weltweit größte Produzent von Lebensmitteln.|The company is the world’s largest producer of food.|3847
die|die Transparenz, -en|die Transparenz |transparency, clarity|clarity in communication|Transparenz in der Forschung ist wichtig, um ethische Grenzen zu erarbeiten.|Transparency in research is important in order to develop ethical boundaries.|3848
der|der Asylbewerber, -|der Asylbewerber |asylum seeker|asylum seeker protection|Ein Asylbewerber ist eine Person, die geflohen ist und in einem anderen Land einen Antrag auf Asyl stellt.|An asylum seeker is a person who fled and applies for asylum in another country.|3849
der|der Eigentümer, -|der Eigentümer |owner|pride of the owner|Die Polizei sucht den Eigentümer des Autos.|Police are looking for the owner of the car.|3850
die|die Fabrik, -en|die Fabrik |factory|factory production|In der Fabrik laufen die Maschinen 24 Stunden am Tag.|The machines run 24 hours a day in the factory.|3851
adj|mutig|mutig handeln |courageous|to act courageously|Janosch ist ein mutiges Kind und traut sich deswegen mehr als andere Kinder.|Janosch is a courageous child and therefore dares more than other children.|3852
der|der Stolz|der Stolz der Nation |pride|pride of the nation|Sie empfindet Stolz für ihre Kinder.|She feels pride for her children.|3853
adj|sympathisch|sympathisch wirken |sympathetic|to appear sympathetic|Unser neuer Chef ist ein sympathischer Mensch, mit dem man bestimmt gut zusammen arbeiten kann.|Our new boss is a sympathetic person with whom you can certainly work well together.|3854
die|die Tafel, -n|die Tafel wischen |board, table|to clean the board|Der Lehrer schreibt die neuen Wörter an die Tafel.|The teacher writes the new words on the board.|3855
die|die Transformation, -en|eine Transformation erleben |transformation|to undergo a transformation|Das Internet führt zu einer Transformation vieler Gewohnheiten wie dem Einkaufen.|The internet leads to a transformation of many habits such as shopping.|3856
die|die Uniform, -en|die Uniform tragen |uniform|to wear the uniform|An vielen britischen Schulen tragen die Schüler eine Uniform.|In many British schools, students wear uniforms.|3857
verb|weigern (sich), weigert, weigerte, hat geweigert|sich weigern zu gehen |to refuse|to refuse to go|Das Kind weigert sich, die Hand seiner Mutter zu nehmen. Es will lieber alleine laufen.|The child refuses to take his mother’s hand. He’d rather walk alone.|3858
die|die Akte, -n|die Akte öffnen |file|to open the file|Patienten hat ihre eigenen Akten, in denen die Informationen zu ihrer Krankheit stehen.|Patients have their own files containing information about their illnesses.|3859
verb|charakterisieren, charakterisiert, charakterisierte, hat charakterisiert|einen Charakter beschreiben |to characterize|to characterize a person|Die Schüler sollen den Protagonisten aus dem Buch charakterisieren.|The students should characterize the protagonist from the book.|3860
verb|fotografieren, fotografiert, fotografierte, hat fotografiert|ein Foto machen |to photograph|to take a photograph|Mark fotografiert auf der Hochzeit alle Gäste.|Mark photographs all the guests at the wedding.|3861
das|das Heft, -e|ein Heft schreiben |notebook|to write in a notebook|Herr Köhler hat ein Heft, in das er seine Ideen schreibt.|Mr. Köhler has a notebook in which he writes his ideas.|3862
adj|hilfreich|hilfreiche Tipps |helpful|helpful tips|Vielen Dank für deine hilfreichen Tipps.|Thank you for your helpful tips.|3863
verb|kombinieren, kombiniert, kombinierte, hat kombiniert|Dinge kombinieren |to combine|to combine things|Wenn wir unser Wissen kombinieren, können wir das Problem schneller lösen.|If we combine our knowledge, we can solve the problem faster.|3864
adj|königlich|königliche Familie |royal|royal family|Das Land bereitet sich auf die königliche Hochzeit des Prinzen vor.|The country is preparing for the prince’s royal wedding.|3865
das|das Magnetfeld, -er|das Magnetfeld messen |magnetic field|to measure the magnetic field|Die Erde ist von einem Magnetfeld umgeben.|The earth is surrounded by a magnetic field.|3866
die|die Mode, -n|die neueste Mode |fashion|the latest fashion|Nadja interessiert sich sehr für Mode, deswegen kauft sie gerne ein und liest viele Magazine.|Nadja is very interested in fashion, so she likes to shop and read many magazines.|3867
die|die Schlagzeile, -n|eine Schlagzeile schreiben |headline, caption|to write a headline|Die Zeitungen sind voll mit Schlagzeilen über den Skandal.|The newspapers are full of headlines about the scandal.|3868
adj|schmutzig|ein schmutziges Hemd |dirty|a dirty shirt|Bitte wasche deine schmutzigen Hände.|Please, wash your dirty hands.|3869
verb|überziehen, zieht über, zog über, hat übergezogen|ein Buch überziehen |to cover, put on, overdraw|to cover a book|Wenn es kalt wird, musst du dir eine Jacke überziehen.|You have to put on a jacket when it gets cold.|3870
adv|zumeist|zumeist freundlich |for the most part|mostly friendly|Bei den Tätern handelt es sich zumeist um Männer.|For the most part, the perpetrators are men.|3871
adj|gemütlich|ein gemütliches Zimmer |comfortable, cozy|a cozy room|Dein Bett ist so gemütlich.|Your bed is so comfortable.|3872
der|der Spanier, -|ein Spanier spricht |Spaniard|a Spaniard speaks|Miguel ist Spanier und lebt in Madrid.|Miguel is a Spaniard and lives in Madrid.|3873
das|das Zeitalter, -|im modernen Zeitalter |age, period|in the modern age|Im Zeitalter von Medien kommunizieren die Menschen oft nur per Handy.|In the age of media, people often communicate only by mobile phone.|3874
verb|ausstrecken, streckt aus, streckte aus, hat ausgestreckt|sich ausstrecken |to stretch (out)|to stretch out|Im Flugzeug ist wenig Platz, sodass ich meine Beine nicht ausstrecken kann.|There’s not much room on the airplane so I can’t stretch my legs.|3875
adj|blass|blass werden |pale|to become pale|Sie hat Schmerzen und ist sehr blass.|She’s in pain and very pale.|3876
verb|irritieren, irritiert, irritierte, hat irritiert|jemanden irritieren |to irritate, confuse|to confuse someone|Der Stoff dieser Hose irritiert meine Haut.|The fabric of these pants irritates my skin.|3877
der|der Jurist, -en|ein Jurist spricht |jurist, lawyer|a lawyer speaks|Als Jurist kennt er das Grundgesetz sehr gut.|As a lawyer, he knows the Basic Law very well.|3878
die|die Mission, -en|eine Mission erfüllen |mission|to accomplish a mission|Die Soldaten begeben sich auf eine gefährliche Mission.|The soldiers embark on a dangerous mission.|3879
das|das Mitochondrium, -en|das Mitochondrium enthalten|mitochondrion|to contain mitochondria|Mitochondrien sind wichtige Bestandteile einer Zelle.|Mitochondria are important components of a cell.|3880
das|das Neuron, -en|das Neuron aktivieren|neuron|to activate the neuron|Neuronen liegen im Gehirn und transportieren Informationen.|Neurons are located in the brain and transport information.|3881
die|die Regulation, -en|die Regulation einhalten |regulation|to follow the regulation|Der Ökonom kritisiert die Regulation der Wirtschaft.|The economist criticizes the regulation of the economy.|3882
der|der Rücktritt, -e|vom Rücktritt sprechen |resignation, withdrawal|to speak of resignation|Ein Rücktritt von dem Vertrag ist nur 48 Stunden lang möglich.|Withdrawal from the contract is only possible for 48 hours.|3883
die|die Schätzung, -en|eine Schätzung abgeben |estimate, estimation|to give an estimate|Die Zahlen sind nicht sehr genau und basieren auf Schätzungen.|The figures are not very accurate and are based on estimates.|3884
die|die Entropie, -n|die Entropie berechnen |entropy|to calculate the entropy|Wärme hat Einfluss auf die Entropie eines Systems.|Heat has an influence on the entropy of a system.|3885
das|das Gelenk, -e|ein Gelenk bewegen |joint, hinge|to move a joint|Die Schulter ist ein Gelenk, das den Arm mit dem restlichen Körper verbindet.|The shoulder is a joint that connects the arm to the rest of the body.|3886
der|der Marktanteil, -e|den Marktanteil erhöhen |market share|to increase the market share|Durch die Fusion der Unternehmen verdoppeln sie ihren Marktanteil.|The merger of the companies doubles their market share.|3887
verb|regulieren, reguliert, regulierte, hat reguliert|den Blutdruck regulieren|to regulate|to regulate blood pressure|Schweiß hilft dem Körper, seine Temperatur zu regulieren.|Sweat helps the body regulate its temperature.|3888
der|der Rundfunk|den Rundfunk hören |broadcast|to listen to the broadcast|Zum Rundfunk gehören Radio und Fernsehen.|Broadcasting includes radio and television.|3889
die|die Teilnahme, -n|an einer Teilnahme interessiert |participation|interested in participation|Mit dem Test qualifiziert er sich für die Teilnahme an dem Wettkampf.|With this test he qualifies for participation in the competition.|3890
die|die Thermodynamik|Thermodynamik studieren |thermodynamics|to study thermodynamics|Die Lehre von der Wärme wird auch Thermodynamik genannt.|The theory of heat is also called thermodynamics.|3891
der|LKW (Lastkraftwagen)|ein LKW fahren |truck|to drive a truck|Der LKW transportiert die Milch von den Bauern zu den Läden.|The truck transports the milk from the farmers to the shops.|3892
der|der Quatsch|Quatsch reden |nonsense|to talk nonsense|Was du behauptest, ist absoluter Quatsch!|What you’re claiming is absolute nonsense!|3893
adj|romantisch|romantisch sein |romantic|to be romantic|Stefan kauft Blumen und Kerzen, um für seine Frau einen romantischen Abend vorzubereiten.|Stefan buys flowers and candles to prepare a romantic evening for his wife.|3894
das|das Substrat, -e|das Substrat analysieren |substrate|to analyze the substrate|Pflanzen brauchen ein passendes Substrat, um zu wachsen.|Plants need a suitable substrate to grow.|3895
verb|erlangen, erlangt, erlangte, hat erlangt|ein Ziel erlangen |to obtain, secure|to obtain a goal|Bei den Wahlen erlangt die grüne Partei die Mehrheit.|The Green Party obtains a majority in the elections.|3896
verb|zumachen, macht zu, machte zu, hat zugemacht|die Tür zumachen |to close, shut down|to shut the door|Wenn es regnet, musst du alle Fenster zumachen.|If it rains, you’ll have to close all the windows.|3897
verb|ausstellen, stellt aus, stellte aus, hat ausgestellt|eine Ausstellung besuchen |to display, issue, make out|to visit an exhibition|Der Chef stellt Frau Meinhold ein positives Zeugnis aus.|The boss issues a positive report to Mrs. Meinhold.|3898
das|das Becken, -|ins Becken springen |pool, pelvis|to jump into the pool|Das Becken zum Schwimmen ist drei Meter tief.|The pool for swimming is three meters deep.|3899
verb|kreuzen, kreuzt, kreuzte, hat gekreuzt|die Straßen kreuzen |to cross|to cross the streets|Die beiden Straßen kreuzen sich hinter dem Theater.|The two streets cross behind the theater.|3900
adj|zart|zartes Fleisch |tender|tender meat|Das Baby hat eine zarte Haut.|The baby has tender skin.|3901
der|der Zwang, -̈e|unter Zwang handeln |force, pressure, compulsion|to act under compulsion|Kinder lernen nur, wenn sie wollen, und nicht aus Zwang.|Children only learn if they want to, not by force.|3902
der|der Engländer, -|ein Engländer spricht |Englishman, English|an Englishman speaks|Sie ist mit einem Engländer aus London verheiratet.|She is married to an Englishman from London.|3903
die|die Münze, -n|eine Münze werfen |coin|to toss a coin|Die Münze hat einen Wert von zwei Euro.|The coin has a value of two euros.|3904
die|die Nachrichtenagentur, -en|eine Nachrichtenagentur gründen |news agency|to establish a news agency|Die Nachrichtenagentur sammelt Informationen und gibt diese an die Presse weiter.|The news agency collects information and passes it on to the press.|3905
