1|art|der|определённый артикль|Der Hund ist groß.|Собака большая.
1|pron|der|тот, те|Der Mann ist glücklich.|Тот мужчина счастлив.
1|pron|der|который, что|Der Lehrer, der spricht, ist hier.|Учитель, который говорит, здесь.
2|conj|und|и|Er und ich sind Freunde.|Он и я друзья.
3|prep|in|в|Er ist in der Schule.|Он в школе.
4|aux|sein, ist, war, ist gewesen|(прошедшее время)|Sie war in Berlin.|Она была в Берлине.
4|verb|sein, ist, war, ist gewesen|быть|Er ist mein Bruder.|Он мой брат.
5|art|ein|неопределённый артикль|Ein Apfel ist rot.|Яблоко красное.
5|pron|ein|один (из)|Ein Hund, der ein Freund ist.|Собака, которая друг.
6|aux|haben, hat, hatte, hat gehabt|(прошедшее время)|Sie hatte ein Buch.|У нее была книга.
6|verb|haben, hat, hatte, hat gehabt|иметь|Ich habe einen Hund.|У меня есть собака.
7|pron|sie|она, её|Sie liebt ihre Katze.|Она любит свою кошку.
7|pron|sie|они, их|Sie sind meine Freunde.|Они мои друзья.
7|pron|sie|вы|Sie warten hier.|Вы ждете здесь.
8|aux|werden, wird, wurde, ist geworden|(будущее время)|Es wird regnen.|Пойдет дождь.
8|aux|werden, wird, wurde, ist geworden|(пассивный залог)|Ein Haus wird gebaut.|Дом строится.
8|verb|werden, wird, wurde, ist geworden|становиться|Er wird müde.|Он устает.
9|prep|von|от, из|Ein Brief von dir.|Письмо от тебя.
10|pron|ich|я|Ich bin glücklich.|Я счастлив.
11|part|nicht|не|Das ist nicht gut.|Это нехорошо.
12|pron|es|оно|Es ist ein Buch.|Это книга.
13|prep|mit|с|Ich gehe mit dir.|Я иду с тобой.
14|pron|sich|-ся, -сь|Er schaut sich um.|Он оглядывается.
15|pron|er|он|Er ist mein Freund.|Он мой друг.
16|prep|auf|на|Sie sitzt auf dem Stuhl.|Она сидит на стуле.
17|prep|für|для|Das ist für dich.|Это для тебя.
18|adv|auch|тоже|Ich mag es auch.|Мне тоже это нравится.
19|prep|an|на, у|Sie ist an der Tür.|Она у двери.
20|conj|dass|что|Ich hoffe, dass es gut geht.|Я надеюсь, что все будет хорошо.
21|part|zu|слишком|Er kam zu spät.|Он пришел слишком поздно.
21|part|zu|слишком|Zu viel Zucker.|Слишком много сахара.
21|prep|zu|к|Er ging zu ihr.|Он пошел к ней.
22|conj|als|как, когда|Als er kam, ging sie.|Когда он пришел, она ушла.
22|part|als|чем|Größer als er.|Выше, чем он.
23|verb|können, kann, konnte, hat können|мочь|Er kann schwimmen.|Он умеет плавать.
24|pron|dies|этот|Dies ist mein Haus.|Это мой дом.
25|part|wie|как|Er arbeitet wie ein Pferd.|Он работает как лошадь.
25|pron|wie|как|Wie heißt du?|Как тебя зовут?
26|pron|wir|мы|Wir gehen ins Kino.|Мы идем в кино.
27|pron|ihr|её, их|Ihre Katze ist süß.|Её кошка милая.
27|pron|ihr|её, их|Das ist ihr Buch.|Это её книга.
27|pron|ihr|ваш|Ist das Ihr Auto?|Это ваша машина?
28|adv|so|так|Es ist so kalt.|Так холодно.
28|part|so|так|Es war nicht so.|Это было не так.
29|prep|bei|у, с|Er wohnt bei mir.|Он живет у меня.
30|pron|sein|его|Sein Haus ist groß.|Его дом большой.
31|conj|aber|но|Es ist teuer, aber schön.|Это дорого, но красиво.
31|part|aber||Das ist aber komisch.|Но это странно.
32|pron|man|кто-то, они|Man sagt, es ist gut.|Говорят, это хорошо.
33|adv|noch|ещё|Es ist noch früh.|Ещё рано.
34|prep|nach|после, к|Nach der Schule.|После школы.
35|conj|oder|или|Willst du Tee oder Kaffee?|Ты хочешь чай или кофе?
36|pron|all|все|Alle kommen hierher.|Все приходят сюда.
37|prep|aus|из|Er kommt aus Spanien.|Он из Испании.
38|pron|was|что|Was machst du?|Что ты делаешь?
39|adv|nur|только|Ich habe nur ein Buch.|У меня есть только одна книга.
40|verb|sagen, sagt, sagte, hat gesagt|говорить|Sie sagt die Wahrheit.|Она говорит правду.
41|adv|dann|тогда|Dann gehe ich nach Hause.|Тогда я пойду домой.
42|conj|wenn|если, когда|Wenn er kommt, gehe ich.|Если он придет, я уйду.
43|verb|müssen, muss, musste, hat gemusst|должен|Du musst lernen.|Ты должен учиться.
44|conj|um|чтобы|Um zu verstehen, lerne.|Учись, чтобы понять.
44|prep|um|вокруг|Er ging um die Ecke.|Он пошел за угол.
45|part|ja|да|Ja, ich komme.|Да, я иду.
46|pron|kein|нет|Ich habe kein Geld.|У меня нет денег.
47|prep|über|о|Das Buch ist über Hunde.|Книга о собаках.
48|adv|da|там|Er ist da drüben.|Он там.
48|conj|da|потому что|Er kam, da er müde war.|Он пришел, потому что устал.
49|verb|geben, gibt, gab, hat gegeben|давать|Sie gibt ihm ein Buch.|Она дает ему книгу.
50|prep|vor|перед|Vor dem Haus steht ein Baum.|Перед домом стоит дерево.
51|pron|mein|мой|Mein Hund ist krank.|Моя собака больна.
52|adv|mehr|больше|Ich brauche mehr Zeit.|Мне нужно больше времени.
53|das|das Jahr, -e|год|Das Jahr ist vorbei.|Год закончился.
54|pron|du|ты|Du bist nett.|Ты милый.
55|prep|durch|через|Er ging durch den Park.|Он шел через парк.
56|pron|viel|много|Viel Lärm um nichts.|Много шума из ничего.
57|verb|wollen, will, wollte, hat gewollt|хотеть|Ich will ein Eis.|Я хочу мороженое.
58|verb|machen, macht, machte, hat gemacht|делать|Er macht seine Hausaufgaben.|Он делает свою домашнюю работу.
59|pron|andere (r, s)|другой|Die andere Tür.|Другая дверь.
60|verb|sollen, soll, sollte, hat gesollt|должен|Du sollst das tun.|Ты должен это сделать.
61|adv|schon|уже|Er ist schon da.|Он уже там.
61|part|schon||Schon wieder.|Снова уже.
62|verb|kommen, kommt, kam, ist gekommen|приходить|Sie kommt morgen.|Она придет завтра.
63|pron|mir|мне|Gib mir das Buch.|Дай мне книгу.
64|adv|immer|всегда|Ich gehe immer zu Fuß.|Я всегда хожу пешком.
65|Reflexive pronoun in the acc.|mich|-ся|Er schaut mich an.|Он смотрит на меня.
65|pron|mich|меня|Ich sehe mich im Spiegel.|Я вижу себя в зеркале.
66|verb|gehen, geht, ging, ist gegangen|идти|Ich gehe nach Hause.|Я иду домой.
67|adj|groß|большой|Das ist ein großes Haus.|Это большой дом.
68|adv|hier|здесь|Ich bin hier.|Я здесь.
69|adj|ganz|целый|Das ganze Buch.|Вся книга.
69|part|ganz|вполне|Это вполне мило здесь.|Это вполне мило здесь.
70|num|zwei|два|Zwei Katzen spielen.|Две кошки играют.
71|adv|also|итак|Also, was nun?|Итак, что теперь?
72|adv|jetzt|сейчас|Ich gehe jetzt.|Я иду сейчас.
73|adv|doch|однако|Es ist teuer, doch schön.|Это дорого, но красиво.
73|part|doch||Ich habe es doch gesagt.|Я же говорил.
74|adv|wieder|снова|Er kommt wieder.|Он придет снова.
75|pron|uns|нас, мы|Gib uns das Buch.|Дай нам книгу.
76|adj|gut|хороший|Das ist gut.|Это хорошо.
77|conj|bis|до|Warte bis morgen.|Подожди до завтра.
77|prep|bis|до, пока|Ich bleibe bis acht Uhr.|Я остаюсь до восьми часов.
78|verb|wissen, weiß, wusste, hat gewusst|знать|Ich weiß die Antwort.|Я знаю ответ.
79|verb|sehen, sieht, sah, hat gesehen|видеть|Ich sehe den Hund.|Я вижу собаку.
80|pron|einer|кто-то|Einer kam zu spät.|Кто-то опоздал.
81|adv|sehr|очень|Es ist sehr schön.|Это очень красиво.
82|conj|Mal|раз|Es war das erste Mal.|Это был первый раз.
82|das|Mal|время, отметка|Das erste Mal ist immer besonders.|Первый раз всегда особенный.
82|part|Mal|раз|Dieses Mal ist es anders.|На этот раз всё иначе.
83|verb|lassen, lässt, ließ, hat gelassen|позволять, оставлять|Lass mich in Ruhe.|Оставь меня в покое.
84|adj|neu|новый|Ein neues Buch.|Новая книга.
85|verb|stehen, steht, stand, hat gestanden|стоять|Er steht da.|Он стоит там.
86|pron|unser|наш|Unser Haus ist groß.|Наш дом большой.
87|pron|jede (r, s)|каждый|Jeder Tag ist anders.|Каждый день разный.
88|conj|weil|потому что|Ich bin müde, weil ich arbeite.|Я устал, потому что работаю.
89|prep|unter|под|Der Hund schläft unter dem Tisch.|Собака спит под столом.
90|der|der Mensch, -en|человек|Der Mensch ist klug.|Человек умный.
91|pron|ihm|ему|Ich gebe ihm das Buch.|Я даю ему книгу.
92|pron|ihn|его|Ich sehe ihn jeden Tag.|Я вижу его каждый день.
93|conj|denn|потому что|Er kommt, denn er muss.|Он приходит, потому что должен.
93|part|denn|же|Was denn?|Что же?
94|das|das Beispiel, -e|пример|Ein gutes Beispiel.|Хороший пример.
95|adj|erste (r, s)|первый|Das erste Mal.|Первый раз.
96|die|die Zeit, -en|время|Die Zeit vergeht schnell.|Время летит.
97|adj|lang|длинный|Der Fluss ist lang.|Река длинная.
97|adv|lang|долго|Er wartet schon lange.|Он ждет уже долго.
98|verb|leben, lebt, lebte, hat gelebt|жить|Ich lebe in Deutschland.|Я живу в Германии.
99|die|die Frau, -en|женщина, жена|Die Frau liest.|Женщина читает.
100|pron|etwas|что-то, немного|Ich sehe etwas dort.|Я вижу там что-то.
101|part|selbst, selber|сам|Er hat es selbst gemacht.|Он сделал это сам.
101|pron|selbst, selber|сам|Selbst ich kann das.|Даже я могу это сделать.
102|adj|wenig|мало|Er hat wenig Geld.|У него мало денег.
102|pron|wenig|мало|Es gibt wenig Hoffnung.|Есть мало надежды.
103|verb|finden, findet, fand, hat gefunden|найти|Ich finde den Schlüssel.|Я нахожу ключ.
104|prep|gegen|против|Er ist gegen die Idee.|Он против этой идеи.
105|prep|zwischen|между|Er steht zwischen den Bäumen.|Он стоит между деревьями.
106|num|drei|три|Drei Hunde spielen.|Три собаки играют.
107|verb|liegen, liegt, lag, hat gelegen|лежать|Das Buch liegt auf dem Tisch.|Книга лежит на столе.
108|pron|wo|где|Wo bist du?|Где ты?
109|pron|nichts, nix|ничего|Ich sehe nichts.|Я ничего не вижу.
110|adj|klein|маленький|Das ist ein kleines Haus.|Это маленький дом.
111|der|der Tag, -e|день|Der Tag ist schön.|День прекрасный.
112|adj|deutsch|немецкий|Das deutsche Auto.|Немецкая машина.
112|das|deutsch|немецкий|Er lernt Deutsch in der Schule.|Он учит немецкий в школе.
113|verb|bleiben, bleibt, blieb, ist geblieben|оставаться|Er bleibt hier.|Он остается здесь.
114|adv|nun, nu|теперь|Nun bin ich müde.|Теперь я устал.
115|conj|sondern|а|Nicht dies, sondern das.|Не это, а то.
116|adv|heute|сегодня|Heute ist ein guter Tag.|Сегодня хороший день.
117|pron|beide|оба|Beide kommen morgen.|Оба придут завтра.
118|adj|hoch|высокий|Das Haus ist hoch.|Дом высокий.
119|pron|damit|с этим|Ich bin damit einverstanden.|Я согласен с этим.
120|conj|ohne|без|Ohne dich kann ich nicht.|Без тебя я не могу.
120|prep|ohne|без|Wir fahren ohne dich.|Мы едем без тебя.
121|der|der Mann, -̈er|мужчина|Der Mann ist stark.|Мужчина сильный.
122|pron|welch, -e, -er, -es|который|Welches Buch liest du?|Какую книгу ты читаешь?
123|verb|tun, tut, tat, hat getan|делать|Ich weiß nicht, was ich tun soll.|Я не знаю, что мне делать.
124|adv|einmal|один раз|Einmal ist keinmal.|Один раз - не в счёт.
125|pron|ihnen|им|Ich gebe ihnen das Buch.|Я даю им книгу.
125|pron|ihnen|вам|Ich habe Ihnen geholfen.|Я помог вам.
126|verb|heißen, heißt, hieß, hat geheißen|называться|Wie heißen Sie?|Как вас зовут?
127|conj|ob|ли|Ich frage, ob er kommt.|Я спрашиваю, придёт ли он.
128|verb|denken, denkt, dachte, hat gedacht|думать|Ich denke an dich.|Я думаю о тебе.
129|pron|dabei|при этом|Er ist dabei.|Он при этом.
130|prep|seit|с|Ich wohne hier seit drei Jahren.|Я живу здесь три года.
131|adj|einfach|простой|Einfach und klar.|Простой и ясный.
131|part|einfach|просто|Das ist einfach toll.|Это просто здорово.
132|adv|erst|сначала|Ich komme erst morgen.|Я приду только завтра.
132|part|erst|сначала|Zuerst die Arbeit.|Сначала работа.
133|das|das Kind, -er|ребёнок|Das Kind spielt.|Ребёнок играет.
134|das|das Land, -̈er|страна|Das Land ist schön.|Страна красивая.
135|verb|stellen, stellt, stellte, hat gestellt|ставить|Ich stelle die Vase auf den Tisch.|Я ставлю вазу на стол.
136|verb|zeigen, zeigt, zeigte, hat gezeigt|показать|Er zeigt mir das Bild.|Он показывает мне картину.
137|adj|natürlich|естественный|Das ist natürlich.|Это естественно.
137|adv|natürlich|конечно|Natürlich komme ich.|Конечно, я приду.
138|adj|alt|старый|Das alte Haus.|Старый дом.
139|adv|dort|там|Ich bin dort.|Я там.
140|das|Deutschland|Германия|Deutschland ist schön.|Германия красивая.
141|adj|gleich|такой же|Wir haben das gleiche Problem.|У нас такая же проблема.
142|verb|nehmen, nimmt, nahm, hat genommen|брать|Ich nehme den Bus.|Я сажусь на автобус.
143|verb|dürfen, darf, durfte, hat gedurft|мочь|Du darfst hier nicht parken.|Тебе нельзя здесь парковаться.
144|adj|wichtig|важный|Das ist wichtig.|Это важно.
145|adv|vielleicht|может быть|Vielleicht kommt er.|Может быть, он придёт.
145|part|vielleicht|может быть|Das ist vielleicht wahr.|Это может быть правдой.
146|verb|hören, hört, hörte, hat gehört|слушать|Ich höre Musik.|Я слушаю музыку.
147|das|das Haus, -̈er|дом|Das Haus ist groß.|Дом большой.
148|part|nein, nee, nö|нет|Nein, danke.|Нет, спасибо.
149|pron|wer|кто|Wer ist das?|Кто это?
150|pron|dazu|к этому|Er gehört dazu.|Он принадлежит к этому.
151|adj|eigentlich|настоящий|Das ist eigentlich gut.|Это на самом деле хорошо.
151|adv|eigentlich|на самом деле|Eigentlich mag ich es.|На самом деле мне это нравится.
151|part|eigentlich|на самом деле|Das ist eigentlich wahr.|Это на самом деле правда.
152|adj|letzte (r, s)|последний|Das letzte Mal.|Последний раз.
153|verb|fragen, fragt, fragte, hat gefragt|спрашивать|Ich frage ihn.|Я спрашиваю его.
154|der|der Herr, -en|господин|Herr Schmidt ist nett.|Господин Шмидт милый.
155|verb|halten, hält, hielt, hat gehalten|держать|Er hält den Ball.|Он держит мяч.
156|verb|glauben, glaubt, glaubte, hat geglaubt|верить|Ich glaube dir.|Я верю тебе.
157|die|die Frage, -n|вопрос|Das ist die Frage.|Это вопрос.
158|verb|gelten, gilt, galt, hat gegolten|быть действительным|Das Gesetz gilt.|Закон действует.
159|adj|gerade|прямой|Ein gerades Haus.|Прямой дом.
159|adv|gerade|сейчас|Ich mache es gerade.|Я делаю это сейчас.
160|verb|folgen, folgt, folgte, ist gefolgt|следовать|Er folgt dem Hund.|Он следует за собакой.
161|verb|sprechen, spricht, sprach, hat gesprochen|говорить|Sie spricht Deutsch.|Она говорит по-немецки.
162|verb|führen, führt, führte, hat geführt|вести|Er führt die Gruppe.|Он ведет группу.
163|verb|bringen, bringt, brachte, hat gebracht|приносить, привозить|Er bringt ein Buch.|Он приносит книгу.
164|die|die Welt, -en|мир|Die Welt ist groß.|Мир большой.
165|adv|gar|вообще|Das ist gar nicht schlecht.|Это совсем неплохо.
166|adj|eigen|собственный|Er hat ein eigenes Zimmer.|У него есть своя комната.
167|adj|genau|точный|Das ist genau richtig.|Это точно правильно.
168|verb|mögen, mag, mochte, hat gemocht|любить|Ich mag dieses Buch.|Мне нравится эта книга.
169|adj|spät|поздний|Es ist schon spät.|Уже поздно.
169|adj|spät|позже|Später werde ich kommen.|Я приду позже.
170|adv|bereits|уже|Er hat bereits gegessen.|Он уже поел.
171|adj|möglich|возможный|Das ist möglich.|Это возможно.
171|adv|möglich|возможно|So schnell wie möglich.|Как можно быстрее.
172|das|das Prozent, -e|процент|Zehn Prozent der Leute.|Десять процентов людей.
173|conj|während|пока|Während ich lese, höre ich Musik.|Пока я читаю, я слушаю музыку.
173|prep|während|во время|Während des Tages arbeite ich.|В течение дня я работаю.
174|pron|einige|некоторые|Einige Menschen sind hier.|Некоторые люди здесь.
175|pron|dafür|за это|Ich bin dafür.|Я за это.
176|adj|kurz|короткий|Ein kurzes Gespräch.|Короткий разговор.
177|adj|richtig|правильный|Das ist richtig.|Это правильно.
178|adj|stark|сильный|Er ist stark.|Он сильный.
179|verb|brauchen, braucht, brauchte, hat gebraucht|нуждаться|Ich brauche Hilfe.|Мне нужна помощь.
180|die|die Hand, -̈e|рука|Sie hebt die Hand.|Она поднимает руку.
181|adv|etwa|примерно|Etwa zehn Minuten.|Около десяти минут.
181|part|etwa|разве|Etwa ist es zu spät.|Разве уже поздно.
182|adj|weitere (r, s)|дополнительный|Weitere Informationen.|Дополнительная информация.
183|das|das Ende, -n|конец|Das Ende ist nah.|Конец близок.
184|verb|schreiben, schreibt, schrieb, hat geschrieben|писать|Er schreibt einen Brief.|Он пишет письмо.
185|pron|solch|такой|Solche Bücher mag ich.|Мне нравятся такие книги.
186|adv|nie|никогда|Er kommt nie zu spät.|Он никогда не опаздывает.
187|der|der Fall, -̈e|случай|Im Fall eines Falles.|В случае чего.
188|adj|schön|красивый|Das ist schön.|Это красиво.
189|adj|wirklich|действительно|Ist das wirklich wahr?|Это действительно правда?
189|adv|wirklich|действительно|Ich bin wirklich müde.|Я действительно устал.
190|pron|denen|которым|Die Menschen, denen ich vertraue.|Люди, которым я доверяю.
191|verb|nennen, nennt, nannte, hat genannt|называть|Er nennt mich Freund.|Он называет меня другом.
192|adv|warum|почему|Warum fragst du?|Почему ты спрашиваешь?
193|verb|ziehen, zieht, zog, hat gezogen|тянуть, двигать|Er zieht die Tür auf.|Он тянет дверь.
194|das|das Wort, -̈er|слово|Ein deutsches Wort.|Немецкое слово.
195|pron|darauf, drauf|на это|Ich freue mich darauf.|Я с нетерпением жду этого.
196|adv|eben, ebend|только что|Das ist eben so.|Это только что так.
196|part|eben, ebend|просто|Das war eben so.|Это просто было так.
197|die|die Seite, -n|сторона, страница|Auf der linken Seite.|На левой стороне.
198|der, das|das Teil, -e|часть|Ein Teil des Ganzen.|Часть целого.
199|adj|jung|молодой|Ein junges Mädchen.|Молодая девушка.
200|num|vier|четыре|Vier Katzen spielen.|Четыре кошки играют.
201|adj|besser|лучше|Das ist besser.|Это лучше.
202|adv|fast|почти|Er ist fast fertig.|Он почти готов.
203|adj|schnell|быстрый|Das Auto ist schnell.|Машина быстрая.
204|die|die Stadt, -̈e|город|Die Stadt ist groß.|Город большой.
205|verb|spielen, spielt, spielte, hat gespielt|играть|Er spielt Fußball.|Он играет в футбол.
206|adv|zwar|хотя|Er kommt zwar, aber spät.|Он придет, хотя и поздно.
207|der|der Euro, -s|евро|Ein Euro für ein Brot.|Один евро за хлеб.
208|die|die Arbeit, -en|работа|Die Arbeit ist schwer.|Работа тяжелая.
209|die|Million, Mio.|миллион|Eine Million Menschen.|Миллион человек.
210|das|das Problem, -e|проблема|Das ist ein Problem.|Это проблема.
211|verb|verstehen, versteht, verstand, hat verstanden|понимать|Ich verstehe dich.|Я понимаю тебя.
212|verb|bekommen, bekommt, bekam, hat bekommen|получать|Ich bekomme ein Geschenk.|Я получаю подарок.
213|verb|meinen, meint, meinte, hat gemeint|иметь в виду|Er meint es gut.|Он имеет в виду хорошее.
214|pron|davon|об этом|Ich weiß nichts davon.|Я ничего не знаю об этом.
215|verb|fahren, fährt, fuhr, ist gefahren|ехать|Er fährt nach Hause.|Он едет домой.
216|verb|kennen, kennt, kannte, hat gekannt|знать|Ich kenne ihn.|Я знаю его.
217|pron|dich|тебя, себя|Ich sehe dich.|Я вижу тебя.
218|die|die Mutter, -̈|мать|Meine Mutter ist hier.|Моя мать здесь.
219|die|die Woche, -n|неделя|Die Woche war gut.|Неделя была хорошей.
220|der|der Weg, -e|путь|Der Weg ist lang.|Путь длинный.
221|adv|weiter|дальше|Ich gehe weiter.|Я иду дальше.
222|das|das Auge, -n|глаз|Er hat schöne Augen.|У него красивые глаза.
223|adv|oft|часто|Ich lese oft Bücher.|Я часто читаю книги.
224|die (pl)|Leute|люди|Viele Leute sind hier.|Здесь много людей.
225|adv|allerdings|однако|Das ist allerdings richtig.|Это, однако, правильно.
226|adv|sogar|даже|Er ist sogar größer.|Он даже выше.
227|adv|jedoch|однако|Er kommt jedoch nicht.|Он, однако, не приходит.
228|verb|setzen, setzt, setzte, hat gesetzt|ставить, сажать|Er setzt das Glas auf den Tisch.|Он ставит стакан на стол.
228|verb|setzen, setzt, setzte, hat gesetzt|садиться|Er setzt sich auf den Stuhl.|Он садится на стул.
229|adv|deshalb|поэтому|Deshalb bin ich hier.|Поэтому я здесь.
230|adj|weit|широкий, далеко|Der Weg ist weit.|Путь далёкий.
231|verb|sitzen, sitzt, saß, hat gesessen|сидеть|Er sitzt auf dem Stuhl.|Он сидит на стуле.
232|der|der Vater, -̈|отец|Mein Vater ist stark.|Мой отец сильный.
233|pron|dein|твой|Das ist dein Buch.|Это твоя книга.
234|verb|arbeiten, arbeitet, arbeitete, hat gearbeitet|работать|Er arbeitet hart.|Он работает усердно.
235|das|das Geld, -er|деньги|Ich brauche Geld.|Мне нужны деньги.
236|das|das Unternehmen, -|предприятие, компания|Das Unternehmen ist groß.|Компания большая.
237|adj|nächste (r, s)|следующий|Die nächste Woche.|Следующая неделя.
238|verb|erklären, erklärt, erklärte, hat erklärt|объяснять|Er erklärt das Problem.|Он объясняет проблему.
239|adj|klar|ясный|Das Wasser ist klar.|Вода прозрачная.
240|der|der Doktor, -en (Dr.)|доктор|Der Doktor ist da.|Доктор здесь.
241|das|das Paar, -e|пара|Ein glückliches Paar.|Счастливая пара.
241|pron|das Paar, -e|несколько|Ich habe ein paar Fragen.|У меня есть несколько вопросов.
242|adj|das Recht, -e|право|Sie hat das Recht zu wählen.|У нее есть право голоса.
242|das|das Recht, -e|право|Das Recht ist wichtig.|Право важно.
242|part|das Recht, -e|довольно|Es ist recht schwierig.|Это довольно сложно.
243|prep|wegen|из-за|Wegen des Regens.|Из-за дождя.
