|sentence_de
98|Mir schmeckt das Essen sehr gut.
137|Wo hast du das Buch gelassen?
16|Er wird bald kommen.
37|Wie hast du das geschafft?
72|Du hast den besten Kuchen gebacken.
88|Hier wohne ich seit Jahren.
110|Er steht früh auf und geht joggen.
184|Nein, das kann nicht wahr sein!
185|Weißt du, wer das ist?
720|Los, wir müssen jetzt gehen!
1551|Der arme Junge verlor sein Spielzeug.
54|Was hast du heute gesagt?
62|Ja, das gefällt mir.
92|Also, wann treffen wir uns?
161|Er war dabei, als es passierte.
174|Dort hinten steht ein Baum.
220|Der Wind wehte heute besonders stark.
409|Daher kommt sein Mut.
422|Er tritt den Ball ins Tor.
447|Die Angst überwältigte ihn.
588|Er ruft laut nach Hilfe.
625|Der Vertrag wurde fest unterschrieben.
689|Wenn du okay bist, gehen wir weiter.
775|Er ging hin, um es selbst zu sehen.
800|Das ist doch nicht wahr!
855|Er ist aktiv im Sportverein.
1828|Der Jude erzählte uns seine Geschichte.
2240|Er lügt immer, wenn er Angst hat.
4494|Das naive Kind vertraute jedem.
14|Es wird ein langer Tag werden.
31|Er geht zu seiner Freundin.
43|So einfach ist das nicht.
77|Der andere Weg ist kürzer.
93|Jetzt ist es zu spät.
121|Er gewann das erste Rennen.
173|Das Buch ist sehr alt, aber interessant.
191|Er fragt oft nach dem Weg.
217|Ich bin dafür, dass wir loslegen.
231|Am See war es gestern sehr schön.
261|Er kennt den Weg sehr gut.
262|Ich sehe dich morgen.
540|Wir gehen heute Abend aus.
553|Ich habe euch lange nicht gesehen.
556|Er hat mehr als genug gegessen.
647|Er freut sich über das Geschenk.
688|Das kommt öfter vor, als man denkt.
927|Dieses Land ist mir völlig fremd.
934|Vorher hat er alles vorbereitet.
1042|Er schweigt während der Sitzung.
1078|Er ging hinaus in die Nacht.
1397|Er fühlte sich krank und ging ins Bett.
1426|Der Schmerz fühlt sich völlig real an.
2083|Er war müde und legte sich hin.
2087|Es war wirklich eine blöde Entscheidung.
2089|Er ist in der Forschung tätig.
2971|Sie kauft jeden Freitag ein.
3250|Ich war die ganze Nacht wach.
3338|Er schaut gern beim Fußball zu.
4013|Nach dem Essen war er satt.
4590|Wegen diesem Mist haben wir verloren.
13|Sie hat den Kuchen gebacken.
20|Es regnet schon den ganzen Tag.
26|Sie kommt auch zur Party.
42|Er machte es so, wie gesagt wurde.
59|Du musst das bis morgen erledigen.
79|Er ist schon wieder zu spät.
96|Wir treffen uns wieder am Freitag.
109|Ich habe ein neues Buch gekauft.
126|Die Frau lachte herzlich.
143|Er blieb die ganze Nacht wach.
158|Er heißt Max und kommt aus Berlin.
182|Ich höre oft Musik beim Arbeiten.
186|Was meinst du denn dazu?
190|Das war seine letzte Chance.
194|Er glaubt an das Gute im Menschen.
246|Heute fühle ich mich schon besser.
417|Niemand wusste die Antwort.
419|Ich warte auf den Bus.
426|Na, wie läuft es bei dir?
487|Die Folge des Unfalls war schwer.
500|Er lacht über den Witz.
628|Er erlebt das Abenteuer seines Lebens.
634|Der Gast lobte das Essen.
669|Das Geld reicht für den Einkauf.
677|Er sorgt für seine Familie.
703|Nach dem Unfall ist alles wieder normal.
719|Wann kommst du nach Hause?
732|Solche Tiere sieht man sehr selten.
763|Die Musik klingt wunderbar.
764|Er liebt sie von ganzem Herzen.
810|Das Gespräch bleibt streng privat.
850|Er stand ganz vorne in der Schlange.
914|China hat eine lange Geschichte.
1010|Er leidet unter starken Kopfschmerzen.
1110|Deine Zustimmung ist unbedingt nötig.
1221|Der Juni ist mein Lieblingsmonat.
1308|Ein Spaziergang wäre jetzt ideal.
1350|Er dankte ihr für die Hilfe.
1557|Sie kocht gerne italienisch.
2084|Er spart Geld für den Urlaub.
2096|Er gab eine exakt passende Antwort.
2465|Er traut sich, allein zu reisen.
2581|Die Not war groß, aber er blieb stark.
3083|Er nahm die Sache locker.
3085|Er wartet ab, was passieren wird.
3258|Wofür brauchst du das Geld?
4127|Worum geht es in dem Film?
4181|Er bleibt fit durch regelmäßigen Sport.
4283|Die UNO spielt eine wichtige Rolle.
4876|Das Fieber stieg über Nacht an.
0|Das Kind spielt im Garten.
21|Er kam mit seinem Hund ins Haus.
25|Ich habe ein Geschenk für dich.
41|Ihr habt das gut gemacht!
44|Ich bleibe bei meiner Meinung.
49|Er ist noch nicht fertig.
65|Da liegt der Fehler.
75|Ich will das morgen erledigen.
81|Er kommt morgen nach Hause.
82|Mir gefällt das sehr.
97|Er hilft uns beim Umzug.
138|Nichts kann ihn aufhalten.
167|Das Kind spielt im Sandkasten.
179|Pünktlichkeit ist im Job wichtig.
196|Die Regeln gelten für alle.
211|Bei uns ist fast alles möglich.
219|Dein Vorschlag war absolut richtig.
236|Warum bist du so früh hier?
241|Das ist eben so, wie es ist.
258|Er meint, das wäre eine gute Idee.
266|Er ging weiter, ohne sich umzusehen.
296|Er versucht, das Problem zu lösen.
415|Darin liegt das Geheimnis.
502|Er kam sofort, als ich rief.
523|Hast du etwas dagegen gesagt?
534|Das ist halt so, akzeptier es.
606|Der Junge spielt im Park.
619|Er bewegt den Tisch in die Ecke.
626|Das Thema ist aktuell sehr wichtig.
629|Diese Aufgabe war relativ leicht.
636|Das Gesetz wurde geändert.
645|Ach, das wusste ich nicht!
659|Das Bild gefällt mir sehr.
765|Die Dame trinkt ihren Tee.
789|Die EU hat neue Gesetze erlassen.
844|Er ist ständig unterwegs und arbeitet.
884|Der Einfluss war eher negativ.
885|Das Büro liegt in zentraler Lage.
897|Hast du eine konkrete Idee dazu?
945|Danke, das war sehr nett.
956|Die Sorge um ihn war groß.
975|Der Typ an der Bar war seltsam.
978|Wieso hast du das gemacht?
993|Er droht mit Konsequenzen.
1135|Sie singt im Chor ihrer Schule.
1324|Das genügt, um alle zu versorgen.
1342|Er war bereit, alles zu geben.
1536|Solche Regeln sind hier üblich.
1555|Ich habe davor gewarnt.
1572|Der Zweifel nagte an ihm.
1596|Der Faden reißt unter der Last.
1635|Er weint oft bei traurigen Filmen.
1660|Er taucht tief ins Wasser.
1668|Er ist immer ehrlich zu seinen Freunden.
1723|Er ging vorsichtig die Treppe hinunter.
1834|Er war traurig über die Nachricht.
1875|Er träumt von einer besseren Welt.
1893|Wohin führt dieser Weg?
1916|Der König war sehr mächtig.
1926|Er kauft seine Bücher online.
2047|Er geht langsam auf die Tür zu.
2181|Die jüdische Gemeinde feiert heute.
2294|Er schlägt kräftig zu.
2489|Das Gepäck liegt sicher an Bord.
2576|Der Ball rollt den Hügel hinunter.
2761|Er hasst es, früh aufzustehen.
3377|Er blieb stumm und sagte kein Wort.
3523|Hi, wie geht’s dir heute?
3776|Er zielt genau auf die Mitte.
4269|Er löst den alten Reifen ab.
4955|Er beantragte Asyl in Deutschland.
6|Er ist heute sehr beschäftigt.
9|Wir haben alles erledigt.
18|Ich gehe nach Hause.
19|Er hat das nicht gewusst.
22|Er wäscht sich das Gesicht.
34|Er kann sehr gut schwimmen.
78|Er soll das Projekt leiten.
85|Das hat mich überrascht.
119|Was machst du denn hier?
144|Nun beginnt der Unterricht.
163|Das ist einfach unglaublich.
193|Er hält das Glas fest.
280|Er arbeitet hart für sein Geld.
281|Das Geld liegt auf dem Tisch.
292|Wegen des Regens blieb er zu Hause.
299|Er schüttelt den Kopf.
317|Ich gehe nicht gern allein.
411|Er erkennt die Stimme sofort.
421|Ich stehe heute früh auf.
423|Sie redet gerne über Bücher.
436|Was ist gestern passiert?
451|Er erinnert sich an das Treffen.
453|Was bedeutet dieses Zeichen?
476|Dir wird nichts fehlen, versprochen!
585|Er hob den Arm zur Begrüßung.
605|Er holt die Zeitung aus dem Briefkasten.
616|Der Druck auf den Knopf ist zu stark.
631|Er tritt mit dem Fuß gegen den Ball.
667|Wobei kann ich dir helfen?
673|Im Wald lebt ein seltenes Tier.
684|Bayern ist ein schönes Bundesland.
696|Er machte wieder denselben Fehler.
714|Der Zug kommt pünktlich an.
730|Er baut ein neues Haus.
742|Er schläft immer früh ein.
749|Die Firma stellt Computer her.
759|Das Kleid passt ihr perfekt.
784|Er verkauft sein altes Auto.
792|Offenbar ist er nicht gut informiert.
948|Zuerst muss man das lesen.
959|Dieses Fest hat nationale Bedeutung.
970|Die Preise sind deutlich gesunken.
1000|Es ist ihm egal, was andere denken.
1003|Das Buch liegt irgendwo im Haus.
1104|Das Volk wählte einen neuen Anführer.
1176|Das Baby hat laut geschrien.
1181|Solches Verhalten ist typisch für sie.
1215|Hey, warte doch bitte auf mich!
1219|Er ruft seinen Freund an.
1243|Er kam aus dem Haus heraus.
1545|Er kommt morgen aus dem Urlaub zurück.
1571|Weißt du, woher er kommt?
1574|Er tanzt gern auf Partys.
1582|Er begegnete ihr auf der Straße.
1617|Er lässt keine Fehler zu.
1765|Er kam nach Hause zurück.
1783|Der Vogel singt laut.
1859|Die DNA-Analyse brachte Klarheit.
1994|Deine Antwort war völlig korrekt.
2026|Das ist eine verrückte Idee!
2060|Er ist sehr religiös erzogen worden.
2067|Sag das bitte nochmal.
2093|Afrika hat viele verschiedene Kulturen.
2559|Drogenhandel ist in jedem Land illegal.
2592|Der Erbe trat sein Erbe an.
2673|Er ist wütend auf den Chef.
2789|Er berät die Kunden freundlich.
3048|Er seufzt tief, als er das hörte.
3095|Das Taxi wartet vor dem Haus.
3137|Er jagt das Reh durch den Wald.
3176|Er hat sich sehr diskret verhalten.
3177|Er war erstaunt über das Ergebnis.
3424|Kanada ist ein schönes Land.
3586|Weißt du, wovon er spricht?
3632|Er erwacht früh am Morgen.
3645|Woran denkst du gerade?
3658|Es regnet den ganzen Tag.
3774|Er fühlt sich schuldig.
3783|Er bremst das Auto scharf.
3867|Der Müll stinkt schrecklich.
3909|Er umarmt seinen Freund zum Abschied.
3999|Er macht das Fenster zu.
4036|Au, das hat wirklich wehgetan!
4262|Der Löwe brüllt laut im Zoo.
4341|Irland ist berühmt für seine Landschaft.
4384|Der Stich schmerzte sehr.
4410|Er bleibt schlank durch viel Bewegung.
4428|Diabetes erfordert viel Disziplin.
4554|Er bleibt bei der Arbeit nüchtern.
4608|Der Müll wird morgen abgeholt.
4767|Der Beleg liegt auf dem Tisch.
4987|Er spinnt ein Netz aus Lügen.
5082|Das Obst liegt frisch auf dem Tisch.
23|Er kommt heute spät.
27|Er steht an der Ecke.
35|Dies ist mein letztes Angebot.
38|Wir gehen zusammen ins Kino.
39|Ihr habt die Prüfung bestanden.
45|Sein Auto steht vor der Tür.
63|Kein Problem, ich helfe dir.
99|Warte hier, bis ich zurück bin.
102|Er sieht die Stadt von oben.
103|Einer von uns muss es tun.
104|Das Essen schmeckt sehr gut.
108|Sie lässt das Buch liegen.
130|Er hat wenig Zeit für Hobbys.
140|Der Tag beginnt mit Sonne.
160|Er denkt oft an seine Kindheit.
177|Er nimmt den Bus zur Arbeit.
183|Das Haus wurde renoviert.
195|Die Frage bleibt offen.
199|Der Hund folgt seinem Herrn.
203|Die Welt dreht sich weiter.
208|Es ist schon spät geworden.
221|Wir brauchen mehr Informationen.
222|Er hält die Hand seiner Mutter.
223|Kommst du etwa nicht mit?
250|Die Kinder spielen im Garten.
256|Er versteht die Aufgabe nicht.
279|Ist das wirklich dein Ernst?
283|Der nächste Zug kommt bald.
297|Der Punkt ist klar formuliert.
338|Sie lernt gerade für die Prüfung.
343|Er denkt immer daran.
427|Das Team gewinnt das Spiel.
458|Der Raum ist voll besetzt.
464|Die USA sind wirtschaftlich stark.
472|Die Regel betrifft uns alle.
485|Er nutzt jede Gelegenheit.
494|Die Regel ist einfach zu verstehen.
538|Er braucht dringend Hilfe.
548|Ich möchte dich um einen Gefallen bitten.
555|Das Konzert fängt gleich an.
608|Die Polizei ermittelt im Fall.
614|Der Schüler lernt fleißig.
638|Die Prüfung war extrem schwierig.
653|Der Prozess dauert Jahre.
660|Das Mädchen lacht fröhlich.
683|Was ist gestern geschehen?
697|Er wählt den richtigen Weg.
726|Zuletzt sah ich ihn in der Stadt.
745|Der Apfel ist noch grün.
778|Zuvor hatte er angerufen.
780|Es ist schwierig, dennoch machbar.
781|Er wirft den Ball weit.
783|Das Projekt läuft seit einem Jahr.
793|Mein Bruder ist älter als ich.
794|Er beteiligt sich an der Diskussion.
805|Es war bloß ein Missverständnis.
806|Eine Klärung der Sache ist notwendig.
815|Sie ist finanziell unabhängig.
862|Die Ordnung muss eingehalten werden.
863|Russland ist das größte Land.
873|Er lächelt ihr freundlich zu.
875|Er überzeugt durch gute Argumente.
877|Er zeigt sich sehr menschlich.
895|Ein Bild hängt an der Wand.
905|Es dauert nur eine Sekunde.
908|Diese Lösung ist praktisch und nützlich.
932|Die Sonne scheint hell.
952|Er hat sich das Bein gebrochen.
1004|Sie trennte das Papier vom Plastik.
1013|Sport macht Spaß und hält fit.
1031|Erlauben Sie mir eine Frage?
1032|Er treibt Sport jeden Morgen.
1036|Er ist noch unterwegs.
1058|Die Ruhe im Wald tat ihm gut.
1077|Das Opfer wurde gerettet.
1126|Er kämpft bis zum Schluss.
1128|Er versprach, pünktlich zu sein.
1131|Er hebt die Kiste vom Boden.
1134|Die Masse drängte zum Ausgang.
1160|Er hielt sich das Ohr zu.
1165|Der Februar ist der kürzeste Monat.
1195|Er vertraut nur wenigen Menschen.
1283|Amerika ist ein großes Land.
1297|Der Oktober ist meist kühl.
1338|Die Nase lief ihm wegen der Erkältung.
1430|So ein Plan wäre wirklich sinnvoll.
1495|Er liebt britischen Humor.
1508|Der Hof ist voller Blumen.
1514|Er hätte ohnehin gewonnen.
1531|Er ist finanziell von ihnen abhängig.
1564|Naja, das könnte stimmen.
1626|Es wird sowieso nicht funktionieren.
1655|Das Feuer brannte lichterloh.
1701|Er hält das Auto an der Ampel an.
1731|Er weist den Weg zum Bahnhof.
1733|Das Haus brennt lichterloh.
1811|Er traf sie zufällig im Café.
1832|Er drehte den Schlüssel um.
1842|Der Schnee bedeckt die Straßen.
1848|Ich muss dich dringend sprechen.
1885|Er wandert gerne in den Bergen.
1953|Der Zahn schmerzt seit Tagen.
2008|Sie malt gern Landschaften.
2011|Er übt täglich auf der Gitarre.
2028|Er lädt die Kisten in den LKW.
2031|Der weibliche Vogel singt nicht.
2196|Er konnte seine Unschuld nachweisen.
2266|Sie sahen dem Spiel zu.
2372|Sie stritten sich um das Geld.
2470|Er grinst schelmisch nach der Frage.
2632|Wozu dient dieses Werkzeug?
2654|Der Fakt spricht für sich.
2687|Er geht dorthin, wo er gebraucht wird.
2794|Die Wut war deutlich spürbar.
2887|Die Schokolade ist sehr süß.
2889|Mein Kopf tut schrecklich weh.
2916|Er kommt gut mit allen aus.
2956|Dänisch ist schwer zu lernen.
3039|Das war eine peinliche Situation.
3049|Achtung, die Straße ist glatt!
3163|Er rutschte auf dem Eis aus.
3181|Er sieht jetzt erwachsen aus.
3298|Er fühlt sich unsicher bei der Prüfung.
3515|Wonach hast du gesucht?
4019|Die Kerze brennt ruhig im Dunkeln.
4049|Er tippt den Text schnell ein.
4053|Er macht mit der Arbeit weiter.
4151|Das Flugzeug hebt bald ab.
4281|Er blickt skeptisch auf die Zahlen.
4333|Ein Tropfen fiel ins Wasser.
4368|Der Pfeil traf ins Schwarze.
4390|Er hat sich in der Straße geirrt.
4452|Er hilft seinem behinderten Bruder.
4479|Er ist ihm überlegen im Schach.
4486|Er tröstet sie nach dem Verlust.
4497|Er kam sogleich zur Hilfe.
4616|Er legt das Buch auf den Tisch hin.
4785|Der Tisch glänzt nach dem Polieren.
4963|Er verzeiht ihm den Fehler.
4|Er ist in der Stadt.
10|Wir haben genug Zeit.
40|Ihr seid willkommen.
52|All das macht keinen Sinn.
61|Er läuft um das Haus.
74|Viel hat sich verändert.
86|Wir müssen jetzt wirklich gehen.
91|Ich habe zwei Hunde.
120|Das Beispiel zeigt es deutlich.
135|Er hat drei Äpfel gekauft.
155|Wir treffen uns einmal pro Woche.
168|Das Land ist weit und schön.
202|Er bringt das Buch zurück.
247|Er hat fast alles erledigt.
249|Die Stadt pulsiert vor Leben.
302|Das Bild hängt an der Wand.
327|Sie sieht heute besonders müde aus.
339|Der Platz ist noch frei.
387|Er hat zehn Äpfel gekauft.
437|Manchmal gehe ich spazieren.
444|Er erwartet eine Antwort.
449|Sie fühlt sich heute gut.
452|Oh, das wusste ich nicht!
501|Ich wünsche dir ebenfalls viel Glück.
532|Der Markt findet samstags statt.
547|Das Ergebnis stimmt.
561|Wir sehen uns bald wieder.
564|Er kauft sich ein neues Auto.
578|Die Menge jubelte lautstark.
603|Das ist meine persönliche Meinung.
610|Er ist sich gewiss, dass es klappt.
618|Wir wohnen schon lange hier.
621|Sie nimmt das Gespräch auf.
646|Die Partei gewann die Wahl.
687|Er bietet seine Hilfe an.
723|Dieser Punkt ist wesentlich für uns.
755|Die Präsentation nutzte viele Folien.
758|Der Lehrer erklärt die Aufgabe.
767|Kannst du bitte das Geld zählen?
786|Der Autor liest aus seinem Buch.
827|Das war ein schlimmer Fehler.
910|Er bindet die Krawatte geschickt.
1005|Er benötigt Hilfe bei der Aufgabe.
1076|Das war wiederum sehr klug.
1142|Er ist glücklich über das Ergebnis.
1149|Hallo, wie geht's dir?
1217|Er fasst den Entschluss, zu bleiben.
1234|Das neue Kleid fällt auf.
1347|Der November war dieses Jahr mild.
1361|Die Entscheidung ist nun offiziell.
1362|Die Farbe ist außen verblasst.
1375|Er litt sehr unter dem Leid.
1401|Das Netz fängt den Ball.
1425|Er reagiert rasch auf Fragen.
1443|Er begleitet sie nach Hause.
1447|Er gibt nicht so leicht auf.
1595|Er ist zufrieden mit der Arbeit.
1671|Mein Hals tut heute weh.
1745|Im Büro herrscht viel Betrieb.
1761|Das Knie schmerzt nach dem Sturz.
1793|Der Verband muss gewechselt werden.
1823|Der Amerikaner spricht Englisch.
1826|Spanien ist ein beliebtes Reiseziel.
1865|Die Brust hebt sich beim Atmen.
1878|Ah, das verstehe ich jetzt!
1881|Der Vertrag wurde endgültig geschlossen.
1904|Weshalb fragst du das?
1961|So eine Aufgabe ist fast unmöglich.
2024|Er beruhigt das weinende Kind.
2043|Die Medizin wirkt schnell.
2116|Ihre Lippe ist geschwollen.
2126|Er fängt den Ball geschickt.
2162|Sie meldet sich zum Kurs an.
2192|Das Boot schaukelt auf den Wellen.
2243|Arabisch ist schwer zu lernen.
2256|Die E-Mail ist angekommen.
2264|Er hat den Mut, die Wahrheit zu sagen.
2267|Er bevorzugt Tee statt Kaffee.
2268|Hierzu gibt es keine weiteren Fragen.
2287|Das war eine bedeutende Entdeckung.
2560|Der Sand ist warm und fein.
2621|Er beugt sich über das Buch.
2717|Willst du mitkommen?
2755|Der Feind rückte näher.
2792|Wir treffen uns nachher im Café.
2870|Das Gras ist grün und saftig.
2943|Ich bin heute früh aufgewacht.
2974|Das Zelt steht am See.
3027|Sie ist katholisch aufgewachsen.
3093|Er neigt dazu, zu spät zu kommen.
3141|Der Iran liegt im Nahen Osten.
3144|Er lenkt das Auto sicher.
3162|Mitunter macht er Fehler.
3165|Das Zeug liegt überall herum.
3171|Siehe die Anmerkung unten.
3190|Sie ist im achten Monat schwanger.
3229|Der Export ist gestiegen.
3368|Die Nachricht verwirrte ihn sehr.
3468|Die Unruhe im Saal wächst.
3520|Er agiert immer ruhig und besonnen.
3627|Der Papst besucht das Land.
3646|Bitte kommen Sie herein!
3750|Das Gemüse ist frisch vom Markt.
3757|Die Blumen blühen im Frühling.
3795|Die Lüge wurde schnell entlarvt.
3926|Das kam völlig unerwartet.
4027|Er hat starke Bedenken geäußert.
4029|Er wurde kaltblütig ermordet.
4054|Der Dieb haut schnell ab.
4058|Er kennt sich hier gut aus.
4066|Im Camp herrscht viel Trubel.
4092|Wir sind entfernt verwandt.
4123|Sie schimpft über den Lärm.
4233|Die Glocke läutet zur vollen Stunde.
4238|Der Topf kocht über.
4353|In der Hast vergaß er alles.
4363|Der Genosse steht treu zur Partei.
4364|Öh, ich weiß nicht genau.
4570|Der Zug fährt pünktlich los.
4577|Er beleidigt niemanden ohne Grund.
4586|Wir müssen anderswo suchen.
4631|Es ist schwer, gleichwohl möglich.
4703|Er ist fähig, die Aufgabe zu lösen.
4792|Der Knopf ist abgegangen.
4797|Er setzt sich auf den Stuhl.
4885|Das Besteck ist aus Silber.
5054|Das ist eine simpel Lösung.
5083|Der Ofen ist heiß und glüht.
11|Sie kommt heute nicht.
32|Er kam, als es dunkel war.
47|Aber das ist wichtig!
48|Man sollte mehr lesen.
53|Er kommt aus Berlin.
111|Unser Haus ist das Größte.
127|Ich habe etwas gefunden.
128|Ich habe es selbst gemacht.
147|Beide sind angekommen.
172|Natürlich komme ich mit.
180|Vielleicht hast du recht.
198|Er ist gerade angekommen.
200|Wir haben lange miteinander gesprochen.
201|Er führt die Gruppe.
207|Ich mag dieses Lied sehr.
218|Der Weg war wirklich kurz.
224|Etwa so könnte es gehen.
245|Er hat vier Bücher gekauft.
255|Das Problem ist gelöst.
260|Er fährt zur Arbeit.
267|Er hat ein blaues Auge.
268|Er kommt oft zu spät.
271|Er hilft sogar Fremden.
310|Er ist wohl zu Hause.
311|Das wird wohl nicht leicht werden.
376|Ich habe gestern zu viel gegessen.
414|Die Schule beginnt um 8 Uhr.
435|Das hat keinen Sinn.
463|Das Buch erscheint morgen.
491|Er beschreibt den Vorfall.
504|Er ändert seine Meinung.
510|Endlich haben wir gewonnen!
516|Das Buch gehört eigentlich mir.
528|Der Schnee ist blendend weiß.
593|Ich habe das ebenso verstanden.
599|Sein Erfolg war beeindruckend.
609|Er hat die Chance verpasst.
612|Die Kunst des Malens fasziniert mich.
644|Er besitzt ein Haus.
648|Er hängt das Bild auf.
662|Er verhält sich ruhig.
672|Er schlägt den Ball weit.
678|Die Erfahrung zählt.
679|Der Patient schläft.
685|Wie willst du das Problem lösen?
728|Im Zimmer steht ein Bett.
777|Er beschäftigt sich mit dem Thema.
785|Er reagiert schnell.
787|Er kriegt, was er will.
798|Das Projekt war sehr erfolgreich.
802|Die Natur ist überwältigend.
813|Er kam deswegen zu spät.
814|Er spürt den Schmerz.
832|Sein Anteil ist groß.
836|Der Sommer war sehr heiß.
852|Die Meinung ist geteilt.
868|Die Region ist touristisch geprägt.
869|Der Sonntag ist ruhig.
888|Gestern war es kalt.
909|Die Gefahr ist nicht zu unterschätzen.
967|Der Verein hat viele Mitglieder.
982|Die Nachricht überrascht ihn.
989|Es bleibt nichts übrig.
992|Er drückt den Knopf.
1029|Die Klasse schreibt einen Test.
1034|Er musste früh aufstehen.
1039|Er gerät in Schwierigkeiten.
1075|Er meldet sich freiwillig.
1170|Er hat viel Macht in der Firma.
1187|Er hat einen neuen Job gefunden.
1258|Er erhebt seine Stimme.
1278|Italien ist ein schönes Land.
1295|Er stößt die Tür auf.
1316|Äh, ich bin mir nicht sicher.
1344|Das Blatt hat sich gewendet.
1388|Der Film endet gleich.
1412|Er schießt den Ball ins Tor.
1458|Er reist ins Ausland.
1509|Der Polizist regelte den Verkehr.
1584|Er hat elf Punkte erzielt.
1608|Er wendet das Blatt.
1641|Der Bus kommt um acht Uhr.
1692|Sie hat den Preis deutlich gesenkt.
1693|Er behält das Geheimnis für sich.
1712|Der Unterricht fällt heute aus.
1714|Sie drängten zur Tür hinaus.
1785|Die Branche wächst schnell.
1815|Das Lied ist ein Ohrwurm.
1846|Sämtliche Tickets sind ausverkauft.
1872|Das Fleisch ist gut gewürzt.
1889|Er orientiert sich nach Süden.
1929|Die Sterne leuchten hell.
1968|Er rückt den Stuhl näher.
2030|Er wagt den Sprung ins Ungewisse.
2045|Die Sonne geht früh auf.
2224|Der Park ist voller Blumen.
2230|Mein Bauch fühlt sich komisch an.
2234|Er rührt den Kaffee um.
2257|Er macht bei der Challenge mit.
2292|Der Zufall führte uns zusammen.
2321|In der Halle herrscht Ruhe.
2359|Er atmet tief durch.
2399|Er wäscht seine Hände.
2476|Das Rad dreht sich schnell.
2694|Mein Magen knurrt vor Hunger.
2725|Wir decken den Tisch für das Abendessen.
2775|Der Hafen ist voller Schiffe.
2814|Komm schnell hierher!
3021|Der Fleck auf dem Hemd ist groß.
3028|Sein Verhalten war wirklich merkwürdig.
3053|Wir brechen morgen früh auf.
3058|Die Wiese blüht im Frühling.
3060|Sie hat ein ausgeprägtes Talent gezeigt.
3096|Ich war vorhin noch dort.
3127|Wir sind uns darüber einig.
3210|Er kam rechtzeitig zur Sitzung.
3230|Er kehrt die Blätter zusammen.
3296|Er presst den Saft aus der Orange.
3325|Er wird wegen Betrugs angeklagt.
3344|Norwegen hat schöne Fjorde.
3382|Er war maßgeblich am Erfolg beteiligt.
3483|Der Schein trügt manchmal.
3560|Er kam die Treppe herunter.
3615|Die Wüste ist trocken.
3745|Der Block ist vollgeschrieben.
3874|Er war unglücklich über den Verlust.
3979|Das Verhalten irritiert mich.
3988|Das Gelenk schmerzt beim Bewegen.
4004|Er fühlte den inneren Zwang.
4033|Der Turm ragt in den Himmel.
4048|Der Tanz begann um Mitternacht.
4089|Um Mitternacht ist es still.
4098|Der Luftballon ist geplatzt.
4152|Solche Probleme sind leider alltäglich.
4175|Der Schweiß läuft ihm von der Stirn.
4189|Er bleibt in jeder Situation gelassen.
4197|Das Konzert geht gleich los.
4207|Die Hüfte schmerzt beim Gehen.
4237|Der Hund streift durch den Wald.
4284|Das Problem liegt woanders.
4320|Er ist der Favorit im Rennen.
4354|Er geht die Treppe hinauf.
4412|Ich musste zur Arbeit eilen.
4415|Der Lärm war die reinste Hölle.
4470|Er würdigt ihre Leistung.
4574|Die Polizei hat ihn überführt.
4623|Der Rasen wurde frisch gemäht.
4734|Sie ist evangelisch getauft.
4877|Er gießt die Blumen.
4961|Er schwört, die Wahrheit zu sagen.
4998|Der Irrtum wurde schnell erkannt.
5004|Der Angeklagte ist unschuldig.
5028|Er lehnt sich an den Tresen.
5035|Der Priester spricht zur Gemeinde.
5050|Er wurde jüngst befördert.
5090|Der Zorn war ihm deutlich anzusehen.
33|Er arbeitet als Lehrer.
55|Ich habe nur noch zehn Minuten.
56|Ich wollte dir etwas Wichtiges sagen.
67|Er gibt mir das Buch.
70|Ich brauche mehr Informationen.
83|Er kommt immer zu spät.
101|Ich weiß die Antwort.
151|Er kam ohne Vorwarnung.
164|Das ist einfach unglaublich!
229|Er war noch nie hier.
235|Er nennt ihn beim Namen.
237|Er zieht an dem Seil.
238|Er hat das letzte Wort.
275|Deshalb komme ich nicht.
287|Das Paar tanzt elegant.
315|Bist du dir wirklich sicher?
324|Ich habe fünf Finger.
348|Rund 50 Gäste sind gekommen.
357|Ich lese jeden Abend ein Buch.
360|Er betrachtet jeden Fall einzeln.
383|Die Familie sitzt am Tisch.
384|Jemand hat geklopft.
390|Sonst ist alles in Ordnung.
392|Er hilft seinem Freund.
393|Der Bereich ist abgesperrt.
407|Er legt das Buch auf den Tisch.
413|Der Moment ist perfekt für ein Foto.
420|Er stellt die Idee vor.
489|Manche glauben das nicht.
493|Die beiden sehen sich ähnlich.
497|Bisher war alles ruhig.
527|Bitte komm rechtzeitig.
559|Die Wohnung ist neu renoviert.
565|Wir sollten uns das genauer ansehen.
572|Der Gott wird verehrt.
600|Zudem gibt es neue Regeln.
624|Er merkt den Fehler.
649|Er berichtet von dem Vorfall.
657|Er fordert mehr Gehalt.
658|Er studiert Medizin.
664|Es ist ziemlich spät geworden.
674|Jedenfalls werde ich da sein.
681|Der Morgen ist ruhig und kühl.
706|Er hat acht Stunden gearbeitet.
734|Der innere Kreis ist wichtig.
752|Er hofft auf gute Nachrichten.
757|Die Tochter besucht ihre Eltern.
770|Österreich liegt in Europa.
788|Er kommt ca. um 8 Uhr.
