|part_of_speech|word_de|sentence_de
98|adj|gut|Das ist gut.
1551|adj|arm|Er ist arm.
161|pron|dabei|Er ist dabei.
220|adj|stark|Er ist stark.
625|adj|fest|Das ist fest.
689|adj|okay|Das ist okay.
800|adj|wahr|Das ist wahr.
855|adj|aktiv|Er ist aktiv.
1828|der|der Jude|Er ist Jude.
4494|adj|naiv|Er ist naiv.
556|adv|genug|Das ist genug.
927|adj|fremd|Das ist fremd.
1397|adj|krank|Er ist krank.
1426|adj|real|Das ist real.
4590|der|der Mist|Das ist Mist.
246|adj|besser|Das ist besser.
703|adj|normal|Das ist normal.
732|adj|selten|Das ist selten.
810|adj|privat|Das ist privat.
1221|der|der Juni|Juni ist warm.
1308|adj|ideal|Das ist ideal.
2096|adj|exakt|Das ist exakt.
3083|adj|locker|Er ist locker.
7|art|ein|Ein Apfel ist rot.
179|adj|wichtig|Das ist wichtig.
219|adj|richtig|Das ist richtig.
415|pron|darin, drin, drinnen|Etwas ist darin.
626|adj|aktuell|Das ist aktuell.
629|adj|relativ|Das ist relativ.
651|adj|eng|Der Weg ist eng.
884|adj|negativ|Das ist negativ.
885|adj|zentral|Das ist zentral.
897|adj|konkret|Das ist konkret.
1668|adj|ehrlich|Er ist ehrlich.
1827|adv|ab|Der Hut ist ab.
1834|adj|traurig|Er ist traurig.
3508|die|die CD|Die CD ist neu.
226|das|das Ende|Das Ende ist nah.
265|der|der Weg|Der Weg ist lang.
276|adj|weit|Der Weg ist weit.
352|das|das Buch|Das Buch ist neu.
507|die|die Idee|Die Idee ist gut.
533|adj|rot|Die Rose ist rot.
694|das|das Foto|Das Foto ist alt.
696|pron|derselbe, dieselbe, dasselbe|Das ist dasselbe.
792|adj|offenbar|Das ist offenbar.
919|das|das Blut|Das Blut ist rot.
959|adj|national|Das ist national.
1003|adv|irgendwo|Er ist irgendwo.
1181|adj|typisch|Das ist typisch.
1859|die|die DNA (DNS, Desoxyribonukleins채ure)|DNA ist wichtig.
1994|adj|korrekt|Das ist korrekt.
2559|adj|illegal|Das ist illegal.
3176|adj|diskret|Das ist diskret.
3774|adj|schuldig|Er ist schuldig.
4410|adj|schlank|Sie ist schlank.
5082|das|das Obst|Obst ist gesund.
148|adj|hoch|Das Haus ist hoch.
286|der|der Doktor|Der Doktor ist da.
347|adj|rund|Die Erde ist rund.
359|die|die Form|Die Form ist rund.
443|adj|voll|Das Glas ist voll.
473|adv|oben|Das Haus ist oben.
488|der|der Satz|Der Satz ist klar.
514|die|die Kraft|Die Kraft ist weg.
529|der|der Text|Der Text ist lang.
571|adj|tot|Der Vogel ist tot.
638|adj|schwierig|Das ist schwierig.
639|das|das Gut|Das Gut ist teuer.
682|der|der Arzt|Der Arzt ist hier.
748|adj|echt|Das Bild ist echt.
791|adj|hart|Das Holz ist hart.
806|adj|notwendig|Das ist notwendig.
812|das|das Haar|Ihr Haar ist lang.
848|die|die Erde|Die Erde ist rund.
877|adj|menschlich|Er ist menschlich.
908|adj|praktisch|Das ist praktisch.
920|das|das Meer|Das Meer ist blau.
942|adj|leer|Das Glas ist leer.
1022|der|der Plan|Der Plan ist gut.
1036|adv|unterwegs|Er ist unterwegs.
1083|der|der Baum|Der Baum ist alt.
1095|das|das Band|Das Band ist rot.
1165|der|der Februar|Februar ist kurz.
1355|adj|warm|Der Tee ist warm.
1392|der|der See|Der See ist klar.
1430|adj|sinnvoll|Das ist sinnvoll.
1495|adj|britisch|Sie ist britisch.
1744|der|der Ton|Der Ton ist klar.
1848|adj|dringend|Das ist dringend.
1894|das|das Dach|Das Dach ist rot.
1956|das|das Eis|Das Eis ist kalt.
2031|adj|weiblich|Sie ist weiblich.
2270|der|der Ruf|Sein Ruf ist gut.
2669|die|die Bar|Die Bar ist voll.
3047|die|die Note|Die Note ist gut.
3181|adj|erwachsen|Er ist erwachsen.
3298|adj|unsicher|Sie ist unsicher.
3307|das|das Grab|Das Grab ist alt.
3366|die|die Rose|Die Rose ist rot.
4281|adj|skeptisch|Er ist skeptisch.
4337|die|die Burg|Die Burg ist alt.
4452|adj|behindert|Er ist behindert.
4502|die|die Box|Die Box ist laut.
69|pron|mein|Mein Hund ist krank.
71|das|das Jahr|Das Jahr ist vorbei.
123|adj|lang|Der Fluss ist lang.
152|der|der Mann|Der Mann ist stark.
155|adv|einmal|Einmal ist keinmal.
298|der|der Grund|Der Grund ist klar.
388|der|der Preis|Der Preis ist hoch.
408|adj|direkt|Der Weg ist direkt.
492|das|das Licht|Das Licht ist hell.
503|die|die Grenze|Die Grenze ist nah.
567|die|die Musik|Die Musik ist laut.
587|der|der Tisch|Der Tisch ist rund.
594|der|der Boden|Der Boden ist kalt.
613|die|die Lage|Die Lage ist ernst.
723|adj|wesentlich|Das ist wesentlich.
771|das|das Modell|Das Modell ist neu.
773|adv|unten|Der Ball ist unten.
801|die|die Reihe|Die Reihe ist lang.
838|adj|laut|Die Musik ist laut.
906|der|der Brief|Der Brief ist lang.
924|der|der Mund|Der Mund ist offen.
935|der|der Kampf|Der Kampf ist hart.
960|die|die Kirche|Die Kirche ist alt.
968|das|das Atom|Ein Atom ist klein.
1002|der|der Berg|Der Berg ist hoch.
1060|adj|ruhig|Der See ist ruhig.
1146|adj|dick|Das Buch ist dick.
1204|der|der Papa|Der Papa ist nett.
1249|der|der Wagen|Der Wagen ist neu.
1279|der|der Kern|Der Kern ist hart.
1347|der|der November|November ist kalt.
1361|adj|offiziell|Das ist offiziell.
1468|der|der Strom|Der Strom ist weg.
1644|adj|nett|Der Hund ist nett.
1652|adj|fern|Das Haus ist fern.
1679|der|der Bau|Der Bau ist teuer.
1760|der|der Schuh|Der Schuh ist neu.
1823|der|der Amerikaner|Er ist Amerikaner.
1862|das|das Kleid|Das Kleid ist rot.
1864|der|der Ball|Der Ball ist rund.
1943|das|das Loch|Das Loch ist tief.
2050|der|der Zins|Der Zins ist hoch.
2158|die|die Kurve|Die Kurve ist eng.
2264|der|der Mut|Mut ist notwendig.
2287|adj|bedeutend|Das ist bedeutend.
2305|das|das Holz|Das Holz ist hart.
2744|der|der Flur|Der Flur ist lang.
2822|der|der Saal|Der Saal ist voll.
2839|adj|steil|Der Weg ist steil.
3027|adj|katholisch|Er ist katholisch.
3030|die|die Kuh|Die Kuh ist braun.
3190|adj|schwanger|Sie ist schwanger.
3215|der|der Turm|Der Turm ist hoch.
3320|der|der Kerl|Der Kerl ist nett.
3379|der|der Zaun|Der Zaun ist hoch.
3512|adj|treu|Der Hund ist treu.
3590|der|der Apfel|Der Apfel ist rot.
3651|der|der Rock|Der Rock ist kurz.
3722|der|der PC|Der PC ist kaputt.
3964|das|das Heft|Das Heft ist voll.
4012|die|die Oper|Die Oper ist lang.
4378|die|die Gasse|Die Gasse ist eng.
4583|der|der Stab|Der Stab ist lang.
4670|das|das TV|Das TV ist kaputt.
4776|die|die Puppe|Die Puppe ist alt.
4968|das|das Fass|Das Fass ist voll.
5106|die|die Ruine|Die Ruine ist alt.
115|der|der Mensch|Der Mensch ist klug.
285|adj|klar|Das Wasser ist klar.
294|das|das Wasser|Das Wasser ist kalt.
306|adj|schwer|Das Buch ist schwer.
412|die|die Person|Die Person ist nett.
425|das|das Ding|Das Ding ist kaputt.
478|das|das Produkt|Das Produkt ist neu.
498|adj|tief|Das Wasser ist tief.
544|die|die Luft|Die Luft ist frisch.
584|adj|langsam|Der Zug ist langsam.
589|verb|bieten, bietet, bot, hat geboten|Das Angebot ist gut.
598|der|der Tod|Der Tod ist traurig.
650|die|die Zelle|Die Zelle ist klein.
654|der|der Sohn|Mein Sohn ist klein.
721|das|das Bett|Das Bett ist bequem.
727|adj|rein|Das Wasser ist rein.
769|adj|dunkel|Der Raum ist dunkel.
782|das|das Angebot|Das Angebot ist gut.
798|adj|erfolgreich|Sie ist erfolgreich.
799|der|der Zustand|Der Zustand ist gut.
811|adj|modern|Das Haus ist modern.
822|der|der Stoff|Der Stoff ist teuer.
837|das|das Hotel|Das Hotel ist teuer.
861|die|die Methode|Die Methode ist neu.
869|der|der Sonntag|Sonntag ist Ruhetag.
886|die|die Ebene|Die Ebene ist flach.
912|die|die Liebe|Die Liebe ist stark.
921|die|die Anzahl|Die Anzahl ist hoch.
955|adj|kalt|Das Wasser ist kalt.
957|der|der Himmel|Der Himmel ist blau.
961|adv|links|Die Katze ist links.
1008|die|die Sicht|Die Sicht ist klar.
1018|adj|teuer|Das Auto ist teuer.
1027|das|das Dorf|Das Dorf ist klein.
1199|der|der Bund|Der Bund ist stark.
1222|die|die Haut|Die Haut ist weich.
1278|das|Italien|Italien ist sonnig.
1282|der|der Osten, Ost-|Der Osten ist weit.
1337|die|die Welle|Die Welle ist hoch.
1340|adj|dicht|Der Wald ist dicht.
1363|der|der Kreis|Der Kreis ist rund.
1517|die|die Pause|Die Pause ist kurz.
1522|adj|gelb|Die Blume ist gelb.
1624|das|das Signal|Das Signal ist rot.
1685|der|der Zweck|Der Zweck ist klar.
1719|das|das Bad|Das Bad ist sauber.
1741|die|die Mauer|Die Mauer ist hoch.
1758|adj|fein|Das Essen ist fein.
1872|das|das Fleisch|Fleisch ist lecker.
1874|die|die Liste|Die Liste ist lang.
1882|adj|ewig|Die Liebe ist ewig.
1900|die|die Falle|Die Falle ist leer.
2034|die|die Decke|Die Decke ist hoch.
2061|adj|nackt|Das Baby ist nackt.
2062|die|die Ware|Die Ware ist teuer.
2082|das|das Ei|Das Ei ist gekocht.
2150|der|der Rang|Sein Rang ist hoch.
2170|die|die GmbH|Die GmbH ist klein.
2235|der|der Trend|Der Trend ist klar.
2259|die|die Oma|Meine Oma ist nett.
2475|die|die Kugel|Die Kugel ist rund.
2486|die|die Tonne|Die Tonne ist voll.
2597|der|der Kanal|Der Kanal ist tief.
2767|adj|blind|Der Mann ist blind.
2804|das|das Ufer|Das Ufer ist ruhig.
2977|die|die Brille|Die Brille ist neu.
3213|adj|nass|Der Boden ist nass.
3251|der|der Hass|Der Hass ist stark.
3295|der|der Stamm|Der Stamm ist dick.
3334|die|die Linse|Die Linse ist klar.
3374|der|der Leib|Der Leib ist stark.
3387|die|die Jacke|Die Jacke ist warm.
3406|adj|fett|Das Essen ist fett.
3462|das|das Konto|Das Konto ist leer.
3563|die|die Maus|Die Maus ist klein.
3588|die|die Miete|Die Miete ist hoch.
3618|die|die Tasse|Die Tasse ist voll.
3741|der|der Hang|Der Hang ist steil.
3771|der|der Prinz|Der Prinz ist jung.
3994|der|der LKW (Lastkraftwagen)|Der LKW ist schwer.
4028|der|der Cent|Ein Cent ist wenig.
4088|das|das Lokal|Das Lokal ist voll.
4089|die|die Mitternacht|Es ist Mitternacht.
4144|der|der Ozean|Der Ozean ist tief.
4246|die|die Lampe|Die Lampe ist hell.
4299|der|der Faden|Der Faden ist lang.
4459|der|der Knopf|Der Knopf ist lose.
4472|der|der Abfall|Der Abfall ist weg.
4607|die|die Logik|Die Logik ist klar.
4618|der, das|der Laptop|Der Laptop ist neu.
4658|der|der Tempel|Der Tempel ist alt.
4678|der|der Mythos|Der Mythos ist alt.
4734|adj|evangelisch|Er ist evangelisch.
4758|das|das Klo|Das Klo ist sauber.
5004|adj|unschuldig|Sie ist unschuldig.
5027|das|das Seil|Das Seil ist stark.
112|pron|jede (r, s)|Jeder Tag ist anders.
197|adj|gerade|Die Linie ist gerade.
248|adj|schnell|Das Auto ist schnell.
278|der|der Vater|Mein Vater ist stark.
304|der|der Name|Ihr Name ist bekannt.
372|adj|bekannt|Das Lied ist bekannt.
379|die|die Nacht|Die Nacht ist dunkel.
416|das|das Auto|Das Auto ist schnell.
424|die|die Gruppe|Die Gruppe ist klein.
441|das|das Ergebnis|Das Ergebnis ist gut.
539|das|das Kapitel|Das Kapitel ist kurz.
633|der|der Krieg|Der Krieg ist vorbei.
652|die|die Kultur|Die Kultur ist reich.
699|adj|knapp|Das Wasser ist knapp.
744|das|das Werk|Das Werk ist bekannt.
845|der|der Einsatz|Der Einsatz ist hoch.
864|die|die Wahl|Die Wahl ist wichtig.
880|die|die Freiheit|Freiheit ist wichtig.
994|die|die Linie|Die Linie ist gerade.
1014|das|das BGB (B체rgerliches Gesetzbuch)|Das BGB ist wichtig.
1016|adj|blau|Der Himmel ist blau.
1035|der|der Absatz|Der Absatz ist lang.
1040|adj|toll|Das Wetter ist toll.
1044|der|der Chef|Der Chef ist streng.
1046|das|das Risiko|Das Risiko ist hoch.
1100|der|der Wald|Der Wald ist dunkel.
1101|die|die Insel|Die Insel ist klein.
1102|der|der Schluss|Der Schluss ist nah.
1109|der|der Ansatz|Sein Ansatz ist gut.
1122|adj|ernst|Das Thema ist ernst.
1124|der|der Januar|Der Januar ist kalt.
1180|die|die Quelle|Die Quelle ist rein.
1212|der|der Gang|Der Gang ist schmal.
1263|die|die Spur|Die Spur ist frisch.
1277|der|der Rand|Der Rand ist scharf.
1280|der|der Winter|Der Winter ist kalt.
1334|adj|frisch|Das Brot ist frisch.
1365|adj|digital|Die Uhr ist digital.
1452|die|die Ecke|Die Ecke ist dunkel.
1473|die|die Union|Die Union ist stark.
1487|adj|hell|Das Zimmer ist hell.
1502|der|der Geist|Der Geist ist stark.
1550|die|die Karte|Die Karte ist teuer.
1577|adj|stabil|Das Haus ist stabil.
1602|die|die Steuer|Die Steuer ist hoch.
1628|der|der Kurs|Der Kurs ist schwer.
1630|der|der Service|Der Service ist gut.
1639|adj|grau|Der Himmel ist grau.
1756|das|das Ion|Das Ion ist geladen.
1757|der|der Laden|Der Laden ist offen.
1769|der|der Fluss|Der Fluss ist breit.
1775|das|das Handy|Das Handy ist teuer.
1808|die|die Haltung|Die Haltung ist gut.
1820|adj|billig|Das Buch ist billig.
1852|der|der Test|Der Test ist schwer.
1879|das|das Drittel|Ein Drittel ist weg.
1890|adj|schmal|Das Buch ist schmal.
1899|adj|bunt|Der Himmel ist bunt.
1907|das|das Niveau|Das Niveau ist hoch.
1912|das|das Gen|Das Gen ist mutiert.
1914|der|der Onkel|Mein Onkel ist Arzt.
1948|der|der Beweis|Der Beweis ist klar.
1969|der|der Anwalt|Der Anwalt ist hier.
1989|das|das Schloss|Das Schloss ist alt.
2010|die|die Seele|Die Seele ist ruhig.
2033|die|die Treppe|Die Treppe ist lang.
2107|adj|golden|Der Ring ist golden.
2155|die|die Schrift|Die Schrift ist alt.
2178|das|das Brot|Das Brot ist frisch.
2219|der|der Betrag|Der Betrag ist hoch.
2247|die|die City|Die City ist belebt.
2284|adj|schrecklich|Das ist schrecklich.
2293|die|die Armee|Die Armee ist stark.
2506|der|der Stil|Der Stil ist modern.
2523|adj|flach|Der Tisch ist flach.
2736|die|die Faser|Die Faser ist stark.
2745|das|das Hemd|Das Hemd ist sauber.
2853|der|der Hut|Der Hut ist elegant.
2947|die|die Last|Die Last ist schwer.
2953|die|die Version|Die Version ist neu.
3078|der|der Mantel|Der Mantel ist warm.
3126|das|das Symptom|Das Symptom ist neu.
3146|adj|cool|Diese Idee ist cool.
3170|die|die Platte|Die Platte ist rund.
3172|adj|verheiratet|Sie ist verheiratet.
3245|die|die Grafik|Die Grafik ist bunt.
3314|der|der Pilz|Der Pilz ist giftig.
3337|der|der Posten|Der Posten ist frei.
3354|der|der Bescheid|Der Bescheid ist da.
3398|der|der Ertrag|Der Ertrag ist hoch.
3423|die|die Frucht|Die Frucht ist reif.
3477|der|der Anzug|Der Anzug ist teuer.
3526|der|der Helfer|Der Helfer ist hier.
3587|adj|absurd|Die Idee ist absurd.
4001|das|das Becken|Das Becken ist leer.
4042|das|das Examen|Das Examen ist bald.
4045|die|die Schale|Die Schale ist voll.
4062|das|das Rathaus|Das Rathaus ist alt.
4102|der|der Strahl|Der Strahl ist hell.
4136|das|das Tuch|Das Tuch ist sauber.
4158|der|der Tunnel|Der Tunnel ist lang.
4185|der|der Keks|Der Keks ist lecker.
4293|der|der Sack|Der Sack ist schwer.
4319|die|die Fassade|Die Fassade ist neu.
4321|das|das Plakat|Das Plakat ist bunt.
4357|adj|mild|Das Wetter ist mild.
4420|der|der Zwerg|Der Zwerg ist klein.
4432|die|die Malerei|Die Malerei ist alt.
4529|adj|verbal|Das Wort ist verbal.
4539|adj|kommunikativ|Er ist kommunikativ.
4582|adj|reif|Die Frucht ist reif.
4602|adj|witzig|Das Buch ist witzig.
4663|adj|giftig|Das Tier ist giftig.
4672|die|die Dusche|Die Dusche ist kalt.
4687|der|der Riese|Der Riese ist stark.
4737|adj|nachdenklich|Er ist nachdenklich.
4753|adj|diplomatisch|Er ist diplomatisch.
5051|die|die Kopie|Die Kopie ist genau.
5057|adj|uralt|Die Stadt ist uralt.
192|der|der Herr|Herr Schmidt ist nett.
253|die|die Arbeit|Die Arbeit ist schwer.
263|die|die Mutter|Meine Mutter ist hier.
290|das|das Recht|Das Recht ist wichtig.
380|der|der Platz|Der Platz ist besetzt.
395|der|der Ort|Der Ort ist malerisch.
440|die|die Rolle|Die Rolle ist wichtig.
461|die|die Funktion|Die Funktion ist klar.
474|die|die Richtung|Die Richtung ist klar.
483|der|der Anfang|Der Anfang ist schwer.
496|der|der Kollege|Mein Kollege ist nett.
530|adj|schwarz|Die Katze ist schwarz.
562|adj|gering|Das Risiko ist gering.
737|das|das Fenster|Das Fenster ist offen.
762|das|das Element|Ein Element ist klein.
819|die|die Einheit|Die Einheit ist stark.
843|adj|niedrig|Der Preis ist niedrig.
871|die|die Nummer|Meine Nummer ist eins.
917|die|die Wirkung|Die Wirkung ist stark.
980|die|die Bindung|Die Bindung ist stark.
1009|der|der Dollar|Ein Dollar ist wenig.
1012|die|die Position|Die Position ist gut.
1158|das|das Theater|Das Theater ist voll.
1229|das|das Zeichen|Das Zeichen ist klar.
1255|der|der Stein|Der Stein ist schwer.
1312|adj|linear|Die Linie ist linear.
1326|der|der Computer|Der Computer ist neu.
1373|der|der Kaffee|Der Kaffee ist stark.
1376|adj|still|Das Zimmer ist still.
1532|die|die Strecke|Die Strecke ist lang.
1552|die|die Krise|Die Krise ist vorbei.
1611|der|der Gegner|Der Gegner ist stark.
1653|die|die Gegend|Die Gegend ist ruhig.
1683|die|die Flasche|Die Flasche ist leer.
1729|der|der Wille|Sein Wille ist stark.
1743|der|der Stuhl|Der Stuhl ist bequem.
1803|das|das Fahrzeug|Das Fahrzeug ist neu.
1807|adj|erforderlich|Das ist erforderlich.
1819|die|die Auflage|Die Auflage ist hoch.
1854|adj|super|Das Wetter ist super.
1925|die|die Ausgabe|Die Ausgabe ist hoch.
1955|adj|beliebt|Das Buch ist beliebt.
1957|adj|komisch|Der Witz ist komisch.
2042|der|der Fisch|Der Fisch ist frisch.
2046|das|das Video|Das Video ist lustig.
2146|das|das Motiv|Das Motiv ist unklar.
2156|die|die Silbe|Die Silbe ist betont.
2197|die|die Wolke|Die Wolke ist dunkel.
2285|adj|weich|Das Kissen ist weich.
2327|der|der Lohn|Der Lohn ist niedrig.
2360|die|die Milch|Die Milch ist frisch.
2494|der|der Schnitt|Der Schnitt ist tief.
2731|der|der Griff|Der Griff ist kaputt.
3054|das|das Labor|Das Labor ist sauber.
3066|das, die (pl)|das Weihnachten|Weihnachten ist bald.
3070|das|das Schwein|Das Schwein ist rosa.
3079|die|die Prognose|Die Prognose ist gut.
3094|die|die Rente|Die Rente ist sicher.
3188|der|der Kanton|Der Kanton ist klein.
3191|der|der Status|Der Status ist aktiv.
3248|die|die Software|Die Software ist neu.
3262|adj|feucht|Der Boden ist feucht.
3264|die|die Lunge|Die Lunge ist gesund.
3289|adj|herrlich|Der Tag ist herrlich.
3303|die|die Kiste|Die Kiste ist schwer.
3329|die|die Varianz|Die Varianz ist hoch.
3384|die|die Spalte|Die Spalte ist breit.
3416|der|der Athlet|Der Athlet ist stark.
3433|die|die Vorgabe|Die Vorgabe ist klar.
3458|die|die Kammer|Die Kammer ist klein.
3473|der|der Song|Der Song ist bekannt.
3488|die|die Front|Die Front ist stabil.
3591|adj|autonom|Das Auto ist autonom.
3749|das|das Budget|Das Budget ist knapp.
3801|adj|harmlos|Der Hund ist harmlos.
3879|die|die Feder|Die Feder ist leicht.
3910|die|die Vernunft|Vernunft ist wichtig.
3954|adj|mutig|Der Soldat ist mutig.
3957|die|die Tafel|Die Tafel ist sauber.
3959|die|die Uniform|Die Uniform ist blau.
3983|das|das Neuron|Das Neuron ist aktiv.
4003|adj|zart|Das Fleisch ist zart.
4025|die|die Wurst|Die Wurst ist frisch.
4056|die|die Abwehr|Die Abwehr ist stark.
4190|adj|live|Die Sendung ist live.
4367|das|das Hirn|Das Hirn ist komplex.
4405|der|der Stall|Der Stall ist sauber.
4407|die|die Bibel|Die Bibel ist heilig.
4426|adj|homogen|Das Team ist homogen.
4463|die|die Siedlung|Die Siedlung ist alt.
4491|das|das Handwerk|Das Handwerk ist alt.
4541|adj|letzterer, letztere, letzteres|Letzterer ist besser.
4543|die|die Passage|Die Passage ist lang.
4589|adj|hilflos|Das Kind ist hilflos.
4632|die|die Kabine|Die Kabine ist klein.
4950|das|das Getreide|Getreide ist wichtig.
4954|der|der Abgrund|Der Abgrund ist tief.
4986|der|der Reiter|Der Reiter ist mutig.
5000|das|das Kissen|Das Kissen ist weich.
5024|adj|nominal|Der Wert ist nominal.
5034|das|das Modul|Das Modul ist defekt.
5069|die|die Skulptur|Die Skulptur ist alt.
305|die|die Aufgabe|Die Aufgabe ist schwer.
399|die|die Stelle|Die Stelle ist perfekt.
486|adj|sozial|Das Problem ist sozial.
531|verb|sterben, stirbt, starb, ist gestorben|Der Mann ist gestorben.
541|die|die Bedeutung|Die Bedeutung ist klar.
582|adj|falsch|Die Antwort ist falsch.
705|die|die Grundlage|Die Grundlage ist fest.
795|die|die Phase|Die Phase ist kritisch.
878|das|das Elektron|Ein Elektron ist klein.
907|das|das Mitglied|Das Mitglied ist aktiv.
940|der|der Einfluss|Der Einfluss ist stark.
950|adj|klassisch|Das Buch ist klassisch.
1081|der|der Titel|Der Titel ist wichtig.
1114|adj|verantwortlich|Er ist verantwortlich.
1163|der|der Aufbau|Der Aufbau ist stabil.
1186|die|die Summe|Die Summe ist korrekt.
1200|adj|extrem|Das Wetter ist extrem.
1210|der|der Zeitpunkt|Der Zeitpunkt ist gut.
1289|adj|komplett|Das Bild ist komplett.
1292|die|die Nachricht|Die Nachricht ist gut.
1315|adj|kritisch|Die Lage ist kritisch.
1318|der|der Donnerstag|Donnerstag ist morgen.
1357|der|der Nachbar|Mein Nachbar ist nett.
1418|das|das Enzym|Das Enzym ist wichtig.
1451|adj|streng|Der Lehrer ist streng.
1503|das|das Objekt|Das Objekt ist schwer.
1518|adj|scharf|Das Messer ist scharf.
1521|die|die Formel|Die Formel ist schwer.
1559|der|der Schmerz|Der Schmerz ist stark.
1581|das|das Pferd|Das Pferd ist schnell.
1649|der|der Urlaub|Der Urlaub ist vorbei.
1680|der|der Keller|Der Keller ist dunkel.
1700|der|der Vorschlag|Der Vorschlag ist gut.
1702|adj|entfernt|Das Ziel ist entfernt.
1727|die|die Spitze|Die Spitze ist scharf.
1732|die|die Tradition|Die Tradition ist alt.
1814|verb|begrenzen, begrenzt, begrenzte, hat begrenzt|Die Zeit ist begrenzt.
1891|der|der Streit|Der Streit ist vorbei.
1892|adj|spannend|Der Film ist spannend.
1951|die|die Stirn|Seine Stirn ist breit.
1970|pron|dahinter|Das Haus ist dahinter.
1992|der|der Abschluss|Der Abschluss ist nah.
2054|die|die Ladung|Die Ladung ist schwer.
2065|der|der Standard|Der Standard ist hoch.
2080|das|das Viertel|Das Viertel ist ruhig.
2109|adj|sauber|Das Zimmer ist sauber.
2112|die|die Messung|Die Messung ist genau.
2141|der|der Anlass|Der Anlass ist unklar.
2157|der|der Anstieg|Der Anstieg ist steil.
2182|das|das Umfeld|Das Umfeld ist sicher.
2214|der|der Verkehr|Der Verkehr ist dicht.
2251|das|das Metall|Das Metall ist schwer.
2276|die|die Marke|Die Marke ist bekannt.
2295|der|der Nerv|Der Nerv ist verletzt.
2297|der|der Termin|Der Termin ist morgen.
2303|adj|winzig|Das Insekt ist winzig.
2349|die|die Kommune|Die Kommune ist klein.
2398|adj|lebendig|Der Hund ist lebendig.
2447|adj|trocken|Der Boden ist trocken.
2471|der|der Koffer|Der Koffer ist schwer.
2495|adj|wertvoll|Das Buch ist wertvoll.
2526|der|der Winkel|Der Winkel ist scharf.
2527|adj|sauer|Die Zitrone ist sauer.
2591|das|das Erbe|Das Erbe ist wertvoll.
2626|die|die Frequenz|Die Frequenz ist hoch.
2633|adj|schlicht|Der Stil ist schlicht.
2780|das|das Messer|Das Messer ist scharf.
2829|der|der Akzent|Sein Akzent ist stark.
2859|der|der Mittag|Der Mittag ist sonnig.
2930|der|der Besitzer|Der Besitzer ist nett.
2940|das|das Resultat|Das Resultat ist klar.
3016|das|das Motto|Das Motto ist einfach.
3029|verb|bedecken, bedeckt, bedeckte, hat bedeckt|Der Tisch ist bedeckt.
3067|der|der Anschluss|Der Anschluss ist gut.
3086|adj|bitter|Der Kaffee ist bitter.
3120|der|der Horizont|Der Horizont ist weit.
3152|der|der Vorname|Sein Vorname ist Hans.
3197|der|der Duft|Der Duft ist angenehm.
3278|adj|sensibel|Das Kind ist sensibel.
3279|die|die Vision|Seine Vision ist klar.
3284|der|der Teller|Der Teller ist sauber.
3317|der|der Ausgang|Der Ausgang ist links.
3435|adj|abstrakt|Das Bild ist abstrakt.
3469|adj|bequem|Der Sessel ist bequem.
3568|die|die Kohle|Die Kohle ist schwarz.
3701|die|die Schlange|Die Schlange ist lang.
3806|der|der Strich|Der Strich ist gerade.
3822|adj|elegant|Das Kleid ist elegant.
3865|adj|passiv|Die Gruppe ist passiv.
3885|das|das Image|Das Image ist positiv.
3915|der|der Krebs|Der Krebs ist besiegt.
4043|der|der Kristall|Der Kristall ist klar.
4101|der|der Sessel|Der Sessel ist bequem.
4113|die|die Spaltung|Die Spaltung ist tief.
4120|der|der Kasten|Der Kasten ist schwer.
4221|verb|verziehen, verzieht, verzog, hat verzogen|Das Bild ist verzogen.
4258|das|das Regime|Das Regime ist streng.
4332|der|der Trick|Der Trick ist einfach.
4339|das|das Fazit|Das Fazit ist positiv.
4375|adj|belgisch|Das Bier ist belgisch.
4377|das|das Format|Das Format ist falsch.
4434|die|die Maske|Die Maske ist schwarz.
4442|das|das Klavier|Das Klavier ist teuer.
4446|der|der Neubau|Der Neubau ist fertig.
4481|die|die Betreuung|Die Betreuung ist gut.
4489|das|das Center|Das Center ist modern.
4499|das|das Testament|Das Testament ist alt.
4525|das|das Kinn|Das Kinn ist verletzt.
4579|adj|konventionell|Das ist konventionell.
4622|die|die Rakete|Die Rakete ist bereit.
4653|adj|dominant|Der Chef ist dominant.
4732|adj|vornehm|Das Hotel ist vornehm.
4740|die|die Allianz|Die Allianz ist stark.
4789|das|das Segment|Das Segment ist klein.
4838|das|das Insekt|Das Insekt ist winzig.
4918|das|das Design|Das Design ist modern.
4927|das|das Archiv|Das Archiv ist riesig.
381|adj|schlecht|Das Wetter ist schlecht.
401|das|das Gesicht|Ihr Gesicht ist bekannt.
479|die|die Situation|Die Situation ist ernst.
557|der, die|das Deutsche|Das Deutsche ist schwer.
577|der|der Kunde|Der Kunde ist zufrieden.
580|die|die Antwort|Die Antwort ist richtig.
710|die|die Beziehung|Die Beziehung ist stark.
892|der|der Hund|Der Hund ist freundlich.
918|die|die Bildung|Die Bildung ist wichtig.
933|das|das Prinzip|Das Prinzip ist einfach.
941|die|die Temperatur|Die Temperatur ist hoch.
949|die|die Analyse|Die Analyse ist korrekt.
953|das|das Glas|Das Glas ist zerbrochen.
998|der|der Kontakt|Der Kontakt ist wichtig.
1048|die|die Tabelle|Die Tabelle ist fertig.
1079|adj|vorhanden|Das Buch ist vorhanden.
1082|der|der Eindruck|Der Eindruck ist stark.
1123|der|der Roman|Der Roman ist spannend.
1143|der|der Rest|Der Rest ist unwichtig.
1196|das|das Jahrzehnt|Das Jahrzehnt ist lang.
1218|das|das Zentrum|Das Zentrum ist belebt.
1275|der|der Bericht|Der Bericht ist fertig.
1290|die|die Forderung|Die Forderung ist hoch.
1322|adj|offensichtlich|Das ist offensichtlich.
1367|das|das Gericht|Das Gericht ist lecker.
1370|der|der Aspekt|Der Aspekt ist wichtig.
1446|das|das Wachstum|Das Wachstum ist stark.
1461|das|das Gehirn|Das Gehirn ist komplex.
1466|das|das Material|Das Material ist teuer.
1474|das|das Studium|Das Studium ist schwer.
1493|das|das Einkommen|Das Einkommen ist hoch.
1516|die|die Gemeinde|Die Gemeinde ist klein.
1539|adj|global|Das Problem ist global.
1546|verb|besetzen, besetzt, besetzte, hat besetzt|Die Stelle ist besetzt.
1549|der|der Fan|Der Fan ist begeistert.
1553|die|die Strategie|Die Strategie ist klug.
1565|die|die Runde|Die Runde ist spannend.
1616|adj|sichtbar|Das Licht ist sichtbar.
1646|adj|perfekt|Das Wetter ist perfekt.
1746|die|die Umwelt|Die Umwelt ist wichtig.
1790|die|die Botschaft|Die Botschaft ist klar.
1840|das|das Urteil|Das Urteil ist gerecht.
1845|adj|massiv|Der Schaden ist massiv.
1857|die|die Initiative|Die Initiative ist gut.
1869|das|das Detail|Das Detail ist wichtig.
1944|das|das Management|Das Management ist gut.
