|word_en|sentence_en
3117|crooked|The crooked shelf was about to fall over.
3122|corrects|The teacher corrects the tests.
3123|Left Party|The Left Party won the election.
3131|ministry|The ministry approved the application.
3139|deficit|The company has a deficit.
3142|feature|The unique feature was emphasized.
3144|steers|The captain steers the ship safely.
3149|contains|The book contains many topics.
3153|magazine|The magazine was published monthly.
3154|takes off|He carefully takes off his glasses.
3155|commands|The general commands the troops.
3158|making|He is making a serious mistake.
3159|property|The property changed ownership.
3161|creditor|The creditor demanded his money back.
3166|inquiry|The inquiry was answered immediately.
3170|plate|The plate on the table was made of wood.
3176|discreet|He requested discreet advice.
3179|insulated|He carefully insulated the cable.
3181|grown-up|He is now a grown-up man.
3182|ecological|She preferred ecological products.
3184|substitution|The substitution went smoothly.
3185|tip|The tip brings him success.
3186|ask|He challenged him to a duel.
3188|canton|The canton has its own laws.
3192|keyword|The keyword was aptly chosen.
3193|pace|The pace of changes is high.
3194|wonderful|The wonderful painting hung in the museum.
3197|fragrance|The fragrance of the flowers filled the room.
3198|over|He jumped over the ditch.
3199|points out|The teacher points out the mistake.
3200|furnished|The house is well furnished.
3208|implementation|The implementation was simply perfect.
3210|timely|The timely intervention saved lives.
3212|roars|The lion roars loudly in its cage.
3220|look after|He has looked after the project from the start.
3223|neighboring|The neighboring village is small.
3231|imagination|His imagination knows no bounds.
3236|hits|He hits the nail with the hammer.
3238|broadcast|The broadcast of the game was exciting.
3241|eliminated|He is eliminated from the competition.
3244|enlarge|He wants to enlarge his company.
3246|majority|The majority of the work is done.
3249|gather|The students gather in the auditorium.
3256|site|The site requires sturdy footwear.
3266|converts|The process converts the energy.
3270|takes off|He takes off his coat and sits down.
3272|establishment|The establishment of the company was in 2000.
3277|backpack|He carries a heavy backpack.
3283|floated|The leaf floated gently to the ground.
3286|completed|He successfully completed his studies.
3293|emerged|It emerged from the letter that he was lying.
3295|trunk|The trunk of the tree is thick.
3302|waiter|The waiter brought the food.
3303|box|There were old toys in the box.
3304|accommodate|We need to accommodate the guests.
3311|project|The project is ambitious and expensive.
3314|mushroom|The mushroom grew in the shady forest.
3317|outcome|The outcome of the game was unclear.
3318|resolution|The resolution was passed unanimously.
3320|fellow|The fellow seems quite strong.
3323|balance|The balance was achieved in the end.
3326|handicap|The handicap was detected early.
3330|turns toward|He turns toward the problem.
3334|lens|The lens magnifies the image.
3337|position|The position as manager is vacant.
3341|opening|The opening of the door was difficult.
3342|broadcasts|The station broadcasts news.
3346|wardrobe|The wardrobe is full of clothes.
3351|stored|The goods are stored in the warehouse.
3354|information|He gave me information about the appointment.
3359|intervention|The intervention went smoothly.
3364|insight|That is my insight into the situation.
3365|young lady|The young lady was politely addressed.
3367|decline|The decline alarms the managers.
3376|harms|Too much sugar harms the teeth.
3377|silent|She remained silent during the discussion.
3382|significant|The significant factor was time.
3384|fissure|The fissure in the rock was deep.
3385|note|The note is on the desk.
3386|boundary|The boundary was clearly visible.
3389|correspond|The results correspond.
3390|distinction|He found the distinction difficult.
3391|seal|The seal on the window is defective.
3395|among themselves|They divided the loot among themselves.
3396|underneath|The dog is underneath the table.
3397|clarified|He clearly clarified his views.
3404|parks|He parks the bicycle in front of the house.
3406|bold|The bold font was immediately noticeable.
3407|consumes|The engine consumes a lot of gasoline.
3408|identifies|He identifies himself with the passport.
3409|bent|He bent the rod with his bare hands.
3412|strolled|We strolled along the lake.
3419|pub|We are meeting at the pub.
3422|quick|He found a quick solution to the problem.
3429|school leaving exam|He passes the school leaving exam in summer.
3431|let in|He let no one into the house.
3434|depreciation|The depreciation is justified.
3438|sound|The sound of the bells filled the air.
3440|pillar|The pillar supported the roof of the temple.
3441|hands over|He hands over the package to the recipient.
3442|clarified|They clarified the misunderstanding.
3447|advertisement|The advertisement led to the arrest.
3449|arrest|The police arrest the perpetrator.
3450|continues|He continues to write the report.
3458|chamber|Old furniture was stored in the chamber.
3461|worried|He is worried about his health.
3465|computer|The computer runs without problems.
3466|sign|The sign shows the way to the exit.
3468|unease|The unease in the hall was palpable.
3471|kindergarten|The kindergarten cares for many children.
3472|puzzle|The puzzle was harder than expected.
3478|ill|He suddenly fell seriously ill.
3479|reign|The reign changed owners.
3483|appearance|Appearances can be deceiving, after all.
3490|ban|The ban took effect immediately.
3491|postponement|The postponement of the appointment was necessary.
3492|went to ruin|The plan ultimately went to ruin.
3493|deviates|The plan deviates from the original.
3495|eager|He is eager to hear the news.
3496|secure|The police secure evidence.
3498|write|He wrote a long letter.
3499|mediation|The mediation was successful.
3500|prosperity|Prosperity in the region is growing.
3504|for his part|He, for his part, responded.
3507|broke out|The fire suddenly broke out.
3513|upbringing|The upbringing of the children was strict.
3515|for|What are you looking for in the bag?
3521|order|The order came directly from the boss.
3524|drags|He drags the boxes into the basement.
3525|goal|The goal decided the game.
3526|helper|The helper brought the boxes into the house.
3531|definitive|The approval is now definitive.
3532|lures|He lures the cat with food.
3533|put out|He put out the fire with water.
3535|along with|He came to the celebration along with his family.
3536|carried out|The ritual was carried out quietly.
3538|raise|She quickly raised the money.
3539|reasonably|The food was reasonably good.
3540|announcement|The announcement came unexpectedly.
3542|record|The statistics record an increase.
3546|arc|He drew a circle with the compass.
3548|school break|The school break ends in two weeks.
3550|trade fair|The trade fair attracted many visitors.
3551|separate|She passed away peacefully.
3554|covered|He covered a long distance.
3555|arrange|The boss assigns the tasks.
3557|imminent|The exam is imminent in two days.
3559|phenomenon|The phenomenon seemed mysterious.
3561|afterward|He came afterward and explained himself.
3566|inventory|The inventory was carefully checked.
3572|garage|The garage repaired the car.
3574|monastery|The monastery is situated on a hill.
3576|inquired|He inquired about the way.
3578|disaster|The disaster occurred suddenly.
3579|postponed|He postponed the appointment by a week.
3581|problem|The question was complex.
3586|dream of|What do you dream of at night?
3598|laborious|The laborious work took a long time.
3600|madness|That was pure madness yesterday.
3602|fixed|It is certain that we are leaving.
3605|combination|The combination was complicated.
3610|scale|The scale is two meters long.
3611|sketches|He sketches the design on paper.
3612|rigid|The rigid stare made us nervous.
3619|imply|He implied he had bad intentions.
3620|passed by|He passed by his childhood home.
3628|professional|The professional trained hard every day.
3630|recite|He recited the poem flawlessly.
3631|hides|He hides the secret to his success.
3635|suggests|He suggests that he will leave soon.
3639|deficit|The deficit was hard to overcome.
3640|unfolded|He unfolded the paper carefully.
3645|recognize|On what do you recognize the truth?
3647|howls|The wind howls loudly around the house.
3648|resigned|The president unexpectedly resigned.
3650|hammered|He hammered the nail into the wall.
3651|skirt|The skirt is made of light fabric.
3654|costly|The production was very costly.
3655|assesses|He assesses the situation correctly.
3662|squats|He squats in front of the TV for hours.
3672|sofa|The sofa is comfortable and modern.
3674|averts|He averts the danger just in time.
3676|hen|The hen lays an egg every day.
3677|relation|The relation between the values fits.
3683|dissolution|The dissolution was surprising.
3684|evaded|He skillfully evaded the question.
3685|package|The package was delivered on time.
3688|supplies|The river supplies a lot of water.
3691|advisor|The advisor gives important tips.
3692|attracted|He attracted a lot of attention.
3696|deadline|The deadline expires in a week.
3699|subject|The test subject participates in the study.
3701|snake|The snake crawled quietly through the grass.
3702|angled|The angled tree fell during strong winds.
3703|venerated|The venerated teacher gave a speech.
3707|captured|The captured cat was freed.
3713|mistaken|He was mistaken in his assumption.
3718|unique|It was a unique opportunity.
3723|minutes|The minutes were written.
3725|suppressed|He suppressed the thought immediately.
3728|soak|He skillfully avoided the car.
3729|acute|The acute problem had to be solved.
3733|come together|The friends come together to celebrate.
3735|investigate|He investigates animal behavior.
3739|judged|The book was rated positively.
3741|slope|The slope was steep and slippery.
3744|shaping|The shaping is clearly visible.
3746|rushes|The wind rushes through the trees.
3747|exchange|He exchanged the books for CDs.
3753|catch|He caught the conversation.
3755|go away|He went away to the city.
3756|submission|The submission of the tax return is due.
3759|proof|The proof of payment is missing.
3760|control|The control of the vehicle is precise.
3761|return|He returns the book on time.
3762|stay|The stay was much too short.
3763|published|The newspaper was republished.
3764|tilt|The chair suddenly tipped over.
3766|wipes|She wipes the dust from the shelf.
3768|produced|He successfully provided the proof.
3770|receiver|The receiver was lying next to the phone.
3777|basic|Basic knowledge is required.
3778|on the side|He works as an author on the side.
3783|braked|He braked the car sharply.
3784|installed|He installed a new door.
3786|drink|The drink tasted refreshing.
3787|in this country|There are many customs in this country.
3789|venture|The venture was a complete success.
3792|fracture|The fracture in the bone healed slowly.
3793|endless|The discussion seemed endless.
3794|expansion|The expansion of the house began.
3798|reflects|The mirror reflects the light.
3799|urban|Urban life is hectic.
3800|convert|The city changed over the years.
3802|generous|The generous meal made everyone full.
3803|struggle|He struggled with the decision for a long time.
3806|line|The line in the picture was very fine.
3807|host|The host serves us dinner.
3808|addition|The addition of these numbers is simple.
3811|downtown|The downtown area is lively in the evening.
3812|construction|The construction was extremely stable.
3814|triumph|The team triumphed despite all obstacles.
3817|lead|The lead quickly shrank.
3819|admits|He admits to his mistakes.
3820|constant|The constant rain annoyed us.
3824|suspected|The suspected perpetrator was caught.
3827|regrets|He deeply regrets his decision.
3829|pass|He went through the plan once more.
3832|offside|He stood aside and observed.
3835|dropped|The appointment was canceled due to illness.
3849|provoke|The discussion tempts him to participate.
3850|attribute|The most important attribute was the color.
3853|join|Another problem was added.
3857|pad|He uses a pad for his mouse.
3861|replacement|The replacement for the device was necessary.
3866|smoke|The smoke drifts through the window.
3870|stares|He stares at her all the time.
3874|unhappy|He was unhappy about the loss.
3875|blows|A cold wind blows through the city.
3878|hope for|He hopes for better results.
3883|home|He returned to the home late.
3884|consulted|He consulted experts for advice.
3888|holder|The award holder gave a speech.
3889|intensify|He intensified the controls.
3898|subtract|He carefully removes the film.
3899|finding|The finding was unfortunately positive.
3902|push|He felt a push on his back.
3911|idea|Her idea was gladly accepted.
3928|accumulate|The costs accumulate unexpectedly.
3929|breakdown|The breakdown led to delays.
3935|trend|The current in the river is strong.
3936|overtax|The test is too much for many students.
3938|structure|The structure of the text was clear.
3940|sneak|The cat sneaked inside.
3941|gains|He gains significantly during training.
3945|insert|He inserts the CD into the drive.
3948|material|Material possessions are fleeting.
3950|transparency|Transparency is important to us.
3957|board|The board was covered with notes.
3970|headline|The headline caused a stir.
3972|overdraw|He overdrawn the account to shop.
3974|cozy|The café was small but cozy.
3976|age|The Age of Enlightenment began.
3979|confused|The question confused him greatly.
3980|lawyer|The lawyer gave legal advice.
3985|resignation|The resignation came unexpectedly.
3986|estimate|The estimate is about 10,000 euros.
3988|joint|The joint hurts when moving.
3998|secure|He finally achieved his goal.
3999|shut down|He closes the window because of the cold.
4000|displays|He displays his artworks.
4001|pelvis|The basin in the bathroom is made of marble.
4004|pressure|The pressure to conform was great.
4005|Englishman|The Englishman speaks German.
4008|side|The side door was locked.
4013|full|The full man went to sleep.
4022|phase|The project is in the final phase.
4023|injustice|The injustice had to be atoned for.
4024|insurance|The insurance doesn't always pay.
4027|concerns|He expressed strong concerns.
4029|murdered|The king was treacherously murdered.
4035|improbable|The scenario is improbable.
4038|hired|He hired the firm immediately.
4040|penetrated|The water penetrated the basement.
4046|crapped|The dog crapped in the garden.
4047|referee|The referee blows the final whistle for the game.
4049|types|He types the text quickly.
4051|networked|He networked the devices for use.
4053|continues|He continues with the work.
4054|takes off|He quickly takes off from the city.
4055|rejection|The rejection was unexpected.
4057|ass|He falls on his ass and laughs.
4058|knows his way around|He knows his way around the city well.
4061|shoplifted|He shoplifted the apple from the market stand.
4064|distracts|He skillfully distracts him from the topic.
4069|listens|He listens to the quiet noise.
4070|understand|I can understand your arguments.
4074|tell|You couldn't tell anything from him.
4077|follows through|He follows through with his plan consistently.
4078|recovered|He recovered after the illness.
4080|rating|The rating for the show increased.
4081|submission|The submission of the document is still missing.
4082|sign|The sign foreshadowed the storm.
4085|threshold|The threshold was exceeded.
4086|metropolis|The metropolis pulses with life.
4087|emphasizes|He emphasizes the most important points.
4088|pub|The pub serves good dishes.
4091|reduced|He consciously reduced the risks.
4098|burst|The balloon burst loudly in the room.
4102|beam|The beam pierced through the darkness.
4106|so to speak|He is, so to speak, a genius.
4110|objective|The discussion remained objective.
4113|split|The split in the group is visible.
4115|instructed|He instructed the employees to be cautious.
4116|trip|The trip to the mountains was a success.
4117|extraordinary|Extraordinary talents are rare.
4118|construction site|The construction site blocks the road.
4120|crate|The crate is hard to carry.
4122|Parisian|The Parisian Eiffel Tower is famous.
4123|ranted|He ranted loudly about the noise.
4124|protection|The protection of data has priority.
4125|slope|The slope requires a lot of strength.
4132|delighted|The gift delighted him greatly.
4133|developing|The city is developing new areas.
4134|rifle|The rifle was carefully cleaned.
4136|cloth|He wiped the table with a cloth.
4141|fleeting|He gives her a fleeting kiss.
4148|in vain|All the work was not in vain.
4151|took off|The plane took off on time.
4152|usual|Such problems are unfortunately commonplace.
4153|attaches|He attaches the shelf to the wall.
4154|escaped|He narrowly escaped the danger.
4156|nothing but|He made nothing but mistakes in the dictation.
4157|physician|The physician conducted intensive research.
4162|even|The distribution of the load was even.
4165|modernism|Modernism strongly influences art.
4169|inpatient|The inpatient treatment took a long time.
4172|voluntary|Voluntary work brings a lot of joy.
4174|editorial staff|The editorial staff is editing the article.
4176|saying|The saying on the poster is funny.
4178|interview|The interview brought new insights.
4180|ovum|The ovum is examined in the lab.
4183|pile|A pile of books lay on the table.
4186|variety|This variety of tea tastes especially good.
4189|calm|He remains calm in every situation.
4193|survived|He survived the illness.
4194|assumption|The assumption was confirmed.
4195|jumped up|He quickly jumped up from the chair.
4197|started|The concert started on time.
4198|mouth|The dog opens its mouth and barks.
4202|appointment|The appointment was an honor for him.
4203|classification|The classification of the groups was simple.
4204|admission|Admission costs five euros.
4208|the other day|I met him the other day.
4209|proper|She needs proper treatment.
4210|enshrined|The right was enshrined in the law.
4211|meter|The meter measures electricity consumption.
4213|eliminated|He eliminated the errors in the code.
4216|regular|The regular train departs at 6 p.m.
4220|divided|The text was divided into chapters.
4221|twisted|The child twisted its face in disgust.
4222|order|The order was canceled.
4224|link|The link of the chain is broken.
4231|finally|Finally, he thanked everyone.
4232|opened|He opened the book to page ten.
4235|precipitation|The precipitation fell in large quantities.
4237|wanders|The dog wanders through the forest.
4240|supports|He supports his family with difficulty.
4245|permit|The permit was finally granted.
4249|communicate|They communicate via telephone.
4252|lasts|The rain lasts all day.
4253|straightened up|He slowly straightened up again.
4254|expires|The contract expires next year.
4256|professional|The professional training was intense.
4259|skull|The skull was severely damaged.
4266|conversation|The conversation was lively.
4267|falling apart|The old building is slowly falling apart.
4269|replaced|The new boss replaced the old one.
4271|missing|The expected answer did not appear.
4272|gets|He gets the tickets for the concert.
4275|opposes|He opposes the pressure.
4276|production|The production was impressive.
4282|monitor|The police monitor the area.
4292|recipe|The recipe is from my grandmother.
4293|sack|The sack was filled with potatoes.
4296|pending|The decision is still pending.
4298|locked|He locked the books in the cabinet.
4306|illuminates|The light illuminates the room.
4308|within reach|The summit was barely within reach.
4309|complicates|The rain complicates the drive.
4315|association|The association celebrates its anniversary.
4318|conquer|They conquer the castle in a storm.
4319|facade|The facade was freshly painted.
4322|terrace|They like sitting on the terrace.
4323|visited|He visited the doctor due to pain.
4324|researching|He is researching a new medication.
4325|bill|The bill was rejected.
4339|conclusion|The conclusion sums everything up.
4340|evokes|The picture evokes emotions.
4345|survey|The data collection took weeks.
4349|magazine|The magazine was published monthly.
4350|listener|The listener asked many questions.
4351|complains|He complains about the noise.
4352|accommodates|He accommodates the suggestion.
4354|up|He quickly climbed up the stairs.
4357|mild|The mild wind brushed my face.
4361|questions|The judge questions the witness.
4362|extends|The project extends over years.
4366|performed|She performed her poem impressively.
4370|review|The data review took a long time.
4373|instruction|The instruction was precisely formulated.
4380|shiny|The shiny trophy stood on the table.
4384|sting|The sting still hurts.
4385|variation|The variation of the recipe was successful.
4388|liable|He is liable for the damage caused.
4390|wrong|He was wrong about the street.
4392|deteriorating|The old house is slowly deteriorating.
4393|early|An early start allowed more leeway.
4394|settling|The company is settling here.
4397|realizes|He finally realizes his mistake.
4401|backdrop|The mountains form a beautiful backdrop.
4403|plausible|The explanation was very plausible.
4404|noticeable|The cold was noticeable in the room.
4406|worker|The worker was well paid.
4408|common|The common features are obvious.
4413|resigned|He resigned himself to his fate.
4418|solid|The solid foundation secured the house.
4421|note|The note brought new insights.
4423|alignment|The alignment of the event was perfect.
4424|evaluated|He thoroughly evaluated the data.
4425|spare|He wanted to spare her the pain.
4427|followed|He immediately followed the request.
4431|detention|He was released from detention.
4437|unbearable|The unbearable heat took our breath away.
4438|tears|The dog tears the old toy to pieces.
4449|emphasize|He emphasizes the important passage.
4451|gang|The gang planned the robbery.
4454|cast|The cast changes frequently.
4455|bundle|The bundle was hard to carry.
4456|dampened|He cautiously dampened expectations.
4463|settlement|The settlement is on the outskirts of town.
4465|statement|The statement clarified many questions.
4469|probable|The weather is expected to remain warm.
4470|appreciates|He appreciates her performance in the project.
4472|waste|The waste was thrown into the bin.
4482|arrive|The guests will arrive around evening.
4484|offspring|The offspring is thriving splendidly.
4485|pleaded|The lawyer pleaded for innocence.
4487|inequality|Income inequality is growing.
4488|defender|The defender blocked the attack.
4490|stop|The bus made a short stop.
4491|craft|The craft has a long tradition.
4496|scale|The scale ranges from one to ten.
4502|stall|The box is full of surprises.
4507|sport|This sport requires endurance.
4509|assignment|The assignment of tasks was clear.
4513|acquisition|The acquisition of the house was expensive.
4517|much|That is much better than expected.
4520|loan|He took out a loan.
4528|by|There was criticism by the government.
4533|occasionally|He drinks a coffee occasionally.
4534|driver|The driver stopped at the red light.
4540|congress|The congress took place in Berlin.
4542|side by side|The houses stand side by side.
4546|shattered|The glass shattered into a thousand pieces.
4554|sober|He stays sober at work.
4558|certificate|The certificate was issued.
4563|inputs|He inputs the data into the system.
4566|nerve cell|The nerve cell transmits signals.
4567|unnecessary|This information was unnecessary.
4568|organizes|He skillfully organizes the work.
4569|assessment|The assessment was surprising.
4570|departs|He finally departs early tomorrow.
4572|switched|He immediately switched off the light.
4575|binding|I need a binding answer.
4584|overtakes|He overtakes the slow car.
4585|led|He bravely led the way into battle.
4588|finances|The finances were carefully examined.
4590|crap|Because of this crap, we lost.
4591|flows|The river flows into the open sea.
4594|premiere|The film’s premiere was sold out.
4598|public prosecutor|The public prosecutor led the prosecution.
4601|prevent|Exercise helps to prevent diseases.
4603|rapprochement|The rapprochement was peaceful.
4605|copy|The copy of the book is out of print.
4608|trash|The trash will be picked up tomorrow.
4611|flowing|The flowing water calmed him.
4619|rang|The bells rang in the morning.
4623|lawn|The lawn was freshly mowed.
4624|realized|He realized his dream.
4625|attaches|He attaches the picture to the wall.
4629|shook|The news shook him.
4632|cabin|The cabin accommodates two people.
4637|overnight|He stays overnight at the hotel by the lake.
4642|defeated|The team defeated the opponent in the final.
4644|meanwhile|Meanwhile, the work continued.
4650|claim|The claim sparked a debate.
4656|operates|The doctor operates on the patient.
4657|stung|The bee stung him in the arm.
4661|confused|He often confused the twins.
4664|produced|The plant produced many flowers.
4666|establishes|He establishes contacts at the fair.
4668|easing|The pain is finally easing.
4671|well|He recovered very well during the vacation.
4673|floor|We live on the third floor.
4674|university of applied sciences|The university of applied sciences offers new courses.
4678|myth|The myth about the hero lives on.
4682|appointment|They made an appointment for the evening.
4685|close-knit|We live in a close-knit family environment.
4686|range|The range of the station is wide.
4690|deepens|The book deepens his knowledge.
4692|equipment|The equipment makes the work easier.
4693|favors|The mild climate favors growth.
4696|commitment|Her words had great commitment.
4697|pushed|He pushed the project forward swiftly.
4700|distances|She distances herself from the others.
4701|expenditure|The expenditure was justified.
4702|makes up|He makes up a story.
