|word_de|part_of_speech|word_en|sentence_de|sentence_en|sentence_lemmatized_de
1651|kicken|verb|to kick|Der Spieler konnte den Ball präzise kicken.|The player was able to kick the ball precisely.|
1652|der Therapeut|noun|the therapist|Der Therapeut half ihr, ihre Ängste zu bewältigen.|The therapist helped her overcome her fears.|
1653|das Weizenbier|noun|wheat beer|Er genoss ein kühles Weizenbier im Biergarten.|He enjoyed a cold wheat beer in the beer garden.|
1654|das Shampoo|noun|shampoo|Das neue Shampoo riecht nach Kokos und Vanille.|The new shampoo smells of coconut and vanilla.|
1655|das Abrakadabra|noun|abracadabra|Mit einem „Abrakadabra“ verschwand die Münze.|"With an ""abracadabra,"" the coin disappeared."|
1656|die Nazipartei|noun|the Nazi party|Die Nazipartei wurde 1945 endgültig zerschlagen.|The Nazi party was decisively dismantled in 1945.|
1657|wildern|verb|to poach|Die Wilderer wurden im Naturschutzgebiet gefasst.|The poachers were caught in the nature reserve.|
1658|stillhalten|verb|to hold still|Beim Zahnarzt musste das Kind stillhalten.|At the dentist, the child had to hold still.|
1659|boomen|verb|to boom|Die Tech-Industrie boomt in diesem Jahr.|The tech industry is booming this year.|
1660|der Schnurrbart|noun|mustache|Der alte Mann hatte einen dichten Schnurrbart.|The old man had a thick mustache.|
1661|aufwecken|verb|to wake up|Der laute Wecker wird ihn sicher aufwecken.|The loud alarm clock will surely wake him up.|
1662|die Haarfarbe|noun|the hair color|Die Haarfarbe wurde durch die Sonne aufgehellt.|The hair color was lightened by the sun.|
1663|die Bremse|noun|brake|Die Bremse des Fahrrads war defekt.|The bike's brake was defective.|
1664|der IQ-Test|noun|IQ test|Der IQ-Test zeigte beeindruckende Ergebnisse.|The IQ test showed impressive results.|
1665|der Faschist|noun|fascist|Der Faschist wurde in der Rede stark kritisiert.|The fascist was heavily criticized in the speech.|
1666|albern|adjective|silly|Sein albernes Verhalten nervt alle im Büro.|His silly behavior annoys everyone in the office.|
1667|die Made|noun|the maggot|Die Made befand sich im verdorbenen Apfel.|The maggot was in the spoiled apple.|
1668|das Beben|noun|quake|Das Beben war im gesamten Gebäude zu spüren.|The quake was felt throughout the building.|
1669|die Gesundheitspolizei|noun|health authority|Die Gesundheitspolizei prüft Restaurants genau.|The health authority inspects restaurants thoroughly.|
1670|jedweder|adjective|any|Jedweder Versuch wurde im Keim erstickt.|Any attempt was thwarted at its inception.|
1671|die Hautfarbe|noun|skin color|Die Hautfarbe sollte nie über Chancen entscheiden.|Skin color should never determine opportunities.|
1672|der Schwerverbrecher|noun|felon|Der Schwerverbrecher wurde lebenslang verurteilt.|The felon was sentenced to life imprisonment.|
1673|die Geldwäsche|noun|the money laundering|Die Behörde untersucht einen Fall von Geldwäsche.|The agency is investigating a case of money laundering.|
1674|ausloten|verb|to sound out|Man sollte die Optionen vorab ausloten.|You should sound out the options beforehand.|
1675|der Aufstrich|noun|spread|Frischer Aufstrich schmeckt hervorragend auf Brot.|Fresh spread tastes excellent on bread.|
1676|die Türpolitik|noun|the door policy|Die Türpolitik des Clubs war streng und selektiv.|The door policy of the club was strict and selective.|
1677|verprügeln|verb|to beat|Der wütende Mob wollte den Dieb verprügeln.|The angry mob wanted to beat the thief.|
1678|verfehlen|verb|to miss|Der Pfeil verfehlte knapp das Ziel.|The arrow narrowly missed the target.|
1679|höchstwahrscheinlich|adverb|most likely|Das Problem wird höchstwahrscheinlich bald gelöst.|The problem will most likely be solved soon.|
1680|überteuern|verb|to overprice|Das Unternehmen darf Produkte nicht überteuern.|The company must not overprice products.|
1681|der Anführer|noun|leader|Der Anführer der Gruppe hielt eine Rede.|The leader of the group gave a speech.|
1682|passend|adjective|appropriate|Die Rede war sowohl passend als auch inspirierend.|The speech was both appropriate and inspiring.|
1683|enthüllen|verb|to unveil|Der Künstler enthüllte sein neuestes Meisterwerk.|The artist unveiled his latest masterpiece.|
1684|die Exfrau|noun|the ex-wife|Die Exfrau des Künstlers schrieb einen Bestseller.|The artist's ex-wife wrote a bestseller.|
1685|der Partisan|noun|the partisan|Der Partisan versteckte sich in den Bergen.|The partisan hid in the mountains.|
1686|der Sneaker|noun|sneaker|Seine neuen Sneaker waren sofort ein Hingucker.|His new sneakers were an instant eye-catcher.|
1687|umkreisen|verb|to orbit|Der Satellit umkreist die Erde in 90 Minuten.|The satellite orbits the Earth in 90 minutes.|
1688|nippen|verb|to sip|Sie nippte vorsichtig am heißen Tee.|She sipped cautiously on the hot tea.|
1689|die Selbstständigkeit|noun|independence|Die Selbstständigkeit erfordert Disziplin und Mut.|Independence requires discipline and courage.|
1690|zugehen|verb|to approach|Der Hund lief freudig auf sein Herrchen zu.|The dog joyfully approached its owner.|
1691|gebären|verb|to give birth|Die Königin gebar einen gesunden Thronfolger.|The queen gave birth to a healthy heir.|
1692|ausbrennen|verb|to burn out|Das Lagerfeuer ist letzte Nacht ausgebrannt.|The campfire burned out last night.|
1693|das Urlaubsland|noun|holiday destination|Spanien ist ein beliebtes Urlaubsland in Europa.|Spain is a popular holiday destination in Europe.|
1694|der Herbstwind|noun|the autumn wind|Der Herbstwind wehte durch die bunten Blätter.|The autumn wind blew through the colorful leaves.|
1695|duschen|verb|to shower|Nach dem Training duschte er heiß und lange.|After the training, he showered hot and long.|
1696|der Thrombozyt|noun|the platelet|Thrombozyten fördern die Blutgerinnung effizient.|Platelets promote blood clotting efficiently.|
1697|abnibbeln|verb|to kick the bucket|Er meinte, er will nicht so jung abnibbeln.|He said he doesn’t want to kick the bucket so young.|
1698|der Fremdarbeiter|noun|foreign worker|Der Fremdarbeiter suchte eine neue Unterkunft.|The foreign worker looked for new housing.|
1699|die Ader|noun|the vein|Man sah die blaue Ader auf seiner Hand.|The blue vein on his hand was visible.|
1700|die Sünde|noun|the sin|Gier gilt in vielen Kulturen als eine große Sünde.|Greed is considered a great sin in many cultures.|
1701|tätowieren|verb|to tattoo|Der Künstler wird das Motiv präzise tätowieren.|The artist will tattoo the design precisely.|
1702|das Essen|noun|the food|Das Essen im neuen Restaurant war köstlich.|The food at the new restaurant was delicious.|
1703|das Sein|noun|being|Das Sein im Moment kann sehr erfüllend sein.|Being in the moment can be very fulfilling.|
1704|vermasseln|verb|to mess up|Er hat die Gelegenheit gründlich vermasselt.|He thoroughly messed up the opportunity.|
1705|verrecken|verb|to perish|Die Tiere im Käfig mussten jämmerlich verrecken.|The animals in the cage had to perish miserably.|
1706|humpeln|verb|to hobble|Nach dem Sturz begann er leicht zu humpeln.|After the fall, he began to hobble slightly.|
1707|der Übergriff|noun|the assault|Der Übergriff wurde sofort gemeldet.|The assault was reported immediately.|
1708|die Laterne|noun|lantern|Die Laterne erleuchtete den Weg in der Dunkelheit.|The lantern illuminated the path in the darkness.|
1709|mittags|adverb|at noon|Mittags treffen wir uns am Hauptbahnhof.|We’ll meet at the main station at noon.|
1710|das Banner|noun|banner|Das Banner hing stolz über dem Eingang.|The banner hung proudly over the entrance.|
1711|der Kummerkasten|noun|the advice column|Der Kummerkasten half vielen Lesern bei Problemen.|The advice column helped many readers with issues.|
1712|stumpf|adjective|blunt|Das stumpfe Messer machte die Arbeit mühsam.|The blunt knife made the work laborious.|
1713|killen|verb|to kill|Die Waffe wurde benutzt, um den Feind zu killen.|The weapon was used to kill the enemy.|
1714|trist|adjective|dreary|Der trübe Himmel machte den Tag noch trister.|The cloudy sky made the day even drearier.|
1715|wie|adverb|how|Wie können wir das Problem effizient lösen?|How can we solve the problem efficiently?|
1716|edel|adjective|noble|Das edle Geschmeide funkelte im Dämmerlicht.|The noble jewelry sparkled in the twilight.|
1717|gutmachen|verb|to make up for|Er versuchte, den Schaden schnell gutzumachen.|He tried to make up for the damage quickly.|
1718|die Kotze|noun|the vomit|Die Kotze auf dem Gehweg wurde umgehend beseitigt.|The vomit on the pavement was promptly removed.|
1719|die Lebenswelt|noun|life-world|Ihre Lebenswelt ist von Natur geprägt.|Her life-world is shaped by nature.|
1720|der Flop|noun|flop|Der Film war leider ein totaler Flop.|The movie was unfortunately a total flop.|
1721|der Chor|noun|choir|Der Chor sang mit außergewöhnlicher Leidenschaft.|The choir sang with extraordinary passion.|
1722|der Sprayer|noun|the graffiti artist|Der Sprayer erschuf ein farbenfrohes Wandgemälde.|The graffiti artist created a colorful mural.|
1723|der Spinner|noun|the crackpot|Der Spinner glaubte an Verschwörungen und Aliens.|The crackpot believed in conspiracies and aliens.|
1724|hineingehen|verb|to enter|Wir werden durch das alte Portal hineingehen.|We will enter through the ancient portal.|
1725|schäumen|verb|to foam|Die Seife begann in der Schale zu schäumen.|The soap began to foam in the dish.|
1726|das Raubtier|noun|predator|Das Raubtier lauerte im Schatten auf seine Beute.|The predator lurked in the shadows for its prey.|
1727|sternenklar|adjective|starry-clear|Der sternenklare Himmel war eine wahre Augenweide.|The starry-clear sky was a true feast for the eyes.|
1728|der Stahl|noun|the steel|Das Gebäude wurde aus Glas und Stahl gefertigt.|The building was made of glass and steel.|
1729|der Millionär|noun|millionaire|Der Millionär investierte klug in Start-ups.|The millionaire wisely invested in start-ups.|
1730|überfahren|verb|to run over|Das Auto überfuhr versehentlich einen kleinen Ast.|The car accidentally ran over a small branch.|
1731|akribisch|adjective|meticulous|Er arbeitet akribisch an den Details der Maschine.|He works meticulously on the details of the machine.|
1732|rausschmeißen|verb|to throw out|Er musste den unhöflichen Gast rausschmeißen.|He had to throw out the rude guest.|
1733|die Jogginghose|noun|jogging pants|Die Jogginghose wurde schnell zum Modetrend.|The jogging pants quickly became a fashion trend.|
1734|der Regenbogen|noun|rainbow|Ein Regenbogen spannte sich über das weite Tal.|A rainbow stretched across the wide valley.|
1735|der Hammelbraten|noun|mutton roast|Der Hammelbraten duftete köstlich in der Küche.|The mutton roast smelled delicious in the kitchen.|
1736|einfangen|verb|to capture|Die Kamera fing die Schönheit der Landschaft ein.|The camera captured the beauty of the landscape.|
1737|plaudern|verb|to chat|Wir saßen im Café und plauderten über alte Zeiten.|We sat in the café and chatted about old times.|
1738|der Verwandte|noun|the relative|Ein Verwandter kam zu Besuch aus Kanada.|A relative visited from Canada.|
1739|die Pubertät|noun|the puberty|Die Pubertät ist eine Phase großer Veränderungen.|Puberty is a phase of great changes.|
1740|der Ernst|noun|seriousness|Sein Gesichtsausdruck zeigte den Ernst der Lage.|His facial expression showed the seriousness of the situation.|
1741|der Trottel|noun|the fool|Nur ein Trottel würde das Risiko eingehen.|Only a fool would take the risk.|
1742|die Arznei|noun|the medicine|Die Arznei schmeckt bitter, hilft aber schnell.|The medicine tastes bitter but works quickly.|
1743|die Vollkasko|noun|the comprehensive insurance|Ohne Vollkasko wäre der Schaden teuer geworden.|Without comprehensive insurance, the damage would have been costly.|
1744|einwecken|verb|to preserve|Die Oma weckte die Früchte für den Winter ein.|Grandma preserved the fruits for winter.|
1745|die Rippe|noun|the rib|Die Rippe schmerzt nach dem Sturz beim Training.|The rib hurts after the fall during training.|
1746|stopfen|verb|to stuff|Er stopfte die Kleidung hastig in die Reisetasche.|He hastily stuffed the clothes into the travel bag.|
1747|der Schwachsinn|noun|nonsense|So einen Schwachsinn habe ich noch nie gehört.|I’ve never heard such nonsense.|
1748|verhauen|verb|to thrash|Er verhauchte den Gegner in einem fairen Duell.|He thrashed the opponent in a fair duel.|
1749|das Plätzchen|noun|the cookie|Das Plätzchen war knusprig und süß.|The cookie was crispy and sweet.|
1750|der Sündenfall|noun|the fall of man|Der Sündenfall symbolisiert menschliche Schwäche.|The fall of man symbolizes human weakness.|
1751|die Girlande|noun|garland|Die Girlande aus Blumen schmückte die Eingangstür.|The garland of flowers adorned the entrance door.|
1752|der Matrose|noun|sailor|Der Matrose kletterte mutig auf die Mastspitze.|The sailor bravely climbed to the masthead.|
1753|das Kommando|noun|the command|Das Kommando wurde laut und deutlich erteilt.|The command was given loudly and clearly.|
1754|ander|adjective|other|Die andere Gruppe hat das Spiel gewonnen.|The other group won the game.|
1755|geil|adjective|awesome|Die Aussicht von diesem Gipfel war wirklich geil.|The view from this peak was truly awesome.|
1756|der Herzinfarkt|noun|heart attack|Ein Herzinfarkt ist oft eine Folge von Stress.|A heart attack is often a result of stress.|
1757|der Marsch|noun|the march|Der Marsch durch die Stadt dauerte drei Stunden.|The march through the city lasted three hours.|
1758|brr|interjection|brr|Brr, ist das heute kalt draußen!|Brr, it’s so cold outside today!|
1759|der Tweet|noun|the tweet|Sein Tweet ging über Nacht viral.|His tweet went viral overnight.|
1760|das Gedränge|noun|the crowd|Im Gedränge verlor er fast seinen Rucksack.|In the crowd, he almost lost his backpack.|
1761|der Hinterkopf|noun|the back of the head|Er spürte den Schlag am Hinterkopf deutlich.|He clearly felt the blow to the back of his head.|
1762|der Dinosaurier|noun|the dinosaur|Der Dinosaurier im Museum faszinierte die Kinder.|The dinosaur in the museum fascinated the children.|
1763|der Reifen|noun|tire|Ein beschädigter Reifen kann gefährlich sein.|A damaged tire can be dangerous.|
1764|umher|adverb|around|Die Kinder liefen umher und suchten Ostereier.|The children ran around searching for Easter eggs.|
1765|der Spielplatz|noun|playground|Die Kinder tobten fröhlich auf dem Spielplatz.|The children played happily on the playground.|
1766|derselbe|pronoun|the same|Das ist derselbe Fehler wie gestern.|That is the same mistake as yesterday.|
1767|drauflegen|verb|to add extra|Sie mussten noch 20 Euro auf den Preis drauflegen.|They had to add an extra 20 euros to the price.|
1768|der Milliardär|noun|the billionaire|Der Milliardär spendete großzügig für Bildung.|The billionaire donated generously to education.|
1769|olé|interjection|olé|Mit einem lauten „Olé!“ begann der Stierkampf.|"With a loud ""Olé!"" the bullfight began."|
1770|wienern|verb|to polish|Er wienerte die alte Kommode bis sie glänzte.|He polished the old dresser until it shone.|
1771|befriedigend|adjective|satisfactory|Seine Arbeitsergebnisse waren befriedigend.|His work results were satisfactory.|
1772|schmelzen|verb|to melt|Das Eis begann in der warmen Sonne zu schmelzen.|The ice began to melt in the warm sun.|
1773|perfektionieren|verb|to perfect|Sie möchte ihre Kochkünste weiter perfektionieren.|She wants to further perfect her cooking skills.|
1774|die Tarnjacke|noun|the camouflage jacket|Die Tarnjacke wurde für die Wanderung gewählt.|The camouflage jacket was chosen for the hike.|
1775|die Unwissenheit|noun|ignorance|Unwissenheit über Fakten kann gefährlich sein.|Ignorance of facts can be dangerous.|
1776|nimmer|adverb|nevermore|Der König sprach: „Ich kehre nimmer zurück!“|"The king said: ""I shall nevermore return!"""|
1777|die Hexenjagd|noun|witch hunt|Die Hexenjagd zerstörte unschuldige Existenzen.|The witch hunt destroyed innocent lives.|
1778|dazwischenstellen|verb|to intervene|Man darf sich nicht unüberlegt dazwischenstellen.|One must not intervene thoughtlessly.|
1779|der Schmuck|noun|jewelry|Ihr Schmuck war schlicht, aber elegant.|Her jewelry was simple yet elegant.|
1780|die Speise|noun|dish|Diese Speise ist eine Spezialität der Region.|This dish is a specialty of the region.|
1781|verfluchen|verb|to curse|Er verfluchte den Tag, an dem er sie traf.|He cursed the day he met her.|
1782|die Minne|noun|courtly love|Die Lieder der Troubadoure besangen die Minne.|The songs of the troubadours praised courtly love.|
1783|verzerren|verb|to distort|Die Linse verzerrte das Bild leicht.|The lens slightly distorted the image.|
1784|der Wandschrank|noun|the closet|Im Wandschrank fand er die alten Fotos.|In the closet, he found the old photos.|
1785|die Zuversicht|noun|confidence|Mit Zuversicht begann sie ihr neues Projekt.|With confidence, she started her new project.|
1786|die Mailbox|noun|the voicemail|Die Mailbox war voller ungehörter Nachrichten.|The voicemail was full of unheard messages.|
1787|der Bizeps|noun|the biceps|Sein Bizeps war nach dem Training deutlich größer.|His biceps were noticeably larger after the workout.|
1788|der Depp|noun|the fool|Was für ein Depp, der das Fenster offen ließ!|What a fool to leave the window open!|
1789|die Garage|noun|the garage|In der Garage standen alte, aber wertvolle Autos.|In the garage stood old but valuable cars.|
1790|der Märchenerzähler|noun|the storyteller|Der Märchenerzähler faszinierte die Kinder sofort.|The storyteller immediately fascinated the children.|
1791|durchschleichen|verb|to sneak through|Der Flüchtige schlich lautlos durch die Wälder.|The fugitive sneaked silently through the woods.|
1792|der Streik|noun|the strike|Der Streik legte den gesamten Zugverkehr lahm.|The strike brought all train traffic to a halt.|
1793|die Bitch|noun|bitch (slang)|In der Serie wurde sie oft als Bitch bezeichnet.|In the series, she was often referred to as a bitch.|
1794|das Zweite|noun|the second|Das Zweite war genauso wichtig wie das Erste.|The second was just as important as the first.|
1795|der Karren|noun|the cart|Der schwere Karren wurde von zwei Pferden gezogen.|The heavy cart was pulled by two horses.|
1796|das Schmuckstück|noun|jewel|Das Schmuckstück funkelte im Scheinwerferlicht.|The jewel sparkled in the spotlight.|
1797|auslassen|verb|to skip|Ich habe das Frühstück heute einfach ausgelassen.|I just skipped breakfast today.|
1798|treudeutsch|adjective|staunchly German|Der Film porträtiert einen treudeutschen Offizier.|The film portrays a staunchly German officer.|
1799|der Atemzug|noun|breath|Sie nahm einen tiefen Atemzug vor dem Sprung.|She took a deep breath before the jump.|
1800|zauberhaft|adjective|enchanting|Die Aussicht war zauberhaft und unvergesslich.|The view was enchanting and unforgettable.|
1801|der Fax|noun|fax|Der Vertrag kam per Fax innerhalb einer Stunde an.|The contract arrived via fax within an hour.|
1802|kugelrund|adjective|round as a ball|Nach dem Festessen war er kugelrund und zufrieden.|After the feast, he was round as a ball and content.|
1803|hinkriegen|verb|to manage|Er kriegte die komplexe Aufgabe ohne Probleme hin.|He managed the complex task without problems.|
1804|bestialisch|adjective|brutal|Der Mord war einfach bestialisch.|The murder was simply brutal.|
1805|das Kaiserreich|noun|empire|Das Kaiserreich endete nach dem Ersten Weltkrieg.|The empire ended after the First World War.|
1806|der Hausflur|noun|hallway|Der Hausflur war frisch gestrichen und sauber.|The hallway was freshly painted and clean.|
1807|das Unentschieden|noun|the draw|Das Fußballspiel endete mit einem Unentschieden.|The soccer match ended in a draw.|
1808|nationalistisch|adjective|nationalistic|Die nationalistische Rhetorik stieß auf Kritik.|The nationalistic rhetoric was met with criticism.|
1809|das Lumpenpack|noun|the riffraff|Das Lumpenpack wurde von der Polizei vertrieben.|The riffraff was dispersed by the police.|
1810|das Lotto|noun|the lottery|Das Lotto brachte ihm endlich den großen Gewinn.|The lottery finally brought him the big win.|
1811|die Schnauze|noun|the snout|Die Schnauze des Hundes war voller Schnee.|The dog’s snout was covered in snow.|
1812|totprügeln|verb|to beat to death|Im Roman wird der Verräter vom Mob totgeprügelt.|In the novel, the traitor is beaten to death by the mob.|
1813|die Leute|noun|the people|Die Leute standen Schlange für die Konzertkarten.|The people lined up for the concert tickets.|
1814|der Lack|noun|the varnish|Der Lack auf dem Auto glänzt in der Sonne.|The varnish on the car shines in the sun.|
1815|austicken|verb|to flip out|Als er die Rechnung sah, ist er ausgetickt.|When he saw the bill, he flipped out.|
1816|gesprächig|adjective|talkative|Er war heute überraschend gesprächig und offen.|He was surprisingly talkative and open today.|
1817|der Schlafanzug|noun|the pajamas|Der Schlafanzug aus Seide fühlte sich luxuriös an.|The silk pajamas felt luxurious.|
1818|tracken|verb|to track|Moderne Apps können den Schlaf präzise tracken.|Modern apps can track sleep precisely.|
1819|trashig|adjective|trashy|Der Film war zwar trashig, aber unterhaltsam.|The film was trashy but entertaining.|
1820|die Wimper|noun|eyelash|Eine Wimper landete sanft auf ihrer Wange.|An eyelash gently landed on her cheek.|
1821|das N-Wort|noun|N-word|Das N-Wort hat in unserer Sprache keinen Platz.|The N-word has no place in our language.|
1822|das Porzellan|noun|the porcelain|Das Porzellan der alten Vase war handbemalt.|The porcelain of the old vase was hand-painted.|
1823|festkrallen|verb|to cling tightly|Der Vogel krallte sich fest an den Ast.|The bird clung tightly to the branch.|
1824|einwerfen|verb|to throw in|Er warf den Brief in den Briefkasten ein.|He threw the letter into the mailbox.|
1825|der Nahverkehr|noun|the local transport|Der Nahverkehr in der Stadt ist sehr zuverlässig.|The local transport in the city is very reliable.|
1826|raus|adverb|out|Die Katze sprang durch das offene Fenster raus.|The cat jumped out through the open window.|
1827|das Häuschen|noun|the little house|Das Häuschen im Wald war märchenhaft schön.|The little house in the forest was fairy-tale beautiful.|
1828|multikulturell|adjective|multicultural|Die Stadt war ein multikultureller Schmelztiegel.|The city was a multicultural melting pot.|
1829|die Schokofrucht|noun|the chocolate fruit|Die Schokofrucht war eine süße Überraschung.|The chocolate fruit was a sweet surprise.|
1830|die Kehle|noun|throat|Die Kehle des Sängers vibrierte bei jedem Ton.|The singer's throat vibrated with every note.|
1831|das Label|noun|the label|Das Label auf der Flasche war elegant gestaltet.|The label on the bottle was elegantly designed.|
1832|der Longdrink|noun|the long drink|Ein kalter Longdrink wäre jetzt perfekt am Strand.|A cold long drink would be perfect at the beach now.|
1833|herablassen|verb|to lower|Der Arbeiter ließ das Seil vorsichtig herab.|The worker carefully lowered the rope.|
1834|der Wirbel|noun|the whirlwind|Ein Wirbel aus Blättern zog durch die Straße.|A whirlwind of leaves swept through the street.|
1835|die Abwertung|noun|the devaluation|Die Abwertung der Währung trifft alle hart.|The devaluation of the currency hits everyone hard.|
1836|canceln|verb|to cancel|Der Flug wurde wegen des Sturms gecancelt.|The flight was canceled because of the storm.|
1837|die Ampel|noun|the traffic light|Die Ampel sprang gerade auf Grün.|The traffic light just turned green.|
1838|die Rüstung|noun|the armor|Die glänzende Rüstung hing im Museum der Stadt.|The shiny armor hung in the city museum.|
1839|die Gemütlichkeit|noun|the coziness|Die Gemütlichkeit des Cafés lud zum Verweilen ein.|The coziness of the café invited guests to linger.|
1840|indigen|adjective|indigenous|Die indigenen Traditionen sind hier gut erhalten.|The indigenous traditions are well-preserved here.|
1841|das Treppenhaus|noun|stairwell|Das Treppenhaus war frisch gestrichen und sauber.|The stairwell was freshly painted and clean.|
1842|das Placebo|noun|the placebo|Das Placebo zeigte keine messbare Wirkung.|The placebo showed no measurable effect.|
1843|das Diktat|noun|the dictation|Das Diktat war fehlerfrei und gut lesbar.|The dictation was error-free and clearly legible.|
1844|auftragen|verb|to apply|Du musst die Farbe gleichmäßig auftragen.|You need to apply the paint evenly.|
1845|vorbringen|verb|to put forward|Er wollte seine Argumente eloquent vorbringen.|He wanted to put forward his arguments eloquently.|
1846|verlieben|verb|to fall in love|Er verliebte sich unsterblich in die Sängerin.|He fell madly in love with the singer.|
1847|grillen|verb|to grill|Wir planen, morgen am See zu grillen.|We are planning to grill by the lake tomorrow.|
1848|die Moschee|noun|the mosque|Die Moschee wurde renoviert und neu eröffnet.|The mosque was renovated and reopened.|
1849|das Fähnchen|noun|the small flag|Das Fähnchen flatterte stolz im Sommerwind.|The small flag fluttered proudly in the summer breeze.|
1850|beschimpfen|verb|to insult|Er beschimpfte den Fahrer wegen der Verspätung.|He insulted the driver because of the delay.|
1851|der Stammtisch|noun|the regulars' table|Am Stammtisch wurden hitzige Diskussionen geführt.|Heated discussions took place at the regulars' table.|
1852|der Überzeugungstäter|noun|the ideologue|Ein Überzeugungstäter handelt aus Prinzipien.|An ideologue acts based on principles.|
1853|verweichlichen|verb|to soften|Zu viel Komfort kann den Geist verweichlichen.|Too much comfort can soften the spirit.|
1854|die Falte|noun|the wrinkle|Die Falte in ihrem Gesicht zeugt von Erfahrung.|The wrinkle on her face reflects experience.|
1855|stillstehen|verb|to stand still|Die Maschine konnte keinen Moment stillstehen.|The machine couldn’t stand still for a moment.|
