|title|author|text
90|Laterne|Monsters Of Liedermaching|Es war vor ein paar Stunden bei Sternen klarer Nacht da kam ich aus der Kneipe hab mich auf den Heimweg gemacht\nMitten im Dezember,bei minus zwanzigrad kein Mensch mehr auf der Straße weder Mütze noch Handschuh parat\nDie Luft so klar und kalt,dass einem der Atem gfriert und dann sah ich die Laterne...und da ist die Scheiße passiert\nSie glitzerte wie Zuckerwatte wollte wissen ob die auch so schmeckt und weil ich von natur aus so neugierig bin hab ich mal dran geleckt,die Zunge sie bliebt kleben und seitdem steh ich hier\nIch steh hier mit meiner laterne und meine laterne mit mir\nIch steh hier mit meiner laterne und meine laterne mit mir\nDas war ja wieder Typisch in der Nacht um kurz nach drei wer kommt zu dieser Uhrzeit mit heißem Wasser vorbei.Ein Hund kommt um die Ecke und hebt sein Bein an mir...\nIch steh hier mit meiner laterne und meine laterne mit mir\nIch steh hier mit meiner laterne und meine laterne mit mir\nIch hab versucht zu ziehen und die Zunge wurd lang wie ein Al,sie geht nicht ws ich auch tue,dass ist nicht mehr normal\nIn den Häusern da schlafen die Menschen und ich steh hier und frier\nIch steh hier mit meiner laterne und meine laterne mit mir\nIch steh hier mit meiner laterne und meine laterne mit mir\nMein Licht geht aus ich will nach Haus\nWas ist hier los ich muss mal groß\nIch hol sie her die Feuerwehr wähl 112 oh kein Handy dabei\nIch bin so Dumm,ich bring mich um\nRambimmel rabammel ra bumm bumm bumm
91|Ich rollator mit meim Besten|Grossstadtgeflüster|Wir ham' Rücken und Knie hamwa' auch\nWir ham ein müden Blick und einen dicken Bauch\nMan könnte sagen wir sind richtig dicke Kumpel\nHatten große Zeiten, jetzt beginnt das große Schrumpeln\nWir waren der Big Bang - jetzt sind wir nur noch Bumm\nDrehen Pirouetten und fallen dabei um\nWir fahren Rolltreppe, denn das gibt uns den Kick\nNur Headbangen ist halt nicht mehr so\nWeil sonst \nKrrrkst\n es im Genick\n\nWir sind nur einmal jung und das ist lange her\nHoch die Schnabeltassen, Alter ist das schwer\nIch war mal knackig, heute knack ich noch viel mehr\nOh – Oh –Ich rollator mit meim Besten!\nWir sind nur einmal jung und das ist lange her\nHoch die Schnabeltassen, Alter ist das schwer\nIch war mal knackig, heute knack ich noch viel mehr\nOh – Oh –Ich rollator mit meim Besten!\n\nWas früher mal der Knaller war  ist heute nur noch Krach\nUnd drei Tage wach gleich zwölf Tage schwach\nFrüher waren wir Bunnies, heute sind wir alte Hasen\nUnd die Blüten uns'rer Jugend blühen bei uns nur noch in Vasen\nDu hast mein Namen vergessen, nach all den ganzen Jahren\nDas ist okay mein Liebes, macht nichts\nDu hast das schönste Lächeln, welches ich jemals sah\nIn deinem Glas auf einem Nachttisch\n\n\nWir sind nur einmal jung und das ist lange her\nHoch die Schnabeltassen, Alter ist das schwer\nIch war mal knackig, heute knack ich noch viel mehr\nOh – Oh –Ich rollator mit meim Besten!\nWir sind nur einmal jung und das ist lange her\nHoch die Schnabeltassen, Alter ist das schwer\nIch war mal knackig, heute knack ich noch viel mehr\nOh – Oh –Ich rollator mit meim Besten!\n\nAn unseren Astralkörpern stapeln sich die Jahresringe\nKeine Zeit fürn großen Plan, nur noch für die wahren Dinge, Die Sicht getrübt, Gesichter fahl,  Man Möge uns n Klaren bringen!\nDenn der Geist ist willig und das Fleisch ist gar\nTanztee, nochmal die letzten Haare schwingen\nLos, wir stoßen an auf all die guten Jahre\nWir sind immer noch da, wer will uns an‘n Karren pinkeln Denn der Geist ist chillig und der scheisst drauf!\nWir sind nur einmal jung und das ist lange her\nHoch die Schnabeltassen, Alter ist das schwer\nIch war mal knackig, heute knack ich noch viel mehr\nOh – Oh –Ich rollator mit meim Besten!\nOh – Oh –Ich rollator mit meim Besten!\nOh – Oh –Ich rollator mit meim Besten!\nOh – Oh –Ich rollator mit meim Besten!
92|Warum hört der Fahrradweg einfach hier auf?|Jan Böhmermann|"\nWenn ich unser Deutschland seh':\nAlles voller PKW\nUnsere Herzen asphaltiert\nAutomobil radikalisiert\nKommt, hört auf zu lenken!\nUnd fangt and zu denken!\nDenn fängt einmal an zu fragen\nDann hören die Fragen niemals mehr auf\nWarum sind hier überall Autos?\n\nWarum ist ein Discovery 4 Meter 90 lang?\nUnd was gibt es in Bielefeld eigentlich zu discovern?\nWarum parkt der Q7\nMit Warnblinklicht auf'm Fahrradstreifen?\nWarum bekommen Dеutsche Yuppies\nBeim Porschе-Fahren 'nen steifen Hals\nWarum fährt E-Bike besser mit Helm\nAber Cabrio ohne? (Warum)\nWieso nennen wir die Asphaltwüste\nIn der Innenstadt ""Umweltzone""?\nWarum ist Heroin verboten und 260 fahren erlaubt?\nWarum muss Papi weinen\nWenn man ihm den VW-Bus klaut?\n\n\nEintausend Fragen, ich komme nicht drauf\nWarum hört der Fahrradweg einfach hier auf?\nWarum nehmen wir Brumm-Brumm\nEigentlich noch in Kauf?\nWarum hört der Fahrradweg einfach hier auf?\nLalala Lalala Lalala Lalala\nLalala Lalalala Laaa\n\nWarum kostet Schwarzfahren hundert Euro\nUnd Falschparken nur zehn?\nWarum sollten Kinder und Omas\nÜber Zebrastreifen gehen? (Warum)\nWollen Leute wirklich mit dem PKW\nZum Shopping in die Innenstädte?\nUnd wie geil könnten die eigentlich sein\nWenn niemand mehr PKWs hätte?\nWarum wachsen auf Radwegen Bäume\nAber auf Autobahnen nicht?\nWarum macht Disney Kinderfilme mit Autos mit Gesicht? (Warum)\nWas ist ""Vollkasko"" eigentlich für'n beschissenes Wort?\nWarum fahren wir nicht mal 30 statt 50 innerorts?\n\nEintausend Fragen, ich komme nicht drauf\nWarum hört der Fahrradweg einfach hier auf?\nWarum nehmen wir Brumm-Brumm\nEigentlich noch in Kauf?\nWarum hört der Fahrradweg einfach hier auf?\n\n\nIch fahr' gern Auto, doch ich frage mich schon:\nWäre es gedanklich nicht mal langsam\nZeit für Innovation?\nWann erfinden deutsche Tüftler\nEine Antwort darauf:\nWarum hört der Fahrradweg einfach hier auf?\nWarum hört der Fahrradweg einfach hier auf?\nWarum hört der Fahrradweg einfach auf?"
93|Es muss was Wunderbares sein (von mir geliebt zu werden)|Sportfreunde Stiller|Liebes Fräulein, ich möchte mich zu dir setzen\nUnd mit dir ein paar Sätze wechseln\nUm dir zu erklär'n, dass wir zusammen gehör'n\nGestatten: Mein Name ist nicht von Belang\nWichtig ist nur, ich bin nicht wie die andern\nIch führe dich voll und ganz bei unserem Tanz\nIch bin kein bekannter Herzensbrecher\nKein verkappter Schwerverbrecher\nSondern ein Charmeur, mit einem heißem Flair\nIch bin kein Millionär, kein Schauspieler und Schwindler\nIch habe keine Hobbys, bin ausschließlich für dich da\nAlles was ich geben kann ist unendlich und Lebenslang\nEin Konzentrat an Liebe\n\nEs muss was Wunderbares sein, von mir geliebt zu werden\nDu bist für immer mein auf dieser schönen Erde!\nMit mir tanzt sich's schön durch's Leben\nEs kann wohl nicht's Schöneres geben\nEs muss was Wunderbares sein, von mir geliebt zu werden!\n\nSie sagt zu mir\nRomantische Stunden mit leichten Bisswunden\nEin Höllenritt, gerne auch zu Dritt\nMit Zeder und Parfüm im Lederkostüm\nIch hebe dich auf Wolke sieben\nMit Hilfe von Rohrstock und Riemen\nSo tu' ich meine Sehnsucht kund\nMit einem rotem Ball im Mund\nAlles nur aus Liebe!\n\n\nEs muss was Wunderbares sein, von mir geliebt zu werden\nDu bist für immer mein auf dieser schönen Erde!\nMit mir tanzt sich's schön durch's Leben\nEs kann wohl nicht's Schöneres geben\nEs muss was Wunderbares sein, von mir geliebt zu werden!\nEs muss was Wunderbares sein, von mir geliebt zu werden\nDu bist für immer mein auf dieser schönen Erde!\nMit mir tanzt sich's schön durch's Leben\nEs kann wohl nicht's Schöneres geben\nEs muss was Wunderbares sein, von mir geliebt zu werden!\nEs muss was Wunderbares sein!\nEs muss was Wunderbares sein!\nMit mir tanzt sich's schön durch's Leben\nEs kann wohl nichts Schöneres geben!\nEs muss was Wunderbares sein, von mir geliebt zu werden!
94|Bumm! Bumm! Bumm!|Madsen, König Boris|Es ist nicht so einfach\nWenn man leise denkt\nWenn es dir nicht gefällt\nWer da die Fahne schwengt\nWenn es zu vielen egal ist\nWer da am Lenker hängt\nUnd mit stumpfen Parolen\nAll die Menschen fängt\n\nEs ist nicht so einfach\nWenn dir kaum jemand glaubt\nDenn unter all dem Donner\nFällst du kaum noch auf\nDu suchst nach der Stille\nUnd findest nur Gebrüll\nEs ist schwer etwas zu wollen\nWenn keiner mehr was will\n\nEs macht Bumm! Bumm! Bumm!\nUnd keiner fragt warum\nHauptsache es ist laut und Hauptsache es ist dumm\nEs macht Bumm! Bumm! Bumm!\nUnd keiner fragt warum\nDie Lauten werden lauter und die Leisen werden stumm\nEs macht Bumm, Bumm, Bumm, Bumm, Bumm, Bumm, Bumm, Bumm, Bumm\n\n\nKB Baby, König Boris, eure Lieblings-Rapperin\nDas Abendland geht unter\nUnd ich bin die Retterin\nMit rosa Röckchen und 'ner Maske von Chewbacca\nUnd du mit 'nem Teleskop-Schlagstock\nIch deutsche Raplegende, funky Motherfucker\nUnd du nur 'n elendes Arschloch\nIch schmeiß' eine Party\nWillkommen im Klub d'Amour\nDer Laden hat wirklich für alle geöffnet, rund um die Uhr\nFür die schäbigen Kollegen\nFür die Ruhigen, die Zerbrechlichen\nEin Tänzchen mit den unbestechlich hässlichen Verdächtigen\nIst Platz für leise Töne und krumme Gedanken\nUnd verschlungene Wege und  Musik zum Tanzen\nAlle zusammen, jeder so wie er will\nDas Gegenprogramm zum ganzen Hass und Gebrüll\nDem täglichen Krach, Medien Overkill\nIm Auge des Sturms ist es still\n\nEs macht Bumm! Bumm! Bumm!\nUnd keiner fragt warum\nHauptsache es ist laut und Hauptsache es ist dumm\nEs macht Bumm! Bumm! Bumm!\nUnd keiner fragt warum\nDie Lauten werden lauter und die Leisen werden stumm\nEs macht Bumm, Bumm, Bumm, Bumm, Bumm, Bumm, Bumm, Bumm, Bumm\nBumm, Bumm, Bumm, Bumm, Bumm, Bumm, Bumm, Bumm, Bumm\n\n\nLass uns die Leisen verstärken\nIch kann sie kaum verstehen\nVielleicht haben sie die besseren Ideen\nDie Lauten mit den Pauken und den Internet-Armeen\nIch kann sie nicht mehr hören\nUnd ich kann sie nicht mehr sehen\nIch will sie nicht mehr sehen\n\nEs macht Bumm! Bumm! Bumm!\nUnd keiner fragt warum\nHauptsache es ist laut und Hauptsache es ist dumm\nEs macht Bumm! Bumm! Bumm!\nUnd keiner fragt warum\nDie Lauten werden lauter und die Leisen werden stumm\nEs macht Bumm, Bumm, Bumm, Bumm, Bumm, Bumm, Bumm, Bumm, Bumm\nBumm, Bumm, Bumm, Bumm, Bumm, Bumm, Bumm, Bumm, Bumm
95|Das Schaf|Monsters Of Liedermaching|Das Leben is' legal\nNur gestohlen wird die Zeit\nEigentlich alles ganz normal\nBis dahin schnall' ich das soweit\nDer Schlaf in einer Nacht\nRaubt einem schon den halben Tag\nUnd egal, wie man es macht\nSo geht es weiter, Schlag auf Schlag\nRote Ampeln, trinken, essen, Stuhlgang, urinieren\nAm Besten wie besessen noch das Wetter diskutieren\nDie Uhr des Lebens läuft\nGanz egal, wie man auch tickt\nNur wer sich dagegen sträubt\nDen halte ich für ungeschickt\nDoch Zeit extra zu verschwenden\nSowas geht mir gegen'n Strich\nLass uns das Gespräch beenden\nDenn du int'ressierst mich nicht\nMann halt die Schnauze, wenn du mit mir redest\nKomm halt die Schnauze, wenn du mit mir sprichst\nHalt einfach deine Schnauze wenn du mit mir redest\nWeil ich höre nichts\n\nDeine Lippen zu bewegen\nKostet nicht nur Energie\nMeine Zeit und Gottes Segen\nUnd 'ne Menge Sympathie\nMich wirft nichts aus der Bahn\nDenn ich hab' n feinen Zug\nDeiner ist schon abgefahren\nNimm den nächsten, sei so klug\nVon mir aus, sprich mich heilig\nOder lobe meinen Herrn\nAber dann bitte beeil' dich\nVon mir kriegste nur zu hör'n:\nMann halt die Schnauze, wenn du mit mir redest\nKomm halt die Schnauze, wenn du mit mir sprichst\nHalt einfach deine Schnauze wenn du mit mir redest\nWeil ich höre nichts\nOooh weil ich höre nichts\nOooh\nDa hilft auch leider nicht Physik\nVon wegen, Gegensätze zieh'n sich an\nAuch war ich nie gut in Chemie\nNatürlich stimmt sie trotzdem dann und wann\n\nDas klingt jetzt alles zu quadratisch\nZu schwachmatisch potenziert\nDoch bei dir seh' ich's mathematisch\nUnd die Formel leicht diktiert\nHast du kapiert:\nMann halt die Schnauze, wenn du mit mir redest\nKomm halt die Schnauze, wenn du mit mir sprichst\nHalt einfach deine Schnauze wenn du mit mir redest\nWeil ich höre nichts\nOooh weil ich höre nichts\nOoooooh weil ich höre nichts
96|Hätte, hätte, hätte|Hasenscheisse|"Hätte, Hätte, Hätte ist ein vielbenutztes Wort\nEin flotter Spruch, ein süßer Traum, ein Trick, ein sehr beliebter Sport\nIck hätt' dit Loch ja jern gebuddelt\nAber ick hatte keene Schippe\nIck hätt' den Kampf bestimmt jewonnen\nAber ick hatte die Grippe\nHätte, Hätte, Hätte\nDit klebt wie eine Klette\nIn der Kommunikation\nUnd nährt die süße Illusion\nNeulich war Angelina Jolie in meiner Stadt\nSie stand da anner' Pommesbude, ick hab se' einfach anjequatsch\nWir ham' dann stundenlang palavert, Kuss heißt auf englisch Kiss\nSie meinte ick wär voll der Held und das Brad Pitt ne Pfeife ist\nAls sie mich nachts besuchen wollte, lag ick leider schon im Bette\nUnd hab die Kieselsteine die se an mein Fenster jeschmissen hat nicht gehört\n*NEIN*\nAch, Hätte, hätte, hätte ich doch noch nen Buch gelesen, aber\nWahrscheinlich hatt' ick keens parat\nWieso lag ich den Tag überhaupt so früh im Bette\nIs' doch sonst nicht meine Art\nHätte, Hätte, Hätte\nDit klebt wie eine Klette\nIn der Kommunikation\nUnd nährt die süße Illusion\n\nZwei pubertierende Punker, sitzen zurechtgemacht am Tresen\nDer eene wird nostalgisch: ""Mensch, ich wär' so gerne damals in England mit dabei jewesen\nHätten meine Eltern nicht früher""\nNE, schreib dir dit hinter die Ohren\nDer Punk ist tot, aber wenn du willst dann wird er jeden Tag neugeborn'\nOhohohohoh, hätte, hätte, hätte, ick werd hier noch bekloppt\nHeut ist heute vorwärts, marsch Gitarre raus und losgerockt\nHätt' ick Birnen einjeweckt, dann hätt' ick jetzt Kompott\nHätte ick die Welt erschaffen, dann wär icke jetze Gott\nAch, hätte, hätte, hätte, ich die Fukushimaaktien mehr verkauft\nDann wär jetzt allet prima\nHätten wir früher mehr trainiert, dann wär'n wir jetzt noch fit\nWir wären eine sexy Boygroup, dieses Lied vielleicht ein Hit\nWir hätten längst ein Haus am See, so'n Grundstück hat sonst keener\nPeter Fox wär unser Nachbar, nur: Seine Hütte wär viel kleener\nSkit:\n""Peter sag mal wat is' denn eigentlich  diesjahr da  mit deinen Orangenbäumen passiert, die sehen irgendwie bisschen mikrig aus, findest de' nicht? Haste' irgendwat falsch jemacht! Und dann als du den ersten Tag da in deinen Schuppen rübergestolpert bist, ick dachte du jehst auf's Klo, aber du wohnst da ja. Naja, jeder wie er will""\nHätte, Hätte, Hätte\nDit klebt wie eine Klette\nIn der Kommunikation\nUnd nährt die süße Illusion\n\nIck halte dieses hätte, hätte, für ein Gerücht\nIck glaube das das Wort, nicht hält was et verspricht\nTrotzdem hab ick mich mit hätte schon ziemlich oft liebkost\nDenn die verpatzte Chance bleibt uns als lebenslanger Trost\nDenn die verpatzte Chance bleibt uns als lebenslanger Trost\nDenn die verpatzte Chance bleibt uns als lebenslanger Trost\nDenn die verpatzte Chance bleibt uns als lebenslanger Trost\nManch einer denkt er hat versagt, und ertränkt sein' Frust im Suff\nAber hätte, hätte ist der Anker\nEigentlich, ham' wat alle druff'"
97|Körperliche Selbstverteidigung|Liedfett|"\nIch geh' mit meiner Flasche\nUnd dem Korken vom Wein den Berg hinauf\nUnd geb' ihm zu verstehen \n""ich kann mit dir allein sein""\nDie Blockwärter dürfen uns nicht zusammen sehen\nOh, du rote Schönheit, bist hier nicht erwünscht\nLass' meine Fahne für dich wehen\nWenn sie dreht, dann bin ich weg, nur du bleibst da\nBleib' wie du bist, Fähnchen im Wind, Fels in der Brandung, ist egal\n\nIch nenn' das körperliche Selbstverteidigung\nWenn wir uns verstecken, Schluck für Schluck unserem Schmerz entkommen\nIch nenn' das körperliche Selbstverteidigung\nWenn wir uns verstecken, Schluck für Schluck unserem Schmerz entkommen\n\nSind das Scherben von nem alten Glas?\nIch hab' aufgehört zu trauern, doch am Trinken hab' ich Spaß\nUnd das bleibt so, denn ich kann ja frei entscheiden\nOb ich mich bestrafe oder mit gezähmten Monstern spiele im Gras\nIch steh' mit Schleife auf'm Kopf und Mutters Kuchen in der Hand\nVor deiner Tür, denn es ist kalt und ich krieg' ziemlichen Brand\nIch brauch' die Hilfe nich', ich komm' sehr gut alleine klar\nBin einfach da, weil du dich freust, und die flaschenfreie Zone birgt Gefahr\n\n\nIch nenn' das körperliche Selbstverteidigung\nWenn wir uns verstecken, Schluck für Schluck unserem Schmerz entkommen\nIch nenn' das körperliche Selbstverteidigung\nWenn wir uns verstecken, Schluck für Schluck unserem Schmerz entkommen\n\nWir drehen die Heizung auf, lassen frische Luft rein\nDie Stille ist im Wald, doch auch hier schaut manchmal rein\nIch fürchte sie nich' mehr und genieße das Zusammensein\nWir üben Selbstverteidigung, ein kurzer und 'ne Flasche Wein\nIch pfeif' so vor mich hin, weils gute Laune macht\nEs pfeift sich wunderbar, allein auch\nIn dieser Nacht, ich bügel' mir selbstverständlich ordentlich einen rein\nWenn du mich anrufst: ""woll'n wir saufen gehn?"", dann sag' ich eher: NEIN!\n\nWenn ich einmal traurig bin, dann trink' ich einen Korn\nUnd wenn ich dann noch traurig bin, dann trink ich noch 'en Korn\nUnd wenn ich dann noch traurig bin, dann trink ich noch 'en Korn\nUnd wenn ich dann immer noch traurig bin, dann mach' ich das ganze von vorn\n\nIch nenn' das körperliche Selbstverteidigung\nWenn wir uns verstecken, Schluck für Schluck unserem Schmerz entkommen\nIch nenn' das körperliche Selbstverteidigung\nWenn wir uns verstecken, Schluck für Schluck unserem Schmerz entkommen\n\nIch nenn' das körperliche Selbstverteidigung\nWenn wir uns verstecken, Schluck für Schluck unserem Schmerz entkommen\nIch nenn' das körperliche Selbstverteidigung\nWenn wir uns verstecken, Schluck für Schluck unserem Schmerz entkommen"
98|Klaus|Das Lumpenpack|Klaus war wieder mal nicht brav, er hat etwas angestellt\nMutti hatte gleich gesagt „Heute gibt's kein Taschengeld“\nDoch das hat nicht gezogen, Klaus war nicht zu zügeln\nSie fanden es zu oldschool, ihn einfach zu verprügeln\nEr saß auf der stillen Treppe, er sah oft den Schweigefuchs\nDoch all diese Sanktionen haben nichts genutzt\nEr bekam drei Jahre Hausarrest, dazu nur Brot und Wasser\nDoch dann fanden sie ein Mittel und das war deutlich krasser\n\nUnd dann am nächsten Morgen wollten sie ihn wecken\nDoch gab's zu ihrem Schrecken dort nur eines zu entdecken\n\nKlaus ist tot, Klaus ist tot, wegen Internetverbot\nSie nahmen ihm das WLAN und er nahm sich das Leben\nSie sahen ihm am Morgen in der Badewanne liegen\nDie Pulsadern war'n offen, er war leichenblass und blutleer\nUnd das ausschließlich wegen verbotenem Computer\n\nKlaus\nKein Twittern und kein Chatten, auch kein Whats-App mehr\nSeit Statusfeld bei Facebook stand viel zu lange leer\nUnd auf seinen Farmville-Feldern, da verrottete das Korn\nWeil kein Mausklick es mehr mähte, weder hinten weder vorn\nUnd bei World of Warcraft, da verstarb sein Avatar\nUnd das war besonders tragisch, weil er Level siebzig war\nDoch um Selbstmord zu begehen, da muss schon Schlimmeres passieren\nDas Problem lag auf der Hand: Worauf offline masturbieren?\n\n\nKlaus ist tot, Klaus ist tot, wegen Internetverbot\nSie nahmen ihm das WLAN und er nahm sich das Leben\nSie sahen ihm am Morgen in der Badewanne liegen\nDie Pulsadern war'n offen, er war leichenblass und blutleer\nUnd das ausschließlich wegen verbotenem Computer\n\nDann stand er dort am Himmelstor um darin einzuchecken\nDoch gab's zu seinem Schrecken dort nur eines zu entdecken\n\nIm Himmel gibt's kein Internet, im Himmel gibt's kein Internet\nAls er das sah, hätt' er am liebsten sofort wieder ausgecheckt\nNur Wolken und Apostel, nur Engel und Gesang\nUnd nicht einmal sein iPhone fünf hatte hier Empfang\nIm Himmel gibt's kein Internet, im Himmel gibt's kein Internet\nKein Fernsehen und kein Radio, Jesus spart sich GEZ\nWarum muss er in den Himmel? Er war doch kein frommer Christ\nEr wär lieber in der Hölle, weil die Hölle Hotspot ist\n\nKlaus ist tot, Klaus ist tot, wegen Internetverbot\nSie nahmen ihm das WLAN und er nahm sich das Leben\nMan bezahlt für seinem Sünden, Klaus, so ist das eben
99|Alligatoah - Lady Gaga Remix|Alligatoah|Hallo? Hallo? Eine Pizza mit Schrauben, bitte...\nKann nicht so weiter gehen, hier!\nOh, meinst du wirklich der Terrorist war am Telefon?\n \nBestimmt!\n \nAch komm!\n \nWie... Was sagst du, ein Terrorist?!\n\nDer Fuchs schaut auf, der Büffel gähnt\nAlligatoah hat sich zurück bequemt\nUnd nein, ich bin nicht eilig gerannt\nIch gehe nicht auf Klo, weil ich muss sondern weil ich es kann\nIch trete auf in deinem Zimmer heute Abend\nKein Problem! Man kann mich auch in Kinder Joy bezahlen\nIch muss nicht wie du Mücken in die Menge lassen\nDamit wenigstens ein paar in die Hände klatschen\nSag mir, warum ist der Maikäfer braun\nUnd, warum nennst du dein Mic Eva Braun\nMich fragt der Bulle, wie ich sein Genick aufbiss\nEin Zauberer verrät seine Tricks auch nicht\nIch komm in Sammeltaxen voller Angelsachsen\nTrotzdem müsst ihr nicht aus Mücken Elefanten machen\nUnd, wenn der Terrorist mal wieder Fallobst grillt\nIst das halb so wild also chillt!\n\nSag unseren Nam'n! Sag unseren Nam'n! Alligatoah!\nHeb deinen Arm, lass einen fahr'n, auf'm Dancefloor!\nWir sind nicht blind, wir sind nicht taub\nWir pusten Zigarettenrauch!\nSag unseren Nam'n! Sag unseren Nam'n! Alligatoah!\nAlligatoah, Alligatoah (Alligatoah!)\nAlli-Alligatoah, Alli-Alligatoah (Yayeyeheah!)\nAlligatoah, Alligatoah (Das bin ich! Hihi!)\nAlli-Alligatoah, Alli-Alligatoah (Ahaha!)\n\n\nDiese Musik ist für Viele schon ein Lebensgefühl\nSie kommt aus beiden Boxen, denn ich bin ein Stereotyp\nDon Deagle macht die Drums auf der Kabeltrommel\nTrotzdem wird daraus ne atomare Bombe\nEr ist fly, ich bin sick und zusammen sind wir fleißig\nKalli und Partner finden dich ein bisschen peinlich\nDenn du siezt deine Dudes, ich duz deine Sis\nGlaub nicht, dass du mit diesen Schuhen\nIn meine Fußstapfen trittst\nDu möchtest mit den Terroristen Blutsbrüderschaft\nDoch du bist zu rüpelhaft, weil du in Schultüten kackst, Homie!\nMan hat dir nix in die Wiege gelegt\nAußer ein piepsendes Gerät, was explodiert, wenn du schläfst\n(Terrorstyle!) \nIch komm mit toxischen Froschgiften\nTrotzdem hängst du mir am Rockzipfel du Schrottwichtel\nAußerdem bin ich ein großer Fan von Nosliw\nOder vielleicht doch nicht... Wer weiß!\n\nSag unseren Nam'n! Sag unseren Nam'n! Alligatoah!\nHeb deinen Arm, lass einen fahr'n, auf'm Dancefloor!\nWir sind nicht blind, wir sind nicht taub\nWir pusten Zigarettenrauch!\nSag unseren Nam'n! Sag unseren Nam'n! Alligatoah!\nAlligatoah, Alligatoah (Aber dicken Schwanz!)\nAlli-Alligatoah, Alli-Alligatoah (Fleisch im Gemüsefach!)\nAlligatoah, Alligatoah (Alli, Alli, Alli, Alli, Alli, Alli, Alli, Alli...)\nAlli-Alligatoah, Alli-Alligatoah\n\n\nDu siehst Kaliba alkoholisiert auf Dorffesten\nPass auf dein Mädel auf er knabbert gern an Ohrläppchen\nIch stell mich auf den Kopf und fülle mein Gehirn mit Blut\nIch bin so gut man könnte denken ich bin wirklich gut (Krank!)\nWeil ich mit Leguanen Friedenspfeife rauch (Und?)\nIch gieße einen Zaun (Und?) Ich liebe meine Frau (Uh!)\nDenn ich hab ne harte Schale doch darunter eine weiche Seite\nDann wieder ne harte und dann kommen nur noch Eingeweide\nTjaa... manchmal muss man nur durchs Schlüsselloch gucken\n(Penis!)\n \nUnd dann weißt du, wir küssen doch Nutten\nEs ist Faulheit\n aber kommt die Frau meines Lebens\nMach ich ausreichend täglich \nBauch, Beine, Penis\n(Aber dick!)\n \n(Ro-man-tik!)\n \nIch komm im Barkeeperstyle\nWenn das Leben dir Zitronen gibt, dann blas mir doch einen\nAber du bist nicht romantisch also halt die Schnauze\nDu alte Pflaume! (Was?)\n\nSag unseren Nam'n! Sag unseren Nam'n! Alligatoah!\nHeb deinen Arm, lass einen fahr'n, auf'm Dancefloor!\nWir sind nicht blind, wir sind nicht taub\nWir pusten Zigarettenrauch!\nSag unseren Nam'n! Sag unseren Nam'n! Alligatoah!\nAlligatoah, Alligatoah (Kaliba, Don Deagle!)\nAlli-Alligatoah, Alli-Alligatoah (Kauft die CD!)\nAlligatoah, Alligatoah (Oho! Bitte!)\nAlli-Alligatoah, Alli-Alligatoah (Lalala!)\n\n\n(Junge ist das windig hier, du. Ich muss dann mal wieder weg!)\n-\nWarum denn bloß?\n-\nKönnte doch sein, dass er keine Lust mehr hat den Terroristen zu spielen
