|title|author|text
171|Verwandtschaftstreffen (Weihnachtsversion)|RIAN|"Hab gedacht, es wird ein ganz normaler Sonntag (ganz normal)\nUnd dass heute nichts besonderes passiert (nix passiert)\nPlötzlich sagt mir meine Mum: Heut gibt's ein Treffen"" (hä, was?)\nWeil die Nichte zweiten Grades 40 wird\nAh, cool, das würd ich gern verpassen (hab was vor)\nDoch ich fahr mit, sonst wär sie von mir enttäuscht (oh nein)\nJa, was soll ich sagen? Ja, was soll ich machen? (Was soll ich tun?)\nIch bin auf jeden Fall gespannt, wie das heut läuft\nUnd alle sitzen da, bis jetzt noch ganz entspannt\nDoch dann gab's diese Person, die plötzlich etwas sagt\nUnd es eskaliert, keiner weiß wieder, wieso (weiß wieso)\nAlle streiten, alle schrei'n, und ich schau zu (ich schau zu)\nUnd wenn der Onkel voll besoffen seine Ex-Frau kritisiert\nDann ist alles so, wie immer, wie gewohnt (wie gewohnt)\nEs eskaliert, die Verwandtschaft rastet aus (rastet aus)\nUnd auch Opa haut politisch einen raus (einen raus)\nUnd wenn die Tante jetzt noch kommt, mit den Verschwörungstheorien\nDann ist alles so, wie immer, wie gewohnt (wie gewohnt)\nHat mich gefreut, hat sich wieder mal gelohnt\nHab gedacht, es wird ein ganz normaler Samstag (ganz normal)\nUnd dass ich heute nicht mehr irgendwo hin muss (bleib zuhaus)\nDoch das letzten Sonntag war nur mal der Anfang (oh nein)\nUnd dass heut noch wer 50 wird, das hab ich bis jetzt nicht gewusst\nDenn heute hat der Bruder meines Schwagers, dessen Onkel, deren Vater\nDessen Opa mal ein Graf war, eine Feier bei dem Nachbar\nDer im Garten so viel Platz hat, dass die komplette Verwandtschaft\nInklusive mir heut antanzt, wir freu'n uns\nUnd alle sitzen da, bis jetzt noch ganz entspannt\nDoch dann gab's diese Person, die plötzlich etwas sagt\nUnd es eskaliert, keiner weiß wieder, wieso (weiß wieso)\nAlle streiten, alle schrei'n, und ich schau zu (ich schau zu)\nUnd wenn der Onkel voll besoffen seine Ex-Frau kritisiert\nDann ist alles so, wie immer, wie gewohnt (wie gewohnt)\nEs eskaliert, die Verwandtschaft rastet aus (rastet aus)\nUnd auch Opa haut politisch einen raus (einen raus)\nUnd wenn die Tante jetzt noch kommt, mit den Verschwörungstheorien\nDann ist alles so, wie immer, wie gewohnt (wie gewohnt)\nHat mich gefreut, hat sich wieder mal gelohnt\n"
172|Das Geschenk|Sportfreunde Stiller|Du trägst ein Herz auf deinen Lippen\nDu reißt fixe Grenzen ein\nBist bereit alles zu kippen, soll es so nicht sein\nDu machst aus ultra faden ausgetreten Pfaden\nTante Emmas wundervollen Phantasienladen\nDu kommst wie gerufen\nTrittst auf den Plan den es nicht gibt\nWie ein Bild das Götter schufen\nDich hat der Himmel geschickt\nDich hat der Himmel geschickt\n\nUnd weil ich an dir teilhab\nUnd immer an dich denk\nUnd weil du mir so viel bedeutest\nBist du ein Geschenk\nDu bist ein Geschenk\nUnd weil ich dich so sehr mag\nUnd gern in deine Richtung lenk\nUnd weil du mir so viel bedeutest\nBist du ein Geschenk\nDu bist ein Geschenk\n\n\nDu bist die Antwort auf die Frage\nGibt es reiche Tage?\nIch spür mit dir\nHat mich das Glück im Visier\nDu kommst wie gerufen\nTrittst auf den Plan den es nicht gibt\nWie ein Bild das Götter schufen\nDich hat der Himmel geschickt\nDich hat der Himmel geschickt\n\nUnd weil ich an dir teilhab\nUnd immer an dich denk\nUnd weil du mir so viel bedeutest\nBist du ein Geschenk\nDu bist ein Geschenk\nUnd weil ich dich so sehr mag\nUnd gern in deine Richtung lenk\nUnd weil du mir so viel bedeutest\nBist du ein Geschenk\nDu bist ein Geschenk\nUnd weil ich an dir teilhab\nUnd immer an dich denk\nUnd weil du mir so viel bedeutest\nBist du ein Geschenk\nDu bist ein Geschenk\nUnd weil ich dich so sehr mag\nUnd gern in deine Richtung lenk\nUnd weil du mir so viel bedeutest\nBist du ein Geschenk\nDu bist ein Geschenk
173|Mathematik - A19|Lindemann, Haftbefehl|Fuck fuck fuck!\nFuck! Fuck! Fuck!\nFuck! Fuck! Fuck her hard\n\nI never wanted to go to school\nI rather wanted to watch TV\nInstead of adding stupid sums\nOr subtracting or dividing\nYou won't need any calculating\nWhy should I still think so much?\nWhy torturing oneself with numbers?\nWhile there are machines to count money\n\nFuck, fuck, fuck maths\nFuck, fuck, fuck, fuck her hard\nFuck, fuck, fuck maths\nAlgebra is not important\n\nFuck, fuck, fuck maths\nFuck, fuck, fuck, fuck her hard\nFuck, fuck, fuck maths\nAlgebra is not important\n\n\nI never wanted to go to school\nCalculating roots, counts, integration\nGeometry and these quotients\nThey are fucking useless later\n\nJoint in the corner of my mouth\nAnd I'm on my way to school\nEyes red like tomatoes\nKool Savas LMS in my walkman, whore\n\nWhat Algebra, bitch?\nI only know street maths\nI learnt calculating by selling hash and weed\nI put it on the scale and you pay me\n\nFinally we need to write a test\nThe teacher is happy when we suffer\nI only say what everybody thinks\nYou can skip on that maths crap\n\nFuck, fuck, fuck maths\nFuck, fuck, fuck, fuck her hard\nFuck, fuck, fuck maths\nAlgebra is not important\n\n\nBack then I came to school\nBut I was three weeks too late\nMy teacher said: Who are you?\nI was like: Ah what are you trying to tell me?\nI packed my bag full of drugs\nBack then I was only fifteen\nI threw my chair out of the window\nAnd said: Bye, you sons of bitches\n\nOne plus one is two, two plus two is four\nI don't need to know more, yeah, that's enough for me\nWhy torturing oneself with numbers?\nWhile there are machines to count bucks\n\nThere are so many know-it-alls, that know it all\nThose know-it-alls, they should fuck off\nThey can get together in their maths club\nHave good grades, but shitty clothes\n\nFuck, fuck, fuck maths\nFuck, fuck, fuck, fuck her hard\nFuck, fuck, fuck maths\nAlgebra is not important\n\n\nFuck, fuck, fuck maths\nFuck, fuck, fuck, fuck her hard\nFuck, fuck, fuck maths\nAlgebra is not important\n\nWe weigh money, we don't need to calculate (no)\nWe weigh money\nWe weigh money, we don't need to calculate (no)
174|We Are Family|Timi Hendrix, Trailerpark|Papa will mich hau'n, doch Mama hält ihn fest\nDer Hund ist dauernd aggressiv und bellt gestresst\nDas ganze Haus ist versaut und unser Geld ist weg\nWegen Trailerpark rauchen deine Eltern Crack\nPapa will mich hau'n, doch Mama hält ihn fest\nDer Hund ist dauernd aggressiv und bellt gestresst\nDas ganze Haus ist versaut und unser Geld ist weg\nWegen Trailerpark rauchen deine Eltern Crack\n\nDu fühlst dich\nAusgegrenzt und ab und an verraten\nDenn du wurdst nie von dein'm lattenstrammen Vater\nMit der flachen Hand geschlagen\nSo wie alle deine Klassenkameraden (alle deine Klassenkameraden)\nWir holen dich da raus\nHeute darfst du bei der Assibande schlafen\nWir bieten ein normales Umfeld um Aufzuwachsen\nFrauen klatschen, lautes Schnackseln, Rauschgiftkapseln\nSaufen Schnaps, nun mach dein Zimmer sauber\nTrailerpark, hier kriegst du endlich dein Kindheitstrauma\n\nJunge, quatsch mal kein Salz, man, sonst mach ich dich kalt\nDenn meine besten Freunde heißen Hass & Gewalt\nWenn ich ficke kommt bei mir der Prügelfetisch raus\nMach' die Fotze deiner Schwester mit \nGeflügelschere\n auf (Ahh!)\nUnd sie knackt wie 'ne Weihnachtsgans\nJunge was für ein Einzelkampf\nQuatsch keine Scheiße man\nDeine Wohnung passt in ein Fach meines Kleiderschranks\n\n\nWe are family\nWe are family\nLet's all come together 'cause we all family\nWe are family\n\nPapa will mich hau'n, doch Mama hält ihn fest\nDer Hund ist dauernd aggressiv und bellt gestresst\nDas ganze Haus ist versaut und unser Geld ist weg\nWegen Trailerpark rauchen deine Eltern Crack\nPapa will mich hau'n, doch Mama hält ihn fest\nDer Hund ist dauernd aggressiv und bellt gestresst\nDas ganze Haus ist versaut und unser Geld ist weg\nWegen Trailerpark rauchen deine Eltern Crack\n\nBevor wir damals diesen Unfall hatten (Plusquamperfekt)\nHab ich aufgepasst, dass keiner unsern Busfahrer weckt\nSeit dem spiel'n wir auf der Fahrt nur noch Russisch Roulette\nTP4L\n \nSaddam Hussein is back\nGuck mal, ich seh unsre high level Groupies schon\nSie steinigen Blumio\nAlso setz ich gleich erstmal wieder ein paar Kinder in die Welt\nBasti hat sich prophylaktisch schonmal Tinder angestellt\n\n\nSeit 2009 haben wir den Scheiß weit gebracht\nMassimo ist mittlerweile mein Leibeigener\nOpium für's Volk\n, Schore von Zoll\nTP4L unser Wohnwagen rollt\nDie meisten sind verwirrt, wenn sie mich mal besuchen kommen\nDenn ich hab 29 Zimmer und dazu 58 Bongs\nIch weiß nicht mehr, wie viel es waren, hundert tausend Shows?\nIn unserm Tourbus duftet der Wunderbaum nach Hoe\n\nWe are family\nNothing over the family\nIt's all about the family, it's not?\nLet's all come together 'cause we all family\nWe are family\n\nPapa will mich hau'n, doch Mama hält ihn fest\nDer Hund ist dauernd aggressiv und bellt gestresst\nDas ganze Haus ist versaut und unser Geld ist weg\nWegen Trailerpark rauchen deine Eltern Crack\nPapa will mich hau'n, doch Mama hält ihn fest\nDer Hund ist dauernd aggressiv und bellt gestresst\nDas ganze Haus ist versaut und unser Geld ist weg\nWegen Trailerpark rauchen deine Eltern Crack\n\n\nIn our family portrait we looked pretty happy\nLet's play pretend, let's act like it comes naturally\nAnd I dont wanna have to split the holidays\nAnd I dont wanna have two adresses\nAnd I dont want a stepbrother anyways\nAnd I dont want my mom to change the cocaine
175|Recht kommt (K.O... in KA)|POL1Z1STENS0HN a.k.a. Jan Böhmermann, Justice|„am Landgericht”\n„der verurteilte Massenmörder”\n„hat das Bundesverfassungsgericht”\n„hier Strafsache wegen Mordes”\n„der reuelose Killer“\n„begann heute der Prozess”\n„Ich bin das Opfer”\n\nUnd es gibt eigentlich nur einen Satz: dass man so behandelt wird, wie man in den Wald hineinruft. Ich weiß, es ist schwierig. Es ist schwierig gegen den Strom zu schwimmen. Und die Vorstellung bedeutet auch Opfer (Opfer)\n\nJetzt gibt es Treibjagd, ya chara, auf Standspur Kickdown mit GG (brrum)\nBeschlossen und verkündet\n, hier kommt Kavallerie\nDiktaturensohn macht Welle, aber ich fahr' AGB\nJurasohn gibt Schelle, Attacke, Anwaltarmee\nSchriftsätze ballern wie Fahrradkette in die Fresse\nUnd deine blutet, auf Titelseite \nLügenpresse\nJurajudo, zehnter Dan, hat offensiv verteidigt\nWer will was von wem woraus? Guck nicht so beleidigt\nBigotte\n \nCucks\n, \nlutscht doch Cocks bei\n \nAlternative\nIch zerficke euch bareback mit Judikative\nMein Schutzbereich\n, \nwas Widerspruch\n?\nMit kollegialem Gruß,\n \nnach Akteneinsicht Kieferbruch\nRule of Law\n ist \nPolizistensohn-DNA\nWeil nicht sein kann, was nicht sein darf\nDu Einzelfall meinst, Rechtsstaat ist deins\nEh-eh, du Bastard, bist \nRechtsstaatsfeind Nummer Eins\nGuck ma' hoch\n\n\nRecht kommt,\n steht über dir\n und lacht\nRecht kommt,\n fünf vor zwölf per Fax in der Nacht\nRecht kommt,\n da wackelt das Jabot\nRecht kommt,\n Verfassungspatriot\nRecht kommt,\n nil, seven, two, one, Karlsruhesohn\nRecht kommt,\n Zivilisation\nRecht kommt,\n das ist Next-Level-Shit\nRecht kommt,\n und alle machen mit\n\nIch glaube, es ist eine traurige Wahrheit, dass wir unserem Affenzustand noch sehr nahe sind, und dass die Zivilisation nur eine sehr dünne Decke ist, die sehr schnell abblättert.”\n \n(K.O. in KA)\n\nTick, tack,\n \ndu Primat\n, \nRecht kommt langsam\n und hart\nRecht gewinnt eiskalt wie Stalin Stalingrad\nRickeracke,\n \nmahlt Justiz dich mit Geknacke\nPrüft weisungsgebunden\n und legt dich an als Akte\nTipp, tipp, tipp, klack –\n \nwer tippt so spät in der Nacht?\nStaatsanwältin Machete hat Anklage gemacht\nDu bist von oben herab? Dann guck ma' nach oben\nJustice kommt \nindie-schmindie\n in zuckersüßen Roben\nHörst du in der Ferne Purpurponchos roll'n\nInstanzenzug\n \nin Fahrtrichtung Recht\n, \nNormkontrolle\nJustiz macht die Mucke und zwingt dich zum Dancen\nPumpt mit der Power von tausend Ingo Lenßen\nLeserattenbande mit ein bis zwei Staatsexamen\nDas woll'n wa doch ma' sehen, das schau'n wa uns ma' an\nVolljuristen\n fisten dich bei Tisch, verzieh'n keine Miene\nUnd richten über dich mit Frikadelle in Kantine\nGruß aus der Küche!\n\n\nRecht kommt,\n steht über dir und lacht\nRecht kommt,\n fünf vor zwölf per Fax in der Nacht\nRecht kommt,\n da wackelt das Jabot\nRecht kommt,\n Verfassungspatriot\nRecht kommt,\n nil, seven, two, one, Karlsruhesohn\nRecht kommt,\n Zivilisation\nRecht kommt,\n das ist \nNext-Level-Shit\nRecht kommt,\n und alle machen mit\n\nAuf die Knie und leck, hier kommt die blinde Fotze mit der Waage\nRasier' dich mit Schwert, wenn du nicht machst, was ich dir sage\nSelbstgerechte Götter pumpen Luft, okay, steh' ich drüber\nDer Geist, der in mir atmet, flüstert: „Nie wieder!”\nEiserne Justitties\n, \nin jeder Stadt steht mein Palast\nIch hol' dich aus der Scheiße und ich schmeiß' dich in den Knast\nUnantastbar\n, fuckable, \nich mach's dir frei und gleich\nLiebe und beschirme mir's, mein Wille und mein Reich\n\nRecht kommt,\n steht über dir und lacht\nRecht kommt,\n fünf vor zwölf per Fax in der Nacht\nRecht kommt,\n da wackelt das Jabot\nRecht kommt,\n Verfassungspatriot\nRecht kommt,\n nil, seven, two, one, Karlsruhesohn\nRecht kommt,\n Zivilisation\nRecht kommt,\n das ist Heavy-Alman-Shit\nRecht kommt,\n und alle machen mit\nRecht kommt,\n \nnicht zu viel, nicht zu wenig\nRecht kommt,\n Kunde ist König\nRecht kommt,\n und alle stehen stramm\nRecht kommt,\n taram-tam-tam-tam\nRecht kommt,\n und wird exekutiert\nRecht kommt,\n und jetzt wird Gleichschritt marschiert\nRecht kommt,\n Attention, mein Freund\nRecht kommt,\n hör nicht, was Recht sagt, hör nur, was Recht meint
176|herz und faust und zwinkerzwinker|POL1Z1STENS0HN a.k.a. Jan Böhmermann|Der \nJunge\n ist zurück (zurück)\nUnd er ist wütend wie nie (Wie nie)\n(He's back)\n\nDas ist die legendary Legend, blasser dünner Junge (Ja)\nEs wird über ihn geredet, es wird über ihn gesungen\nDer Five Track Superstar\n, \nBruce Wayne des Rap\nKommt Kaboom aus'm Nichts – und dann ist er wieder weg\n(Was) Was ist sein Geheimnis? Seine Philosophie?\nWarum macht er das? Warum the fuck erklärt er sich nie? (Damn)\nWarum dies? Warum das? Und was ist seine Message?\nUnd ich denk' mir nur: „Okay, jetzt kriegst du Message in die Fresse!“\n\nUnd alle fragen sich, wer steckt dahinter?\nMit Herz und Faust und Zwinker-Zwinker\nRechts überhol'n und links den Blinker\nMit Herz und Faust und Zwinker-Zwinker\nUnd alle fragen sich, was steckt dahinter?\nMit Herz und Faust und Zwinker-Zwinker\nWer hat Angst vor \nblasse dünne Kinder\n?\nMit Herz und Faust und Zwinker-Zwinker\n\n\nDu fragst: „Ist das jetzt Größenwahn oder Kunstfigur?“\nIch sag': „Du bist doch Journalist, der Junge kann nur Hochkultur!“\nDu sagst: „Jetzt spricht er von sich in dritter Person!“\nIch sag': „Dir hängt dein Studium aus der \nScheide\n, du Maturasohn!“\nDu Paperback-Bestseller, willst immer noch mit Rechten reden\nAber der \nVegesack-Jetsetter\n will \nRechten linken Haken geben\nDu sagst: „So endet die Streiterei ja nie!“\nIch sag': \n„Ja, das ist ja grad das Geile an der Demokratie! Bitte bye-bye!“\nDu sagst: „Er macht nur Spaß“, ich sag': „Und was, wenn nicht?“ (Haha)\nDu sagst: „Ich verklag' dich!“, ich sag': „Warum nicht?“\nJe suis assi mit Abi\n – \nmal auf die Zwölf und mal subtil\nWeil ist nur labern nicht am Ende bisschen wenig, \nDoktor Phil?\nIch versenk' dich mit Herz und Füße in Beton\nMit deiner Angst, deinem Geheul und deinem Online-Feuilleton\nSchreib dir den Jungen ruhig vom Hals, immer wieder, immer wieder\nUnd trotzdem nag' ich jede Nacht an dir wie \nChuck der Biber\n\nUnd alle fragen sich, wer steckt dahinter?\nMit Herz und Faust und Zwinker-Zwinker\nRechts überhol'n und links den Blinker\nMit Herz und Faust und Zwinker-Zwinker\nUnd alle fragen sich, was steckt dahinter?\nMit Herz und Faust und Zwinker-Zwinker\nWer hat Angst vor blasse dünne Kinder?\nMit Herz und Faust und Zwinker-Zwinker\n\n\nDu prolliger Facebook-Folli-Junkie denkst, dass dich keiner schlägt?\nIch warte, bis du Vizewitz dich selber zerlegst\n (Ha)\nDu fragst: „Wie konnte das passieren? Wer hat was gewusst?“\nIch sag': \n„Lass uns noch 'ne Runde dreh'n um Wien im Vengabus!“\nDu glaubst, du bist schlau, ich weiß, ich bin dumm\nLeg du mal scharfe Bitches flach\n, ich schmeiß' lieber Regierung um (Servus)\nIch spiel' nicht mit dem Feuer, ich fackel' nur nicht lang\nUnd zünde, was verbrennen muss, nur mit mein'n Gedanken an\nPass auf, flacher Kasper, der blasse Clown kommt tief\nExeku-, judika-, legislativ\nDumme Augustarmeen werden dich jagen\n (Wir werden sie jagen!)\nWenn der Staat nicht läuft, dann müssen wir ihn tragen\nUnd dann schmeiß' ich mit \nStihl\n \nNervenkettensäge\n an\nSag mein'n Namen, sag mein'n Namen (\n„Der Herr Böhmermann“\n)\nSag mein'n Namen, sag mein'n Namen (\n„Der Herr Böhmermann“\n)\nSag nicht mein'n Namen, sag nicht mein'n Namen\nWar das internationale Geheimdienstaktion\nOder vielleicht doch die Faust vom Polizistensohn?\n\nUnd alle fragen sich, wer steckt dahinter?\nMit Herz und Faust und Zwinker-Zwinker\nRechts überhol'n und links den Blinker\nMit Herz und Faust und Zwinker-Zwinker\nUnd alle fragen sich, was steckt dahinter?\nMit Herz und Faust und Zwinker-Zwinker\nWer hat Angst vor blasse dünne Kinder?\nMit Herz und Faust und Zwinker-Zwinker\n\n\nIch stör' Unterricht in dein verkackten Alpha-Seminar (Aka)\nFaulige Brüder ficken traurige Beta Peter\nDu sagst: „Ich bin jetzt Mentor!“ Ich sag': „Joa!“\nEducated criminals work within the law\nGeh scheißen mit dei'm Cash, \nich mach' 'ne Mio in drei Tagen\nUnd will die ganze Kohle am Ende nicht mal haben (Ha)\nIch grins' wie Sphinx vor dein \nPyramidensystem\nWas jetzt, Chefchen? Willst du mein Rapausweis seh'n? (Hahaha)\nDu sagst, meine Tattoos sind Ausdruck meiner Seele\nIch bin tätowiert von innen und kann selber was erzählen\nDu sagst: „Schwule Fotze!“ Ich sage: „Achtung, \nVoßkuhle!“\nUnd surfe auf'm Spuckesee vor deiner scheiß Berufsschule\nIch \nbrat' an\n für Gourmets, ich grille nur für Genießer\nHinterlass' tiefere Spuren als Tikka Masala in Feinripp von Schießer\nAber geb' keinem richtig Antwort, wenn keiner richtig fragt\nAlles, was ich mach', ist ein Signal an den Markt\nDu fragst: „Ist das jetzt Kunst oder schlechte Manieren?“\nIch sag': „Das ist was für dein Leistungskurs zum Interpretieren!“\n\nUnd alle fragen sich, wer steckt dahinter?\nMit Herz und Faust und Zwinker-Zwinker\nRechts überhol'n und links den Blinker\nMit Herz und Faust und Zwinker-Zwinker\nUnd alle fragen sich, was steckt dahinter?\nMit Herz und Faust und Zwinker-Zwinker\nWer hat Angst vor blasse dünne Kinder?\nMit Herz und Faust und Zwinker-Zwinker\nUnd alle fragen sich, wer steckt dahinter?\nMit Herz und Faust und Zwinker-Zwinker\nRechts überhol'n und links den Blinker\nMit Herz und Faust und Zwinker-Zwinker\nUnd alle fragen sich, was steckt dahinter?\nMit Herz und Faust und Zwinker-Zwinker\nWer hat Angst vor blasse dünne Kinder?\nMit Herz und Faust und Zwinker-Zwinker\n\nUnd alle, alle blasse, dünne Kinder singen:\nMit Herz und Faust\nMit Herz und Faust\nUnd Zwinker-Zwinker\nUnd  Zwinker-Zwinker\nMit Herz und Faust\n (Faust)\nMit Herz und Faust\n (Faust)\nUnd  Zwinker-Zwinker\nUnd  Zwinker-Zwinker
177|Rainer Wendt (Du bist kein echter Polizist)|Jan Böhmermann|Dies ist die Geschichte eines ganz, ganz kleinen Mannes\nEines kleinen Polizisten, der Bekannteste des Landes\nSeine Klappe war so groß wie sein Körper – zwerghaft\nDarum wurde er der Chef der deutschen Polizeigewerkschaft\nBei Maischberger, bei Illner und bei Plasberg, ja, da saß er\nDass er nicht für alle Bullen sprach – irgendwann vergaß er's\nEr will die harte Hand des Staates und für den Flüchtling keine Gnade\nImmer pöbelte er rum, dann traf's ihn selber, schade\nEr ist der mensch-geword'ne Räumpanzer populistischer Sicherheitspolitik\nUnd ab heute der einzige Polizeigewerkschafter der Welt\nMit 'nem eig'nen Lied\n\nWer blökt in jeder Talkshow und in der Neonazipresse?\nUnd vertritt dabei vor allem sein eig'nes Interesse?\nWer hält sich für das Sprachrohr der deutschen Polizei?\nUnd wird mit ein paar fast legalen Tricks noch reich dabei?\nWer schimpft gerne auf Moslems und schürt Angst vor Terroristen?\nWer hätte gerne Sonderrechte, nur für Polizisten?\nUnd sitzt dabei als Beamter für fünfzigtausend jährlich\nIm Aufsichtsrat von AXA und findet sich voll ehrlich?\n\nMan flötet im Beamtenbund\nIm Polizeipräsidium\nEs singt die ganze GdP\nDieses kleine Lied\n\n\nRainer Wendt, du bist kein echter Polizist\nRainer Wendt, weil du dir selbst der Nächste bist\nRainer Wendt, du forderst Rechtsstaat und Moral\nAber beides ist dir selber scheißegal\nRainer Wendt, du bist ein rechter Populist\nUnd du denkst, du wärst ein echter Polizist\nRainer Wendt, du forderst Ordnung und Gesetz\nAber scheißt drauf, wenn's dir selber etwas nützt\n\nWer findet Grundrechte entbehrlich? Wer verachtet Demokraten?\nWer ist eins-achtundsechzig groß und markiert ständig den Harten?\nWer kennt vor jeder Straftat die Hautfarbe des Täters schon?\nWie passt nur so viel Doppelmoral in so 'ne halbe Portion?\nWer kriegt kein Geld fürs Nichtstun? Nein, wirklich, also, echt nicht\nAlso, außer im Monat 3348,68 €?\nWer teilt am liebsten aus und steckt nicht so gerne ein?\nHalt außer Kohle, aber das ist streng geheim\n\nEs singt der Schutzmann mit dem Nafri\nSingt die Zecke mit dem Nazi\nBlaulicht an und Martinshorn\nUnd jetzt noch mal von vorn\n\n\nRainer Wendt, du bist kein echter Polizist\nRainer Wendt, weil du dir selbst der Nächste bist\nRainer Wendt, du forderst Rechtsstaat und Moral\nAber beides ist dir selber scheißegal\n(Und alle!) Rainer Wendt, bist nur ein eitler Lobbyist\nDoch du denkst, du wärst ein echter Polizist\nRainer Wendt, gieriger Hauptkommissar\nWegen Typen wie dir ist Deutschland in Gefahr\n\nDieses Liedchen hat ein Happy end\nJetzt kennt jeder Rainer Wendt\nSelbstgerecht und eigennützig\nAber sein WhatsApp-Profilbild ist ganz witzig\nErst der Sexmob von Köln und jetzt das\nKönnen unsere deutschen Frau'n\nRainer Wendt denn noch vertrau'n?\nIst er kaltblütig und kriminell?\nWenn ja: Abschieben, aber ganz, ganz schnell\n\nRainer Wendt, du bist kein echter Polizist\nRainer Wendt, weil du dir selbst der Nächste bist\nRainer Wendt, du forderst Rechtsstaat und Moral\nAber beides ist dir selber scheißegal\nRainer Wendt, lieben Gruß an die Kollegen\nDu kassierst und sie riskier'n im Job ihr Leben\nRainer Wendt, du hast bei andern stets gefordert\nJetzt gibt's für dich mal selber Law & Order (Zugriff!)\nRainer Wendt, gehörst gehörig eingekesselt\nRainer Wendt, kontrolliert und fußgefesselt\nRainer Wendt, ich wünschte, er würd' Tag und Nacht\nVom Staatsschutz observiert und Video-überwacht, hey!
178|Tanzlehrerin|Till Lindemann|Tanzen ist ein Glück auf Erden\nDas muss ich können, so ich werde\nMir eine Tanzlehrerin suchen\nUnd einen Tanzkurs bei ihr buchen\nIch hab' gesucht und auch gefunden\nEs wird getanzt und viel gelacht\nWir praktizieren viele Stunden\nUnd lieben uns die ganze Nacht\n\nIch hab' den Schwanz wieder drin\nIn meiner Tanzlehrerin\nDenn ich lieb' sie so sehr\nWir wiegen uns im Rhythmus hin und her\nRan zieht sie mich\nIch küsse zärtlich ihr Gesicht\nSie fängt leise an zu stöhn'n, ach, ist das schön\nDas ist so schön\n\nTanzen ist nun meine Welt\nUnd auch den Frauen sehr gefällt\nWenn man sie dreht und führt famos\nDann ist die Chance auf Paarung groß\nLasset die Musik erklingen\nUnd im Takt das Tanzbein schwingen\nWir wiegen uns her und hingebungsvoll\n\n\nIch hab' den Schwanz wieder drin\nIn meiner Tanzlehrerin\nDenn ich lieb' sie so sehr\nWir wiegen uns im Rhythmus hin und her\nRan zieht sie mich\nIch küsse zärtlich ihr Gesicht\nSie fängt leise an zu stöhn'n, ach, ist das schön\nDas ist so schön\n\nDoch beim Tango wurd sie prüde\nUnd ich, ich war des Tanzens müde\nWas nicht will, kann man nicht zwingen, nein\nSo fing ich einfach an zu singen\n\nIch hab' den Schwanz wieder drin\nIn der Gesangslehrerin\nDenn ich lieb' sie so sehr\nWir wiegen uns im Rhythmus hin und her\nRan zieht sie mich\nIch küsse zärtlich ihr Gesicht\nSie fängt leise an zu stöhn'n, ach ist das schön\nSo schön\nSo schön\nJa, das ist schön\nSo schön
